cleaned_text	lemm_text
ДИНАМИЧНАЯ МУЗЫКА	динамичный музыка
-Вудик, ко мне!	вудик ко
Я кому сказал - ко мне!	сказать ко
Вудик!	вудик
ТРЕВОЖНАЯ МУЗЫКА	тревожный музыка
ПЁС ЛАЕТ	пес лаять
-Э-э, парень!	э э парень
Ты чего?	
Слышь, парень!	слышь парень
Вудик, а чего это с ним?	вудик это
ПЁС ЛАЕТ	пес лаять
Вроде молод ещё, чтоб так напиваться.	вроде молодой напиваться
ПЁС ЛАЕТ	пес лаять
ТРЕВОЖНАЯ МУЗЫКА	тревожный музыка
СТУК В ДВЕРЬ	стук дверь
-Да-да.	
-Разрешите?	разрешать
-Да, товарищ заместитель, заходите.	товарищ заместитель заходить
ЗВОНОК ТЕЛЕФОНА	звонок телефон
-У нас убийство.	убийство
-Уже?	
-Первое за восемнадцать лет.	первый восемнадцать год
-Эх, Витя, Витя...	эх витя витя ...
Тихое место, спокойное, с экологией.	тихий место спокойный экология
-У нас убийство, товарищ майор.	убийство товарищ майор
-Я вот всё думаю, а мой предшественник	думать предшественник
чего так рано на пенсию вышел?	рано пенсия выходить
Проблемы со здоровьем?	проблема здоровье
-Не думаю. Он мастер спорта по городошному спорту.	думать мастер спорт городошный спорт
Ваш предшественник - подполковник Рагулин.	ваш предшественник подполковник рагулин
-Рагулин...	рагулин ...
-У нас убийство, товарищ майор. Понимаете?	убийство товарищ майор понимать
-Я понимаю, товарищ капитан, первое за 18 лет.	понимать товарищ капитан первый 18 год
-След взяла только до дороги, значит, на машине отсюда уехали.	след взять дорога значит машина отсюда уезжать
-Посмотри ещё по верху.	посмотреть верх
Тараненко, что имеем?	тараненко иметь
-Да пока не много имеем, товарищ майор.	пока иметь товарищ майор
Возле тела обнаружены две пары следов.	возле тело обнаруживать пара след
Ботинки 41-го и, скорее всего, кроссовки 43 размера,	ботинок 41 го скоро кроссовок 43 размер
это исключая следы обнаружившего тело гражданина Горина.	это исключая след обнаруживать тело гражданин горин
Он допрошен и отпущен.	допрашивать отпускать
Грибник. Это он с собакой обнаружил тело, когда из леса вышли.	грибник это собака обнаруживать тело лес выходить
-Причём следов самого мальчика не обнаружено.	причем след мальчик обнаруживать
-Значит, убивали не здесь.	значит убивать
-Наверняка сюда привезли уже тело.	наверняка сюда привозить тело
-Личность убитого?	личность убивать
-Васька. Гринёвых сын.	васька гринев сын
Вот же беда, твою мать! С моим - в одном классе.	беда твой мать класс
Двадцать одно ножевое, включая прямое в сердце.	двадцать ножевой включая прямой сердце
СВИСТИТ	свистеть
Предполагаемая длина орудия преступления - 15-14 сантиметров.	предполагаемый длина орудие преступление 15 14 сантиметр
-Столько ранений... Маньяк, что ли?!	столько ранение ... маньяк ?!
Ещё и нервный. Или два маньяка.	нервный маньяк
Может, второй только помогал тело тащить?	второй помогать тело тащить
-Не такой уж и нервный.	нервный
На лице ни одного пореза, тело положил как подарок.	лицо порез тело полагать подарок
Со всех холмов видно, первый грибник сразу - рядом тропинка - заметит.	весь холм видно первый грибник сразу рядом тропинка замечать
Предполагаемое время убийства?	предполагать время убийство
-Ну это после вскрытия.	это вскрытие
-Хорошо.	
ТЯЖЁЛЫЙ ВЗДОХ	тяжелый вздох
-Вот зараза...	зараза ...
-Ребята! В семье Алёны Черновой случилось несчастье.	ребята семья алена черновой случаться несчастие
Неизвестные бандиты совершили покушение на её маму.	неизвестный бандит совершать покушение мама
Я прошу вас поддержать её в этот трудный момент	просить поддерживать трудный момент
и учитывать этот факт при общении с ней.	учитывать факт общение
Алёна пережила шок, но с сегодняшнего дня она снова посещает школу.	алена переживать шок сегодняшний день снова посещать школа
-Вы бы, Юлия Сергеевна, сразу на доске ссылку на видео написали.	юлия сергеевна сразу доска ссылка видео написать
У вас с головой всё в порядке?	голова порядок
-Красавина, встала и вышла вон из класса.	красавина вставать выходить вон класс
Быстро!	быстро
-Знаете что, Юлия Сергеевна, лучше бы эти отморозки пришли и вас убили.	знать юлия сергеевна отморозок приходить убивать
-Ты что такое несёшь, Чернова? -Что слышали.	нести чернов слышать
Нужно убивать не таких, как моя мама, а таких дур, как вы.	нужно убивать мама дура
-Ты куда пошла? Ты куда пошла? Я тебя не выпускала из класса!	пойти пойти выпускать класс
-Ну? Это он?	это
Васенька?	васенька
ЖЕНЩИНА ПЛАЧЕТ	женщина плакать
А слушай... А ты же... ты же близорукий.	слушать ... ... близорукий
У тебя же минус два.	минус
Я тебе давно говорила, что тебе нужно очки носить.	давно говорить нужно очки носить
Ты мог обознаться. Слышишь?	мочь обознаваться слышать
Скажите, это же не Васенька? Правда?	сказать это васенька правда
Послушайте, пойдёмте вместе со мной.	послушать пойти вместе
Вы меня слышите?	слышать
Ну я... я буду опознавать.	... опознавать
-Тело для похорон сможете забрать не раньше, чем через неделю.	тело похороны смочь забирать рано неделя
Оно сейчас улика. Нужно для судмедэксперта.	оно улика нужно судмедэксперт
Держитесь, тёть Зин.	держаться тетя зина
И вы, дядь Толь, держитесь.	дядь толь держаться
ЖЕНЩИНА ПЛАЧЕТ	женщина плакать
-Ну я, конечно, понимаю, у девочки психическая травма.	понимать девочка психический травма
Потерять одного из родителей в таком возрасте	потерять родитель возраст
и при таких обстоятельствах, пусть и временно...	обстоятельство пусть временно ...
Но вы и меня должны понять.	должный понимать
Существует педагогический авторитет, учебная субординация.	существовать педагогический авторитет учебный субординация
-Что вы предлагаете? -Только одно.	предлагать
Чтобы Алёна при всех извинилась перед Юлией Сергеевной.	алена извиняться юлия сергеевна
-За что? Я, что ли, виновата, что она дура?	виноватый дура
-Но это ни в какие ворота... -Я не буду перед ней извиняться.	это ворота ... извиняться
Я просто назвала вещи своими именами, и всё.	просто называть вещь свой имя
-Ну, в таком случае у меня нет иного выхода,	случай иной выход
как исключить Алёну из нашей школы.	исключать алена наш школа
-С превеликим удовольствием.	превеликий удовольствие
-Выйди за дверь, подожди меня там.	выходить дверь подождать
-Вы видели, я сделала всё, что могла.	видеть сделать мочь
-Вы знаете, я в прошлом тоже педагог.	знать прошлый педагог
И если честно...	честно ...
если бы я оказалась на месте Алёны,	оказываться место алена
я бы вашей Юлии Сергеевне сказала ровно то же самое.	ваш юлия сергеевна сказать ровно самый
Всего вам хорошего.	хороший
-Майор Борисов. Ваш заместитель по угро.	майор борисов ваш заместитель угро
-Мы с капитаном собрались к родителям мальчика. Составите нам копанию?	капитан собираться родитель мальчик составлять копание
-Как я понял, в Москве начальники ОВД непосредственно занимаются	понимать москва начальник овд непосредственно заниматься
преступлениями, совершёнными на территории обслуживания?	преступление совершенный территория обслуживание
А пристяжными у них выступают заместители по работе	пристяжной выступать заместитель работа
с личным составом.	личный состав
-Как я понял, вы, в отличие от предыдущего начальника,	понимать отличие предыдущий начальник
больше по конюшням специализируетесь, да? Или повысили уровень квалификации	конюшня специализироваться повышать уровень квалификация
до уровня, позволяющего хамить вышестоящему начальству. Вот что,	уровень позволять хамить вышестоящий начальство
майор, устали, наверное? Отдыхайте сегодня.	майор уставать наверное отдыхать сегодня
Дежурный! -Да.	дежурный
-Майора в здание не пускать. -Так точно.	майор здание пускать точно
-Это приказ. Поехали.	это приказ поехать
-От калитки до окна комнаты мальчика обнаружены узкие следы.	калитка окно комната мальчик обнаруживать узкий след
-Сорок первый, сорок третий?	сорок первый сорок третий
-Только сорок первый. Отпечатков на фрамуге нет, окно было открыто,	сорок первый отпечаток фрамуга окно открывать
так преступник и проник в комнату.	преступник проникать комната
-Т.е. похищал он в одиночку, а тело на поляну подкладывал с подельником?	т е похищать одиночка тело поляна подкладывать подельник
-Вероятно, хотя логичнее было бы наоборот.	вероятно хотя логичный наоборот
-День рождения был у соседа, у Володьки Захаренкова.	день рождение сосед володька захаренкова
Вышли мы из дома.	выходить дом
"-Васенька уже в кровати лежал. Читал ""Трёх мушкетёров""."	васенька кровать лежать читать мушкетер
Понимаете, он у нас такой был...	понимать ...
-Старались мы, в общем, чтобы он поменьше в Интернете сидел,	стараться общий мало интернет сидеть
и всяких гаджетов-фигаджетов ему не покупали.	всякий гаджет фигаджет покупать
-Да. Мы даже мобильник ему только в прошлом году подарили на именины.	мобильник прошлый год подарить именины
-Значит, последний раз вы видели Васю в кровати?	значит последний видеть вася кровать
-Получается, что так.	получаться
Вернулись от Захаренковых около двенадцати часов.	вернуться захаренков около двенадцать час
И сразу спать легли.	сразу спать ложиться
-Значит, в тот день вы в комнату сына больше не заходили?	значит день комната сын заходить
-Только утром.	утро
А его уже...	...
-Получается, преступник проник в комнату к мальчику через окно,	получаться преступник проникать комната мальчик окно
похитил его, предположим. Но тогда почему мы не находим в комнате	похищать предполагать почему находить комната
следов борьбы? Почему соседи не слышали криков? В конце концов,	след борьба почему сосед слышать крик конец конец
мальчик спал и должен был проснуться.	мальчик спать должный просыпаться
-Вероятно, в момент похищения ребёнок находился в бессознательном	вероятно момент похищение ребенок находиться бессознательное
состоянии. Преступник ввёл его в это состояние медикаментозно.	состояние преступник вводить состояние медикаментозный
-Подождите, может быть, вы забыли, день рождения, всякое бывает,	подождать мочь забывать день рождение всякое бывать
выпили и не помните, что, вернувшись, вы заглянули в комнату к Васе	выпивать помнить вернуться заглядывать комната вася
убедиться, спит ли сын, всё ли с ним в порядке.	убеждаться спать сын порядок
-Я не пью. И Зина тоже.	пить зина
Мы вместе закодировались, когда решили Ваську запланировать.	вместе закодироваться решать васька запланировать
-Извините.	извинять
-Значит, получается, что Васю похитили в интервале между девятью	значит получаться вася похищать интервал девять
вечера и восемью утра.	вечер восемь утро
Вы подозреваете кого-нибудь?	подозревать кто-нибудь
-Да бог с тобой, Оль. Кого?	бог оля
-Матвеич, вот, возле самого забора валялось.	матвеич возле самый забор валяться
Вонища от неё какая-то странная.	вонища какой-то странный
-Эфир. Так что никаких уколов. Положили на лицо спящего мальчика,	эфир никакой укол полагать лицо спящий мальчик
и всё. Пару вздохов - и выноси, без криков и сопротивлений.	пара вздох выносить крик сопротивление
-Надо доложиться старшим. -Да, давай туда.	докладываться старший давать туда
-Куда? -В вещдоки.	вещдок
-И что я бы поступила так же на месте Алёны. Всего вам доброго.	поступать место алена весь добрый
-Так и сказала? -Ага. Я специально дверь не закрыла,	сказать ага специально дверь закрывать
когда вышла, чтоб послушать, чего Нина ответит.	выходить послушать нина отвечать
-Крутая у тебя тётка. И что решили, где ты теперь учиться будешь?	крутой тетка решать учиться
Слушай, а хочешь, я тоже из этой школы уйду?	слушать хотеть школа уходить
-А что, было бы круто.	круто
-И мы бы вместе с тобой учились -А ты можешь?	вместе учиться мочь
-Да. -А родители не будут против?	родитель против
-Я думаю, нет.	думать
-Алён, привет.	ален привет
-Привет.	привет
-Надо поговорить.	поговорить
У тебя номер заблокирован. Я бы мог позвонить с другого телефона,	номер заблокировать мочь позвонить телефон
но решил встретиться.	решать встречаться
-Зачем?	
-Я в библиотеку, учить уроки. Пока.	библиотека учить урок пока
"-Алён, один мудрый человек сказал: ""Сын за своего отца не отвечает""."	"ален мудрый человек сказать : "" сын свой отец отвечать"
-Толь, все за всё отвечают.	толь отвечать
Как ты представляешь наши отношения?	представлять наш отношение
Твой отец чуть не убил мою маму.	твой отец убивать мама
А мы с тобой после этого будем гулять под ручку, да? Мороженое есть?	это гулять ручка мороженое
-Но он же за это сидит. -Он-то сидит, а ты живёшь.	это сидеть сидеть жить
Ты живёшь за его деньги, в его доме. Ты катаешься на машине,	жить деньги дом кататься машина
купленной за его деньги.	купить деньги
-Алён...	ален ...
-Я прошу тебя, уходи.	просить уходить
ГРУСТНАЯ МУЗЫКА	грустный музыка
-Если бы хотели убить, убили бы прямо в доме.	хотеть убивать убивать прямо дом
Наверняка выследили, что Васька один остался. Но почему-то сначала	наверняка выслеживать васька оставаться почему-то сначала
похитили, потом где-то убили, потом подложили труп на поляну.	похищать где-то убивать подкладывать труп поляна
Зачем?	
-Зачем - это мотив, старлей. Его мы и выясняем. Куда я пистолет дел? А?	это мотив старлей выяснять пистолет дело
Точно, дома оставил.	точно дома оставлять
А пока остаётся определить всё окружение мальчика - дальнее,	пока оставаться определять весь окружение мальчик дальний
ближнее, школы. Сколько школ в городе?	ближний школа сколько школа город
-Первая и вторая. Вася учился во второй.	первый второй вася учиться второй
-Отлично, вот со школы и начнём завтра.	отлично школа начинать завтра
-Надеюсь, вы тоже примите участие во всех оперативно-следственных	надеяться принимать участие оперативно следственный
мероприятиях?	мероприятие
-Да, в отличие от вас. Майор Борисов назначается дежурным офицером	отличие майор борисов назначаться дежурный офицер
по отделу на всё время следствия по делу. Все свободны.	отдел весь время следствие дело весь свободный
Что у вас, Ольга Сергеевна?	ольга сергеевна
-Я хочу сказать: не обращайте на него внимания.	хотеть сказать обращать внимание
На майора Борисова. Вернее, обращайте. Вы пришли на его место,	майор борисов вернее обращать приходить место
а он его девятый год в замах высиживает.	девятый год замах высиживать
-Извините.	извинять
-Да, Нин.	нина
-Как у тебя дела, Серёжа? -Всё нормально. Как у вас с Алёнкой?	дело сережа нормальный аленка
-Всё хорошо. Алёну переводим в новую школу.	хороший алена переводить новый школа
-В смысле? -Так надо.	смысл
На твоей новой работе столовая хорошая?	твой новый работа столовая хороший
-Нин, всё нормально, у меня совещание, я перезвоню.	нина нормально совещание перезванивать
-У нас хорошая столовая?	хороший столовая
-У нас нет столовой и никогда не было.	столовая
Жена? -Сестра.	жена сестра
