cleaned_text	lemm_text
-Ну что? Мы здесь уже 2 часа! -Я тебе говорю, она скоро пройдет.	ну что мы 2 час я ты говорить скоро пройти
Ты должен был взять ее координаты. Так не проще?	ты должный взять координата так простой
Вот она! Не смотри!	вот она не смотреть
-Блондинка? -Да. Не смотри, я сказал!	блондинка да не смотреть сказать
Хорошенькая!	хорошенький
-Пошли? -Что ты делаешь?	послать что делать
-Возвращаемся... -Возвращаемся? Куда?	возвращаться возвращаться куда
-В Париж. -Что?	в париж что
Уже 3 месяца ты мне твердишь про свою Флоранс Арно!	уже 3 месяц твердить флоранс арно
Мы проехали 500 км, чтобы ее увидеть! А ты не сказал ей слова!	мы проехать 500 километр увидеть а сказать слово
Я никогда не хотел с ней говорить. Я хотел ее видеть и увидел.	я хотеть говорить я хотеть видеть увидеть
Он - ненормальный!	он ненормальный
В следующий раз, научишься водить и купишь себе машину. Ладно?	в следующий раз научиться водить купить машина ладный
Ты ее видел? Если видел, то понял, что у меня нет шансов...	ты видеть если видеть понять шанс
Раз ты так настроен, то да!	раз настроить да
К счастью, ты не каждый день влюбляешься.	к счастие каждый день влюбляться
Когда я влюблен, я теряюсь. Ты знаешь.	когда влюбить теряться ты знаешь
Замолчи, ты меня нервируешь!	замолчать нервировать
-Ты куда?! -Псих!	ты куда псих
-Ты, не посмотрев, подал назад. -Оставь меня в покое!	ты посмотреть подать назад оставить покой
Что я люблю в Ваших полотнах?	что любить ваш полотно
Это контраст между игровой стороной сюжета и отработанной техникой...	это контраст игровой стороной сюжет отработать техника
Идемте, я Вам представлю художника...	идти вы представить художник
-Вы знакомы, конечно? -Да.	вы знакомый конечно да
Это восхитительно, Ян! Действительно!	это восхитительно ян действительно
Спасибо.	спасибо
Я обожаю! Надеюсь, это стоит целое состояние!	я обожать надеяться это стоить целое состояние
Это - художник. Спорю, он даже не знает, сколько стоят его картины.	это художник спорить знать сколько стоять картина
Видно, он плохо знает художников.	видно плохо знать художник
О! Что ты здесь делаешь?	о что делать
Какой негодяй! Мы тебя ждали у Софи, нахальства тебе не занимать.	какой негодяй мы ждать софи нахальство ты занимать
Что это за история? Как давно Вы знакомы?	что это история как давно вы знакомый
Ты заинтригован, ладно... Мы с Флоранс были очень близки...	ты заинтриговать ладный мы флоранс очень близкий
Не делай такое лицо. Я тебя рекламировал, я не говорил...	не делать такой лицо я рекламировать говорить
Я тебя не просил! Ненавижу такое!	я просить ненавидеть такой
-Надеюсь, ты не рассказал о нашей? -Поездке в Довиль?	надеяться рассказать наш поездка довиль
-Конечно! Она была так взволнована. -Негодяй!	конечно она взволновать негодяй
Прекрати. Ты ей нравишься. Это очевидно.	прекратить ты нравиться это очевидно
"Знаешь, она сказала:""-Как мило!"". Слушай, что она еще сказала. Да-а."	знаешь сказалакака мило слушай сказать даа
Давно в меня так не влюблялись...	давно влюбляться
"-""Гммм."" -Принесу выпить..."	гммм принести выпить
-С удовольствием... -Шампанское?	с удовольствие шампанский
Да, да...	да да
Я вернусь посмотреть на Ваши картины, потому что выставки...	я вернуться посмотреть ваш картина выставка
-Это невозможно... -Ненавижу выставки, особенно мои!	это невозможно ненавидеть выставка особенно мой
-Ян, знаете, что бы мне хотелось? -Нет...	ян знаете хотеться нет
-Посетить Вашу мастерскую... -Правда?	посетить ваш мастерский правда
Да, мне хотелось бы посмотреть, как Вы работаете...	да хотеться посмотреть вы работать
-Если не затруднит, конечно. -Нет, нет, нет! Но в данный момент...	если затруднить конечно нет нет нет но данный момент
Вы очень заняты, я представляю.	вы очень занятый представлять
Да, да. Я готовлю выставку в Нью-Иорке. Поэтому...	да да я готовить выставка ньюиорка поэтому
Но, зачем спешить... Когда будет время.	но спешить когда время
-При условии, что не помешаю.- Абсолютно! Смеетесь?	при условие помешать абсолютно смеяться
Нет, я вижу Вам не удобно, нет...	нет видеть вы удобно нет
Завтра. Завтра в 5 часов. Вам удобно?	завтра завтра 5 часы вы удобно
Завтра? Но завтра я занята.	завтра но завтра занятый
Осторожней!	осторожный
-Позвольте! -Эй, там!	позволить эй там
Ну, ну, расслаблен.	ну ну расслабить
-Борис, прекрати! -Что такое?	борис прекратить что такой
О, я проверял. Не стоит расстраиваться!	о проверять не стоить расстраиваться
-Он не в себе! -Дай твой стакан.	он себя дать твой стакан
-Ты выпил? -Чтобы немного расслабиться.	ты выпить чтобы немного расслабиться
Пошли!	послать
Иду...	идти
Ты идешь, Ева?	ты идти ева
Что Вы себе позволяете?	что вы позволять
Наташа, ты спешишь?	наташа спешить
-Флоранс? -Хорош, твой друг!	флоранс хороший твой друг
Это не друг. Это - сосед по площадке.	это друг это сосед площадка
Напомни, однако его имя, чтобы я внесла в список!	напомнить однако имя внести список
Ты не видела Флоранс? Флоранс Арно!	ты видеть флоранс флоранс арно
Ева, не глупи! Иди, мы возвращаемся.	ева глупить идти возвращаться
Он очень близко стоял, это опасно.	он очень близко стоялый это опасный
Черт! Что за черт! Что Вы делаете! Куда он едет?	черта что черта что вы делать куда ехать
Ева, прекрати!	ева прекратить
Предупреждаю, я сейчас разнесу эту будку!	предупреждать разнести будка
-Эй, скажите, пожалуйста. -Чего тебе?	эй сказать пожалуйста что ты
-Я хотел бы поехать домой! -Представьте себе, я тоже!	я хотеть поехать домой представить себя тоже
Ева, выходи оттуда!	ева выходить оттуда
Мсье, пожалуйста! Завтра утром мне на работу.	мсьё пожалуйста завтра утром работа
-И что?Мне тоже. -Да, но Вы въехали в мою машину!	и чтомня тоже да вы въехать мой машина
Я не могу тронуться с места, надо составить...	я мочь тронуться место составить
Выходи, мы идем домой. Ева, женушка моя! Пожалей.	выходить идти домой ева жёнушка мой пожалеть
Я уйду к Кати. Я предупреждала. Все!	я уйти катя я предупреждать весь
Но, Ева, те не можешь меня так мучить. Я люблю тебя.	но ева тот мочь мучить я любить ты
-Будьте любезны, мсье, я прошу. -Но я люблю тебя. Черт! Люблю!	быть любезный мсьё просить но любить ты черта любить
Мадмуазель, Вы разумнее, прошу... Меня ждет жена...	мадмуазель вы разумный просить я ждать жена
Наплевать! Я не хочу его больше видеть! Все!	наплевать я хотеть видеть весь
-Мсье... -Вы меня доводите, эй!	мсьё вы доводить эй
Но если хотите вернуть Ваши деньги, уговорите ее пойти со мной.	но хотеть вернуть ваш деньга уговорить пойти я
Я, с удовольствием, но что я могу сделать?	я удовольствие мочь сделать
Скажите, что люблю и не могу жить без нее. Меня она не слушает. Ну...	сказать любить мочь жить нея я слушать ну
Мадмуазель, он любит Вас! Не может жить без Вас!	мадмуазель любить вы не жить вы
-Эй, не так, Поло! -Что?	эй так полый что
С чувством, эмоциональней!	с чувство эмоциональный
Он любит Вас, мадмуазель! Не может жить без Вас!	он любить вы мадмуазель не жить вы
Прошу Вас, сделайте это для меня. Меня жена ждет...	просить вы сделать это я я жена ждать
Хорошо, но предупреждаю, я вернусь, чтобы собрать свои вещи.	хорошо предупреждать вернуться собрать свой вещий
Я пойду к Кати.	я пойти катя
Она хочет вернуться собрать свои вещи. Она пойдет спать к Кати.	она хотеть вернуться собрать свой вещий она пойти спать катя
Хорошо, лапочка, хорошо! Возвращаемся.	хорошо лапочка хорошо возвращаться
Нечего ломать комедию. Борис...	нечего ломать комедия борис
-Нечего ломать комедию. Борис... -Заткнись, занимайся своим делом!	нечего ломать комедия борис заткнуться заниматься свой дело
-Говорите после сигнала. -Вас нет дома...	говорить сигнал вы дом
Да, вот, я подумала...	да вот подумать
Я приду завтра в 5 часов, как Вы мне любезно предложили...	я прийти завтра 5 часы вы любезно предложить
Я буду счастлива увидеть Ваши творения вблизи.	я быть счастливый увидеть ваш творение вблизи
Да, завтра у нас четверг, не так ли? Четверг, 17-00?	да завтра четверг ли четверг 1700
Да, это Флоранс. Флоранс Арно. Спокойной ночи, Ян и до завтра.	да это флоранс флоранс арно спокойный ночь ян завтра
Алло, Флоранс?!	алло флоранс
Надеюсь, это не безумие.	надеяться это безумие
А чем ты рискуешь? Он тебя не изнасилует. Не его стиль.	а рисковать он изнасиловать не стиль
Знаешь, почему он мне нравится? Не смейся, Наташа. Он чист душой.	знаешь почему нравиться не смеяться наташа он чистый душа
-Я серьезна. -Он живет в другом мире, поверь.	я серьёзный он жить друг мир поверь
Маленький Принц, что ли?	маленький принц ли
Вместо того, чтобы тебя поджарить, он попросит нарисовать барашка, так?	вместо тот поджарить попросить нарисовать барашек так
Добрый вечер.	добрый вечер
Твой муж всегда со своим портфелем!	твой муж свой портфель
Ты что, он вернулся с делового ужина.	ты что вернуться деловой ужин
-Ева, прекрати эту комедию! -Отстань!	ева прекратить комедия отстать
-Так ты ничего не добьешься! -Хорошо. Успокоимся и поговорим.	так добиться хорошо успокоиться поговорить
-Я не зверь. Поговори! Ты куда? -Подышать! Можно?	я зверь поговорить ты куда подышать можно
У Вас есть сигарета? Мне очень жаль за недавнее...	у вы сигарета я очень жаль недавний
Вашему другу надо меньше пить.	ваш друг маленький пить
Что ты там делаешь?	что делать
-Иди сюда! -Оставь меня или я закричу, Борис!	идти сюда оставить закричать борис
-Мне наплевать! -Послушайте, прошу Вас...	я наплевать послушать просить вы
-Ааааааа! -Не вмешивайтесь!	ааааааа не вмешиваться
-Я бы хотел! -Оставь его, говорю!	я хотеть оставить он говорить
Ааааааа!	ааааааа
Антракт 5 минут. Как я выгляжу? Перестань дуться.	антракт 5 минута как выглядеть перестать дуться
Я спешу.	я спешить
Послушай, я обожаю смотреть, как ты танцуешь, но не сейчас.	послушать обожать смотреть танцевать сейчас
Для меня ты - новая Жозефин Беккер!	для новый жозефина беккер
Тебе следует подготовить один из ее номеров.	ты следовать подготовить номер
Костюм тебе бы очень подошел.	костюм ты очень подойти
За неимением другого, я могла бы всегда есть бананы.	за неимение другой мочь банан
Будь любезна, скажи. Как? Все новое. Честно, как я выгляжу?	быть любезный сказать как весь новое честно выглядеть
Очень хорошо.	очень хорошо
Зачем так нервничать! Не впервые же встречаетесь с женщиной!	зачем нервничать не впервые встречаться женщина
Да, но Флоранс - это другое...	да флоранс это другой
Кто эта Флоранс? Английская королева, что ли?	кто этот флоранс английский королева ли
Смеешься! Я не пригласил бы Английскую королеву даже сесть.	смеяться я пригласить английский королева сесть
Потребовал бы сразу раздеться. А Флоранс...	потребовать сразу раздеться а флоранс
Улица Лозье, пожалуйста.	улица лозий пожалуйста
-Я не убрала в Вашей комнате. -Ничего. Уже поздно.	я убрать ваш комната ничто уже поздно
Все будет хорошо, увидите. Смелей!	весь хорошо увидеть смелеть
Ну, что за...	ну за
Ты меня не обнимешь?	ты обнять
Я опаздываю.	я опаздывать
Ты мокрая!	ты мокрый
Мне казалось, ты опаздываешь.	я казалось опаздывать
Что ты делаешь? А если кто-нибудь пройдет?	что делать а ктонибыть пройти
Ева, предупреждаю, я не люблю это! Не люб-лю!	ева предупреждать любить это не любить
Закрой эту дверь! Закрой дверь!	закрыть дверь закрыть дверь
Черт!	черта
Борис! Твой портфель! Борис?!	борис твой портфель борис
О, нет! Нет! Нет! Черт! Ну, что ты будешь делать!	о нет нет нет черта ну быть делать
-Здравствуйте. -Здравствуйте.	здравствовать здравствовать
Глупая случайность. Я была на площадке, а ключ остался изнутри.	глупый случайность я площадка ключ остаться изнутри
Я вышла на минутку, позвать Бориса, он забыл портфель.	я выйти минутка позвать борис забыть портфель
А дверь захлопнулась! Можно позвонить?	а дверь захлопнуться можно позвонить
Надо вызвать мастера.	надо вызвать мастер
-Это невозможно! -Почему?	это невозможно почему
Послушайте, Я жду...	послушать я ждать
Вы не оставите меня здесь в таком виде!	вы оставить такой вид
Конечно, оставлю. Нет, нет, если она застанет Вас в таком виде?	конечно оставить нет нет застать вы такой вид
Я не знаю, как она воспримет.	я знать воспринять
Это ужасно! Что мне делать? Здесь нет даже консьержа...	это ужасно что делать здесь консьерж
-А Ваше окно открыто? -Да.	а ваш окно открыто да
Я перешагну на балкон, пролезу через окно и открою Вам дверь.	я перешагнуть балкон пролезть окно откроить вы дверь
-Это опасно? -Нет, нет.	это опасный нет нет
Позвольте войти. Это же смешно. Могут увидеть...	позволить войти это смешно мочь увидеть
Ладно, входите. Там есть халат, если хотите.	ладный входить там халат хотеть
-Осторожно! -Не беспокойтесь...	осторожно не беспокоиться
Черт, черт...	черта черта
-Я могу помочь? -Нет, нет, все нормально.	я мочь помочь нет нет нормальный
Подождите.	подождать
-Ааааааааа! -Ааааааа!	ааааааааа ааааааа
Не кричите так! Господи, мы чуть не упали!	не кричать так господь упасть
Постарайтесь ухватиться за перекладину и отпустите меня!	постараться ухватиться перекладина отпустить я
Постарайтесь встать на стул, спокойно, спокойно.	постараться встать стул спокойно спокойно
Да не держите меня! Отпустите!	да держать я отпустить
-Что с Вами? -Ужас! Судорога.	что вы ужас судорога
-Все в порядке? -Да, да. Нормально.	весь порядок да да нормальный
-Вы уверены? -Да, да, все в порядке.	вы уверить да да порядок
Сейчас открою.	сейчас откроить
Как больно! Как больно!	как больно как больно
Эй! Телефон!	эй телефон
-Алло! Да! -Алло!	алло да алло
-Это квартира Яна Дюкудрея? -Да, да. Хотите поговорить с ним?	это квартира ян дюкудрей да да хотеть поговорить он
Подождите! Сейчас накину халат и позову.	подождать сейчас накинуть халат позвать
Нет, нет!	нет нет
-Я сейчас. -Нет, нет! Не беспокойтесь! Спасибо!	я сейчас нет нет не беспокоиться спасибо
Да-а. Кажется, я сделала глупость.	даа кажется сделать глупость
Что он там делает?	что делать
Что она со мной сделала!	что я сделать
Уф-ф! Еще и царапалась!	уфф ещё царапаться
Борис!	борис
Борис, Борис?! Борис, послушай!	борис борис борис послушать
Что это с ним?	что это он
Борис? Это не то, что ты думаешь, поверь!	борис это то думать поверь
Борис, ты там?	борис там
-Что Вы с ним сделали? -Что я сделал? Это он меня выкинул!	что вы сделать что сделать это выкинуть
Надо было ему объяснить!	надо объяснить
Вы думаете, он позволил? Какой-то бешеный, Ваш друг.	вы думать позволить какойтый бешеный ваш друг
-Борис? -Сейчас придет Флоранс!	борис сейчас прийти флоранс
-Мне все равно! -Что?	я равно что
-Меня не волнует Ваша подруга! -Откуда Вы узнали?	я волновать ваш подруга откуда вы узнать
Она звонила, когда Вы были рядом.	она звонить вы ряд
-Флоранс звонила? -Думаю, она, была недовольна.	флоранс звонить думать она недовольный
Ничего не понимаю! Почему Флоранс была недовольна?	ничто понимать почему флоранс недовольный
