cleaned_text	lemm_text
Но потом, вы уберетесь отсюда раз и навсегда. Договорились?	но потом убраться отсюда навсегда договориться
Итак, это-пистолет, который отец привез из Алжира мне в подарок.	итак этопистолет который отец привезти алжир подарок
Время от времени, мы с другом на выходные.	время время друг выходной
Едем пострелять по консервным банкам.	ехать пострелять консервный банка
А это - точная копия пистолета, которую друг нашел в Нью-Йорке.	а это точный копия пистолет который друг найти ньюйорк
И привез мне ради шутки...	и привезти ради шутка
Смотрите, он похож на оригинал, только не так хорошо отделан.	смотреть похожий оригинал отделать
Если я нажму на курок, затвор сдвинется и превратится в зажигалку.	если нажать курок затвор сдвинуться превратиться зажигалка
Смотрите...	смотреть
О, господи! Я опять ошибся.	о господь я ошибиться
Дайте мне это! Вы опасны для общества.	дать это вы опасный общество
-Он меня задел? -На этот раз нет.	он задеть на нет
-Точно? -Ну, да. У тебя ничего нет.	точно ну да у нет
Давайте это сюда. Давайте!	давать это сюда давать
Пошли, Борис.	послать борис
Давайте же.	давать же
Я выкину эту гадость в урну пока не поздно.	я выкинуть гадость урна пока поздно
Что это за бутылка? Ты здесь бутылки прячешь? Ты что, сдурел?	что это бутылка ты бутылка прятать ты что сдуреть
Он себя вёл подло с тобой... Когда?	он вести подло ты когда
Послушай, я тебе всё объясню, пусти меня! Хватит пить!	послушать ты весь объяснить пустить я хватить пить
Он тебя унижает, заставляет страдать? Скажи мне это.	он унижать заставлять страдать сказать это
Мы об этом тоже поговорим.	мы поговорить
Скажи мне правду. Я терпеть не могу ложь. Понимаешь?	сказать правда я терпеть мочь ложь понимать
Я потеряла голову. Я же не могу это выкинуть в урну. Их могут найти.	я потерять голова я мочь это выкинуть урна они мочь найти
Предупреждаю, если Вы ещё раз дотронетесь до них, я убью Вас!	предупреждать вы ещё дотронуться они убить вы
-Что Вы делаете в такой позе? -Я решил регрессировать.	что вы делать поза я решить регрессировать
Я стал зародышем, я в утробе матери, я в безопасности.	я стать зародыш утроба матерь безопасность
Ян, мне надо с Вами поговорить.	ян вы поговорить
Так что, хотя бы на 5 минут покиньте чрево Вашей матери.	так что хотя 5 минута покинуть чрево ваш матерь
Нет! Мне уже один раз досталось, второго раза мне не надо!	нет я достаться два раз надо
Я спешу.	я спешить
Ладно.	ладный
-Ян, я вернулась. -Я это понял.	ян вернуться я это понять
-Я вела себя, как идиотка. -Я хочу Вас ещё раз увидеть.	я вести себя идиотка я хотеть вы ещё увидеть
Прошу Вас, не настаивайте.	просить вы настаивать
Если Вы откажетесь встретиться, предупреждаю, я выброшусь.	если вы отказаться встретиться предупреждать выброситься
Довольно дурачиться! Это не лучший способ.	довольно дурачиться это хороший способ
Я знаю о чем Вы думаете.	я знать вы думать
Если я каждый раз буду встречать у него полуголую девушку.	если каждый быть встречать полуголый девушка
Которая отказывается уходить.	который отказываться уходить
Попытка убийства, приход моего мужа...	попытка убийство приход мой муж
-Эй! О! -Ты же не начнёшь заново?	эй о ты начать заново
Я хочу задать Вам пару вопросов.	я хотеть задать вы пара вопрос
Не сердитесь. Это не стоит того.	не сердиться это стоить тот
Мы ещё встретимся. Я уверена, мы подружимся.	мы ещё встретиться я уверить подружиться
-Я не хочу быть Вашим другом. -Это невежливо.	я хотеть ваш друг это невежливый
Не издевайтесь!	не издеваться
Обернитесь!	обернуться
Успокойтесь, не открывайте им дверь, они уйдут.	успокоиться открывать дверь уйти
Это точно пистолет.	это точно пистолет
Хватит. Вы и так много глупостей натворили.	хватить вы глупость натворить
Я не буду стрелять, я хочу только напугать.	я быть стрелять хотеть напугать
Вдруг нас оставят на час или два?	вдруг оставить час два
-Мсье, здесь стреляли? -Да, это я Вам звонила.	мсьё стрелять да это вы звонить
Где раненый?	где раненый
Он пошёл домой. Я зря волновалась, всего лишь царапина.	он пойти домой я зря волноваться лишь царапина
Из этого пистолета стреляли? Что произошло?	из пистолет стрелять что произойти
Я Вам объясню.	я вы объяснить
Я всегда держу дома оружие. У меня есть разрешение.	я дерзить дом оружие у разрешение
Один мой друг мне его подарил. Это копия пистолета.	один друг подарить это копия пистолет
Если я нажму на курок, он превратиться в зажигалку.	если нажать курок превратиться зажигалка
Смотрите...	смотреть
Чёрт! Я ничего не понимаю! Тогда вот это зажигалка.	чёрт я понимать тогда это зажигалка
-На этот раз он точно стрелял. -Вот жертва.	на точно стрелять вот жертва
-Этот тип 2 раза стрелял. -Но это несчастный случай.	этот тип 2 раз стрелять но это несчастный случай
-Да, я свидетель. -Подождите, я всё объясню.	да свидетель подождать весь объяснить
-Послушайте, это стоит того. -Вот.	послушать это стоить тот вот
Этот пистолет мне привёз отец из Алжира.	этот пистолет привезти отец алжир
По выходным мы с друзьями стреляем по банкам, ясно?	по выходной друг стрелять банка ясно
Да, продолжайте.	да продолжать
А эту зажигалку мне привёз друг из Нью-Иорка.	а зажигалка привезти друг ньюиорка
-А где пистолет? -Но я думал, что это зажигалка!	а пистолет но думать это зажигалка
Я забыл Вам сказать, что зажигалка в виде пистолета. Вот.	я забыть вы сказать зажигалка вид пистолет вот
Мне его привёз из Алжира друг. Я думал, это зажигалка.	я привезти алжир друг я думать это зажигалка
Нет. То-есть, он привез из Нью-Йорка.	нет тобыть привезти ньюйорк
Но это пистолет. Вы из него стреляли.	но это пистолет вы стрелять
-Я думал, что это зажигалка. -Какая зажигалка?	я думать это зажигалка какой зажигалка
Зажигалка, которую привёз его друг из Нью-Иорка.	зажигалка который привезти друг ньюиорка
-Ну, вот! -Ничего не понимаю!	ну вот ничто понимать
Потому что все время перебиваете. Дайте мне сказать!	потому время перебивать дать сказать
Ну, давайте!	ну давать
Эту зажигалку мне привез отец из Алжира,	этот зажигалка привезти отец алжир
-Мы стреляем по банкам из нее. -Из зажигалки?	мы стрелять банка нея из зажигалка
Нет же, из пистолета!	нет же пистолет
-Вы только что сказали... -Он говорил о пистолете.	вы сказать он говорить пистолет
Естественно!	естественно
Пистолет, который Вам привёз Ваш отец из Алжира.	пистолет который вы привезти ваш отец алжир
-Так точно! -Абсолютно ясно.	так точно абсолютно ясно
Так вот... Эту зажигалку мне привёз отец из Нью-Иорка.	так вот этот зажигалка привезти отец ньюиорка
То есть, я хотел сказать, мой друг из Алжира.	то есть хотеть сказать друг алжир
Вы имеете ввиду, Ваш друг из Нью-Иорка?	вы иметь ввиду ваш друг ньюиорка
-Да! Понятно? -Абсолютно.	да понятно абсолютно
5 минут назад мадам позвонила в дверь...	5 минута назад мадам позвонить дверь
-Да, я забыла свои чемоданы. -Какие чемоданы?	да забыть свой чемодан какой чемодан
-Те, что я спрятала в комнате. -Зачем Вы прятали её чемоданы?	тот спрятать комната зачем вы прятать её чемодан
-Потому что пришёл мой муж. -Не понимаю.	потому прийти муж не понимать
Я думала... Мсье и...	я думать мсьё и
Мсье - любовник моей жены? Так? Говорите!	мсьё любовник мой жена так говорить
-Вы любовница мсье? -Нет же, это мадам - любовница мсье.	вы любовница мсьё нет же это мадам любовница мсьё
Заткнитесь! Умоляю, дайте сказать!	заткнуться умолять дать сказать
Не этим тоном! Успокойтесь.	не это тон успокоиться
Послушайте, я ничего не понимаю.	послушать понимать
Если Вы будете всё время говорить, я не смогу объяснить.	если вы быть весь время говорить смочь объяснить
Давайте же!	давать же
5 минут назад мадам позвонила в дверь, и я ей дал зажигалку.	5 минута назад мадам позвонить дверь дать зажигалка
Нет, пистолет.	нет пистолет
-Который Ваш отец привёз из Алжира. -Да, думая, что это зажигалка.	который ваш отец привезти алжир да думать это зажигалка
Которую Ваш друг привёз из Нью-Иорка.	который ваш друг привезти ньюиорка
Именно! И я попросил её выстрелить.	именно и попросить её выстрелить
-Выстрелить? -Да, в шутку.	выстрелить да шутка
В шутку? Вы попросили мадам выстрелить из 7.65 в шутку!	в шутка вы попросить мадам выстрелить 765 шутка
Да. Я признаюсь, да.	да я признаться да
А мадам сочла более забавным выстрелить в мсье?	а мадам счесть забавный выстрелить мсьё
Нет, это я стрелял в мсье.	нет это стрелять мсьё
Он признался! Слышишь, он признался!	он признаться слышать признаться
Борис!	борис
Вот, как все было, мадам и мсье подумали, что это - револьвер.	вот быть мадам мсьё подумать это револьвер
А это и вправду был револьвер. Я думал, что это зажигалка.	а это вправду револьвер я думать это зажигалка
Тогда я взял револьвер. Думая, что это зажигалка, а не револьвер.	тогда взять револьвер думать это зажигалка револьвер
И, чтобы доказать, что это зажигалка, нажал на курок.	и доказать это зажигалка нажать курок
Пуля вылетела и слегка, совсем легонечко, задела мсье. Понятно?	пуля вылететь слегка легонечко задеть мсьё понятно
-Все понятно! -Помолчи!	весь понятно помолчать
Шеф, мы же не будем...	шеф быть
Не обращайте внимания! Это практикант. Я пытаюсь его воспитать.	не обращать внимание это практикант я пытаться воспитать
-Я все расскажу! -Нет! Сделаем по-другому.	я рассказать нет сделать подругий
-Послушайте, я единственный, кто... -Нет. Помолчите.	послушать единственный кто нет помолчать
Но...	но
Прошу, замолчите, здесь я задаю вопросы. Без этого не получится.	просить замолчать задавать вопрос без получиться
-Постараемся разобраться. -Руки вверх, это ограбление!	постараться разобраться рука вверх это ограбление
-Эй, пустите меня! Вы психи, что ли?! -Отпустите его, это мой друг.	эй пустить я вы псих ли отпустить он это друг
-Это была шутка! -Хорошие тут у вас шуточки!	это шутка хороший шуточка
Да, это было глупо. Что происходит?	да это глупо что происходить
Я потом объясню, отпустите его!	я объяснить отпустить он
-Что мне делать, шеф? -Отпусти. Сказали же, его друг.	что делать шеф отпустить сказать же друг
-Вы не поранились? -Нет.	вы пораниться нет
Убери это. Не строй из себя ковбоя.	убрать это не строить ковбой
-Вы в порядке? -Да, да. Спасибо.	вы порядок да да спасибо
-Вы слишком громко ворвались. -Неплохо получилось, а?	вы слишком громко ворваться неплохо получиться а
-Вы что, псих, так шутите! -Это глупо, я согласен.	вы что псих шутить это глупо согласный
Это - моя зажигалка.	это зажигалка
Да, он ее оставил на даче в воскресенье.	да оставить дача воскресение
Это игрушечный пистолет, зажигалка.	это игрушечный пистолет зажигалка
Вы можете его держать в другом направлении?!	вы мочь держать друг направление
-Простите. -Спасибо.	простить спасибо
-Никакого риска. -Да, но...	никакой риска да но
-Смотрите. -Моя зажигалка, я нашел ее!	смотреть мой зажигалка найти она
Советую избавиться от нее, как можно раньше.	советовать избавиться нея ранний
Вы объясните, что происходит. Мне начинает это надоедать.	вы объяснить происходить я начинать это надоедать
Погодите, шеф. Я понял.	погодить шеф я понять
-Это - Ваш пистолет. -Да.	это ваш пистолет да
Вы развлекаетесь, стреляя по банкам по выходным. Правильно?	вы развлекаться стрелять банка выходной правильно
Верно.	верно
Вы привезли эту зажигалку из Нью-Иорка.	вы привезти зажигалка ньюиорка
Она в точности, как ваши пистолеты.	она точность ваш пистолет
Да, я сделал этот идиотский подарок.	да сделать идиотский подарок
В воскресенье, уходя, мсье по ошибке взял Ваш пистолет.	в воскресение уходить мсьё ошибка взять ваш пистолет
Думая, что это его зажигалка.	думать это зажигалка
-Точно! Откуда Вы это все знаете? -Простая дедукция.	точно откуда вы это знаете простой дедукция
-Вы изумительны, правда! -Этот парень гениален!	вы изумительный правда этот парень гениальный
Пошли, мы итак много времени потеряли с этими дураками.	послать итак время потерять этот дурак
Эй. А если он будет продолжать случайно стрелять в меня.	эй а продолжать случайно стрелять я
Каждые 5 минут?!	каждый 5 минута
Если случайно, мы ничего не сможем сделать.	если случайно смочь сделать
А если, случайно стреляя, он случайно убьет меня?	а если случайно стрелять случайно убить я
Повторяю...	повторять
Тогда мы его задержим за непредумышленное убийство.	тогда задержать непредумышленный убийство
Это уже лучше.	это хороший
Ты начинаешь надоедать мне.	ты начинать надоедать я
Ладно, я тоже пойду. Пока, душенька.	ладный пойти пока душенька
Вы не обязаны в пятницу приходить с Яном на обед.	вы обязать пятница приходить ян обед
Я что-нибудь придумаю мужу.	я чтонибыть придумать муж
-Так ее муж приглашает вас на обед? -Ты меня достал.	так муж приглашать обед ты достать
Вы уже официально вместе?	вы официально вместе
Пусти меня, Борис. Пусти!	пустить я борис пустить
-Ты куда? -За чемоданами.	ты куда за чемодан
Чувствуйте себя, как дома.	чувствовать себя дом
-Вы не останетесь, Флоранс? -Нет, на сегодня мне хватит.	вы остаться флоранс нет сегодня хватить
Мы еще встретимся?	мы встретиться
Конечно, Вы же обедаете у нас в пятницу.	конечно вы обедать пятница
-Я Вас провожу. -Нет, нет, нет. Я возьму такси.	я вы провозить нет нет нет я взять такси
-Я Вас подброшу, мне по пути. -Вы не знаете, куда мне надо.	я вы подбросить путь вы знаете надо
Но я знаю, что это по пути.	но знать это путь
Вы точно не хотите, чтоб я Вас проводил?	вы точно хотеть вы проводить
У Вас был трудный день, отдыхайте.	у вы трудный день отдыхать
Да.	да
Положись на меня.	положиться я
Он вышел мне навстречу застегиваясь.	он выйти навстречу застёгиваться
Ты в это время ушла через балкон.	ты это время уйти балкон
Я ухожу, Борис, так больше не может продолжаться.	я уходить борис продолжаться
Нет. Это слишком просто.	нет это слишком просто
Ты не уйдешь, пока не расскажешь правду.	ты уйти пока рассказать правда
-Дай мне пройти! -Нет!	дать пройти нет
Невероятно! Я сплю!	невероятно я спать
-Открой дверь, Борис! -Нам надо объясниться.	открыть дверь борис мы объясниться
Все уже ясно.	весь ясно
Откройте дверь.	открыть дверь
-Оставьте нас! Идите к себе! -Но это его дом.	оставить мы идти себя но это дом
-Плевать! -Он псих! Он псих...	плевать он псих он псих
Откройте дверь, ради Бога! Откройте дверь!	открыть дверь ради бог открыть дверь
Я запарковался чуть подальше.	я запарковаться далёкий
-Давайте выпьем. -С удовольствием.	давать выпить с удовольствие
Какой-же он подлец.	какойж подлец
Вы не очень то вежливы с моим другом...	вы очень вежливый мой друг
У Вас прелестный друг, но у него слишком бурная жизнь. Понимаете?	у вы прелестный друг слишком бурный жизнь понимать
Шутите? Это самый спокойный человек.	шутить это самый спокойный человек
Предупреждаю, я вызову полицию! Или дверь разнесу.	предупреждать вызов полиция или дверь разнести
