cleaned_text	lemm_text
Думаю потому, что я попросила подождать, пока накину халат...	думать потому попросить подождать пока накинуть халат
Иначе говоря, Вы дали ей понять, что не одеты!	иначе говорить вы дать понять одетый
Но так и было!	но быть
-Извините, я не нарочно. -Уходите, умоляю! Убирайтесь!	извинить нарочно уходить умолять убираться
С удовольствием, если бы могла открыть дверь...	с удовольствие мочь открыть дверь
Давайте.	давать
Прошу!	просить
Борис?	борис
Борис, позволь объяснить, что произошло.	борис позволить объяснить произойти
-Алло? -Алло?	алло алло
Флоранс!	флоранс
Не знаю, сказала ли Ваша подружка, но я звонила недавно...	не знать сказать ваш подружка звонить недавно
Она мне не подружка!	она подружка
Ах, да - Ваша домработница, которая убирает голой.	ах ваш домработница который убирать голый
Флоранс, это - ужасное недоразумение! Вы где?	флоранс это ужасный недоразумение вы где
"Внизу, в ""Табачной лавке""."	внизу табачный лавка
Поднимайтесь, сейчас же, прошу Вас.	подниматься же просить вы
Это - глупая история, я все объясню. Мы еще вместе посмеемся!	это глупый история объяснить мы вместе посмеяться
Это невероятно, мне надо поговорить с Вами.	это невероятно поговорить вы
-Флоранс, Вы там -Да.	флоранс вы да
Флоранс, идите. Хотите, я спущусь?	флоранс идти хотеть спуститься
Я иду.	я идти
Борис. Ты должен мне поверить! Клянусь, это правда.	борис ты должный поверить клясться это правда
Это же смешно!	это смешно
Уходи.	уходить
Помоги мне - уходи.	помочь уходить
О-о, нет!	оо нет
-Куда Вы? -Борис выгнал меня, и все из-за Вас!	куда вы борис выгнать я изз вы
Опять начинается?! Сейчас же уходите!	опять начинаться сейчас уходить
-Позвольте вызвать такси! -Неет!	позволить вызвать такси неть
Вы не можете выставить меня вот так!	вы мочь выставить так
-Буду я церемониться!. -Дайте, хотя бы, одеться.	быть церемониться дать хотя бы одеться
-Исключено! Убирайтесь! -Но куда я пойду в таком виде!	исключить убираться но пойти такой вид
-Мне все равно! -Меня остановит полиция!	я равно я остановить полиция
-Мне плеать! -У меня даже денег нет на такси!..	я плеать у деньга такси
Держите!	держать
Ай!	ай
Вы - негодяй!	вы негодяй
Флоранс! Флоранс!	флоранс флоранс
-Извините! -О, ла-ла!	извинить о лал
Пойду поговорю с Вашим другом. Пора положить конец этой истории!	пойти поговорить ваш друг пора положить конец история
Он не может выставить Вас на улицу.	он выставить вы улица
Он поймет. Человек, все таки.	он понять человек таки
Не беспокойтесь, все уладится.	не беспокоиться уладиться
Можем спокойно поговорить две минуты?	мочь спокойно поговорить два минута
Я объясню, она, она...	я объяснить она она
Флоранс!	флоранс
Заходите, быстрей. Делайте, что говорю.	заходить быстрый делать говорить
Как хорошо, что Ваша подружка еще здесь.	как хорошо ваш подружка здесь
Она не подружка!	она подружка
Не волнуйтесь, сцен ревности не будет.	не волноваться сцена ревность быть
Послушайте, мне жаль, но я хотел бы знать, что там происходит.	послушать жаль хотеть знать происходить
Вы мне дадите две минуты?	вы дать два минута
Помоги мне, старина!	помочь я старина
Я не хочу делать тебе больно.	я хотеть делать ты больно
-Понял? -Да.	понять да
Убирайся, чтобы я тебя не видел. Помоги.	убираться видеть помочь
Я помогу.	я помочь
Что Вы там застряли? Идите же?	что вы застрять идти же
Не могу! Скажите, чтобы он меня отпустил!	не мочь сказать отпустить
Да отпустите Вы его!	да отпустить вы он
Слышите? Она хочет, чтобы Вы меня отпустили.	слышать она хотеть вы отпустить
Быстрей же!	быстрый же
-Спасибо. -Пошли.	спасибо послать
Я положила ее вещи в Вашу камнату.	я положить вещий ваш камнат
Да?	да
Откройте бутылку!	открыть бутылка
-Бутылку? -Да, бутылку шампанского!	бутылка да бутылка шампанский
-Хорошо... -Быстрей!	хорошо быстрый
Садитесь.	садиться
-Эй, как зовут Вашу подружку? -Она мне не подружка.	эй звать ваш подружка она подружка
-Как Вас зовут? -Ева, мадам...	как вы звать ева мадам
-Зовите меня Флоранс. Ну как? -Сейчас, сейчас!	звать флоранс ну как сейчас сейчас
Звонят. Этому не будет конца.	звонить это конец
-Это мой муж. -Что!?	это муж что
Я чуть было не столкнулась с ним у выхода.	я столкнуться выход
-Он меня не заметил. Откройте. -Надо спрятаться!	он заметить открыть надо спрятаться
Нет. С мужчинами, лучший способ защиты - нападение.	нет с мужчина хороший способ защита нападение
Идите!	идти
Дорогой! Что ты здесь делаешь?	дорогой что делать
Я хотел задать тебе тот же вопрос.	я хотеть задать ты вопрос
Хотела сделать тебе сюрприз - купить картину к твоему дню рождения.	хотеть сделать ты сюрприз купить картина твой день рождение
-Но сюрприза не вышло. А ты? -Я?	но сюрприз выйти а ты я
Ну, да. Что ты здесь делаешь?	ну да что делать
То же, что и ты. Я тоже хотел купить картину мсье Дюкудрея.	то же ты я хотеть купить картина мсьё дюкудрей
Решительно, мне сегодня везет...	решительно сегодня везти
-Хочешь шампанского? -Да!	хотеть шампанский да
-Он обожает это. -О да, шампанское!	он обожать это о да шампанский
Ева - подруга Яна, Андре - мой муж.	ева подруга ян андре муж
-Здравствуйте. -Мое почтение, мадам.	здравствовать мой почтение мадам
Ева позировала Яну, когда я пришла...	ева позировать ян пришлый
-Да, да -Больше нет...	да большой нет
Не беспокойтесь...	не беспокоиться
Можно?	можно
-Вы позволите? -Да, да, конечно...	вы позволить да да конечно
Ну, я не ищу настоящего сходства.	ну искать настоящий сходство
В этом что-то есть.	в чтоть есть
Иначе, когда я что-то рисую, меня вдохновляет обнаженная женщина.	иначе чтоть рисовать вдохновлять обнажённый женщина
Затем я выражаю, как это сказать, чувственность моей модели...	затем выражать это сказать чувственность мой модель
Я понял.	я понять
-Дорогая! -Ева, что случилось?	дорогой ева случиться
Все в порядке?	весь порядок
Ева недавно потеряла близкого человека и...	ева недавно потерять близкий человек и
-Родителя? -Нет, да, почти своего гуру.	родитель нет да свой гуру
Гуру?	гуру
Его Святейшество Равишанадрадраван.	он святейшество равишанадрадраван
-Трудно выговорить, он индус. -Надеюсь, он не мучился.	трудно выговорить индус надеяться мучиться
Смерть была мгновенной. Сердце...	смерть мгновенный сердце
Инфаркт?	инфаркт
Нет. Удар ножа. Его тело нашли а келье.	нет удар нож он тело найти келья
Какой ужас! Такое преступление в монастыре!	какой ужас такой преступление монастырь
Нет, это была келья покаяния в Сан-Кентине...	нет это келья покаяние санкентина
Его заколол кинжалом дилер - пуэрториканец.	он заколоть кинжал дилер пуэрториканец
Они не поделили прибыль...	они поделить прибыль
Он сидел в тюрьме за торговлю наркотиками?	он сидеть тюрьма торговля наркотик
О нет, за... за... налоговые махинации.	о нет за за налоговый махинация
Он был погребен на своем ранчо в Гамбурге, Висконтин...	он погрести свой ранчо гамбург висконтина
Очень красивые похороны. Вся деревня съехалась...	очень красивый похороны весь деревня съехаться
Впрочем, деревня тоже его. Он был для Евы, как отец...	впрочем деревня он он ева отец
Мужайся, любовь моя!	мужаться любовь мой
Его Святейшество оставил ей один из своих Роллсов, их у него было 35.	он святейшество оставить свой роллсова 35
Для Евы это только знак внимания. Она не водит машину...	для ева это знак внимание она водить машина
Любовь моя, умерло только его тело, а его послание пережило его.	любовь мой умереть тело послание пережить он
Это главное. Мистика!	это главный мистика
Опять звонят! Определенно, этому нет конца!	опять звонить определённо это конец
Сегодня праздник:	сегодня праздник
Она забыла это.	она забыть это
Спасибо, старина.	спасибо старина
Это мой сосед. Он вернул несколько вещичек, которые утром попросил.	это сосед он вернуть несколько вещичка который утром попросить
-А, он просил Вашу зубную щетку. -Он вернул и Вашу косметику.	а просить ваш зубной щётка он вернуть ваш косметика
Да и мой тональный крем тоже! В этом прелесть квартирных домов.	да тональный крем тоже в прелесть квартирный дом
Если кому-то что-то нужно, мы стучимся к соседям...	если комуть чтоть нужно стучаться сосед
Опять! Этому нет конца!	опять это конец
Действительно, этот дом купается в гостеприимстве!	действительно дом купаться гостеприимство
-Дверь захлопнулась. -Видишь, а ты мне не верил!	дверь захлопнуться видеть верить
Но что мне делать? Ключ остался дома.	но делать ключ остаться дом
Перейди через балкон, как он.	перейти балкон он
Ладно, не буду Вам мешать работать. До свидания.	ладный быть вы мешать работать до свидание
-Ты остаешься? -Нет, нет, я тоже иду.	ты оставаться нет нет идти
Спасибо. До свидания, Ева.	спасибо до свидание ева
А где полотно, которое ты выбрала?	а полотно который выбрать
Я его заказала Яну. Он обещал нарисовать к твоему дню рождения.	я заказать ян он обещать нарисовать твой день рождение
Это портрет моей жены в стиральной машине, в моторе велосипеда?	это портрет мой жена стиральный машина мотор велосипед
Это будет сюрприз!	это сюрприз
Позвольте проигласить вас обоих к нам.	позволить проигласить оба мы
-Это очень мило. -В пятницу вечером, вам удобно?	это очень мило в пятница вечером удобно
Да, да, дорогая?	да да дорогой
Извините. Вы позволите?	извинить вы позволить
Спасибо!	спасибо
Что с твоей рукой?	что твой рука
Ты ранен!	ты раненый
Моя жена прекрасно ладит с нашим соседом. Они очень дружны.	мой жена прекрасно ладить наш сосед они очень дружный
Сейчас ты мне веришь?	сейчас верить
Я не знаю, не знаю...	я знать знать
Прошу.	просить
-Договорились. Мы вас ждем у нас. -Хорошо. Вы очень любезны.	договориться мы ждать мы хорошо вы очень любезный
Ты - ненормальный!	ты ненормальный
Этим двоим понравилось!	это двоить понравиться
О, нееет!	о нееет
Подойди.	подойти
Можно 5 минут отдыха!?	можно 5 минута отдых
Было бы замечательно. Но это Вы все время звоните в мою дверь!	быть замечательный но это вы время звонить мой дверь
Что Вам нужно?	что вы нужно
Сквозняк захлопнул дверь. Да, мою тоже!	сквозняк захлопнуть дверь да мой тоже
Я хотел бы перейти через балкон, если Вас не затруднит...	я хотеть перейти балкон вы затруднить
-Идите. Быстрей. -Спасибо!	идти быстрый спасибо
В этом доме не осталось ничего личного.	в дом остаться личный
Только со мной могло такое случиться!	только я мочь такой случиться
Продолжается! Замечательно!	продолжаться замечательный
Мне очень жаль, но я оставила у Вас свои вещи.	я очень жаль оставить вы свой вещий
Молчите. Я понял. Держите.	молчать я понять держать
-Но это пистолет! -Да, да. Слушайте.	но это пистолет да да слушать
-Давайте! -Что?	давать что
-Цельтесь в сердце. -Вы что?	целиться сердце вы что
Вы решили меня уничтожить, это очевидно! Тогда, закончим!	вы решить уничтожить это очевидно тогда закончить
Облегчите мои страдания, умоляю! Стреляйте!	облегчить мой страдание умолять стрелять
Послушайте, хватит. Возмите это. Я ненавижу оружие. Возьмите.	послушать хватить возмитя это я ненавидеть оружие взять
-Нет. -Я сойду с ума с вами обоими, точно!	нет я сойти ум вы оба точно
-Флоранс! -Нет! Ева! Не делайте этого!	флоранс нет ева не делать это
-Успокойтесь! -Но я спокойна.	успокоиться но спокойный
Дайте мне сказать! Вы совершите непоправимое! Вы молоды!	дать сказать вы совершить непоправимый вы молодой
Ева, что ты делаешь? С ума сошла?	ева делать с ум сойти
Оставайтесь на месте! Не двигайтесь!	оставаться место не двигаться
Послушайте! Я видела, как подло он с Вами обошелся...	послушать я видеть подло вы обойтись
-Подло обошелся с тобой! -Не вмешивайтесь!	подло обойтись ты не вмешиваться
Каковы бы ни были мучения и униже- ния, которые он Вам причинил...	каков мучение униже ния который вы причинить
Мучения и унижения, которые он тебе причинил!	мучение унижение который ты причинить
Флоранс, Вы это не серьезно...	флоранс вы это серьёзно
Замолчите! Он не стоит того.	замолчать он стоить тот
-Отдайте мне! -Возьмите.	отдать я взять
Вы все сошли с ума! Это была шутка! Это - зажигалка!	вы сойти ум это шутка это зажигалка
Зажигалка! Смотрите.	зажигалка смотреть
Мой пистолет! Заряженный! О, Господи!	мой пистолет зарядить о господь
О, Господи!	о господь
Господи!	господь
Вы обезумели, друг мой! А если бы Вы убили кого-нибудь!	вы обезуметь друг мой а вы убить когонибудь
В шкафу, рядом с холодильником моя зажигалка, завернутая в ткань.	в шкаф ряд холодильник зажигалка завернуть ткань
Принесите ее, пожалуйста.	принести она пожалуйста
-Держите. -Вот моя зажигалка! Глупая история!	держать вот зажигалка глупый история
Надо положить зажигалку вместо пистолета! Ради Бога!	надо положить зажигалка вместо пистолет ради бог
Вы абсолютно безрассудны!	вы абсолютно безрассудный
-Главное, что Вы здесь! -Да, уж.	главный вы здесь да уж
Пейте!	пить
Но я не понимаю, Флоранс. Я же видел Вас, садящейся в такси...	но понимать флоранс я видеть вы садиться такси
Да, да. Я сделала круг по кварталу и вернулась.	да да я сделать круг квартал вернуться
Потому что мне нужно поговорить с Вами.	потому нужно поговорить вы
-Мне нехорошо, голова кружится... -Ложитесь, сюда...	я нехорошо голова кружиться ложиться сюда
Держите, это Вам поможет...	держать это вы помочь
Спасибо. Вы - замечательная! Я Вас люблю.	спасибо вы замечательный я вы любить
Ева!	ева
Сейчас не время. Ты что, не видишь, что ему плохо?	сейчас время ты что видеть плохо
Надо вызвать врача!	надо вызвать врач
Не надо, это - нервы. Через две минуты пройдет.	не надо это нерв через два минута пройти
-Уже лучше. -Правда?	уже хороший правда
Я все объясню. Флоранс. Я объясню.	я объяснить флоранс я объяснить
Служба спасения?	служба спасение
Почему он вызывает службу спасения?	почему вызывать служба спасение
Тебе же сказали, что не надо! Борис!	ты сказать надо борис
Вы его ранили! Борис!	вы ранить борис
-У Вас есть аптечка? -Сейчас.	у вы аптечка сейчас
-Иди ложись, иди. -Меня хотели застрелить, я ранен.	идти ложиться идти я хотеть застрелить раненый
Дайте мне и ложитесь.	дать ложиться
Улица Лозье 36, 6 этаж, быстрей, пожалуйста.	улица лозий 36 6 этаж быстрый пожалуйста
Дайте мне.	дать я
Почему ты на меня так смотришь?	почему смотреть
-Перестань так смотреть! -Я не понимаю.	перестать смотреть я понимать
Что ты не понимаешь?	что понимать
Что такого произошло, что ты хотела его застрелить.	что такой произойти хотеть застрелить
Ничего не произошло.	ничто произойти
Смотрите, ничего страшного.	смотреть страшный
Пуля едва задела.	пуля едва задеть
-Ему повезло. -Видишь, ничего страшного.	он повезти видеть страшный
-Ты мне так и не ответила. -Ответила на что?	ты ответить ответить что
Почему ты хотела его застрелить?	почему хотеть застрелить
Она не хотела меня застрелить! Это я глупо пошутил!	она хотеть застрелить это глупо пошутить
Послушайте, я сейчас Вам все объясню.	послушать вы объяснить
