cleaned_text	lemm_text
-Вы вовремя. Заходите. -Это так любезно.	вы вовремя заходить это любезно
А теперь, покиньте мой дом. Иначе, я вас вышвырну вон.	а теперь покинуть дом иначе вышвырнуть вон
Предупреждаю, я переверну весь дом.	предупреждать перевернуть весь дом
Дай мне ключ, я хочу уйти.	дать ключ хотеть уйти
-Хватит! -Мне нужна правда.	хватить я нужный правда
Если я скажу Вам правду, Вы оставите меня в покое?	если сказать вы правда вы оставить покой
Вы обо мне больше никогда не услышите.	вы о услышать
Хорошо, я скажу Вам правду.	хорошо сказать вы правда
Что Вы конкретно хотите знать? На какую тему?	что вы конкретно хотеть знать на какой тема
-Вы что, меня за идиота держите?! -Спрашивайте, я отвечу.	вы что идиот держать спрашивать ответить
Когда и как это началось у Вас с Евой?	когда это начаться вы ева
-Когда это началось? -Да.	когда это начаться да
-В июле. -Начало июля?	в июль начать июль
-Да, точно. -Я так и знал.	да точно я знать
-Да? -Как?	да как
-Что как? -Как это началось?	что как как это начаться
Э, ну... в лифте. В лифте.	э ну лифт в лифт
-В лифте? -Да.	в лифт да
Что произошло?	что произойти
Мы были в лифте. Нас зажали. Я не знаю, что произошло...	мы лифт мы зажать я знать произойти
Было жарко. Я чувствовал ее грудь своим телом, ее запах...	быть жарко я чувствовать грудь свой тело запах
Мне продолжать?	я продолжать
Дальше рассказывать?	далёкий рассказывать
-Продолжайте. -Этому типу нравится страдать.	продолжать это тип нравиться страдать
-Продолжайте. -Тогда я ее обнял и поцеловал.	продолжать тогда обнять поцеловать
Что дальше?	что далёкий
Хватит! Мне надоели ваши выходки.	хватить я надоесть ваш выходка
Успокойся, дорогая. Он имеет право знать правду.	успокоиться дорогой он иметь право знать правда
Вы тоже пьяны?	вы пьяный
-Вы занимались любовью? -В лифте?	вы заниматься любовь в лифт
Да, конечно.	да конечно
Это было не так уж легко. Представьте себе кабину...	это легко представить кабина
Словно я 10 лет занимался йогой...	словно 10 год заниматься йога
Все, Вам этого хватит?	весь вы хватить
-Вы потом встречались? -Все время. Как только Вы уезжали...	вы встречаться весь время как вы уезжать
Какой она была?	какой быть
Вы имеете в виду в постели? А, страстной.	вы иметь вид постель а страстный
Ваш друг очень странный...	ваш друг очень странный
Борис, хватит!	борис хватить
Ладно, вдоволь пошутили...	ладный вдоволь пошутить
Вы меня заставили говорить это.	вы заставить говорить это
Он Вас не слушает. Он любит мучить и себя, и меня. Он псих.	он вы слушать он любить мучить себя я он псих
-Что вы наделали? -Не злите его.	что наделать не злить он
Не двигайтесь, Борис! Предупреждаю, я рассержусь!	не двигаться борис предупреждать рассердиться
Ты мне надоел, Борис. Я больше не хочу тебя видеть, слышишь?	ты надоесть борис я хотеть видеть слышать
Замолчите.	замолчать
Мне надоело все это! Надоело! Это длится годами, но все! Конец!	я надоесть это надоесть это длиться годами весь конец
Мне очень жаль, я звоню в полицию.	я очень жаль звонить полиция
Да, да. Звоните в полицию. Хоть бы его забрали!	да да звонить полиция хоть забрать
Вы не знаете номер полиции?	вы знаете номер полиция
Давайте, звоните! Он меня достал.	давать звонить он достать
Сволочь. Я бросила все ради него! Я все отдала ему!	сволочь я бросить ради он я отдать он
Скажите это ему. Мне наплевать.	сказать это он я наплевать
Я его любила больше всех на свете. Я...	я любить свет я
Помогите мне, ради Бога.	помочь я ради бог
Ни одна женщина не будет его так любить.	ни один женщина любить
Помогите мне!	помочь я
Скорее!	скорее
Почему ты так смотришь? Ты думаешь, напугал меня?	почему смотреть ты думать напугать я
Заткнитесь!	заткнуться
Борис, прошу Вас, давайте поговорим, как разумные люди.	борис просить вы давать поговорить разумный человек
Чего тебе надо, Борис? Ты хочешь знать, не изменила ли я тебе с ним?	что ты надо борис ты хотеть знать изменить ты он
-Так вот, слушай! -Она ненормальная! Замолчите!	так вот слушай она ненормальный замолчать
Да, я тебе изменила!	да ты изменить
Как только ты уходил, я приходила к нему	как уходить приходить он
-И мы часами занимались любовью! -Ева!	и часами заниматься любовь ева
С тобой я не ощущала даже десятой доли того, что с ним!	с ты ощущать десять доля тот он
Он гениален! Он прекрасен! Это супермен!	он гениальный он прекрасный это супермен
Борис!	борис
На помощь! Помогите!	на помощь помочь
-Что происходит? -Не понимаю.	что происходить не понимать
Это парочка с 6-ого, у них все время так.	это парочка 6ий время так
Борис?	борис
Борис? Что случилось? Борис?	борис что случиться борис
Убирайтесь. Оставьте меня в покое.	убираться оставить покой
Что Вы с ним сделали?	что вы сделать
Ничего. Все нормально. Он слегка ударился...	ничто весь нормальный он слегка удариться
Он поправится.	он поправиться
Кажется, все нормально.	кажется нормальный
-Вы ему сделали больно. Что с ним? -Ну, хватит!	вы сделать больно что он ну хватить
-Вы его ранили! -Ну хватит! Оставьте меня!	вы ранить ну хватить оставить я
Негодяй! Грубиян! Вы ему сделали больно!	негодяй грубиян вы сделать больно
Все! Хватит! Они оба чокнутые!	весь хватить они оба чокнутый
Бориииис!	бориииис
-В чем дело? Что вы шумите? -Все в порядке! Я тебе все объясню.	в дело что шуметь весь порядок я ты объяснить
-Он плачет! -Что?	он плакать что
Он плачет!	он плакать
Ну, нет! Он не может так поступить! Это неудобно!	ну нет он поступить это неудобно
Борис, хватит плакать, прошу тебя, хватит.	борис хватить плакать просить ты хватить
Оставь меня. Не трогай!	оставить я не трогать
-Помогите мне его поднять. -Надо пересилить себя, старина.	помочь поднять надо пересилить себя старина
Приложите каплю усилия.	приложить капля усилие
-Не трогай меня! Отстань! -Он сердится на меня.	не трогать я отстать он сердиться я
-Я никогда не видела, чтоб он плакал! -Он это готовил для меня.	я видеть плакать он это готовить я
-Я не могу больше! -Я тоже!	я мочь большой я тоже
Что произошло? Как мы дошли до такого?	что произойти как дойти такой
Если б не он, я бы убил тебя, затем себя.	если б он убить ты затем себя
Так было бы лучше для всех.	так весь
Я должен кое-что объяснить.	я должный коечто объяснить
Я слушаю.	я слушать
Ты поймешь. Посмотри на нее! Ты думаешь, это женщина?	ты понять посмотреть нея ты думать это женщина
Я уже ничего не думаю. Но, на первый взгляд, да.	я думать но один взгляд да
-А что? Разве Ева не женщина? -Нет.	а что разве ева женщина нет
Ева для меня не женщина. Это остров, мой причал, мой дом.	ева женщина это остров причал дом
Заткнись.	заткнуться
Когда она меня подобрала, я был весь разломан.	когда подобрать весь разломать
Она меня вылечила, как мой папа.	она вылечить папа
У меня больше ничего в жизни не было.	у жизнь быть
Ничего.	ничто
Очень грустная история.	очень грустный история
Ева вселила в меня смелость рисовать.	ева вселить смелость рисовать
Он рисовал тайком.	он рисовать тайком
Я никогда этому не учился. Рисование меня успокаивало.	я это учиться рисование успокаивать
Это талантливый художник.	это талантливый художник
Да, это правда. То, что ты делаешь, это великолепно.	да это правда то делать это великолепно
Все это говорят. Ты далеко пойдешь.	весь это говорят ты далеко пойти
Идиоты! Запомни одну вещь - я никогда не брошу Еву!	идиот запомнить один вещь бросить ева
Никогда не брошу Еву!	никогда бросить ева
Я это запомню.	я это запомнить
-Ладно, надо что-нибудь придумать. -Да.	ладный чтонибыть придумать да
У тебя есть предложение?	у предложение
-Что? Кто? Я? Но на какую тему? -На тему Евы, тебя и меня.	что кто я но какой тема на тема ева я
-Борис, не начинай. -Помолчи! Это мужской разговор.	борис начинать помолчать это мужской разговор
Ну?	ну
Вот, что я предлагаю. Ты вернешься к себе с Евой.	вот предлагать ты вернуться ева
Я завтра уеду очень далеко, чтоб забыть все это.	я завтра уехать очень далеко забыть это
Когда я вернусь, обещаю больше никогда не смотреть на нее.	когда вернуться обещать смотреть нея
Не разговаривать с ней, даже не здороваться.	не разговаривать она здороваться
Если этого не достаточно - я готов переехать на другой конец Парижа.	если достаточно готовый переехать конец париж
Если мне не придется уехать в США, я буду тебе очень признателен.	если прийтись уехать сша быть ты очень признательный
-Как тебе мое предложение? -Нет.	как ты мой предложение нет
Это не сработает. Как только я уеду.	это сработать как уехать
Она приедет повидать тебя, и все начнется заново.	она приехать повидать ты начаться заново
Она без ума от тебя. Это очевидно.	она ум ты это очевидно
Что ты с ней сделал? Как она оказалась в таком состоянии?	что сделать как оказаться такой состояние
Ничего! Честно! Пусти меня!	ничто честно пустить я
-В чем твой секрет? -Мой секрет?	в твой секрет мой секрет
Да. Почему все женщины без ума от тебя?	да почему женщина ум ты
Это сексуальность, интеллигентность? Что это? Что?	это сексуальность интеллигентность что это что
Не знаю. Это от природы. Я понятия не имею.	не знать это природа я понятие иметь
Это дар, как у тебя, например, досаждать людям.	это дар ты например досаждать человек
Да, но я страдаю, как проклятый!	да страдать проклятый
Малышка! Ангелочек! Что он с тобой сделал?	малышок ангелочек что ты сделать
Почему?	почему
Почему мы? Почему ты вторгся в нашу жизнь, чтоб разрушить ее?	почему мы почему вторгнуться наш жизнь разрушить она
Что мы тебе сделали? Мы тебе ничего не делали!	что ты сделать мы ты делать
Тебя привлекает зло! Ты извращенец, нечисть, хищник, ты дьявол!	ты привлекать зло ты извращенец нечисть хищник дьявол
Борис!	борис
Да.	да
-Я ухожу. -Хорошо, дорогая. Иду.	я уходить хорошо дорогой идти
Не притворяйся, будто не понимаешь. Я ухожу от тебя.	не притворяться понимать я уходить ты
Ты же не можешь так поступить?	ты мочь поступить
Если ты хочешь себя погубить, это твое дело. Я люблю тебя.	если хотеть погубить это твой дело я любить ты
-Но я молода и хочу жить. -Я тоже!	но молодой хотеть жить я тоже
Ева!	ева
Я обдумала все. Это наш последний шанс. Дай мне уйти.	я обдумать весь это наш последний шанс дать уйти
Ты его любишь?	ты любить
Ты хорошая девушка, ты не хочешь жить во лжи. Да?	ты хороший девушка хотеть жить ложь да
Послушай, ты можешь с ним встречаться. Вы сходите на танцы.	послушать мочь встречаться вы сходить танец
Она это любит, а я нет. Меня тошнит от этих светских вечеров.	она это любить нет я тошнить этот светский вечер
Я начинаю пить, потом начинаю делать гадости.	я начинать пить начинать делать гадость
Я это понял.	я это понять
Прости меня!	простить я
Ева, я хочу, чтобы ты была счастлива, чтобы ты цвела.	ева хотеть счастливый цвести
Многие так живут в Париже.	многие жить париж
Хочешь, чтобы мы жили вместе? Да?	хотеть жить вместе да
Скажи честно. Мы - соседи по площадке. Это естественно.	сказать честно мы сосед площадка это естественно
Что скажешь?	что сказать
Он согласен!	он согласный
Мы будем хорошими друзьями. Видишь, как мы ладим.	мы быть хороший друг видеть ладить
Он хороший парень, от него хорошо пахнет.	он хороший парень пахнуть
Он розовый, как попка ребенка.	он розовый попка ребёнок
У меня идея! Давайте наймем дом на окраине Парижа.	у идея давать нанять дом окраина париж
Ты же любишь пригород.	ты любить пригород
Летом, по вечерам будем сидеть в саду под старым деревом.	летом вечер быть сидеть сад старое дерево
Говорить о философии, литературе, о жизни.	говорить философия литература жизнь
Ты будешь напевать на кухне, моя посуду.	ты быть напевать кухня посуда
Затем, ты присоединишься к нам с бутылкой сивухи.	затем присоединиться мы бутылка сивуха
-Апельсинового сока. -Чего?	апельсиновый сок что
Пусть лучше это будет апельсиновый сок.	пусть это апельсиновый сок
Ладно, с апельсиновым соком.	ладный апельсиновый сок
Будем там сидеть, как 3 идиота.	быть сидеть 3 идиот
Смотреть на звезды и слушать звуки ночи.	смотреть звезда слушать звук ночь
Я нес чепуху, говорил неизвестно что.	я нести чепуха говорить неизвестно что
-Чтобы удержать ее. -Ну что теперь?	чтобы удержать она ну теперь
Если ты еще раз дотронешься до моей жены, я тебя убью.	если дотронуться мой жена убить
Ладно.	ладный
Иди поговори с ней. Сделай, чтоб она осталась. Давай, бегом.	идти поговорить она сделать остаться давать бегом
-Но что я ей скажу? -Что хочешь.	но сказать что хотеть
Это несерьезно. Вы не можете меня оставить. Увезите его, прошу Вас.	это несерьёзно вы мочь оставить увезти он просить вы
Нет, Ян. Я должна, наконец, уйти. Займитесь им. Вы ему нужны.	нет ян я должный наконец уйти заняться имя вы нужный
-Я доверяю Вам его. -Спасибо, это очень мило.	я доверять вы он спасибо это очень мило
-Она ничего не хочет знать. -Ева, я покончу с собой.	она хотеть знать ева покончить себя
-Если ты уйдешь. Я убью себя! -Ты что, будь же разумным.	если уйти я убить себя ты что быть разумный
Я способен на это. Я выброшусь.	я способный это я выброситься
Хороший шантаж, трогательно.	хороший шантаж трогательно
Ева, если ты уйдешь, я выброшусь!	ева уйти выброситься
Я предупредил тебя, предупредил!	я предупредить ты предупредить
Ева, я прыгну.	ева прыгнуть
Я сделаю это.	я сделать это
Этот идиот сделает это!	этот идиот сделать это
Еваааа!	еваааа
-Боже мой! -Я припаркуюсь и приду.	бог мой я припарковаться прийти
Евааа!	евааа
Борис, Борис, остановись.	борис борис остановиться
Не подходи, я спрыгну! Не подходи!	не подходить спрыгнуть не подходить
Борис. Остановись! Ради всего святого!	борис остановиться ради святой
Скажи мне правду! Ты мне с ним изменяла?	сказать правда ты изменять
Я все придумал! Ты меня заставил!	я придумать ты заставить
Тебя не спрашивали!	ты спрашивать
Нет же! Я тебе никогда не изменяла!	нет же я ты изменять
Мы же поклялись не врать друг другу!	мы поклясться врать друг друг
Я тебе никогда не врала! Борис, я тебя люблю!	я ты врать борис любить
Видишь, она тебя любит! Я тоже тебя люблю!	видеть любить я любить
Обещай мне, что между вами все кончено!	обещать я вы конченый
Клянусь! Клянусь тебе.	клясться клясться ты
Все закончилось. Все... Она поклялась. Все в порядке.	весь закончиться весь она поклясться весь порядок
Ну и напугали же вы меня! Что случилось?	ну напугать я что случиться
Не знаю.	не знать
Что-то не так?	чтоть так
У меня голова кружится.	у голова кружиться
Держитесь за меня.	держаться я
Садитесь. Да, сюда.	садиться да сюда
Вы знаете, это кошмар...	вы знаете это кошмар
Он хотел, чтобы мы жили вместе загородом.	он хотеть жить вместе загород
На, дорогой. Пей. Тебе станет лучше.	на дорогой пить ты стать хороший
Что вы с ним сделали, что он в таком состоянии?	что сделать такой состояние
-Не ваше дело. -Вы достаточно ему уже навредили.	не ваш дело вы достаточно навредить
Помолчи, Марильда.	помолчать марилёд
