cleaned_text	lemm_text
Они должны быть где-то здесь...	они должный гдеть здесь
Здесь! Что происходит?!	здесь что происходить
Эй, подожди! Ты же ч е л о в е к! Ты хоть понимаешь, во что ввязываешься?!	эй подождать ты число е литр е к ты понимать ввязываться
Да, я обычный человек... но должно же быть что-то, что я могу сделать!	да обычный человек должный чтоть мочь сделать
Разуй глаза! Он лишь навредит тебе! Теперь-то ты з н а е ш ь!	разуть глаз он лишь навредить ты теперьто з наш е ш ь
Верданди!	верданди
Что происходит?	что происходить
Она не властна над своей мощью! Стоит ей окончательно обезуметь, и будет по-настоящему плохо!	она властный свой мощь стоить окончательно обезуметь понастоящий плохо
Верданди! Пожалуйста, вспомни! Ветер, который мы слушали вместе! Он никогда не был таким грустным!	верданди пожалуйста вспомнить ветер который слушать вместе он такой грустный
Морисато...	морисато
Я попала в беду и поэтому наглухо тебя з а т в о р и л а?	я попасть беда поэтому наглухо з том р литр а
Пожалуйста, поделись со мной своей печалью.	пожалуйста поделиться я свой печаль
И тогда, я поделюсь с тобой в с е м.	и тогда поделиться ты е метр
Давай вместе шагнем в будущее.	давать вместе шагнуть будущее
Из-за тебя...из-за тебя...!	изз тебяизз ты
ИДИОТ!!!	идиот
Верданди!	верданди
Морисато! Морисато... Морисато!	морисато морисато морисато
Сестра, Морисато... Морисато...!!!	сестра морисато морисато
Теперь боги зашевелятся.	теперь бог зашевелиться
И все закончится?	и закончиться
Нет. Все только начнется.	нет весь начаться
Он поправится.	он поправиться
Кейичи счастливчик, его хранят аж три богини.	кейй счастливчик хранить аж богиня
Сестра... Прости, что доставила столько хлопот.	сестра простить доставить столько хлопоты
Тебе тоже не мешало бы отдохнуть.	ты мешать отдохнуть
Извини... я прибегла к магии...	извинить прибегнуть магия
Ничего, Скульд... когда все окажется позади, давай вместе вернемся на небеса.	ничто скульда оказаться позади давать вместе вернуться небо
Я только навредила Морисато... Я ни на что не гожусь!	я навредить морисато я годиться
Кейичи... Я думаю, Кейичи предвидел такой поворот событий....	кейй я думать кейй предвидеть поворот событие
Все будет как в старые добрые времена, до того, как тебе отшибло память о Кейичи.	весь старое добрый время тот ты отшибить память кейй
После п р и ш е с т в и я на Землю, мы много повидали, многих повстречали... и Кейичи всегда был с тобой.	после плата р ш е том земля повидать многий повстречать кейй ты
Вы всегда лучились счастьем и радостно смеялись.	вы лучиться счастие радостно смеяться
Не сдавайся, Сестра.	не сдаваться сестра
Ты вспомнишь, и все вернется на круги своя! Обязательно!	ты вспомнить вернуться круг свой обязательно
Спасибо, Скульд.	спасибо скульда
Я приложу все силы... костьми лягу, но верну свое и с т и н н о е Я!	я приложить сила кость лечь вернуть свой том наш наш е я
Сестра!	сестра
Не беспокойся за нее. Чересчур увлеклась магией, потому и лежит пластом.	не беспокоиться нея чересчур увлечься магия лежать пласт
Это тебе.	это ты
Я, желавшая счастья в с е м...	я желать счастие е метр
Невольно вспоминается Селестин.	невольно вспоминаться селестина
Сейчас я... желаю...	сейчас я желать
Да, Кейичи? Это Хасегава...	да кейй это хасегава
Я нашла клапан для BMW, могу отдать хоть сейчас.	я найти клапан bmw мочь отдать сейчас
Да ну? Спасибо.	да ну спасибо
Знаешь, у нас тут временные сложности... мы еще вернемся к этому разговору.	знаешь временной сложность вернуться это разговор
Хм... надеюсь, потеря памяти, не ухудшит ваших отношений?	хм надеяться потеря память ухудшить ваш отношение
Конечно.	конечно
Морган! Кровь...	морган кровь
В чем дело?	в дело
Ты вроде цел и невредим.	ты вроде целый невредимый
Разумеется, но тебе нужно думать о с в о е м здоровье.	разумеется ты нужно думать е метр здоровье
Все в порядке.	весь порядок
Пошли в медпункт.	послать медпункт
Ты... ты беспокоишься обо мне?	ты беспокоиться о я
Быстрее! Сейчас не время для подобных разговоров!	быстрый сейчас время подобный разговор
[Ушел в университет. Kеичи.]	уйти университет kей
Скорей всего, ничего страшного. Можно было обойтись и без...	скорый всего страшный можно обойтись без
А это уже серьезно!	а это серьёзно
Извини...	извинить
У... у меня был человек, который мне н р а в и л с я.	у человек который наш р литр я
Но нас разлучили...	но разлучить
Когда я вижу вас в д в о е м, то чувствую себя немножко странно.	когда видеть далее е метр чувствовать немножко странно
То, чего я была лишена... любовь. А вы смогли полюбить друг друга?	то лишить любовь а смочь полюбить друг друг
Если смогли, то я никогда не прощу свою ошибку. Почему м ы не смогли?	если смочь простить ошибка почему метр ы смочь
Пытались, конечно. Но... я противилась.	пытаться конечно но противиться
Словно боялась стать соучастницей... почему? Ради чего??	словно бояться стать соучастница почему ради что
Я не знаю...	я знать
Морган...	морган
Если мир и з м е н и т с я, сможешь ли ты полюбить меня?	если мир з метр е наш том я смочь полюбить я
Дашь ли ты осуществиться моей мечте?	дать осуществиться мой мечта
Я не слишком хорошо понял, но... Похоже, жизнь тебя не щадила...	я слишком понять но похоже жизнь щадить
...надеюсь, ты не хочешь обжечься еще раз?	надеяться хотеть обжечься раз
В конце концов, Верданди уйдет к Селестину. И тогда ты останешься один-одинешенек.	в конец конец верданди уйти селестина и остаться одинодинёшенек
Что ты сказала?	что сказать
Мир скоро и з м е н и т с я.	мир скоро з метр е наш том я
Потому-то я и пришла. И... это н о в а я я.	потомуть пришлый и это наш я
Это ты украла воспоминания Верданди?!	это украсть воспоминание верданди
Морган...	морган
Погоди!!	погодить
Авария! Вирус размножается! Заражены сектора E и G! Барьер неминуемо опоздает!	авария вирус размножаться заразить сектор e g барьер неминуемо опоздать
Переключаемся на резервную систему!	переключаться резервный система
Прорвался!	прорваться
Пеорт! Отказало 20% систем Небес! Возможно, досталось и сети Земли.	пеорт отказать 20 система небо возможно достаться сеть земля
Верданди подключена к системе! Нужно срочно установить подлинную форму вируса, иначе эту заразу не остановить!	верданди подключить система нужно срочно установить подлинный форма вирус иначе зараза остановить
Готовьтесь к запуску.	готовиться запуск
Что? Тогда...	что тогда
Обычными методами тут не обойтись...	обычный метод обойтись
Инъекцию Верданди нужно сделать до того, как вирус проникнет в систему Земли.	инъекция верданди нужно сделать тот вирус проникнуть система земля
Да... Что?	да что
Верданди!	верданди
Слишком опасно!	слишком опасный
Неужели правда? Шансы на успех всего 16%!	неужели правда шанс успех 16
Ты и Кейичи... мне тяжко на вас смотреть.	ты кейй тяжко смотреть
Малейшая оплошность - и ты забудешь не только Кейичи, но и нас, и Небеса!	маленький оплошность забыть кейй мы небо
Не хочу-у!	не хочуа
Я...лучше... без всяких там вакцин...	яхороший всякий вакцина
Вакцина... надо полагать, антивирус?	вакцина полагать антивирус
Да... Вакцина архиэффективна против вирусов, но слишком велика вероятность побочных эффектов.	да вакцина архиэффективный против вирус слишком велик вероятность побочный эффект
При таком п о б о ч н о м исходе...	при такой плата б число наш метр исход
...Верданди может стать чистым листом.	верданди стать чистый лист
Вакцина с т о л е т и я м и пылилась в арсенале... ибо риск воистину огромен.	вакцина том литр е том метр пылиться арсенал ибо риск воистину огромный
Морган была союзницей Селестина...	морган союзница селестина
Возможно, она знает, как вернуть память... И тебе не придется рисковать!	возможно знать вернуть память и ты прийтись рисковать
Я... приму вакцину.	я принять вакцина
Верданди!	верданди
Морган и Морисато... вы целовались?	морган морисато целоваться
Ну...	ну
Извини. Наверно, показалось.	извинить наверно показаться
Я не сумела обуздать свои чувства...	я суметь обуздать свой чувство
...казалось, будто мое сердце вот-вот разорвется. И я побежала.	казалось мой сердце вотвота разорваться и побежалый
Я пришла исполнить твое желание, но...	я пришлый исполнить твой желание но
Сейчас я просто-напросто хочу быть любимой... Но глубоко в н у т р и меня спит мое второе ``я``.	сейчас простонапросто хотеть любимый но глубоко наш том р спать мой два я
И, тем не менее, ты способен любить меня?	и менее способный любить я
Я приму тебя л ю б о й.	я принять литр ю б й
Спасибо тебе, Морисато. Я попробую.	спасибо ты морисато я попробовать
И пускай вероятность успеха каких-то жалких 16%, если удача улыбнется мне...	и пускай вероятность успех какихтый жалкий 16 удача улыбнуться я
Я... даже если мы потеряем все, даже если нас разлучат...	я потерять весь разлучить
Мы снова встретимся и попробуем начать сначала.	мы снова встретиться попробовать начать сначала
И неважно, сколько раз придется пробовать, неважно, сколько нам потребуется лет.	и неважно сколько прийтись пробовать неважно сколько мы потребоваться год
Благодарю тебя от всего сердца.	благодарить сердце
Вакцина готова. Переключаю канал на Пеорт.	вакцина готовый переключать канал пеорт
Нам обязательно повезет.	мы обязательно повезти
Прорываясь сквозь тьму необъятную, сметая вековечное зло...	прорываться сквозь тьма необъятный сметать вековечный зло
...призываем ветер снизойти на Землю...	призывать ветер снизойти земля
Подключаемся к Верданди!	подключаться верданди
Светом желаний заклинаю прошлое, настоящее и будущее...	свет желание заклинать прошлое настоящее будущее
Вернись во тьму...	вернуться тьма
Мы установили истинную форму вируса!	мы установить истинный форма вирус
И это, по-вашему, вирус?	и это повашему вирус
И з ы д и!	и з ы далее и
Началось.	начаться
Что это?	что это
Что-то странное.	чтоть странный
В чем загвоздка?	в загвоздка
Вирус интегрируется в вакцину... и переписывает программу!	вирус интегрироваться вакцина переписывать программа
Нет! Неужели это и есть его цель?!	нет неужели это цель
В чем дело?	в дело
Ты в порядке?	ты порядок
Нападение на главную систему!	нападение главный система
Программа начала взлом паролей.	программа начало взлом пароль
Она играючи обходит защиты!	она играючи обходить защита
Куда прорывается вирус?!	куда прорываться вирус
К и з н а ч а л ь н о й программе!	к з наш число литр ь наш й программа
Селестин... какова твоя цель?	селестина каков твой цель
Используя их чувства... используя сердце Верданди... и даже вакцину...	использовать чувство использовать сердце верданди вакцина
...только так ты мог заполучить программу, каковой по зубам уничтожить Иггдрассиль?	только мочь заполучить программа каковой зуб уничтожить иггдрассиля
Ты... ты что творишь?	ты творить
Уничтожу...всех и вся...и сей жалкий мир!	уничтожувсех всяй сеять жалкий мир
Рядом с домом появилось нечто огромное... нечто, обладающее неимоверной мощью!	ряд дом появиться нечто огромный нечто обладать неимоверный мощь
Нам не выстоять!	мы выстоять
Как там Верданди? Что с ней!?	как верданди что она
Не могу проверить, в системе царит полный хаос!	не мочь проверить система царить полный хаос
Все ближе и ближе!	весь близкий близкий
Это...	это
Открой глаза, Верданди.	открыть глаз верданди
Наконец-то пробил час.	наконецтый пробить час
Как прекрасно, что именно вы, господин Селестин, станете ее наставником.	как прекрасно именно вы господин селестина стать наставник
Верданди занимает почетное место в небесной иерархии.	верданди занимать почётный место небесный иерархия
У нее прекрасное сердце... Такой ее впервые увидели небеса.	у прекрасный сердце такой впервые увидеть небо
Верданди... Верданди?	верданди верданди
В чем дело? А? А вот и она.	в дело а а она
Приятно познакомится, Верданди. Меня зовут Селестин.	приятно познакомиться верданди я звать селестина
Рада вас видеть... господин Селестин...	рада видеть господин селестина
Что стряслось? Почему ты плачешь?	что стрястись почему плакать
Птичка...	птичка
Спасибо, господин Селестин!	спасибо господин селестина
"Обойдемся без ""господин"". Зови меня просто Селестин."	обойтись господин звать просто селестина
Я, Селестин, клянусь светом надежды, что всегда буду с тобой. Посему можешь быть со мной полностью откровенной.	я селестина клясться свет надежда быть ты посему мочь я полностью откровенный
Верданди, я тебя нашел. Спускайся.	верданди найти спускаться
Урд меня никогда не сыскать, а Селестин почему-то всегда находит.	урд сыскать селестина почемуть находить
Почему?	почему
Потому что я всегда думаю о тебе.	потому думать ты
Когда я думаю о тебе, то могу понять в с е.	когда думать ты мочь понять е
Где бы ты ни пряталась, я всегда тебя найду.	где прятаться найти
Деревцу плохо. Оно несчастно.	деревце плохо оно несчастный
Как же быть?	как быть
Почему бы тебе не спеть?	почему ты спеть
Спеть?	спеть
Именно. Поделись с ним теплом своего сердца, и дереву станет легче.	именно поделиться тепло свой сердце дерево стать лёгкий
Вер... данди...	вера данди
Заснула? Быстро взрослеешь, Верданди.	заснуть быстро взрослеть верданди
Ее путь был долог, но в итоге она стала доброй и прекрасной богиней.	она путь долгий итог стать добрый прекрасный богиня
И теперь мы направим ее в Небесную Службу Спасения.	и направить небесный служба спасение
Мир наполнен печалью и болью...	мир наполнить печаль боль
...то что ты увидишь там, в н и з у, может изранить твою душу.	то увидеть там наш з у изранить твой душить
Возможно, ты еще не готова к пришествию в э т о т мир... значит, нам должно создать новый.	возможно готовый пришествие э том том мир значит мы должный создать новый
Морисато... Я буду часто вспоминать о тебе...	морисато я быть часто вспоминать ты
Понимаешь, Верданди? Это я.	понимать верданди это я
Понимаю. Ты... ты...	понимать ты ты
Как д р е в о попало на Землю?	как далее р е попасть земля
Благодаря тебе, я его таки нашел.	благодаря ты таки найти
Энергия, заключенная в сем древе, больше не будет достоянием Небес.	энергия заключить сем древо достояние небо
И никому не придется грустить.	и никто прийтись грустить
Ни Морган... ни тебе.	ни морган ты
Живущие на грешной Земле... Не примут такого счастья!	жить грешный земля не принять такой счастие
Каждый живет и самосовершенствуется, прилагая немало усилий. И в конце концов - достигает счастья.	каждый жить самосовершенствоваться прилагать немало усилие и конец конец достигать счастие
За всю свою жизнь люди успевают познать и счастье, и печаль, и любовь!	за жизнь человек успевать познать счастие печаль любовь
Я видела много счастливых обитателей Земли!	я видеть счастливый обитатель земля
