cleaned_text	lemm_text
Я не знаю.	я знать
В этом все и дело. Я не могу ничего объяснить.	в дело я мочь объяснить
Я просто рассказываю, как было.	я просто рассказывать быть
(Мишель) Посвети фонариком повыше.	мишель посветить фонарик высокий
Хорошо.	хорошо
Прости, ведь надо взять правильный ракурс.	простить взять правильный ракурс
- (Мишель) Это точно. - Привидения ведь капризные. Призрак-Дива.	мишель это точно привидение капризный призракдив
(Мишель) Что угодно, лишь бы появились.	мишель что угодный лишь появиться
Погоди секунду.	погодить секунда
Посмотри сюда. На этой камере что-то странное...	посмотреть сюда на камера чтоть странный
Она то ли наклонилась, то ли что...	она наклониться что
Это сломанная камера?	это сломать камера
Не знаю, что-то явно не так. Не знаю, что...	не знать чтоть явно так не знать что
- Это и есть причина.	это причина
Сломанная камера? - Не хочу проверять.	сломать камера не хотеть проверять
(Мишель) Она такая сломанная... Починить ее?	мишель она такой сломать починить она
(Джон) Ты сама это знаешь.	джон ты сам это знаешь
- (Мишель) Ты издеваешься надо мной? - (Джон) Это не я.	мишель ты издеваться я джон это я
(Мишель) Так это не ты?	мишель так это ты
(Джон) Нет.	джон нет
Я и сам удивился.	я удивиться
(Мишель) Эй, Джулс! В этой комнате может...	мишель эй джулс в комната мочь
(Джон) Какого черта это было?	джон какой черта это быть
Я...я не знаю.	яя знать
- (Мишель) Здесь что-то есть. - (Джон) Кто-то нас разыгрывает.	мишель здесь чтоть есть джон ктоть разыгрывать
Что такое? Вы в порядке?	что такой вы порядок
(Мишель) Видела, как дверь захлопнулась?	мишель видеть дверь захлопнуться
- Нет. (скрип двери)	нет скрип дверь
(Джулс) Черт...А вот это уже видела.	джулс черта это видеть
Давай камеру. Дай сюда камеру!	давать камера дать сюда камера
(Джулс) Давай же. Ты только что открыл нам дверь.	джулс давать же ты открыть мы дверь
Скажи, зачем ты здесь?	сказать здесь
Зачем хлопать дверями?	зачем хлопать дверь
- Покажись! (Мишель кричит)	показаться мишель кричать
Меня что-то тронуло. Что-то тронуло меня за ногу!	я чтоть тронуть чтоть тронуть нога
- Ты видела что-нибудь на камере? - (Джулс) Не знаю.	ты видеть чтонибыть камера джулс не знать
- Меня что-то коснулось! - (Джулс) Я ничего не вижу.	я чтоть коснуться джулс я видеть
Все хорошо. Спокойно...	весь хорошо спокойно
(Дженкинс) Ни у кого не было приводов, кроме Перселла. Его исключили за то...	дженкинс ни кто привод кроме перселла он исключить то
...что он угрожал преподавателю ножом во время спора.	что угрожать преподаватель нож время спорый
Преподаватель добился ограничительного заперта.	преподаватель добиться ограничительный запереть
"И Чампан сказал ""он"" на записи прежде, чем его убили."	и чампан сказать он запись прежде убить
Значит, девчонка ни при чем. А еще он сказал...	значит девчонка чем а сказать
He also said that they were locked in the house.	he also said that they were locked in the house
...что они заперты в доме. Но как это возможно, если они были внутри?	что запереть дом но это возможно внутри
- Мы обнаружили отпечатки на дверной ручке. - (Льюис) Да?	мы обнаружить отпечаток дверной ручка льюис да
Не знаю.	не знать
Если бы тебя заперли в доме, Дженкинс, как бы ты продпочел спасатись?	если запереть дом дженкинс продпочесть спасатиться
Вылез бы в окно.	вылезти окно
Принято.	принять
Или через окошко в прачечной.	или окошко прачечный
Нет...	нет
Окошко для молочника!	окошко молочник
Это еще что?	это что
В старых домах молочник оставлял в них бутылки.	в старое дом молочник оставлять бутылка
Ооо...	ооо
Господи Иисусе...	господь иисус
Тестовато, едва пролезешь.	тестоватый едва пролезть
Хорошо бы это были люди, которых мы сейчас ищем.	хорошо это человек который искать
Нужно это сфотографировать и отправить кровь на экспертизу.	нужно это сфотографировать отправить кровь экспертиза
Где Мишель, Джон?	где мишель джон
- (льюис) Где Мишель? - (Джон) Я не знаю.	льюис где мишель джон я знать
- (Льюис) Не знаешь?. - Марк...	льюис не знаешь марк
Что это?	что это
- Что...Не знаю. - Ты не знаешь, что это?	чтоня знать ты знаешь это
Я думаю, она сбежала через окошко, а ты за ней гнался.	я думать сбежать окошко гнаться
Не знаю, о чем вы говорите.	не знать говорить
Разве? Я говорю в том, что ты не можешь вспомнить.	разве я говорить тот мочь вспомнить
- Я пытаюсь вспомнить. - Как же...	я пытаться вспомнить как же
Знаешь, что я думаю? Ты убил этих людей.	знаешь думать ты убить этот человек
Устранял друзей по одному, прямо как Марта Ливингстон.	устранять друг один прямо март ливингстон
Только Мишель удалось от тебя спасатись...	только мишель удаться спасатиться
...как спаслась твоя мама.	как спастись твой мама
- Пошел ты! - Пошел я?	пойти ты пойти я
Я надеюсь, Мишель сбежала. Я бы в жизни ее не обидел.	я надеяться мишель сбежать я жизнь обидеть
- (Льюис) Почему? - Потому что она беременна!	льюис почему потому беременный
Беременна?	беременный
- Она беременна. - Десять недель.	она беременный десять неделя
Мы еще никому не сказали.	мы никто сказать
Раз никому не сказали, зачем ты говоришь это мне, Джон?	раз никто сказать говорить это я джон
Не знаю!	не знать
Ах, не знаешь. Ты вообще ничего не знаешь!	ах знаешь ты вообще знаешь
Ничегошеньки!	ничегошеньки
- Сдается мне, это ты их убил, Джон! - Марк, оставь нас на минутку.	сдаваться я это убить джон марк оставить минутка
Я с ним поговорю.	я поговорить
Слушай...	слушай
Что ты делаешь? Я почти его расколола.	что делать я расколоть
Ты знала, что она беременна?	ты знать беременный
Нет. Но не возвращайся, пока я тебя не позову.	нет но возвращаться пока позвать
Я вот-вот его разговорю.	я вотвота разговорить
Я бы тоже разговорил.	я разговорить
Ладно.	ладный
Послушай, это его домыслы. Я так не думаю.	послушать это домысел я думать
(Элизабет) Зря ты не сказал, что она беременна. Я не понимаю, почему.	элизабет зря сказать беременный я понимать почему
(Мишель) Какое жуткое место.	мишель какой жуткий место
Зачем ты ее включил?	зачем включить
Нет, не я.	нет я
Эй, ребята. Хозяйская спальня.	эй ребята хозяйский спальня
Что случилось?	что случиться
Я просто задел балерину и...	я просто задеть балерина и
Блин, я же велел ничего не трогать!	блин велеть трогать
Прости, я думал...	простить думать
Думаю тебя не просили. Только ничего не трогать.	думать просить только трогать
Брайан, не будь козлом. Он не специально.	брайан быть козёл он специально
Ничего: ни диван, ни бвлерину, ни мою бывшую.	ничто диван бвлерин мой бывший
Ни к чему не прикасайся.	ни что прикасаться
- Обладеть. - (Донни по рации) Все, вырубайте рации.	обладеть донни рация весь вырубать рация
Сказал он по рации.	сказать рация
- Есть электроимпульсы кроме наших? - Нет.	есть электроимпульс кроме наш нет
- Сэм, камера. - (Сэм) А...Да.	сэм камера сэм ад
- Так было до того, Джон ее коснулся? - Да - Все так?	так тот джон коснуться да весь так
Да.	да
Я поставлю ее обратно.	я поставить обратно
(статуэтка начинает играть) - Да ладно.	статуэтка начинать играть да ладный
Она заводится.	она заводиться
Нет, дело не в этом. Она указывает на что-то.	нет дело это она указывать чтоть
На что указывает, Джон?	на указывать джон
На стену?	на стен
На ковер.	на ковёр
Джулс?	джулс
Там ничего нет.	там нет
Погодите. А что, если она имеет в виду другой ковер?	погодить а что иметь вид ковёр
- Донни, помоги мне. - Вперед.	донни помочь я вперёд
- О, черт... - Не заступайте за круг!	о черта не заступать круг
- Ребята, что это? - Донни, дай прибор.	ребята это донни дать прибор
Зашкаливает.	зашкаливать
Что это?	что это
Похоже на печать, но я впервые такое вижу.	похоже печать впервые такой видеть
В смысле? Ты же вроде все про все знаешь.	в смысл ты вроде знаешь
Печатей на свете тысячи.	печать свет тысяча
У всех разные значения и вариации...	у разный значение вариация
так что простите, я не все выучила.	простить выучить
Итак, это источник энергии дома.	итак это источник энергия дом
Здесь исполнялись все ритуалы...	здесь исполняться ритуал
...а значит здесь лучше всего начать наш сеанс.	а значит начать наш сеанс
Возможно, им удалось достучаться до потустороннего мира.	возможно удаться достучаться потусторонний мир
А потом Марта спятила и всех поубивала.	а март спятить поубивать
Никакие потусторонние силы...	никакой потусторонний сила
...не могли заставить Мапту сделать это.	не мочь заставить мапту сделать это
Она спятила задолго до того, как все это произошло.	она спятить задолго тот это произойти
Моя мама всегда так говорила.	мой мама говорить
В детстве она постоянно попадала в неприятности, дралась.	в детство постоянно попадать неприятность драться
Ничто ни к чему ее не подтолкнуло. Марта уже давно перешла все границы.	ничто что подтолкнуть март давно перейти граница
Ребят, это кровь?	ребята это кровь
- Нет, это воск. - Ясно. Тогда можно расслабиться.	нет это воск ясно тогда расслабиться
- Видел такую печать раньше, Джон? - Нет.	видеть такой печать ранний джон нет
Но когда балерина указала место, я понял, что она имеет в виду.	но балерина указать место понять иметь вид
- (Мишель) Откуда эти звуки? - Постой...Погоди.	мишель откуда звук постойпогодить
(брайан) Донни, держись рядом.	брайан донни держаться ряд
- (Джулс) Черт... - (Брайан) Мишель, ты в порядке?	джулс черта брайан мишель порядок
(Джон) Она в порядке.	джон она порядок
(Джулс) откуда эти звуки?	джулс откуда звук
(громкий удар) - Боже!	громкий удар бог
Сигнала нет.	сигнал нет
Осторожно. Будь осторожней.	осторожно быть осторожный
- Что это было? - Господи Иисусе!	что это быть господь иисус
- (Сэм) Что это было? Вы это видели? - (Джулс) Нет.	сэм что это быть вы это видеть джулс нет
- (Сэм) Видели? - (Джулс) Нет!	сэм видеть джулс нет
(Сэм) Проклятье.	сэм проклятие
- Что это? - (Мишель) Что там?	что это мишель что там
- (Брайан) Ну-ка, посмотри. - (Джулс) Черт...	брайан нук посмотреть джулс черта
(Сэм) Ни фига себе.	сэм ни фига себя
- Вот черт... - Фантастика.	вот черта фантастика
Кровь на окне - Брайана Перселла.	кровь окно брайан перселла
Третья положительная. Он вылез оттуда.	три положительный он вылезти оттуда
Итак, он был ранен и вылез в окно.	итак раненый вылезти окно
Вопрос, кем он вылез. Жертвой или убийцей?	вопрос кто вылезти жертва убийца
Зачем лезть в окно, если можно было выйти через даерь?	зачем лезть окно выйти даерь
Он за кем-то гнался, Дженкинс. Возможно, за жертвой.	он кемтый гнаться дженкинс возможно жертва
Типа, Мишель вылезла в окно, а Перселл вслед за ней?	тип мишель вылезти окно перселла вслед она
Да.	да
А значит, надо их найти, пока не стрялась беда.	а значит найти пока стрялася беда
Вперед! Скорее, скорее.	вперёд скорее скорее
Вас понял. Ривс, где находишься?	вы понять ривс находиться
Расскажи о Брайане Перселле. Вы с ним не ладили.	рассказать брайан перселла вы ладить
Я видел его несколько раз. С ним трудно поладить.	я видеть несколько раз с трудно поладить
Он тебе не нравился?	он ты нравиться
Он был просто... помешан на этом доме.	он просто помешанный дом
Он любил заходить слишком далеко. Так оно и было.	он любить заходить слишком далеко так оно быть
Ну же, детка, где ты?	ну же детка ты
Я знаю, ты здесь.	я знать здесь
Где же ты?	где ты
Ну ладно, будь по-твоему.	ну ладный быть потвоему
Покажись.	показаться
Да ладно.	да ладный
(Сэм) Чего так долго? Я не хочу проторчать здесь всю ночь.	сэм что долго я хотеть проторчать ночь
Еще минуточку. Последняя...	ещё минуточка последний
- Это оно, да? - Да.	это оно да да
Что это?	что это
(Донни) крайне чувствительный микрофон.	донни крайне чувствительный микрофон
Улавливает звуки и частоты, которые обычно не услышишь.	улавливать звук частота который обычно услышать
Запись идет по 50 каналам. Это как внутреннее ухо человека.	запись идти 50 канал это внутренний ухо человек
Как он работает?	как работать
Что это?	что это
Что?	что
Круто.	круто
(Донни) Это мы.	донни это мы
Типа, наше сердцебиение?	тип наш сердцебиение
Это сердцебиение...	это сердцебиение
...оно в четыре раза быстрее обычного.	оно четыре раз быстрый обычный
Пятое.	пять
Шестое...	шесть
Седьмое, а может и больше.	семь большой
- Что? - Кто-то только что был здесь.	что ктоть здесь
Клянусь Богом, он стоял прямо тут.	клясться бог стоялый прямо тут
- О, черт! Что происходит? - Донни! Донни, у тебя есть что-нибудь?	о черта что происходить донни донни чтонибыть
Черт...Черт, черт, черт!	чертчерта черта черта
(Мишель) Там ничего.	мишель там ничто
Джон?	джон
Что происходит? Какого черта тут творится?	что происходить какой черта твориться
Картина ни с того ни с сего вспыхнула.	картина сей вспыхнуть
- Как это, вспыхнула? - Взяла и загорелась.	как это вспыхнуть взять загореться
Откуда ты знал, где огнетушитель?	откуда знать огнетушитель
Не знаю.	не знать
Ты уже видел эту комнату?	ты видеть комната
Так, не оборачиваясь, скажи, что у тебя за спиной?	так оборачиваться сказать спина
Там...	там
...кусок обоев оторван, а под обоями...	кусок обои оторвать обои
...под обоями рисунок маленькой девочки.	под обои рисунок маленькая девочка
Как странно.	как странно
Что еще?	что ещё
Фотография мужчин в костюмах...	фотография мужчина костюм
...и за ней печать.	и печать
Ничего себе.	ничто себя
Еще кое-что.	ещё коечто
Какая-то женщина позади Джулс.	какаять женщина позади джулс
(Сэм) Джулс!	сэм джулс
Джулс?	джулс
- (Сэм) Джулс...Ты в порядке? - (Мишель) Джулс!	сэм джулст порядок мишель джулс
- Поднимайте ее. - Все, уходим отсюда.	поднимать она весь уходить отсюда
Вы понимаете, что произошло? Это просто круто.	вы понимать произойти это просто круто
Круто, что она улетала через всю комнату?	круто улетать комната
Я просто предлагаю это обдумать прежде, чем сваливать.	я просто предлагать это обдумать прежде сваливать
Вы должны понимать, на что мы наткнулись.	вы должный понимать наткнуться
Я понимаю одно: ты спятил, а мы уходим!	я понимать один спятить уходить
Это бывает, когда у тебя образуется связь.	это бывать образоваться связь
А ты трус! Разве мы здесь не за этим?	а трус разве это
- Джулс знает. - Нет! Хватит! Перестаньте!	джулс знать нет хватить перестать
Джулс, он не понимает.	джулс понимать
Я никуда не уйду.	я никуда уйти
Что? Джулс...	что джулс
Над нами смеются, нас считают повернутыми чудиками.	над мы смеяться считать повернуть чудик
Нас постоянно полощут в дерьме, и мы должны положить этому конец.	мы постоянно полоскать дерьмо должный положить это конец
То, что произошло, безумие, но Брайан прав.	то произойти безумие брайан право
Я остаюсь.	я оставаться
Ладно.	ладный
- А мы уходим. Сэм! - Сэм?	а уходить сэм сэм
Эй!	эй
Ты в порядке?	ты порядок
И ты думаешь, я поверю в эту чепуху?	и думать поверить чепуха
Я рассказываю, как было на самом деле.	я рассказывать самый дело
Ваша подруга улетала в другой конец комнаты?	ваш подруга улетать конец комната
Раньше я и сам бы в это не поверил...	ранний это поверить
...а теперь верю.	а верить
