cleaned_text	lemm_text
<i>(репортеры разных каналов) Жестокость убийств и обстоятельства, при которых они произошли...</i>	iрепортёр разный канал жестокость убийство обстоятельство который произошлиi
Главные новости.	главное новость
Немыслимое убийство в Четвертом церковном приходе...	немыслимый убийство четыре церковный приход
<i>Одно из самых жутких происшествий в 1988-м году.</i>	iодно самый жуткий происшествие 1988м годуi
<i>Марта Ливингстон убила четверых друзей, а сама повесилась...</i>	iмарт ливингстон убить четверо друг сам повесиласьi
<i>Полиция назвала это ритуальным убийством...</i>	iполиция назвать это ритуальный убийствомi
<i>Это самое громкое дело из разряда культов со времен Лиззи Борден.</i>	iэтый самый громкий дело разряд культ время лиззь борденi
<i>Пятеро молодых людей погибли в результате сатанинского ритуала...</i>	iпятеро молодая человек погибнуть результат сатанинский ритуалаi
<i>Джин Стэнтон, Седьмой канал. Прямое включение из прихода Лафорт.</i>	iджина стэнтон семь канал прямой включение приход лафортi
<i>Соседи потрясены, узнав, что скромная и замкнутая девушка...	iсосед потрясти узнать скромный замкнутый девушка
...совершила такое... </i>.	совершить такой i
<i>Местные до сих пор с содроганием вспоминают</i>	iместный сей пора содрогание вспоминаютi
<i>убийства от рук Марты Ливингстон.</i>	iубийство рука марта ливингстонi
<i>Спустя более 20 лет после убийств Ливингстон...</i>	iспустить 20 год убийство ливингстонi
<i>...местные утверждают, что роль в этом сыграли паранормальные явления.</i>	iместный утверждать роль сыграть паранормальный явленияi
<i>Грейс впервые пригласила медиума, чтобы очистить дом от негативных эманаций...</i>	iгрейс впервые пригласить медиум очистить дом негативный эманацийi
<i>...но она хочет попробовать.<i>	iно хотеть попробоватьi
<i>Мы приглашаем всех желающих.</i>	iмы приглашать желающихi
<i>Посетители заходят и спрашивают, кто здесь жил и почему они переехали.</i>	iпосетитель заходить спрашивать жить почему переехалиi
"<i>""Здесь кто-то умер?""</i>"	iздесь ктоть умерi
<i>Говорят, призраки - это заблудшие души, которых не отпускает печаль...</i>	iговорить призрак это заблудший душа который отпускать печальi
<i>...но верите вы в загробную жизнь или нет...</i>	iно верить загробный жизнь нетi
<i>...без сомнения, в этом доме произошло нечто страшное много лет назад.</i>	iбез сомнение дом произойти нечто страшный год назадi
Я приеду.	я приехать
Сказал же, приеду.	сказать же приехать
Откуда плохое настроение?	откуда плохой настроение
Деб что-то послышалось, велела сходить к соседям.	деб чтоть послышаться велеть сходить сосед
Хорошо.	хорошо
Дом Ливингстонов.	дом ливингстон
Да нет, все тихо.	да нет тихо
Я перезвоню.	я перезвонить
Дурацкий вопрос, но получше ничего не найдется?	дурацкий вопрос хороший найтись
- И впрямь дурацкий. - Беру.	и впрямь дурацкий брать
Алло?.	алло
Детектив, простите, что поздно. Поступил вызов.	детектив простить поздно поступить вызов
Какие-то непорядки в доме 4 по Лафорт Роуд, местные переполошились...	какиеть непорядок дом 4 лафорт роуд местный переполошиться
...а ближайший патрульный в 20 минутах езды.	а ближний патрульный 20 минута езда
Ничего, Марджери, я съезжу. Тут две минуты.	ничто марджерь съездить тут два минута
Еще раз извините. У вас же свидание...	ещё извинить у свидание
Да, к сожалению, преступники в мой личный график не заглядывают.	да сожаление преступник личный график заглядывать
Ни с места!	ни место
Проклятье, Леонард. Ты меня до смерти напугал!	проклятие леонард ты смерть напугать
- Все в порядке? - Да, да, да. Да...	весь порядок да да да да
- В чем дело? - Там кровь.	в дело там кровь
- Стой здесь. Никуда не уходи. - Да...Да, да.	стоять здесь никуда уходить дада да
(Льюис) Полиция!	льюис полиция
Полиция.	полиция
Декектив Льюис. Полкрепление и скорую на Лафорт Роуд, дом 4.	декектив льюис полкрепление скорый лафорт роуд дом 4
Повторяю, подкрепление и скорую на Лафорт Роуд, дом 4.	повторять подкрепление скорый лафорт роуд дом 4
(Диспетчер) Принято.	диспетчер принять
(Льюис) Господи...	льюис господь
Полиция!	полиция
Марджери, где...	марджерь где
Полиция! Спокойно, парень! Стоять!	полиция спокойно парень стоять
Я сказал, стоять! Стой!	я сказать стоять стоять
Не двигаться! Ни с места!	не двигаться ни место
Спокойно, спокойно.	спокойно спокойно
Как ты?	как ты
(Льюис) Смотри на меня. На меня! Не отключайся, ладно?	льюис смотреть я на я не отключаться ладный
Все хорошо.	весь хорошо
Все будет хорошо.	весь хорошо
НЕДЕЛЮ НАЗАД	неделя назад
(Мишель) Ты в порядке?	мишель ты порядок
Джон?	джон
Джон?	джон
Что с тобой?	что ты
Ты ответишь моему брату?	ты ответить мой брат
Да...Прости, чувак, какой вопрос?	дапростить чувак вопрос
Ты рассказывал о том, что видел в том доме.	ты рассказывать тот видеть дом
Ты сказал, тебе являлась она.	ты сказать ты являться она
"Хотел прояснить, что за ""она""."	хотеть прояснить она
Одна из жертв или...	один жертва или
- ...хозяйка дома? - Нет.	хозяйка дом нет
Это была моя мама.	это мама
Она умерла несколько лет назад и...	она умереть несколько год назад и
...я просто вижу ее в этом доме...	я просто видеть дом
...но еще ни разу туда не заходил.	но раз туда заходить
Она...сидит там.	онасидеть там
Улыбается.	улыбаться
Просит отпустить ее...	просить отпустить она
Она выглядит моложе, чем я ее помню. Моего возраста.	она выглядеть молодой помнить мой возраст
У тебя всегда были видения?	у видение
Нет, последние пару месяцев.	нет последний пара месяц
Это классный материал.	это классный материал
Брайану понравится.	брайан понравиться
Брайану?	брайан
Да, Брайану Перселлу.	да брайан перселла
Эй! Эй, ну пожалуйста, не уходи.	эй эй пожалуйста уходить
Мы только-только к чему-то пришли.	мы толькотолько чемуть прислать
Почему ты не сказала про Брайана?	почему сказать брайан
Я не думала, что это так важно.	я думать это важный
Ты подумала, что участие твоего бывшего не имеет значения?	ты подумать участие твой бывший иметь значение
Мы расстались три года назад.	мы расстаться год назад
Я собиралась сказать тебе, но мне надо было знать, поедешь ты или нет.	я собираться сказать ты знать поехать нет
Понимаю, Сэм, ты хотел помочь, но...	понимать сэм хотеть помочь но
...мои кошмары это не излечит.	мой кошмар это излечить
Понял.	понять
Но такие виления не приходят сами по себе. Мы должны встретить их лицом к лицу.	но такой вилений приходить сам себя мы должный встретить лицо лицо
"- В смысле ""лицом к лицу""? - Мы пойдем в том дом."	в смысл лицо лицо мы пойти дом
Внутри ты поймешь, к чему привязан...	внутри понять что привязать
...и есть ли в здании что-то реальное из твоих видений.	и здание чтоть реальный твой видение
Да. А Брайан?	да а брайан
Брайан, Джулс и Донни будут фиксировать паранормальные аспекты.	брайан джулс донни быть фиксировать паранормальный аспект
Они уверены, что там, где были жертвы, остались их души.	они уверить там жертва остаться душа
Нет.	нет
Брайану плевать и на жертвы, и на души...	брайан плевать жертва душа
...и на все, что связано со мной.	и весь связать я
Он хищник, которого волнует одно: как заснять привидение...	он хищник который волновать один заснять привидение
...и срубить на этом побольше бабок.	и срубить большой бабка
Поэтому он настоит, чтобы мы пошли. С тобой или без тебя.	поэтому настоять послать с ты ты
Послушай, в том доме много лет назад произошли необъяснимые вещи.	послушать дом год назад произойти необъяснимый вещий
Возможно, когда об этом узнала твоя мать, оно запало ей в душу...	возможно узнать твой мать оно запасть душить
...и эти случаи преследовали ее, как преследуют тебя сейчас.	и случай преследовать она преследовать сейчас
Но я не прошу тебя слушаться меня.	но просить слушаться я
Послушай маму. Это она велит тебе отпустить ее.	послушать мама это велита ты отпустить она
Ты не спишь неделями.	ты спать неделя
Я не понимаю твой скепсис...	я понимать твой скепсис
Возможно, ничего не выйдет. А что, если получится?	возможно выйти а что получиться
Попробуй.	попробовать
Пожалуйста.	пожалуйста
(Дженкинс) ЕЕ зовут Мишель Чампан. Кажется, она подружка подозреваемого.	дженкинс она звать мишель чампан кажется подружка подозревать
Мы нашли только ее сумочку, а ее саму - нет.	мы найти сумочка сам нет
(Ривс) Я сниму отпечатки с орудия убийства.	ривс я снять отпечаток орудие убийство
Давай.	давать
И чего мы стоим? Вперед.	и стоять вперёд
Есть, сэр.	есть сэр
Шевелитесь, шевелитесь.	шевелиться шевелиться
- Сколько камер? - Всего 13 штук.	сколько камера всего 13 штука
(Питер) В поле зрения почти весь дом, но ничего не обнаружили.	питер в пол зрение весь дом обнаружить
- Дьявол! Стерто? - Нет, зашифровано. Мертвый эфир.	дьявол стёртый нет зашифровать мёртвый эфир
В записи есть кое-что, но...	в запись коечто но
Массовое убийство, вокруг куча камер...	массовый убийство вокруг куча камера
...и что, ничего нет?	и что нет
Думаю, мы что-нибудь разыщем.	думать чтонибыть разыскать
Генри, при чем здесь морозилка?	генри морозилка
Заморозка помогает восстановить данные.	заморозка помогать восстановить дать
Попортишь диски - я тебя сам убью.	попортить диск убить
Честное слово.	честной слово
Загерметизируем.	загерметизировать
Попробуем провести дефрагментацию. Мало ли, что найдется.	попробовать провести дефрагментация мало ли найтись
Шесть винчестеров, терабайта данных - на это уйдет много времени.	шесть винчестер терабайт дать это уйти время
- Привет, Перси. - (Дженкинс) Привет, Перси.	привет перси дженкинс привет перси
- (Льюис) Ему зачитали права? - (Дженкинс) Да, сэр. Ривс.	льюис он зачитать право дженкинс да сэр ривс
(Льюис) Как, ты Джон?	льюис как джон
- Вы нашли Мишель? - Пока нет.	вы найти мишель пока нет
Думали, ты нам поможешь.	думать мы помочь
- Он забрал ее. Он ее забрал. - Кто ее забрал?	он забрать она он забрать кто забрать
Я должен ее найти, он не мог уйти далеко.	я должный найти мочь уйти далеко
Сколько вас было, Джон? Шестеро? Шестеро?!	сколько быть джон шестеро шестеро
Вы меня слышали?	вы слышать
Идите туда и найдите ее!	идти туда найти она
Мы ищем Мишель, поверь мне.	мы искать мишель поверь я
А сейчас мне нужно знать, кого здесь не хватает.	а нужно знать кто хватать
Джон, взгляни на эти фотографии и скажи, кого здесь нет.	джон взглянуть фотография сказать кто нет
- Брайана Перселла. - Брайана Перселла?	брайан перселла брайан перселла
- Давно ты не видел Брайана? - Не знаю.	давно видеть брайан не знать
(Льюис) Не знаешь? Ты сказал, он ее забрал. Куда?	льюис не знаешь ты сказать забрать куда
- Я не знаю. - (Льюис) Куда?	я знать льюис куда
Все так быстро...Не знаю.	весь быстрон знать
Брайан Перселл убил этих людей?	брайан перселла убить этот человек
Это он убил твоих людей?	это убить твой человек
Нет?	нет
Это все дом.	это дом
Это все дом.	это дом
Этот дом...что-то сделал с ним.	этот домчтоть сделать он
Дом что-то сделал с ним?	дом чтоть сделать он
Боюсь, что в суде такую отговорку сочтут нелепой, Джон.	бояться суд такой отговорка счесть нелепый джон
В Луизиане дома не сажают за решетку.	в луизиана дом сажать решётка
Этот дом не такой, как все.	этот дом такой весь
Что вы делали в доме, Джон?	что делать дом джон
Они пробудили зло.	они пробудить зло
Они попробовали вызвать духов и пробудили его.	они попробовать вызвать дух пробудить он
Пробудили зло, пробудили дом...	пробудить зло пробудить дом
я согласился только ради Мишель.	согласиться ради мишель
- Это я виноват. Только бы она была жива... - Джон...	это виноватый только живой джон
(Джон) Вернись живой.	джон вернуться живой
Послушай, Джон. Успокойся, прошу тебя.	послушать джон успокоиться просить ты
Если это Брайан, найдите его, пока он не убил Мишель.	если это брайан найти он пока убить мишель
Вы должны его найти!	вы должный найти
- (Льюис) Найдем. - Пожалуйста...Умоляю.	льюис найти пожалуйстаумолять
Умоляю. Пожалуйста...Пожалуйста.	умолять пожалуйстапожалуйст
Детектив, топор вытерли. Никаких отпечатков.	детектив топор вытереть никакой отпечаток
Откуда им там быть, Дженкинс?	откуда быть дженкинс
Это сделал дом.	это сделать дом
Сэр?	сэр
- Забудь. - Доставить его в участок?	забыть доставить участок
Нет. Подержи его пока здесь.	нет подержать пока здесь
Еще двое где-то рядом. Неизвестно, жертвы они или убийцы.	ещё двое гдеть ряд неизвестно жертва убийца
А этот парнишка - мой единственный шанс выяснить, в чем дело.	а парнишка единственный шанс выяснить дело
- Пусть будет рядом - Есть, сэр.	пусть ряд есть сэр
- Так точно. - Держи его здесь, хорошо?	так точно держать здесь хорошо
(Дженкинс) Диспетчер, отмените транспортировку.	дженкинс диспетчер отменить транспортировка
- Привет. - (Льюис) Привет.	привет льюис привет
- Это я. Занята? - Да, ведь кто-то меня продинамил.	это я занятый да ктоть продинамил
- Прости, возникли срочные дела. - Я прождала два часа, Льюис.	простить возникнуть срочный дело я прождать час льюис
(Льюис) Я все обьясню.	льюис я обьяснить
Я в доме Ливингстонов. Тройное убийство.	я дом ливингстон тройной убийство
(Элизабет) Что?	элизабет что
- Марты Ливингстон? - Да.	марта ливингстон да
Уже кого-нибудь задержали?	уже когонибудь задержать
Да, задержали, но у него шок...	да задержать шок
...и он говорит, что ничего не помнит.	и говорить помнить
Еще двое пропали, все силы брошены на их поиски.	ещё двое пропасть сила бросить поиск
"- Может, это подражатель? - Никаких ""может""."	мочь это подражатель никакой мочь
- Парень сказал, что они пробудили дом. - Вот как...	парень сказать пробудить дом вот как
- Да. - Сейчас приеду.	да сейчас приехать
(Льюис) Отлично. Это свидание.	льюис отлично это свидание
Нет, это должно было быть свидание, но сейчас нет.	нет это должный свидание нет
- Ривс! - Да, сэр.	ривс да сэр
Собери все, что можно, по делу Ливингстон. Хорошо?	собрать весь можно дело ливингстон хорошо
Есть, сэр.	есть сэр
Привет, это Джулс. Я со стуки помираю в машине.	привет это джулс я стук помирать машина
- (Джулс) Брайан, скажи что-нибудь. - (сигналит)	джулс брайан сказать чтонибыть сигналить
Ну, и где они?	ну они
Черта помянешь....	черта помянуть
(Джулс) Давайте скорее, голубки!	джулс давать скорее голубка
Привет.	привет
Донни...	донни
Донни.	донни
Сегодня ты еще не разговаривал с живыми людьми. Ничего?	сегодня разговаривать живой человек ничто
- Не сажай батареи, Джулс. - (Брайан) Отдай камеру.	не сажать батарея джулс брайан отдать камера
- (Джулс) Приветик. - (Мишель) Джулс...	джулс приветик мишель джулс
(Брайан) Доброе утро, Мишель. Доброе утро, Джон.	брайан добрый утро мишель добрый утро джон
Привет.	привет
(Брайан) Вы прямо-таки идеальная пара. Одинаковые прически и все такое.	брайан вы прямотак идеальный пара одинаковый причёска такой
 А твоя похожа на мокрую собаку.	а твой похожий мокрый собака
