cleaned_text	lemm_text
Эй! Эй! И куда вы пойдете?	эй эй и пойти
"Будете стучаться к соседям? ""Помогите, мы в тут один дом вломились..."""	быть стучаться сосед помочь дом вломиться
"""Отвезите нас домой, а то машина у друзей осталась."""	отвезти домой машина друг остаться
Я знаю, что твоя мать была в этом доме в день убийств.	я знать твой мать дом день убийство
Что?	что
Думал, я об этом не узнаю?	думать узнавать
О чем он говорит? Твоя мать была в этом доме?	о говорить твой мать дом
Я никому не говорил. Прости.	я никто говорить простить
Мы сто раз обсуджали этот дом, и ты ни разу не сказал...	мы сто обсуджать дом раз сказать
...что тут была твоя мать?	что твой мать
Не понимаю. Почему ты не сказал?	не понимать почему сказать
Порой дурацкое прошлое влияет на все.	порой дурацкий прошлое влиять весь
На твою жизнь...	на твой жизнь
...на то, как к тебя относятся. Об этом проще не говорить.	на то относиться о простой говорить
Ты молишься, чтобы об этом никто не узнал...	ты молиться никто узнать
Ну?	ну
- Брайан, как ты узнал? - Потрудился, Джон.	брайан узнать потрудиться джон
Я перерыл весь интернет и узнал, что у единственной выжившей...	я перерыть весь интернет узнать единственный выжить
...сары Мэттьюс, родился сын, которого... погодите-ка...	сара мэттьюс родиться сын который погодитек
...которого зовут Джон Митчелл.	который звать джон митчелла
Да, моя мать была тут в ночь убийств. И что?	да мать ночь убийство и что
Слушай...	слушай
Я понимаю, почему ты не хлтел об этом распространяться.	я понимать почему хлтело распространяться
Правда, понимаю.	правда понимать
На что, если это она тебя сюда привела?	на что это сюда привести
Чтобы связаться с тобой.	чтобы связаться ты
Если уйдешь, кошмары не прекратятся. Ты все также будешь видеть мать.	если уйти кошмар прекратиться ты также быть видеть мать
А можешь остаться, и мы вызовем духов...	а мочь остаться вызвать дух
...и узнаем, что твоя мама пытается тебе сказать.	и узнать твой мама пытаться ты сказать
Мне кажется, она в этом доме...	я кажется дом
...и ты это знаешь.	и это знаешь
Останься.	остаться
(Генри) Эй, кажется, у меня что-то есть.	генри эй кажется чтоть есть
(Льюис) Постой. Это камера из дома?	льюис постоять это камера дом
- Одна чернота. - Погоди.	один чернота погодить
- (по рации) Детектив Льюис? - Да.	по рация детектив льюис да
(по рации) Сэр, поступила информация об угоне машины в полукилометре от дома.	по рация сэр поступить информация угон машина полкилометра дом
Красный пикап, Додж 2000-го года.	красный пикап додж 2000го год
Почему доложили только сейчас?	почему доложить сейчас
(по рации) Владелец не знал об угоне, он только утром вернулся домой.	по рация владелец знать угон утром вернуться домой
Объявите красный пикап 2000-го в розыск...	объявить красный пикап 2000го розыск
...в радиусе 500 километров. Все понятно? Сейчас же!	в радиус 500 километр весь понятно сейчас же
Расскажи, что случилось во время того ритуала? Спиритического сеанса.	рассказать случиться время ритуал спиритический сеанс
Ребята читали отрывок из книги Джулс...	ребята читать отрывок книга джулс
...для связи с потусторонним миром.	для связь потусторонний мир
Мне просто хотелось получить ответы, чтобы обрести хоть какой-то покой.	я просто хотеться получить ответ обрести какойтый покоить
Так, Джулс, давай по порядку.	так джулс давать порядок
(Джулс) Ладно.	джулс ладный
Итак, есть несколько теорий о том, как открыть врата.	итак несколько теория тот открыть врата
существуют некие энергетические карманы...	существовать некий энергетический карман
...где предгады между нашим и загробным миром тоньше.	где предгад наш загробный мир тонкий
Главное - найти эти слабые места, так что возьмемся за руки.	главный найти слабый место взяться рука
Мы хотим связаться с духами, а не вызвать их.	мы хотеть связаться дух вызвать они
Не шевелитесь и не расцепляйте круг.	не шевелиться расцеплять круг
Если появится дух, то наша энергосфера будет сдерживать его.	если появиться дух наш энергосфера сдерживать он
Это всем понятно?	это весь понятно
Ладно. Давай, Брайан.	ладный давать брайан
Если здесь пристутсвует какой-либо дух, явись нам.	если пристутсвовать какойлибо дух явиться мы
Мы не причиним тебе зла и не потревожим.	мы причинить ты зло потревожить
(Джулс) Просто обозначь свое пристутствие.	джулс просто обозначить свой пристутствие
Обозначь свое пристутствие.	обозначить свой пристутствие
Слышишь? Обозначь свое пристутствие.	слышать обозначить свой пристутствие
Сработало. Без паники.	сработать без паника
- О черт... - Что это?	о черта что это
- Не двигайтесь. - Что?	не двигаться что
- (Брайан) Не шевелитесь. - Почему?	брайан не шевелиться почему
Поверь.	поверь
Если здесь присутствуют духи, скажите нам, зачем вы здесь!	если присутствовать дух сказать мы здесь
- Живот... - Что с ним?	живот что он
- Is this suppose to happens? - Just hold on and let it run its course.	is this suppose to happens just hold on and let it run its course
- Так должно быть? - (Джулс) Держитесь, пусть все идет своим чередом. - (Мишель) Нет, я не могу. Я не могу!	так должный быть джулс держаться пусть идти свой чередом мишель нет мочь я мочь
(Джулс) Что бы ни случилось, не ломайте круг!	джулс что случиться ломать круг
Что за бред? Ей же больно.	что бред она больно
(Джулс) Отпустишь - и она выпустит демонов.	джулс отпустить выпустить демон
Верни все обратно! В смысле, не знаешь как?	вернуть обратно в смысл знаешь как
Мишель, не надо!	мишель надо
Отпусти.	отпустить
- Мама? - Отпусти, Джон.	мама отпустить джон
Пора отпустить.	пора отпустить
Отпусти. Отпусти.	отпустить отпустить
Нет!!!	нет
Все в машину!	весь машина
Уходим!	уходить
- Дверь. - Что?	дверь что
(Элизабет) А что потом?	элизабет а потом
Уведи меня отсюда, Джон.	увести отсюда джон
(Джон) Я ее потерял. - Мишель!	джон я потерять мишель
Я пытался ее найти, но было темно.	я пытаться найти темно
Я слышал их крики и вопли...	я слышать крик вопль
...но я искал Мишель.	но искать мишель
Мишель!	мишель
Мишель!	мишель
Брайан?	брайан
(Брайан) Все должны умереть. Все должны умереть...	брайан весь должный умереть весь должный умереть
- Брайан, что с тобой? - (Брайан) Все должны умереть.	брайан ты брайан весь должный умереть
Все должны умереть. Все должны умереть.	весь должный умереть весь должный умереть
- Брайан? - (Брайан) Все должны умереть. Все должны умереть.	брайан брайан весь должный умереть весь должный умереть
Ты утверждаешь, что Брайан стал одержимым?	ты утверждать брайан стать одержимый
Верно?	верно
Убийца снимал все на камеру.	убийца снимать камера
Но как он держал камеру во время убийств?	но держать камера время убийство
Видите очки? Мы нашли их в комнате, где проводился ритуал.	видеть очки мы найти комната проводиться ритуал
- Криминалисты еще в доме? (по рации) Так точно, сэр.	криминалист дом по рация так точно сэр
Выясните, что именно использовалась во время сеанса.	выяснить именно использоваться время сеанс
Доложите через 15 минут.	доложить 15 минута
(по рации) Вас понял.	по рация вы понять
(на видео) Меня зовут Леонард Аббернеки.	на видео я звать леонард аббернек
Я живу неподалеку отсюда. Жена позвонила мне и попросила проверить...	я жить неподалёку отсюда жена позвонить попросить проверить
Погодите. Вернитесь к Аббернеки.	погодить вернуться аббернек
Я поднялся на крылцо, услышал какой-то шум.	я подняться крылцо услышать какойтый шум
Словно издалека.	словно издалёка
- (Питер) Столкновение? - Авария.	питер столкновение авария
Тогда это в нескольких километрах отсюда.	тогда это несколько километр отсюда
Мы прочесали все окрестные дороги.	мы прочесать окрестный дорога
Это спереди дома или сзади?	это спереди дом сзади
Спереди. У парадного входа.	спереди у парадное вход
Но он показывал не на дорогу, а на ферму Джексонов.	но показывать дорога ферма джексон
Вы проверили ферму Джексонов?	вы проверить ферма джексон
- Нет, сэр. Это частная территория. - Так, собирайте всех.	нет сэр это частный территория так собирать весь
Поезжайте на ферму Джексонов, ищите красный пикап.	поехать ферма джексон искать красный пикап
Там полно тропинок и болот, так что запускайте собак.	там полно тропинка болото запускать собака
Джексон, Фредерик.	джексон фредерик
Отмотай назад. Отмотай еще раз.	отмотать назад отмотать раз
Я поднялся на крылцо, услышал какой-то шум...	я подняться крылцо услышать какойтый шум
Словно издалека.	словно издалёка
Допустим я тебе верю...	допустить ты верить
...и Брайан стал одержимым или изменился.	и брайан стать одержимый измениться
Но это еще не делает его убийцей.	но это делать убийца
Я знаю.	я знать
Так что было дальше?	так далёкий
Брайан Перселл бросился на тебя с топором?	брайан перселла броситься топор
На нем были очки с миникамерой.	на немой очки миникамера
То есть, это был Брайан Перселл?	то есть это брайан перселла
Да, но это был не он. Нет...	да это он нет
Ты опознал в нем Брайана Перселла? Это все, что мне нужно знать.	ты опознать немой брайан перселла это весь нужно знать
Говорю вам, это был не человек.	говорить вы это человек
Я скоро вернусь.	я скоро вернуться
- (Льюис) Это все? - Да. Это все, что было в комнате.	льюис это весь да это весь комната
в передней ее части.	передний часть
- Эй... - Что?	эй что
Он назвал Брайана Перселла.	он назвать брайан перселла
Сказал, что тот напал на него с топором, а потом пошел к остальным.	сказать напасть топор пойти остальной
- Черт...Он уверен? - Да, уверен.	чертон уверенный да уверенный
Ясно.	ясно
(Дженкинс по рации) Льюис, езжай сюда Мы кое-что нашли.	дженкинс рация льюис езжать сюда мы коечто найти
Мы в пути, в пути.	мы путь путь
Сделай одолжение, посмотри, что это.	сделать одолжение посмотреть это
Почему я?	почему я
Потому что ты врач и наверняка умеешь читать по-латыни.	потому врач наверняка уметь читать полатынь
Дайте перчатки, пожалуйста.	дать перчатка пожалуйста
Брайан Перселл!	брайан перселла
Перселл.	перселла
(Ривс) Мистер Перселл, вы нас слышите?	ривс мистер перселла слышать
Вы меня слышите? Пульс есть.	вы слышать пульс есть
Одного нашли. В километре к северу по Лафорт Роуд.	один найти в километр север лафорт роуд
(Дженкинс) Пострадавший серьезно ранен.	дженкинс пострадавший серьёзно раненый
(Ривс) Не умирай, приятель. Скорая уже в пути, все будет хорошо.	ривс не умирать приятель скорый путь хорошо
Не знаете, что это за символ?	не знаете это символ
По-моему, это круг.	помоему это круг
Что вы делаете?	что делать
Провожу исследование и выполняю работу за других.	провозить исследование выполнять работа другой
Это просто круг на полу. Детишки сбрендили.	это просто круг пол детишки сбрендить
Я знаю, что они сбрендили...	я знать сбрендить
...но для кого-то этот круг имеет значение, и мы попытаемся понять, для кого.	но коготь круг иметь значение попытаться понять кто
Принесите ноутбук.	принести ноутбук
(Ривс) Эй, Дженкинс! Сюда!	ривс эй дженкинс сюда
- На помощь! (выстрелы)	на помощь выстрел
Ривс!	ривс
(Ривс) Сюда!	ривс сюда
(Дженкинс) Ривс! Держись, приятель.	дженкинс ривс держаться приятель
- Ранен полицейский. Подозреваемый сбежал. - Господи...	раненый полицейский подозревать сбежать господь
РАСПОЗНАВАНИЕ ИЗОБРАЖЕНИЯ	распознавание изображение
ПЕЧАТЬ ЛЕВОЙ ТРОПЫ.	печать левый тропа
Черт...вызови полицию!	чертвызвать полиция
- Я не могу говорить. - (Элизабет) Тогда слушай.	я мочь говорить элизабет тогда слушай
Помнишь, ты просил меня прочитать абзац по-лытыни?	помнить просить прочитать абзац полытыня
Это заклинание для связи с загробным миром.	это заклинание связь загробный мир
"Там говорится:""Приди, обозначь свое присутствие."""	там говоритсяпридь обозначить свой присутствие
Вроде безобидная чушь, но я покопалась...	вроде безобидный чушь покопаться
- Элизабет, мне некогда. - (Элизабет) Погоди. Символ в гостиной.	элизабет некогда элизабет погодить символ гостиный
"Называется ""Печать левой тропы""..."	называться печать левый тропа
...и относится к местам вроде тюрьмы для демонов.	и относиться место вроде тюрьма демон
- Черт, это безумие! - (Элизабет) Послушай.	черта это безумие элизабет послушать
Это не мои слова, так написано в исследовании.	это мой слово написать исследование
Чтобы освободить демона из тюрьмы...	чтобы освободить демон тюрьма
...все участиники спиритического сеанса должны погибнуть.	весь участиник спиритический сеанс должный погибнуть
Затем он может выбраться наружу через человеческую душу.	затем выбраться наружу человеческий душить
Так, и как же это мне поможет? Как это поможет?	так это помочь как это помочь
Мы пытаемся понять поведение Брайана...	мы пытаться понять поведение брайан
...и если Брайан считает, что все должны умереть, чтобы выпустить демона из тюрьмы...	и брайан считать должный умереть выпустить демон тюрьма
...значит, он пытается всех убить.	значит пытаться убить
Он сошел с ума и убивает людей!	он сойти ум убивать человек
- (диспетчер) Всем свободным постам, возможное ограбление. (воют сирены)	диспетчер весь свободный пост возможный ограбление выть сирена
Нужно установить контакт.	нужно установить контакт
Виноват. Не следовало оставлять Ривса наедине с ним.	виноватый не следовать оставлять ривс наедине он
(Льюис) Слушай сюда, оповести отряд, что Перселл в здании. Понятно?	льюис слушай сюда оповестить отряд перселла здание понятно
Потом возвращайся на место аварии, надо найти Мишель Чампан.	потом возвращаться место авария найти мишель чампан
Брайан Перселл! Меня зовут детектив Льюис.	брайан перселла я звать детектив льюис
Ты уже достаточно натворил. Это потянто?	ты достаточно натворить это потянто
(Льюис) Брайан!	льюис брайан
Ты еще можешь все объяснить.	ты мочь объяснить
Вели своим людям приготовиться на случай, если это не сработает. Понял?	вели свой человек приготовиться случай это сработать понять
(Дженкинс) Да,сэр.	дженкинс дасэр
(продавец) На помощь!	продавец на помощь
- Брайана Перселла нашли. - А Мишель?	брайан перселла найти а мишель
- Нет, Мишель пока нет. - Он знает, где она.	нет мишель пока нет он знать она
- Заберите ее у него! - Обязательно.	забрать он обязательно
Сейчас я отправлю к тебе одного из своих людей.	сейчас отправить ты один свой человек
Он подойдет к двери и передаст тебе рацию.	он подойти дверь передать ты рация
Он у двери.	он дверь
(Льюис) Подними рацию, Брайан.	льюис поднять рация брайан
Возьми ее, Брайан.	взять она брайан
Ладно, как хочешь, но ты должен со мной поговорить.	ладный хотеть должный я поговорить
Какого черта Брайан делает?	какой черта брайан делать
Он забаррикадировался.	он забаррикадироваться
Что? Мишель истекает кровью!	что мишель истекать кровь
 Джон, успокойся. Все под контролем.	джон успокоиться весь контроль
- Скажи нам, где она! - (Элизабет) Джон, прекрати!	сказать мы она элизабет джон прекратить
