cleaned_text	lemm_text
Я думаю, ты - самый упрямый человек из всех, кого я знаю.	я думать самый упрямый человек весь кто знать
Но...	но
Я никогда не встречала никого с таким чувством справедливости, как у тебя.	я встречать никто такой чувство справедливость ты
Можешь быть уверен.	мочь уверенный
КЕЙТЛИН БАРРЕТТ БУН МОЯ ЛЮБИМАЯ ЖЕНА	кейтлина барретта буна мой любимый жена
<i>С искренними соболезнованиями...</i>	iс искренний соболезнованиямиi
<i>Примите соболезнования...</i>	iпринять соболезнованияi
"<i><b>""НЕ ТОРОПИСЬ С ВЫВОДАМИ!""</b></i>"	ibн торопиться с выводамиbi
<i><b>ЭДДИ.</b></i>	ibэддиbi
Капитан Бун!	капитан буна
Да?	да
Вас хочет видеть мэр Руис.	вы хотеть видеть мэр руис
Да, пусть войдет.	да пусть войти
Я оставлю вам эти бумаги на подпись... - Да, конечно.	я оставить бумага подпись да конечно
Это не займет много времени?.. - Разумеется.	это занять время разумеется
Госпожа мэр,	госпожа мэр
Как вы держитесь, Уилл?	как держаться уилла
Иногда держусь, иногда... как получается...	иногда держаться иногда получаться
Я понимаю...	я понимать
- Присаживайтесь. - Нет, спасибо.	присаживаться нет спасибо
Вчера мне позвонили.	вчера позвонить
Оказывается, Да'ан приглашал вас на службу к Сподвижникам.	оказываться даана приглашать служба сподвижник
Да, и я отказался.	да отказаться
Я в курсе.	я курс
Губернатор - личный друг президента Томпсона.	губернатор личный друг президент томпсон
Думаю, Томпсон позвонил ему, и теперь губернатор требует, чтобы вы изменили свое решение.	думать томпсон позвонить он губернатор требовать изменить свой решение
Это имеет для них такое значение?	это иметь такой значение
Похоже, да.	похоже да
Я не хочу терять вас, Уилл, но вы нужны чрезвычайно важным персонам.	я хотеть терять вы уилла нужный чрезвычайно важный персона
Вам следует их выслушать.	вы следовать выслушать
Знаете, это даже смешно. Кейт сказала то же самое.	знаете это смешно кейт сказать самый
Когда они хотят меня видеть?	когда хотеть видеть
Вообще-то, если вы согласны, они уже прислали за вами пилота.	вообщеть согласный прислать вы пилот
Капитан Лили Маркетт.	капитан лить маркетта
Сколько времени занимает подготовка пилота гиперпространственного шаттла?	сколько время занимать подготовка пилот гиперпространственный шаттл
Я помогала создавать программу подготовки.	я помогать создавать программа подготовка
И панель управления, которую вы увидите, как только мы взлетим. Садитесь.	и панель управление который увидеть взлететь садиться
Спасибо.	спасибо
Потрясающе.	потрясающе
Входим в гиперпространство. Думаю, вам понравится.	входить гиперпространство думать понравиться
Странное ощущение.	странный ощущение
С такой легкостью...	с лёгкость
Выходим из гиперпространства.	выходить гиперпространство
Жду вашего возвращения.	ждать ваш возвращение
Приветствую вас, Уильям Бун.	приветствовать вы уильям буна
Приветствую вас, Да'ан.	приветствовать вы даана
Это...	это
это невероятно.	это невероятно
Я рад, что вам здесь нравится.	я рад нравиться
Примите мои соболезнования.	принять мой соболезнование
Вы чувствуете скорбь, как мы?	вы чувствовать скорбь мы
Тейлоны	тейлона
не страшатся естественного перехода на следующий уровень бытия.	страшиться естественный переход следующий уровень бытие
Но, изучая человечество,	но изучать человечество
я приблизился к пониманию ваших страданий.	приблизиться понимание ваш страдание
Я по-прежнему сомневаюсь.	я попрежний сомневаться
И пришел сюда выслушать вас	и прийти сюда выслушать
лишь потому, что моя жена этого хотела бы.	лишь потому жена хотеть бы
Я уважаю мудрость вашей жены.	я уважать мудрость ваш жена
Прошу, скажите, что вас беспокоит.	просить сказать беспокоить
Хорошо.	хорошо
Самое главное:	самый главный
почему тейлоны пришли на Землю?	почему тейлона прислать земля
Ваша планета находится на эволюционном перепутье.	ваш планет находиться эволюционный перепутье
Для человечества настал критический момент, вы должны переступить черту, сделать шаг в неопределенное будущее.	для человечество настать критический момент должный переступить черта сделать шаг неопределённый будущее
Тейлонская раса развивается по-другому.	тейлонской раса развиваться подругий
Присутствие на Земле дает нам знания об испытаниях, предстоящих тейлонам на эволюционном пути.	присутствие земля давать мы знание испытание предстоящий тейлоно эволюционный путь
Относительно работы. Что она из себя представляет?	относительно работа что представлять
Вы будете главой Службы Безопасности	вы быть главый служба безопасность
и отношений между нашими расами. Станете представлять интересы Сподвижников.	отношение наш раса стать представлять интерес сподвижник
Я считаю, для тейлонского Синода это будет достойным альянсом.	я считать тейлонской синод это достойный альянс
Есть еще дополнительный стимул.	есть дополнительный стимул
Сподвижники имплантировали в мой мозг кибервирус, CVI.	сподвижник имплантировать мозг кибервирус cvi
Это частично компьютерный чип, а частично тейлонский вирус.	это частично компьютерный чип частично тейлонский вирус
Вы позволили им ввести что-то вам в мозг?	вы позволить ввести чтоть мозг
Большинство людей используют только 30% своего мозга.	большинство человек использовать 30 свой мозг
Значит, это увеличивает интеллектуальный потенциал и способность восстанавливать события по памяти?	значит это увеличивать интеллектуальный потенциал способность восстанавливать событие память
Он дает БОЛЬШЕ, чем просто фотографическую память.	он давать большой просто фотографический память
Вы оказываетесь ВНУТРИ своих воспоминаний.	вы оказываться внутри свой воспоминание
Ваша жена всегда будет с вами, Бун.	ваш жена вы буна
<i>Всегда.</i>	iвсегдаi
Я серьезно обдумаю ваше предложение, Да'ан.	я серьёзно обдумать ваш предложение даана
Мы будем ожидать вашего ответа...	мы быть ожидать ваш ответ
с надеждой.	надежда
Смерть жены мотивировала Буна сделать следующий шаг в персональной эволюции.	смерть жена мотивировать буна сделать следующий шаг персональный эволюция
Какая горькая ирония.	какой горький ирония
Вам предстоит еще одна встреча.	вы предстоять один встреча
Сандовал не упоминал ни о каких других встречах.	сандовал упоминать какой другой встреча
Один мой друг всегда советует НЕ СПЕШИТЬ С ВЫВОДАМИ.	один друг советовать не спешить с вывод
Это все, что я могу сказать.	это весь мочь сказать
Пойдемте со мной, если хотите.	пойти я хотеть
Решать вам.	решать вы
Я иду с вами.	я идти вы
Что будете пить?	что быть пить
В другой раз.	в раз
Они скоро будут.	они скоро быть
Мне так жаль... Кейт...	я жаль кейт
С каких пор ты стал профессиональным убийцей, Эдди?	с какой пора стать профессиональный убийца эдди
Поверь мне, это не то, что ты думаешь.	поверь я это то думать
Эдди, того, что ты сказал, недостаточно!	эдди тот сказать недостаточно
А ЭТОГО вам достаточно, мистер Бун?	а это достаточно мистер буна
Я рад, что вы не погибли во время моего дежурства.	я рад погибнуть время мой дежурство
Или его исцелило ваше чудодейственное вмешательство, доктор?	или исцелить ваш чудодейственный вмешательство доктор
Инсценировать мою смерть было непросто.	инсценировать мой смерть непросто
Так же, как и отказаться от 32 миллиардов долларов.	так же отказаться 32 миллиард доллар
Так почему вы это сделали?	так почему это сделать
Ответ прост:	ответ простой
я хочу узнать, зачем Сподвижники здесь.	хотеть узнать сподвижник здесь
И, если вас будут считать умершим, это облегчит вам задачу, так?	и быть считать умерший это облегчить задача так
Вот именно.	вот именно
Я был слишком заметен.	я слишком заметный
Мне нужно было получить возможность действовать свободно.	я нужно получить возможность действовать свободно
Уилл, я предан этому движению.	уилла предать это движение
Как и все остальные здесь присутствующие.	как остальной присутствующий
И я знаю: у тебя тоже есть подозрения относительно Сподвижников.	и знать подозрение относительно сподвижник
Никто больше не задается вопросами.	никто задаваться вопрос
Мы превратились в овец,	мы превратиться овца
а пастухам я не доверяю.	пастух доверять
Когда вы узнали Эда, нам пришлось торопиться.	когда узнать эда мы прийтись торопиться
Необходимо действовать уже сейчас.	необходимый действовать сейчас
А мне не нужно спешить. Да, у меня есть вопросы, и я найду ответы. Сам.	а нужно спешить да вопрос найти ответ сам
Тогда начните с вопроса о вашей жене.	тогда начать вопрос ваш жена
Что вы хотите сказать?	что хотеть сказать
Кейт убили Сподвижники.	кейт убить сподвижник
Ты отказался на них работать,	ты отказаться работать
и в тот же вечер Кейт была убита.	вечер кейт убитый
А через два дня они опять вызывают тебя.	а день вызывать ты
Хочешь с ними рассчитаться - присоединяйся к нам.	хотеть они рассчитаться присоединяться мы
Я слушаю.	я слушать
Уверена, что Да'ан не рассказал вам всей правды о киберимплантах.	уверить даана рассказать весь правда киберимплант
Да, они усиливают мозговые функции.	да усиливать мозговой функция
Однако,	однако
они также изменяют вашу систему ценностей.	также изменять ваш система ценность
В пользу Сподвижников.	в польза сподвижник
Так, что ваши приоритеты меняются.	так ваш приоритет меняться
И первым из них становятся интересы Сподвижников.	и один становиться интерес сподвижник
Я модифицировала один из кибервирусов, и убрала этот императив.	я модифицировать кибервирус убрать императив
Сподвижники не будут об этом знать,	сподвижник быть знать
а вы будете находиться среди них.	быть находиться среди они
Проблема в том,	проблема тот
что мы не можем протестировать модифицированный имплант.	мочь протестировать модифицированный имплант
Гарантии, что он будет работать, нет.	гарантия работать нет
Значит, я могу стать таким, как Сандовал?	значит мочь стать такой сандовал
Кейт была не единственной жертвой.	кейт единственный жертва
И не будет последней.	и последний
Это твой шанс помочь множеству людей.	это твой шанс помочь множество человек
У меня два условия:	у условие
Какие?	какой
Убийца Кейт - мой.	убийца кейт мой
Что еще?	что ещё
Если я стану НАСТОЯЩИМ имплантированным,	если стать настоящее имплантированный
обещайте,	обещать
что убьете меня.	убить я
Об этом позаботятся, мистер Бун.	о позаботиться мистер буна
Доктору Белман даны указания.	доктор белман дать указание
Необходимо, чтобы кибервирус был размещен очень точно.	необходимый кибервирус разместить очень точно
Я полностью	я полностью
зафиксирую вашу голову.	зафиксировать ваш голова
Понятно.	понятно
Кибервирус введен.	кибервирус ввести
<i>Императив...</i>	iимперативi
<i>Мне так жаль... Кейт...</i>	iмна жаль кейтi
<i>Сподвижники...</i>	iсподвижникиi
<i>Ваша жена будет с вами ВСЕГДА...</i>	iваша жена вы всегдаi
Бун! Не теряй сознания, Бун! Держись!	буна не терять сознание буна держаться
Он жив.	он живой
Пульс частый, но в пределах ожидаемого.	пульс частый предел ожидать
Я начну калибровку подсознания.	я начать калибровка подсознание
Добро пожаловать в новую реальность, Бун.	добро пожаловать новый реальность буна
Теперь все гораздо яснее...	теперь гораздо ясный
Вы были правы, когда говорили о достоинствах киберимпланта.	вы правый говорить достоинство киберимплант
Вы должны освоить возможности вашего импланта.	вы должный освоить возможность ваш имплант
Позволить ему ввести вас	позволить ввести
в новую стадию - более глубокого осознания и мышления.	новый стадия глубокий осознание мышление
Под вашим началом будет работать капитан Маркетт.	под ваш начало работать капитан маркетта
Хорошо.	хорошо
А теперь - последний шаг на пути к нашему союзу.	а последний шаг путь наш союз
Снимите пиджак, пожалуйста.	снять пиджак пожалуйста
Закатайте правый рукав.	закатать правый рукав
Этот скрилл	этот скрилла
станет придатком вашей центральной нервной системы	стать придаток ваш центральный нервный система
и будет контролироваться вашим киберимплантом.	контролироваться ваш киберимплант
Сначала вы почувствуете некоторый... дискомфорт.	сначала почувствовать некоторый дискомфорт
Относитесь с уважением к вашему скриллу, Бун.	относиться уважение ваш скрилла буна
Его сила напрямую связана	он сила напрямую связать
с квинтэссенцией вашей души.	квинтэссенция ваш душа
Позвольте...	позволить
Мы кое-что нашли.	мы коечто найти
Ваше присутствие необходимо.	ваш присутствие необходимый
Буду через пять минут.	быть пять минута
Я с вами.	я вы
Что произошло?	что произойти
Плохие новости, Уилл.	плохой новость уилла
Так, ладно, ребята, спасибо. Оставьте нас на минуту.	так ладный ребята спасибо оставить минута
Эдди Джордан.	эдди джордан
И еще, Уилл:	и ещё уилла
готовы результаты экспертизы ДНК пота.	готовый результат экспертиза днк пот
Эдди Джордан убил Джонатана Дорса.	эдди джордан убить джонатан дорса
Теперь вам придется очень тщательно выбирать друзей, Бун.	теперь прийтись очень тщательно выбирать друг буна
Почему-то мне кажется, что это не будет проблемой.	почемуть кажется это проблема
Это не имеет значения.	это иметь значение
Дорсу нельзя доверять.	дорсу доверять
Сейчас я не могу доверять никому. Включая вас.	сейчас мочь доверять никто включая вы
На сей раз я прощу вам эти слова.	на сеять простить слово
Вы даже не смогли уберечь Эдди.	вы смочь уберечь эдди
Не делайте выводов, пока не поговорите с Дорсом.	не делать вывод пока поговорить дорсом
Вы не сможете меня переубедить.	вы смочь переубедить
Я не обязана ни в чем вас убеждать.	я обязать убеждать
За меня говорят мои действия, а Дорс пусть отчитывается за свои.	за говорят мой действие дорс пусть отчитываться свой
И где он?	и он
Я свяжусь с ним.	я связаться он
Бун,	буна
мы пока не знакомы.	пока знакомый
Но, узнав меня лучше,	но узнать хороший
вы никогда больше не усомнитесь в моей верности.	усомниться мой верность
Тогда я жду продолжения нашего знакомства.	тогда ждать продолжение наш знакомство
Я подожду здесь...	я подождать здесь
Спасибо.	спасибо
