cleaned_text	lemm_text
ЗЕМЛЯ: ПОСЛЕДНИЙ КОНФЛИКТ В предыдущих сериях:	земля последний конфликт в предыдущий серия
Я работаю в Дорс Интернешнл не ради тейлонских денег!	я работать дорс интернешнл ради тейлонской деньга
Днем играешь в корпоративную шишку, а по ночам в партизанку	днём играть корпоративный шишка ночь партизанка
Успокойся, Авгур,	успокоиться авгур
нам подойдут любые союзники.	мы подойти любой союзник
Кто дал вам право вторгаться в опечатанное помещение?	кто дать право вторгаться опечатать помещение
Компания Дорса рискует огромными деньгами, вложенными в совместные с тейлонами предприятия.	компания дорса рисковать огромный деньга вложить совместный тейлоно предприятие
А я рискую своей репутацией!	а рисковать свой репутация
Занимайтесь своими делами, мисс Палмер.	заниматься свой дело мисс палмера
А мы разберемся со своими.	а разобраться свой
Во время Индо-Китайской войны вы три года служили под командованием Буна.	в время индокитайский война год служить командование буна
Это правда.	это правда
Кинкейд участвовал во вторжении на Тайвань.	кинкейд участвовать вторжение тайвань
Из-за провала разведки его подразделение попало в засаду.	изз провал разведка подразделение попасть засада
ИНДО-КИТАЙСКАЯ ВОЙНА. ТИБЕТ.	индокитайский война тибет
Импульсные генераторы настроены.	импульсный генератор настроить
Антенна включена?	антенна включить
Да.	да
Коды доступа спутника.	код доступ спутник
Трудно было их получить?	трудно получить
Пришлось лгать и воровать, а так ничего особенного.	прийтись лгать воровать особенный
Мы шпионы, ложь и воровство - наша работа.	мы шпион ложь воровство наш работа
Разумеется, всё во имя блага человечества.	разумеется весь имя благо человечество
Поэтому ты всегда будешь профессионалом, а для меня это задание последнее.	поэтому быть профессионал это задание последний
Ты меня удивляешь, Самира.	ты удивлять самир
Я-то думал, тебе, как и мне, по душе острые ощущения!.. Мы ведь спасаем мир,	ято думать ты я душа острый ощущение мы спасать мир
предотвращаем неминуемую ядерную катастрофу!	предотвращать неминуемый ядерный катастрофа
Романтика! Ты и я, кругом неведомая глушь,	романтика ты я кругом неведомый глушь
красивейший вид на Гималайи,	красивый вид гималайя
мы взламываем системы запуска ядерных боеголовок...	взламывать система запуск ядерный боеголовка
Есть!	есть
Мы в самом сердце пусковых установок китайских и индийских систем наведения.	мы самый сердце пусковой установка китайский индийский система наведение
Начинаю.	начинать
Передаю серии нейтринных импульсов,	передавать серия нейтринный импульс
блокирую схемы запуска.	блокировать схема запуск
Ты уверен, что все получится?	ты уверенный получиться
Если нет, мы с тобой уже этого не увидим.	если нет ты увидеть
Спасибо, успокоил.	спасибо успокоить
Если координаты верны,	если координата верный
то все китайские и индийские ракеты сейчас нейтрализованы.	китайский индийский ракета нейтрализовать
Лишь пока не перекалибруют системы запуска.	лишь пока перекалибровать система запуск
Но за выигранное нами время человечество опомнится	но выиграть мы время человечество опомниться
и прекратит это кровопролитие!	прекратить это кровопролитие
Да. А потом новая война.	да а новый война
Но согласись:	но согласиться
Что может быть лучше, чем спасать мир рука об руку с любимым человеком?	что хороший спасать мир рука рука любимый человек
Что происходит?	что происходить
<i>Они прибыли на Землю с обещанием мира</i>	iонить прибыть земля обещание мираi
<i>Раса тейлонов - пришельцев из космоса</i>	iраса тейлоновый пришелец космосаi
<i>Но среди землян есть и те, кто не доверяет</i>	iно среди землянин тот доверяетi
<i>этим инопланетным Сподвижникам.</i>	iэтим инопланетный сподвижникамi
<i>Потому что истинная миссия тейлонов,</i>	iпотому истинный миссия тейлоновi
<i>тайны, которые они скрывают,</i>	iтайна который скрываютi
<i>навсегда изменят наш мир.</i>	iнавсегда изменить наш мирi
<b>Перевод с английского: Xandra © 2006, Синхронизация: Sky © 2006 Редактор: Loriel © 2007 </b>	bперевод английский xandra © 2006 синхронизация sky © 2006 редактор loriel © 2007 b
"<b>Команда ""Прибежище Тейлонов"" Team ""Taelon Sanctuary"" http://efc.ucoz.ru © 2004 - 2007</b>"	bкоманда прибежище тейлоновый team taelon sanctuary httpefcucozru © 2004 2007b
<i>И теперь судьба человечества зависит от тех,</i>	iи судьба человечество зависеть техi
<i>кто осмелится бросить вызов будущему Земли.</i>	iкто осмелиться бросить вызов будущее землиi
"<b>3 сезон, 14 серия ""ВЫЖЖЕННАЯ ЗЕМЛЯ""</b>"	b3 сезон 14 серия выжечь земляb
"<i>*Субтитры к сериалу ""Земля: последний конфликт"" - частный любительский проект.*</i>"	iсубтитр сериал земля последний конфликт частный любительский проектi
<i>*Любое коммерческое использование, а также распространение субтитров без ведома авторов КАТЕГОРИЧЕСКИ ЗАПРЕЩАЕТСЯ.*</i>	iлюбой коммерческий использование также распространение субтитр ведомо автор категорически запрещаетсяi
О нет!	о нет
Самира!	самир
Благодаря героическим усилиям полковника Робийяра	благодаря героический усилие полковник робийярый
и капитана Самиры Фарид, погибшей во время атаки,	капитан самир фарид погибший время атака
ядерная война была предотвращена!	ядерный война предотвратить
"Однако неизвестное оружие массового уничтожения под кодовым названием ""Квантовый Вихрь"""	однако неизвестный оружие массовый уничтожение кодовый название квантовый вихрь
унесло сто тысяч жизней.	унести сто тысяча жизнь
Я чувствовал себя так, словно был в этом бою!..	я чувствовать так словно бой
Спасибо.	спасибо
Неплохо, если учесть, что все образы созданы компьютерами?	неплохо учесть образ создать компьютер
Кроме автобиографического сценария,	кроме автобиографический сценарий
Дэннис предоставил нам и виртуальных актеров.	дэннис предоставить мы виртуальный актёр
Как я понял, тейлоны хотят привлечь Робийяра к работе над совместным проектом?	как понять тейлона хотеть привлечь робийярый работа совместный проект
Да. A он не поддается на уговоры.	да a поддаваться уговор
Может, тебе стоит быть понастойчивее?	мочь ты стоить настойчивый
Ведь в прошлом вы вместе работали?	ведь прошлое вместе работать
"""Вместе"" - сильно сказано..."	вместе сильно сказать
Майор, произошел новый теракт.	майор произойти новый теракт
На этот раз взрыв в китайском посольстве.	на взрыв китайский посольство
Отправляюсь немедленно.	отправляться немедленно
Служба зовет.	служба звать
Благодарю вас, госпожа посол.	благодарить вы госпожа посол
Тейлоны сделают все возможное, чтобы помочь вам.	тейлона сделать возможный помочь вы
Перезвоню, если будут еще вопросы.	перезвонить быть вопрос
На время Мемориальной Недели Индо-Китайской войны	на время мемориальный неделя индокитайский война
я распорядился разместить персонал посольств Индии и Китая	распорядиться разместить персонал посольство индия китай
и семьи послов на конспиративных квартирах ФБР и ЦРУ.	семья посол конспиративный квартира фбр цру
Вас предупредили как обычно?	вы предупредить обычно
Позвонили на глобал за минуту до взрыва...	позвонить глобал минута взрыв
Достаточно времени для эвакуации людей.	достаточно время эвакуация человек
Классическая партизанская тактика.	классический партизанский тактик
Насколько я помню, вы воевали, майор.	насколько помнить воевать майор
Провел шесть месяцев в окопах, в Непале.	провести шесть месяц окоп непал
А вы?	а вы
Я служил в разведке.	я служилый разведка
Так и не представилось возможности поучаствовать в военных действиях:	так представиться возможность поучаствовать военный действие
я подал рапорт о переводе,	подать рапорт перевод
но командование сочло, что в США я принесу больше пользы.	командование счесть сша принести польза
Если теракты продолжатся, конфликт может возобновиться.	если теракт продолжиться конфликт возобновиться
И вы получите шанс проявить себя в бою.	и получить шанс проявить бой
Система охраны взломана,	система охрана взломать
и я не знаю, что именно было похищено.	знать именно похитить
Приступаю к инвентаризации всех подразделений.	приступать инвентаризация подразделение
Мы должны все сделать собственными силами,	мы должный сделать собственный сила
меньше всего мне хочется привлекать полицию.	маленький хотеться привлекать полиция
Если Зо'ор узнает о краже,	если зоор узнать кража
он ограничит нам доступ к тейлонским технологиям.	ограничить мы доступ тейлонской технология
Все так же, как во время предыдущего теракта в посольстве, Да'ан.	весь же время предыдущий теракт посольство даана
Благодаря предупреждению никто не постадал, но здание полностью разрушено.	благодаря предупреждение никто постадать здание полностью разрушить
А мы считали, что принесли вашей планете мир,	а считать принести ваш планета мир
когда ратифицировали индо-китайский мирный договор.	ратифицировать индокитайский мирный договор
Старая вражда нелегко уходит в прошлое.	старый вражда нелегко уходить прошлое
Годовщина заключения мира - подходящий повод для воскрешения зла в человеческой памяти.	годовщина заключение мир подходящий повод воскрешение зло человеческий память
Тейлонам невозможно вообразить,	тейлоно невозможно вообразить
чтобы представители одной расы вступили в войну друг с другом,	представитель один раса вступить война друг друг
и, тем более, поддерживали вражду после окончания войны.	и более поддерживать вражда окончание война
Невообразимо?	невообразимый
А древние тейлоны,	а древние тейлона
до появления джаридианцев?	появление джаридианец
Джаридианцы -	джаридианец
носители демона агрессии,	носитель демон агрессия
которого наша раса изжила.	который наш раса изжить
"То, что ты зовешь ""демоном агрессии"" -"	то звать демон агрессия
это готовность бороться за дело, которое считаешь правым.	это готовность бороться дело который считать правый
Ты еще красивее, когда погружена в работу.	ты красивый погрузить работа
Дэннис? Здравствуй.	дэннис здравствовать
Я... зашла в тупик.	я зайти тупик
Расследую сбой охранных систем.	расследовать сбой охранный система
Не хочешь взглянуть?	не хотеть взглянуть
Благодарю...	благодарить
Но нет.	но нет
Добро пожаловать в мир, который я с радостью оставил.	добро пожаловать мир который радость оставить
Да брось...	да бросить
Разве не тянет иногда заглянуть в замочную скважину?	разве тянуть заглянуть замочный скважина
Вспомнить, как следил за ничего не подозревающими?	вспомнить следить подозревать
Ни в малейшей степени.	ни маленький степень
У меня нет ностальгии ни по битвам,	у ностальгия битва
ни по тайнам.	тайна
На мой век сражений хватило,	на век сражение хватить
пусть кто-нибудь другой примет эстафету.	пусть ктонибыть принять эстафета
Значит, ты отошел от дел	значит отойти дело
и предоставляешь другим продолжить игру?	предоставлять другой продолжить игра
Игра?	игра
С приходом тейлонов она потеряла привлекательность.	с приход тейлоновый потерять привлекательность
Ты не согласна?	ты согласный
Я хочу лично возглавить сборную группу ФБР и ЦРУ, расследующую атаки на посольства.	я хотеть лично возглавить сборная группа фбр цру расследовать атака посольство
Проблемы людей не относятся к моим приоритетам.	проблема человек относиться мой приоритет
Скажите, агент Сандовал,	сказать агент сандовал
мне только кажется,	кажется
или же дело здесь в чем-то другом?	дело чемтый друг
О чем вы, Зо'ор?..	о вы зоор
Ваш психологический профиль указывает	ваш психологический профиль указывать
на недовольство и неудовлетворенность тем,	недовольство неудовлетворённость тем
что вы никогда не участвовали в военных действиях.	участвовать военный действие
Мой императив - служить вам, Зо'ор.	мой императив служить вы зоор
Но не отрицаю, что в глубине души	но отрицать глубина душа
я рассматриваю эти теракты как шанс	рассматривать теракт шанс
испытать себя в бою.	испытать бой
Меня все больше интригует	я интриговать
человеческая тяга к смертельной схватке.	человеческий тяга смертельный схватка
Здравствуйте.	здравствовать
Я ищу полковника Робийяра.	я искать полковник робийярый
Проходите.	проходить
Он выйдет через минуту.	он выйти минута
Как вас представить?	как представить
Майор Лиам Кинкейд.	майор лиам кинкейд
Рад наконец-то познакомиться, майор.	рад наконецтый познакомиться майор
По лицу я вижу, что вы смотрели документальную кинодраму Рене.	по лицо видеть смотреть документальный кинодрама рен
Самира - голограмма.	самир голограмма
Рада знакомству, майор Кинкейд.	рада знакомство майор кинкейд
Я пойду, Дэннис.	я пойти дэннис
Интересно...	интересно
Судя по вашей реакции, вам скорее жутковато.	судить ваш реакция скорее жутковатый
Ну, это, весьма... необычно.	ну это весьма необычно
Примите голограмму как способ напоминания об утраченной любви,	принять голограмма способ напоминание утратить любовь
о погибших товарищах...	погибший товарищ
Вы ведь воевали... на Тайване, кажется?	вы воевать тайвань кажется
Читали мое досье?	читать мой досье
Зная, что вы приятель Рене,	знать приятель рен
я тряхнул стариной и раздобыл ваши файлы.	тряхнуть старина раздобыть ваш файл
Иногда старому шпиону трудно удержаться от соблазна.	иногда старое шпион трудно удержаться соблазн
Произошедшие теракты, полковник...	произойти теракт полковник
Мне кажется, это отголоски войны,	я кажется это отголосок война
и, честно говоря,	и честно говорить
я обеспокоен, что они могут привести к новому международному конфликту.	обеспокоить мочь привести новый международный конфликт
Официальный акт разоружения не удовлетворил ни одну из сторон.	официальный акт разоружение удовлетворить один сторона
Китай и Индия считают, что мы принудили их к миру.	китай индия считать принудить мир
И это правда.	и это правда
Благодаря вмешательству тейлонов.	благодаря вмешательство тейлоновый
Сошедших с небес, как ангелы...	сойти небо ангел
Я надеялся убедить вас помочь нам в расследовании.	я надеяться убедить помочь мы расследование
При всем уважении, майор, я уже сказал Рене, что отошел от дел.	при весь уважение майор сказать рен отойти дело
Мой интерес к миру угас с тех пор, как тейлоны взялись за нас решать наши проблемы.	мой интерес мир угаснуть тот пора тейлона взяться решать наш проблема
До прихода Сподвижников мир был гораздо опаснее,	до приход сподвижник мир гораздо опасный
теперь же у нас отняли возможность самостоятельного выбора.	отнять возможность самостоятельный выбор
Я считаю, что разоружив Индию и Китай,	я считать разоружить индия китай
вы лишь отложили неизбежное продолжение ядерной вендетты.	лишь отложить неизбежный продолжение ядерный вендетта
