cleaned_text	lemm_text
Это - полная чепуха!	это полный чепуха
У нас были и желание, и возможности заключить мир и поддерживать его.	у желание возможность заключить мир поддерживать он
Но для тех, кто отказался от собственной воли в обмен на безопасность, гарантированную тейлонами...	но тот отказаться собственный воля обмен безопасность гарантировать тейлоно
Имеете в виду меня?	иметь вид я
НЕДЕЛЯ ПАМЯТИ ИНДО-КИТАЙСКОЙ ВОЙНЫ	неделя память индокитайский война
Говорю тебе, Авгур, она как живая была!	говорить ты авгур живой быть
Мои голограммы тоже не мертвецы!	мой голограмма мертвец
Но твои не целуют тебя перед тем, как отключиться.	но твой целовать тем отключиться
А эта еще и по комнате прошлась, после того, как открыла мне дверь...	а этот комната пройтись тот открыть дверь
Прошла по комнате?	пройти комната
Да. Свободно передвигалась.	да свободно передвигаться
Ух ты! Я просто обязан с ним познакомиться!	ух ты я просто обязать познакомиться
Скажи мне: каков он на самом деле?	сказать я каков самый дело
Трудно сказать. Жесткий. Резкий.	трудно сказать жёсткий резкий
На любой вопрос у него готов ответ.	на люба вопрос готовый ответ
в споре он не сдается.	спор сдаваться
Прямо вылитая Рене...	прямо вылить рен
Забавно, что ты о ней вспомнил.	забавно вспомнить
Когда я спросил об их с Робийяром отношениях, Рене как-то ощетинилась...	когда спросить робийярый отношение рен както ощетиниться
Правда?	правда
Тейлонам Робийяр нужен из-за достижений в голографии.	тейлоно робийяр нужный изз достижение голография
Мой интерес в том, что он лучше всех адаптирует тейлонскую технику для наших целей.	мой интерес тот адаптировать тейлонской техника наш цель
Согласна. Есть план...	согласный есть план
Я верю, что Дэннис может быть полезен Сопротивлению, и хочу прямо предложить ему...	я верить дэннис полезный сопротивление хотеть прямо предложить он
Это слишком рискованно, его взгляды нам неизвестны.	это слишком рискованно взгляд мы неизвестный
В лучшем случае он кажется безразличным к тейлонам.	в хороший случай кажется безразличный тейлоно
Это БОЛЬШЕ, чем безразличие. Я чувствую...	это большой безразличие я чувствовать
Рене, я знаю, как Дэннис тебе симпатичен, но дело в том...	рен знать дэннис ты симпатичный дело тот
Вы правда считаете, что я стану рисковать жизнью бойцов Сопротивления из-за дорогого для меня человека?	вы правда считать стать рисковать жизнь боец сопротивление изз дорогой человек
Да что с вами такое?	да вы такой
Думал, ты на корабле-носителе.	думать корабленоситель
Зо'ор отказался от моей помощи в беседе с полковником Робийяром.	зоор отказаться мой помощь беседа полковник робийярый
Кажется, Зо'ор считает, что мне не хватает дипломатического таланта,	кажется зоор считать хватать дипломатический талант
необходимого в переговорах такого рода.	необходимый переговоры такой род
Не понимаю, Да'ан.	не понимать даана
Ты, как никто другой, разбираешься в вопросах политики.	ты никто другой разбираться вопрос политика
<i>Предупреждение: тейлонское посольство будет взорвано через 10 секунд.</i>	iпредупреждение тейлонский посольство взорвать 10 секундi
Моя секретная линия!	мой секретный линия
У них имеется доступ к нашим системам!	у иметься доступ наш система
В Посольстве лишь мы с тобой!	в посольство лишь ты
Немедленно эвакуируемся!	немедленно эвакуироваться
Структура здания Посольства выдержала удар,	структура здание посольство выдержать удар
но интерьер был полностью разрушен.	интерьер полностью разрушить
Итак,	итак
Сопротивление наконец-то обнаружило способ нанести вред инфраструктуре тейлонов	сопротивление наконецтый обнаружить способ нанести вред инфраструктура тейлоновый
Нападение на Посольство не останется безнаказанным	нападение посольство остаться безнаказанный
А вы будете работать без отдыха, пока преступники не предстанут перед судом!	а быть работать отдых пока преступник предстать суд
Всем ячейкам уйти в подполье и свернуть все операции до дальнейшего распоряжения.	весь ячейка уйти подполье свернуть операция дальнейший распоряжение
Мы рискуем. ЦРУ и ФБР объединили силы в борьбе с Сопротивлением.	мы рисковать цру фбр объединить сила борьба сопротивление
Возможно, последуют зачистки и чрезвычайное положение.	возможно последовать зачистка чрезвычайный положение
Лечь на дно - иначе расплачиваться придется всем.	лечь дно иначе расплачиваться прийтись весь
Гнездо подачи	гнездо подача
перейти на второй уровень...	перейти два уровень
Кто-то пришел.	ктоть прийти
Слушаю?	слушать
Полковник Робийяр,	полковник робийяр
Рональд Сандовал, агент ФБР.	рональд сандовал агент фбр
Чем могу быть полезен?	чем мочь полезный
Я вхожу в команду, расследующую теракты в посольствах.	я входить команда расследовать теракт посольство
Вы работаете с Кинкейдом?	вы работать кинкейд
Он мой подчиненный.	он подчинённый
Вопрос остался прежним.	вопрос остаться прежний
Чем могу быть полезен?	чем мочь полезный
Полагаю, что вы, как бывший офицер разведки, поможете разобраться,	полагать вы бывший офицер разведка помочь разобраться
почему неизвестные, желающие продолжить Индо-Китайскую войну,	почему неизвестный желающий продолжить индокитайский война
хотят втянуть в драку тейлонов.	хотеть втянуть драка тейлоновый
Значит, вы считаете, что удар по тейлонам и теракты в посольствах - дело рук одних и тех же преступников?	значит считать удар тейлоно теракт посольство дело рука один тот преступник
Звучит логично.	звучать логично
Ваши соображения по этому поводу, полковник.	ваш соображение это повод полковник
Не стану и начинать...	не стать начинать
Как я уже говорил вашему подчиненному Кинкейду,	как говорить ваш подчинённый кинкейд
я ушел от дел.	уйти дело
Я частное лицо	я частное лицо
с меня хватит войны.	хватить война
Понимаю...	понимать
Однако, должен признаться,	однако должный признаться
я разочарован.	разочаровать
Моя последняя книга. Она вам знакома?	мой последний книга она знакомый
Знакома?	знакомый
Она занимает почетное место на моей книжной полке,	она занимать почётный место мой книжный полка
рядом с Макиавелли и Линебергером...	ряд макиавелли линебергер
Польщен.	польстить
Не сочтите за лесть, полковник,	не счесть лесть полковник
но ваш опыт способствовал моему выбору карьеры - в разведке.	ваш опыт способствовать мой выбор карьера разведка
Так значит, я вас вдохновил?	так значит вдохновить
Тогда какого черта	тогда какой черта
вы пришли на работу к тейлонам?	прислать работа тейлоно
Цитирую вашу книгу:	цитировать ваш книга
"""Для разведчика не существует политических сил, а есть лишь власть."""	для разведчик существовать политический сила лишь власть
Тейлоны обладают этой властью.	тейлона обладать власть
Да, но я также написал,	да также написать
что самый опасный противник разведчика - тот, кто применяет в качестве оружия	самый опасный противник разведчик тот применять качество оружие
искушение властью.	искушение власть
И единственное оружие против подобного врага -	и единственный оружие против подобный враг
это непоколебимая верность	это непоколебимый верность
своим принципам.	свой принцип
Разумеется.	разумеется
И я бы использовал это оружие, будь тейлоны врагами.	и использовать это оружие быть тейлона враг
Разумеется. Будь тейлоны врагами...	разумеется быть тейлона враг
Несомненно.	несомненно
Во избежание двусмысленности, полковник,	в избежание двусмысленность полковник
моя верность СЕБЕ - непоколебима.	верность себя непоколебимый
Еще один рабочий день прошел...	ещё рабочий день пройти
Не каждый день взрывают тейлонские посольства.	не каждый день взрывать тейлонской посольство
И не беспокойся так: я в полном порядке.	и беспокоиться так полный порядок
Если учесть, что Сопротивление ушло в глубокое подполье.	если учесть сопротивление уйти глубокий подполье
Слышала, ты навестил Дэнниса...	слышать навестить дэннис
Пытался уговорить его помочь в расследовании, но он отказался.	пытаться уговорить помочь расследование отказаться
Вежливо, но твердо.	вежливый твёрдо
Мы с Джонатаном обсуждали	мы джонатан обсуждать
вопрос о вовлечении Дэнниса в Сопротивление.	вопрос вовлечение дэннис сопротивление
Твое мнение?	твой мнение
Я не могу понять отношения Робийяра к тейлонам.	я мочь понять отношение робийярый тейлоно
Он считает, что некоторые люди переложили свои заботы на тейлонов,	он считать некоторый человек переложить свой забота тейлоновый
и проблема именно в этом.	проблема именно это
Учитывая вышесказанное, он мне нравится.	учитывать вышесказанный нравиться
Но должен признать, его погибшая возлюбленная в виде голограммы	но должный признать погибший возлюбить вид голограмма
наводит жуть.	наводить жуть
Майор Кинкейд, жду вас на корабле-носителе. Немедленно.	майор кинкейд ждать корабленоситель немедленно
Я только что говорил со следственным отделом ФБР, расследующим теракт в посольстве.	я говорить следственный отдел фбр расследовать теракт посольство
Что они сообщили?	что сообщить
Согласно их заключениям, удар был нанесен Квантовым Вихрем.	согласно заключение удар нанести квантовый вихрь
Но со времен войны никто не применял Квантовый Вихрь.	но время война никто применять квантовый вихрь
Значит тот, кто это сделал, в ответе и за сто тысяч человек, погибших тогда.	значит тот это сделать ответ сто тысяча человек погибший тогда
Это правда, Зо'ор?	это правда зоор
Если ты имеешь в виду сообщения об использовании Квантового Вихря в теракте на Посольство, Да'ан,	если иметь вид сообщение использование квантовый вихрь теракт посольство даана
то да, правда.	да правда
Удивительно, что тебя, похоже, совсем не беспокоит эта новость.	удивительно ты похоже беспокоить этот новость
До сих пор неизвестно, кто в ответе за взрыв посольства.	до сей пора неизвестно ответ взрыв посольство
Кто именно в ответе - это совершенно неважно!	кто именно ответ это совершенно неважно
Страшен сам факт, что КТО-ТО располагает этим ужасающим оружием!	страшный факт ктоть располагать это ужасающий оружие
И, вероятно, ему известна ПРАВДА.	и вероятно известный правда
Знаешь, тейлоны готовы на ушах стоять, чтобы заполучить тебя в совместную команду.	знаешь тейлона готовый ухо стоять заполучить совместный команда
Большинство людей сочло бы это за честь.	большинство человек счесть это честь
Я польщен, ведь ситуация необычна: Сподвижники уговаривают человека,	я польстить ситуация необычный сподвижник уговаривать человек
тогда как люди обычно сами рвутся исполнять их прихоти.	человек обычно сам рваться исполнять прихоть
Что это означает?	что это означать
Мы партнеры тейлонов, а не их слуги.	мы партнёр тейлоновый слуга
Да ладно тебе, Рене.	да ладный ты рен
Я всегда думал, что ты женщина сообразительная.	я думать женщина сообразительный
А теперь?	а теперь
Теперь?	теперь
Скажу лишь, что, похоже,	сказать лишь что похоже
ты - сторонник наших инопланетных приятелей.	сторонник наш инопланетный приятель
Нет.	нет
Это не так.	это так
Ты говоришь так, словно я работаю НА тейлонов.	ты говорить так словно работать на тейлоновый
А не СОВМЕСТНО с ними.	а совместно они
Чему ты улыбаешься?	что улыбаться
Просто...	просто
Когда ты злишься, ты особенно красива.	когда злиться особенно красивый
Не нужно, Дэннис.	не нужно дэннис
А то твоя голографическая подруга обидится.	а твой голографический подруга обидеться
Итак, по-видимому, ты наконец-то что-то нарыл.	итак повидимый наконецтый чтоть нарыть
Со времени терактов бизнес идет хуже некуда.	с время теракт бизнес идти худой некуда
Твои приятели смогли что-нибудь выяснить в связи со взломом моих систем?	твой приятель смочь чтонибыть выяснить связь взлом мой система
Нет. Ничего.	нет ничто
Никто из моих знакомых не в курсе.	никто мой знакомый курс
Слушай, а нельзя ли подсмотреть, чем занимается Робийяр?	слушай подсмотреть заниматься робийяр
Ты о голограммах?	ты голограмма
Если продемонстрируешь надлежащее почтение, он, вероятно, примет тебя с распростертыми объятиями.	если продемонстрировать надлежащий почтение он вероятно принять распростереть объятие
Если я еще об этом не упоминал...	если упоминать
Пей на здоровье! Всего 200 баксов за бутылку!	пить здоровье всего 200 бакс бутылка
Итак, Робийяр дал ответ? Насчет работы с тейлонами?	итак робийяр дать ответ насчёт работа тейлоно
Раз МЫ платим, то все его разработки принадлежат Дорсу.	раз мы платить разработка принадлежать дорсу
Но он вряд ли разрешит использовать свое имя для общественной поддержки проекта.	но вряд разрешить использовать свой имя общественный поддержка проект
Значит, Робийяр не относится к фанатам тейлонов.	значит робийяр относиться фанат тейлоновый
Похоже на то.	похоже то
Я читал его автобиографию, он предвзят и упрям.	я читать автобиография предвзятый упрямый
Полагаю, твои чувства к полковнику позволяют читать его душу?	полагать твой чувство полковник позволять читать душить
Ошибаешься, Авгур...	ошибаться авгур
Как обычно.	как обычно
Майор Кинкейд убежден, что Сопротивление не имеет отношения к теракту.	майор кинкейд убедить сопротивление иметь отношение теракт
И я начинаю с ним соглашаться.	и начинать соглашаться
В чем дело, агент Сандовал?	в дело агент сандовал
Улика, показавшаяся ФБР незначительной.	улика показаться фбр незначительный
Возможно, первый настоящий прорыв в этом деле.	возможно один настоящий прорыв дело
Меморандум Совету Директоров:	меморандум совет директор
Служба Секьюрити произвела проверку 97% персонала всех отделений.	служба секьюрити произвести проверка 97 персонал отделение
Проверка будет закончена не позже 11 часов утра завтра.	проверка закончить поздний 11 часы утро завтра
Я предпочитаю, чтобы мои посетители стучали, перед тем, как зайти.	я предпочитать мой посетитель стучать тем зайти
Сравнительный анализ улик в разных посольствах обнаружил следы радиации -	сравнительный анализ улика разный посольство обнаружить след радиация
излучения, которое имеется лишь в технических устройствах, производимых компанией Дорса совместно с тейлонами.	излучение который иметься лишь технический устройство производить компания дорса совместно тейлоно
Что вы хотите сказать?	что хотеть сказать
Я хочу сказать,	я хотеть сказать
что Квантовый Вихрь, использованный для взрыва Посольства	квантовый вихрь использовать взрыв посольство
был создан с использованием материалов вашего подразделения.	создать использование материал ваш подразделение
Вы обвиняете меня в терроризме?	вы обвинять терроризм
