cleaned_text	lemm_text
Вы низачто не поверите -	вы низачто поверить
- Но это все началось, когда я повесил плакат.	но это начаться повесить плакат
Только лист от автомобильного постера папы.	только лист автомобильный постер папа
Вот, как это началось.	вот это начаться
Мое имя Ходдер Емануэль Якобсен.	мой имя ходдёр емануэль якобсен
Я - обычный мальчик, который живет с папой.	я обычный мальчик который жить папа
Хорошая работа, Ходдер.	хороший работа ходдёр
Я думаю, что это напоминает цветок.	я думать это напоминать цветок
Это - фея.	это фея
Или птица, возможно. - Нет, фея.	или птица возможно нет фея
Ну хорошо.	ну хорошо
Вперед, команда! - Вперед, команда!	вперёд команда вперёд команда
У нас нет мамы. То есть, у папы нет жены -	у мама то есть папа жена
Ну и, также у меня нет мамы.	ну и также мама
Папа расклеивает плакаты по ночам.	папа расклеивать плакат ночь
Автомобильные плакаты, туристические, все виды рекламы.	автомобильный плакат туристический вид реклама
Я могу слышать его мотоцикл еще долго, после того, как он свернет за угол.	я мочь слышать мотоцикл долго тот свернуть угол
Я люблю ромовые ватрушки.	я любить ромовый ватрушка
Я съедаю внешнюю сторону днем -	я съедать внешний сторона днём
И оставляю серединку на ночь.	и оставлять серединка ночь
Внутри мы все одинаковые.	внутри одинаковый
В то же время, внешне мы такие разные. Не так ли, Ходдер?	в время внешне такой разный не ли ходдёр
Внутри мы - все одинаковые, Мисс Аста К.	внутри одинаковый мисс аста к
Да! И замечательная вещь -	да и замечательный вещь
- каждый отдельный орган выполняет свою функцию...	каждый отдельный орган выполнять функция
Внешне мы отличаемся, но внутри мы все одинаковые.	внешне отличаться внутри одинаковый
Я и Филип, который может так двинуть, что твои кости запоют, -	я филип который двинуть твой костя запеть
- И Алекс, у которого хорошие манеры... Мы все получили сердца, легкие, почки.	и алекс который хороший манера мы получить сердце лёгкое почка
Даже Камма из Исландии.	даже камма исландия
Взгляните! - Нет, Камма Гудмундсдорф!	взглянуть нет камма гудмундсдорф
Это - то, что действительно напоминает почка овцы.	это то действительно напоминать почка овца
Мы в Исландии едим их сырыми. - Убери это в свою коробку для завтрака!	мы исландия есть сырой убрать это коробка завтрак
Вот дела. Это настолько странно для нас.	вот дело это настолько странно мы
Вынуждена сидеть рядом с тобой, Ходдер... Я была рождена под несчастливой звездой.	вынудить сидеть ряд ты ходдёр я родить несчастливый звезда
А я родился в больнице.	а родиться больница
Я вошел в мир с пуповиной, семь раз обмотаной вокруг моей шеи.	я войти мир пуповина семь обмотаный вокруг мой шея
Акушерка сказала, что меня ждет большое будущее.	акушерка сказать ждать большой будущее
Ты чего, Ходдер?	ты что ходдёр
Пытался достать это. - Вау!	пытаться достать это вау
Ходдер спасает каштан! Филип, поехали!	ходдёр спасать каштан филип поехать
Не то, что я настроен против других. Просто предпочитаю ходить домой один.	не то настроить против другой просто предпочитать ходить домой один
Я так привык.	я привыкнуть
Изучали что - нибудь в школе сегодня? - Да. Мы должны изучить покровы.	изучать школа сегодня да мы должный изучить покров
Внутренние и внешние.	внутренний внешний
Да, это важно.	да это важный
Одна материя, однако.	один материя однако
Смотри, не хватает 50 крон. У нас изменились цены.	смотреть хватать 50 крона у измениться цена
Ладно, принесешь в следующий раз.	ладный принести следующий раз
Тут она сидит, ждет. Ты никогда не знаешь, где любовь настигнет, -	тут сидеть ждать ты знаешь любовь настигнуть
сказала она мне однажды.	сказать однажды
Знаешь, о чем я подумал? Как насчет новой кухни?	знаешь подумать как насчёт новый кухня
Побольше света, новые цвета.	большой свет новое цвет
Опс! Долой все старое.	опс долой старое
Ты думаешь, что я не решусь, а? Только посмотри на эти обои...	ты думать решиться а только посмотреть обои
Боже мой! Хорошо, так...	бог мой хорошо так
Ты не очень хорошо приклеивал.	ты очень приклеивать
Я думаю, твоя мама приклеивала их.	я думать твой мама приклеивать они
Как насчет новой жены?	как насчёт новый жена
Через мгновение папа скажет, что ему нужно подумать.	через мгновение папа сказать нужно подумать
Нам вместе нужно немного подумать, да? Ходдер?	мы вместе нужно немного подумать да ходдёр
Я уверен, что он хотел бы новую жену.	я уверенный хотеть новый жена
Но он работает в то время, когда все возможности спят.	но работать время возможность спать
МЕЧТА - ВАШ ПУТЬ К СКАЗОЧНОЙ СТРАНЕ	мечта ваш путь к сказочный страна
Останови автомобиль здесь и не переедь всех тех детей!	остановить автомобиль переедь тот ребёнок
Не говори со мной так, хорошо?	не говорить я так хорошо
Не будет вреда, если наш сын услышит, какие у нас отношения.	не вред наш сын услышать какой отношение
Поторопись... - Не кричи на Филипа.	поторопиться не кричать филип
Поторопись, Филип. Не забудь свой рюкзак.	поторопиться филип не забыть свой рюкзак
Не хлопай дверью. Поторопись!	не хлопать дверь поторопиться
Привет, Филип...	привет филип
Теперь действительно интересный орган. Поджелудочная железа -	теперь действительно интересный орган поджелудочный железо
- которая производит ферменты, позволяющие нам переваривать -	который производить фермент позволять мы переваривать
- нашу пищу. И еще одна вещь...	наш пища и один вещь
Камма, убери эту вещь в свою сумку, Сейчас не время ланча...	камма убрать вещь сумка сейчас время ланча
Я только хотела продемонстрировать пищеварение.	я хотеть продемонстрировать пищеварение
Это - обычная еда, которую мы едим в Исландии.	это обычный еда который есть исландия
Копченый мозг овцы.	копчёный мозг овца
Вы чувствуете недомогание, мисс Аста К.?	вы чувствовать недомогание мисс аста к
Хорошо, мы знаем, кого благодарить за это.	хорошо знать кто благодарить это
Так в каждом классе. Один человек всегда остается виноватым.	так каждый класс один человек оставаться виноватый
В моем классе Это, случается... со мной.	в мыть класс это случается я
Ходдер... как всегда.	ходдёр всегда
Мы приходим сюда, чтобы учиться, и мы не можем делать это, если ты срываешь наши уроки...	мы приходить сюда учиться мочь делать это срывать наш урок
Так что иди, и извинись перед ней. Покажи, какой ты воспитанный.	так идти извиниться она показать воспитанный
Давай!	давать
Мисс Аста К.? - Что ты здесь делаешь?	мисс аста к что делать
Урок идет.	урок идти
Есть какой-то вопрос?	есть какойтый вопрос
Ты хотел что-то сказать?	ты хотеть чтоть сказать
Да. Вы пахнете.	да вы пахнуть
Вы хорошо пахнете.	вы пахнуть
""" Вы пахнете ""? Ты это произнес? Это было сказано?"	вы пахнуть ты это произнести это сказать
Я только сказал, что она пахла.	я сказать пахнуть
Наверное, лучше было сказать, что тебе понравились ее духи.	наверное сказать ты понравиться дух
Я сказал, что она пахла хорошо. Но это только рассердило ее еще больше.	я сказать пахнуть хорошо но это рассердить большой
Женщин иногда трудно понять.	женщина трудно понять
Она пахла хорошо, не так ли? - Ничего неприятного в ее запахе.	она пахнуть хорошо ли ничто неприятный запах
Интересуешься? - Давай снимай мокрую одежду.	интересоваться давать снимать мокрый одежда
А то подхватишь простуду.	а подхватить простуда
Ходдер?	ходдёр
Ходдер Емануэль Якобсен?	ходдёр емануэль якобсен
Ходдер, ты был избран. Спасти мир.	ходдёр избранный спасти мир
Вы беспокоитесь о будущем?	вы беспокоиться будущее
Ты избранный. Ты должен спасти мир.	ты избранный ты должный спасти мир
Но я живу своей жизнью вместе с папой. Попросите Филипа из моего класса вместо меня.	но жить свой жизнь вместе папа попросить филип мой класс вместо я
Он намного сильнее меня. И у него есть папа и мама.	он намного сильный я и папа мама
Но ты избран. Это-ты, ты должен спасти мир.	но избранный этота должный спасти мир
Ходдер Емануэль Якобсен.	ходдёр емануэль якобсен
Куда Вы исчезли?	куда вы исчезнуть
Если бы ты не спал -	если спасть
- Я бы рассказал тебе, что фея приходила ко мне ночью. Увидимся, папа.	я рассказать ты фея приходить к ночью увидеться папа
Привет, Филип. Знаешь, что случилось сегодня ночью?	привет филип знаешь случиться сегодня ночью
Ты ведь идешь в школу? - Да, конечно.	ты идти школа да конечно
Ну и иди! Вперед, Ходдер!	ну идти вперёд ходдёр
Хорошо? Иди! - Если ты поведешь, я пойду пешком.	хорошо идти если повести пойти пешком
Веди себя перед своим сыном, как подобает взрослому.	вести свой сын подобать взрослый
Поехали, Филип? Или ты тоже пойдешь пешком?	поехать филип или пойти пешком
Иду, мама.	идти мама
Ни слова об этом никому. - О чем?	ни слово никто о чем
Эй, Филип? Я не расскажу тебе, что произошло сегодня ночью.	эй филип я рассказать ты произойти сегодня ночью
Фея? Она могла говорить?	фея она мочь говорить
О, да. Она сказала мне, что я должен спасти мир.	о да она сказать я должный спасти мир
И что я один был избран. Она сказала мое полное имя.	и избранный она сказать мой полный имя
Ходдер Емануэль Якобсен.	ходдёр емануэль якобсен
Давай Ходдер, садись уже.	давать ходдёр садиться уже
Это была очень странная ночь.	это очень странный ночь
Я мог чувствовать духи на всем ее пути к учительской.	я мочь чувствовать дух весь путь учительский
Если у меня когда-нибудь будет новая мама, я подарю ей 10 литров этих духов.	если когданибудь новый мама подарить 10 литр этот дух
УЧИТЕЛЬСКАЯ	учительский
Простите... - Ходдер?	простить ходдёр
Я могу вас кое о чем спросить? - О фее?	я мочь кой спросить о фея
Ходдер сказал, что Фея приходила к нему вчера ночью.	ходдёр сказать фея приходить он вчера ночью
Нет, я только хотел спросить вас о ваших духах.	нет хотеть спросить ваш дух
Моих духах?	мой дух
Да. Как они называются?	да как называться
Ходдер, я должна сказать тебе пару слов.	ходдёр должный сказать ты пара слово
Ходдер, на прошлой неделе ты спросил меня, провожу ли я выходные в одиночестве.	ходдёр прошлый неделя спросить я провозить выходной одиночество
Нет, конечно. - Нет, конечно нет.	нет конечно нет нет
Ты также спросил меня вышли ли у меня камни из желчного пузыря...	ты также спросить выйти камень жёлчный пузырь
Да. - Да, что касается моих духов,-	да да касаться мой дух
- Я рассматриваю это, как абсолютно мое собственное дело.	я рассматривать это абсолютно мой собственный дело
Это не касается никого, уже не говоря об ученике.	это касаться никто говорить ученик
Так что с этого времени, Ходдер, никаких личных вопросов, хорошо?	так время ходдёр никакой личный вопрос хорошо
Хватит. Сейчас, потом, вообще ничего не говори.	хватить сейчас потом вообще говорить
Ни слова. Понял?	ни слово понять
Ни слова, Ходдер.	ни слово ходдёр
Хорошо, мисс Аста К.	хорошо мисс аста к
Эй!	эй
Мне жаль, что я была немного несдержана.	я жаль немного несдержать
Мои духи - Не твое дело.	мой дух не твой дело
Но если тебе очень нужно знать, они называются Мечты Гарема.	но ты очень нужно знать называться мечта гарем
Мечты Гарема? - Да.	мечта гарем да
Я однажды видела это название на дурацком плакате в аэропорту.	я однажды видеть это название дурацкий плакат аэропорт
Мне нравится женский запах.	я нравиться женский запах
Мечты Гарема. Это английское название. Мечты Гарема.	мечта гарем это английский название мечта гарем
Что такое - мечты гарема?	что такой мечта гарем
Гаремы - существуют в Аравии.	гарем существовать аравия
Арабам позволяется иметь большое количество жен.	араб позволяться иметь большой количество жена
И место, где живут жены, называется гаремом.	и место жить жена называться гарем
Что - нибудь еще ты бы хотел знать?	что хотеть знать
Вы хотели бы быть одной из жен?	вы хотеть один жена
Нет! Господи, нет!	нет господь нет
Достаточно. Пойдем!	достаточно пойти
Я думаю моему папе они понравятся. - Возможно.	я думать мой папа понравиться возможно
они пахнут, как... ромовое пирожное.	пахнуть как ромовый пирожное
Извини, не та рука.	извинить тот рука
Они называются Мечты Гарема, это вроде кухни, где много женщин.	они называться мечта гарем это вроде кухня женщина
Да, они пахнут женщинами, несомненно.	да пахнуть женщина несомненно
Немного насыщенно... я не думаю, что я мог бы привыкнуть к ним, Ходдер.	немного насыщенно думать мочь привыкнуть он ходдёр
Аста К. хотела бы жить в гареме и работать на кухне.	аста к хотеть жить гарем работать кухня
Я уверен, что она могла бы, но я думаю, что хватит уже о духах?	я уверенный мочь бы думать хватить дух
OK?	ok
МАМА Привет, мама, с днем рождения.	мама привет мама днём рождение
Мы в порядке. Папа начал заниматься ремонтом кухни.	мы порядок папа начать заниматься ремонт кухня
Я не думаю, что это займет много времени.	я думать это занять время
И вероятно я должен буду спасти мир.	и вероятно должный быть спасти мир
Пришла фея. Настоящая, живая фея.	пришлый фея настоящий живой фея
С крыльями и всем.	с крыло весь
Давай, Ходдер, мы идем.	давать ходдёр идти
Мы только что пришли. Я не закончил.	мы прислать я закончить
Да, но мы идем, давай.	да идти давать
Не то, что он не хочет поговорить с тобой, просто ему не хватает тебя.	не то хотеть поговорить ты просто хватать ты
Пока мама, увидимся.	пока мама увидеться
Ходдер, ты еще не спас мир, почему?	ходдёр спасти мир почему
Я не могу. Мир слишком большой -	я мочь мир слишком большой
И никто в школе не верит мне.	и никто школа верить я
Они поверят тебе. Я обещаю.	они поверить ты я обещать
Ты сделаешь это? - Мир - не слишком большой для тебя.	ты сделать это мир слишком большой ты
Ты справишься.	ты справиться
Как?	как
Ты избранный. - В таком случае скажи мне как!	ты избранный в такой случай сказать как
Как?	как
Ходдер?	ходдёр
Папа?	папа
Да? - Как можно спасти мир?	да как спасти мир
Господи, ни много, ни мало.	господь много мало
Так ты собираешься спасать мир?	так собираться спасать мир
Да, я так думаю. Это то, о чем сказала фея.	да думать это то сказать фея
О, да. Фея.	о да фея
Сначала я бы, вероятно, снарядил экспедицию.	сначала бы вероятно снарядить экспедиция
Составленную из хороших помощников.	составить хороший помощник
Но прежде всего, я бы немного поспал.	но прежде всего немного поспасть
Фея возвратилась, Биг Мак Джонсон.	фея возвратиться биг мак джонсон
Она продолжает утверждать, что я избранный.	она продолжать утверждать избранный
Она бы лучше Филипа попросила, он тоже очень избранный.	она филип попросить очень избранный
Филип, ты мог бы стать помощником в спасении мира?	филип мочь стать помощник спасение мир
Может, что-нибудь нормальное придумаешь? Только советом.	мочь чтонибыть нормальный придумать только совет
Это плохо, они не могут быть друзьями. - Кто?	это плохо мочь друг кто
Твои мама и папа.	твой мама папа
