cleaned_text	lemm_text
Ну, я вспоминаю, может это были просто порножурналы.	ну вспоминать это просто порножурнал
Нет, ты что-то путаешь. Это из другого воспоминания.	нет чтоть путать это другой воспоминание
Путаю?	путать
- Минни, каков процент истинности фото?	минний каков процент истинность фото
 Ассоциативная визуализация. Этому обучают в старших классах.	ассоциативный визуализация это обучать старший класс
У нас был обед из 7 блюд, и ты ни одного не можешь вспомнить.	у обед 7 блюдо один мочь вспомнить
Но если я напомню что мы ели мясо, ты вспомнишь, что к нему был картофель.	но напомнить есть мясо вспомнить он картофель
Нам нужно запустить процесс.	мы нужно запустить процесс
Энтони, но того, что я вижу недостаточно. Расскажи о своих мыслях.	энтони тот видеть недостаточно рассказать свой мысль
Мы должны работать в команде.	мы должный работать команда
Оставайся здесь, и сосредоточся.	оставаться здесь сосредоточся
Я буду описывать то, что я вижу, а ты добавляй детали.	я быть описывать то видеть добавлять деталь
Слушай меня внимательно.	слушай внимательно
Во-первых...	вопервое
Это не порножурналы. Что это, Энтони?	это порножурнал что это энтони
Журнал с татуировками. И еще один такой же.	журнал татуировка и же
Верно, хорошо.	верно хорошо
А еще здесь есть... Розовая бутылка?	а есть розовый бутылка
Туалетная вода. Несколько флаконов у раковины.	туалетный вод несколько флакон раковина
Хорошо. Какого цвета ковер?	хорошо какой цвет ковёр
- Красный или оранжевый. - Красный.	красный оранжевый красный
Точно, и полотенца. Красное и черное.	точно полотенце красный чёрный
- А картина? - Я пытаюсь... Поезд.	а картина я пытаться поезд
Шторка для душа... На ней какие-то....	шторка душить на какиеть
Геометрические фигуры.	геометрический фигура
В горошены.	в горосить
Вся ванная была очень стильной. Цвета хорошо сочетались.	весь ванная очень стильный цвет сочетаться
Ты вспомнил. Что еще, вспоминай.	ты вспомнить что ещё вспоминать
- Минни, сообщай когда процент увеличивается. - Воспоминание, истинно на 25%.	минний сообщать процент увеличиваться воспоминание истинно 25
Энтони, фотографии в холе. Одна из них...	энтони фотография холя один они
Солдаты.	солдат
35% истины.	35 истина
- Энтони, появилась еще спальня. - Розовое покрывало на диване.	энтони появиться спальня розовый покрывало диван
Картины, шляпа. Кофейный столик с книгой,	картина шляпа кофейный столик книга
комод, телевизор включён. Мультфильмы.	комод телевизор включить мультфильм
Часы показывают разное время.	часы показывать разный время
Который был час?	который час
- Давай. Который час?	давать который час
 Минни, перезагрузи воспоминание.	минний перезагрузить воспоминание
Итак, ты вспомнил все подробности...	итак вспомнить подробность
Ты должен вспомнить главное.	ты должный вспомнить главный
- Что он там делал? - Я не знаю, но это истинное воспоминание.	что делать я знать это истинный воспоминание
В 1:35 зафиксировали время смерти.	в 135 зафиксировать время смерть
- Может он это сделал? - Энтони, я видел как ты её убил.	мочь это сделать энтони видеть её убить
- Ты мог ошибиться. - Я не мог ошибиться.	ты мочь ошибиться я мочь ошибиться
Я помог тебе, помоги теперь ты мне.	я помочь ты помочь я
Скажи Гарету, что я жду его на месте встречи.	сказать гарета ждать место встреча
Договор есть договор.	договор договор
Пойду отолью.	пойти отлить
Можно и мне сигаретку?	можно сигаретка
Брось пистолет! Брось!	бросить пистолет бросить
Давай ключи!	давать ключ
Подумай, Энтони. Они найдут тебя.	подумать энтони они найти ты
Если тебя убьют, ты убьёш Тома.	если убить убьёша том
Давай же, Энтони. Где ты?	давать же энтони где ты
Иду.	идти
Ни хера себе!	ни хер себя
- Когда тебя выпустили? - Только что.	когда выпустить только что
Входи.	входить
100 лет тебя не видел.	100 год видеть
Хочешь взбодриться? У меня есть кое-чё.	хотеть взбодриться у коечё
Очень смешно, засранец.	очень смешно засранец
Ты в ту ночь, был в доме Адрианы.	ты тот ночь дом адриана
Не знаю, о чём ты говоришь.	не знать что говорить
Скажи... Ты ведь был в доме её сестры, когда её убили?	сказать ты дом её сестра её убить
- Не пойму, о чём ты говоришь. - Почему ты убил её?	не понять что говорить почему убить её
- Ты с ума сошел. - Не ври, блядь, мне!	ты ум сойти не врать блядь я
Я не убивал её!	я убивать её
Я был там, но я ничего не делал.	я там делать
Я вошел в спальню, но она уже была мертва.	я войти спальня мёртвый
Я услышал шаги и спрятался. А потом я увидел тебя...	я услышать шаг спрятаться а увидеть ты
с пистолетом. Я запаниковал и ударил тебя.	пистолет я запаниковать ударить ты
Они меня не допрашивали. Ты тоже молчал, что мне было делать?	они допрашивать ты молчать делать
- Что ты делал в её доме? - А ты как думаешь?	что делать её дом а думать
Она бы не стала с тобой встречаться.	она стать ты встречаться
Да неужели?	да неужели
Ты удивлён?	ты удивлённый
Ты подсадил её на наркоту. Она пришла ко мне, по твоей вине.	ты подсадить её наркот она пришлый к я твой вина
"Что значит ""Она пришла к тебе""?"	что значит она пришлый ты
Ну... Мы заключили сделку.	ну мы заключить сделка
Я давал ей наркоту, а она давала мне то, что я хотел.	я давать наркот давать то хотеть
Вина. Вот почему она с тобой порвала.	вино вот почему ты порвать
Она правда хотела тебе всё рассказать.	она правда хотеть ты весь рассказать
Но знаешь, что я думаю?	но знаешь думать
Я думаю, ты пришел к ней домой в тот вечер.	я думать прийти домой вечер
Просто охуенно облажался.	просто охуенно облажаться
Я думаю, что она тебе всё рассказала.	я думать ты весь рассказать
А ты застрелил её, из-за этого.	а застрелить её изз это
Прости меня.	простить я
Не двигайся.	не двигаться
Отдай мне пистолет.	отдать пистолет
И всё это, ради девки.	и весь это ради девка
Я думал что мы были друзьями, чувак.	я думать друг чувак
И что теперь будем делать?	и быть делать
- Звони копам. - Сюда копам нельзя.	звонить копа сюда копа нельзя
А знаешь, он прав.	а знаешь право
Кокого хрена?	кокий хрен
Послушай.	послушать
Если тебе от этого полегчает, она правда хотела остановиться. Хотела.	если ты полегчать правда хотеть остановиться хотеть
Проблема в том, что я на неё подсел.	проблема тот она подсесть
Я сказал ей, что если она разорвёт наш договор...	я сказать она разорвать наш договор
я всажу ей пулю в голову.	всадить пуля голова
Так что спасибо, что сделал грязную работу, за меня.	так спасибо сделать грязный работа я
Минни, перенеси меня в текущий момент.	минний перенести текущий момент
- Минни? - Меня зовут Минни. Чем хочешь заняться сейчас?	минний я звать минний чем хотеть заняться сейчас
Я говорю, перенеси меня в настоящий момент.	я говорить перенести настоящий момент
Перемещение.	перемещение
- Обьект повреждён. - Что ты делаешь?	обьект повредить что делать
Я был так близок.	я близкий
У нас почти получилось.	у получиться
Крах системы.	крах система
Говори со мной, трус!	говорить я трус
Посмотри на меня!	посмотреть я
Уходи отсюда, Энтони. Что-то не то с Минни.	уходить отсюда энтони чтоть минний
Ты ведь обещал.	ты обещать
Что будешь делать?	что быть делать
Посмотри на меня! Что ты будешь делать?	посмотреть я что быть делать
То, что в моих интересах.	то мой интерес
- Твоя теория работает? - Да.	твой теория работать да
Я не могу вернуться к твоему компаньону. Я поеду к твоей жене.	я мочь вернуться твой компаньон я поехать твой жена
Если ты обьяснишь как всё делать, у нас получится.	если обьяснить весь делать получиться
Начать Извлечение.	начать извлечение
- Готово. Что делать? - Он сказал, будет ждать меня.	готовый что делать он сказать ждать я
Вытащи по моему сигналу.	вытащить мой сигнал
Ты его видишь?	ты видеть
- Я потерял его. - Что значит потерял?	я потерять он что значит потерять
Я его не вижу. Куда он делся?	я видеть куда деться
- Что я здесь делаю, Минни? - Я не понимаю. Фильтрация...	что делать минний я понимать фильтрация
Нет, не нужно. Мне нужно попасть в другое воспоминание.	нет нужно я нужно попасть другой воспоминание
- Ты уверен? - Энтони, держись, хорошо?	ты уверенный энтони держаться хорошо
Минни, мне нужно в это воспоминание. Перенеси меня, сейчас!	минний нужно это воспоминание перенести я сейчас
Чем хочешь заняться сейчас, Том?	чем хотеть заняться сейчас тот
- Это его дочь, Донна. - Я могу остаться здесь, навечно.	это дочь донна я мочь остаться здесь навечно
Я знаю, где он.	я знать он
Перемещение завершено.	перемещение завершить
Давай же, Том.	давать же тот
Не отключайся.	не отключаться
Добро пожаловать, Том. Чем хочешь заняться?	добро пожаловать тот чем хотеть заняться
Энтони, смотри сюда. Смотри на меня.	энтони смотреть сюда смотреть я
Ну же, Том.	ну же тот
Говори мне что делать.	говорить делать
Пока тебя дождешься.	пока дождаться
До свидания, Том.	до свидание тот
- Сейчас мы тебя вытащим. - Да, моё место не здесь.	сейчас вытащить да мой место здесь
Последний шанс.	последний шанс
Меня зовут Том Джейкобс.	я звать тот джейкобс
Родился 2-ого ноября 1972 года.	родиться 2ий ноябрь 1972 год
Моих родителей зовут Марк и Джудит. Мою жену зовут Эбби.	мой родитель звать марк джудит мой жена звать эбби
Я бы всё отдал чтобы услышать, как она зовёт меня по имени.	я весь отдать услышать звать имя
Мой отец воевал.	мой отец воевать
Он не верил в психологию...	он верить психология
или пост-травматический стресс.	посттравматический стресс
"Он всегда говорил: ""Война это как сходить на пляж..."	он говорить война это сходить пляж
"ты вернешься домой в песке""."	вернуться домой песок
В тот день, ему исполнилось 15.	в день исполниться 15
Рекс. Я так хорошо помню этого пса, буд-то он жил у меня.	рекс я помнить пёс будто жить я
Это был выставочный пес.	это выставочный пёс
Рекс был выставочным псом? О чём это вы?	рекс выставочный пёс о что это вы
Он не поддавался дресировке. Гадил по всему дому. Грыз мебель.	он поддаваться дресировка гадить весь дом грызть мебель
- Вы прямо как мой сын. - О чём вы говорите?	вы прямо сын о что говорить
Я продал его, потому что мне за него хорошо заплатили.	я продать он заплатить
Я сказал Энтони, что он убежал, пока он был в школе.	я сказать энтони убежать пока школа
Если что-то постоянно повторять, ребенок поверит.	если чтоть постоянно повторять ребёнок поверить
Но пес не слушался. Энтони видел это. Я видел это.	но пёс слушаться энтони видеть это я видеть это
Ни черта Энтони не видел. Рекс был прекрасным псом.	ни черта энтони видеть рекс прекрасный пёс
Вы уверены?	вы уверить
А вы уверены?	а уверить
- Я возьму еще бутылочку. Вы будете? - Нет, спасибо.	я взять бутылочка вы быть нет спасибо
- Папа, как мне научить его садиться? - Повторяй команду, Энтони.	папа научить садиться повторять команда энтони
Если что-то постоянно повторять, ребенок поверит.	если чтоть постоянно повторять ребёнок поверить
Энтони, повторяю в сотый раз. Этот пес - тупой.	энтони повторять сто раз этот пёс тупой
Промывание мозгов сложный процесс, но я знаю, как в этом разобраться.	промывание мозги сложный процесс знать разобраться
Что такое промывание мозгов? Гипноз, внушение.	что такой промывание мозги гипноз внушение
Можна ли точно сказать?. Это то, что не сразу бросается в глаза.	можный точно сказать это то сразу бросаться глаз
Возможно, Энтони просто привык к мысли, что пес тупой.	возможно энтони просто привыкнуть мысль пёс тупой
Сидеть! Молодец.	сидеть молодец
Есть тысячи способов манипулировать людьми.	есть тысяча способ манипулировать человек
Это может быть невинный разговор отца с сыном.	это невинный разговор отец сын
Если Энтони поверил в это, то что еще ему могли навязать?	если энтони поверить это мочь навязать
- Полиция навязала ему убийство. - Посмотри что ты наделал. - Я ничего не делал!	полиция навязать убийство посмотреть наделать я делать
- Разочарование отца. - Я даю тебе слово, или мои слова ничего не значат? - Не для меня.	разочарование отец я давать ты слово мой слово значить не я
- Во что он еще мог поверить? - Прости меня.	в мочь поверить простить я
Я не могу быть частью твоей жизни.	я мочь частью твой жизнь
Прости меня.	простить я
Мы получили анонимный звонок, его машину видели на мосту...	мы получить анонимный звонок машина видеть мост
рядом с местом преступления, окого 2-ух часов ночи.	ряд место преступление окий 2ух часы ночь
Вы совершили анонимный звонок?	вы совершить анонимный звонок
- Это вы сдали его, не так ли? - О чём вы говорите?	это сдать он ли о что говорить
Со мной это не пройдёт.	с я это пройти
Вы сдали его полиции, почему?	вы сдать полиция почему
- Теперь это уже не важно. - Для меня это важно.	теперь это важный для это важный
Энтони позвонил вам той ночью. Что он вам сказал?	энтони позвонить тот ночью что сказать
Да, он позвонил мне, но он так бессвязно говорил.	да позвонить я бессвязно говорить
Я решил что это очередная ложь. Наркоманы постоянно лгут.	я решить это очередной ложь наркоман постоянно лгать
- Как вы могли? Это же ваш сын. - Он от рук отбился.	как мочь это ваш сын он рука отбиться
- Вы хотели таким образом защитить себя? - Я защищал его! Куда он котился со своей наркотой.	вы хотеть такой образ защитить себя я защищать он куда котиться свой наркотой
Рано или поздно, его труп нашли бы в придорожной канаве.	рано поздно труп найти придорожный канава
Утром, когда он проснулся, он сказал что не может ничего вспомнить...	утром проснуться сказать вспомнить
И я принял решение... Сдал его полиции.	и принять решение сдать полиция
Я хотел, чтобы он там завязал с наркотой.	я хотеть завязать наркотой
У вас есть дети?	у ребёнок
- Да. - А чтобы вы сделали на моём месте?	да а сделать мой место
Вина страшная вещь. Она преследует нас. Становится одержимостью.	вино страшный вещь она преследовать мы становиться одержимость
Когда у тебя есть выбор, ты можешь получить всё, или ничего...	когда выбор мочь получить весь ничто
или ты можешь измениться.	мочь измениться
Но я думаю в её ситуации, она решила, что у неё нет выбора.	но думать её ситуация решить она выбор
Эксперементальный проект продвигается.	эксперементальный проект продвигаться
А что если люди поверят, что прибор работает?	а человек поверить прибор работать
Не знаю, зачем я хожу сюда. Старые привычки берут своё.	не знать ходить сюда старое привычка брать свой
Я понимаю.	я понимать
Ну как, получилось?	ну как получиться
Иногда... Людям просто хочется услышать знакомый голос.	иногда человек просто хотеться услышать знакомый голос
