cleaned_text	lemm_text
- Минни, перенеси меня на место встречи. - Перемещение.	минний перенести место встреча перемещение
- Так вы его видите? - Пока нет.	так видеть пока нет
- Не пойму, зачем я пришла. - Подождите.	не понять пришлый подождать
Если вы хотели обвести меня вокруг пальца, вам это удалось.	если хотеть обвести вокруг палец это удаться
Дайте мне минуту.	дать минута
Птичка.	птичка
"Он называет вас ""Птичка""."	он называть птичка
Я могу остаться в твоей памяти навсегда.	я мочь остаться твой память навсегда
Хорошо, запиши это.	хорошо записать это
Я здесь, потому что в теле остался чип.	я здесь тело остаться чип
Я предполагаю что он был повреждён, самоликвидация повредила чип.	я предполагать повредить самоликвидация повредить чип
- Но я смотрел, чипа небыло. - Том говорит что он всё еще там.	но смотреть чип небыть тот говорить весь там
- Почему его не определил металодетектор? - Детектор реагирует только на метал.	почему определить металодетектор детектор реагировать метать
В прототипе чип был металический,	в прототип чип металический
а новый из монокристалического кремня, поэтому	новый монокристалический кремень поэтому
его нельзя было обнаружить, в спешке я не перепрошил детектор.	обнаружить спешка перепрошить детектор
Это бы заняло всего пару минут.	это занять пара минута
- В этом нет твоей вины. - И что нам делать?	в твой вина и мы делать
Мы должны извлечь Тома.	мы должный извлечь том
А как нам достать Энтони?	а мы достать энтони
- Это Ричард. - Ричард?	это ричард ричард
- У него есть связи в тюремном управлении. - Господи.	у связь тюремный управление господь
Привет Эбби, это Ричард.	привет эбби это ричард
Послушай, я поговорил с ними.	послушать поговорить они
Он не пойдёт на это.	он пойти это
- Я не смог с ним договориться. - То есть у нас нет вариантов?	я смочь договориться то вариант
- Нет, я говорю тебе что у меня не вышло. - Я не понимаю.	нет говорить ты выйти я понимать
Я тоже в этом заинтерисован. Я всё ему обьяснил.	я заинтерисовать я весь обьяснил
- Господин Кенисон? - Я ничего не могу сделать, простите...	господин кенисон я мочь сделать простить
Поговори с ним, никто бы не стал сражаться за твоего мужа так, как это сделаешь ты.	поговорить он никто стать сражаться твой муж так это сделать ты
Ну, у меня неподалёку есть ранчо.	ну неподалёку ранчо
Я думаю, я бы смог его вывести туда на несколько дней...	я думать смочь вывести туда несколько день
Нужно договориться с охранниками, чтобы они молчали.	нужно договориться охранник молчать
Если бы у меня была мотивация.	если мотивация
Что это значит?	что это значит
Прибор, миссис Джейкобс.	прибор миссис джейкобс
Я хочу чтобы вы передали мне на него все права.	я хотеть передать право
Я понимаю, это сложное решение для вас.	я понимать это сложный решение вы
Тогда вы ничего обо мне не знаете.	тогда о знаете
По рукам.	по рука
Должен признаться...	должный признаться
Нелегко осознавать что за тобой следят.	нелегко осознавать ты следить
Обещай что не будешь много болтать,	обещать быть болтать
в камере иногда становится одиноко, и тогда...	камера становиться одиноко тогда
Не хочу, чтобы люди меня осуждали.	не хотеть человек осуждать
Знаешь... Ненавижу это место.	знаешь ненавидеть это место
Мы можем переместиться в другое воспоминание?	мы мочь переместиться другой воспоминание
- Ну же, бубусик, пойдём купаться. - Ну, я ведь тебя не держу.	ну же бубусик пойти купаться ну дерзить
А ты будешь просто бездельничать?	а быть просто бездельничать
А может мне просто нравится сидеть и смотреть на тебя.	а просто нравиться сидеть смотреть ты
Хорошо, хорошо.	хорошо хорошо
Последний шанс.	последний шанс
Давай, бубусик.	давать бубусик
Залезай. Давай!	залезать давать
Далеко я забрался, да?	далеко забраться да
Хорошее место.	хороший место
Мы 4 месяца,	мы 4 месяц
проводили здесь все выходные.	проводить выходной
Бывал тут раньше?	бывать ранний
Не припоминаю.	не припоминать
Уже не различаю, где твои а где мои воспоминания.	уже различать твой мой воспоминание
Это точно моё.	это точно мой
Это...	это
рай земной.	рай земной
Помнишь, как мы встретились?	помнить встретиться
Ты сказал: Больно не будет.	ты сказать больно быть
Но с тех пор, мне становилось всё хуже.	но тот пора становиться весь худой
Зачем ты изобрёл этот прибор?	зачем изобрести прибор
Я и сам не знаю.	я знать
Я думал он будет помогать людям.	я думать помогать человек
Попадать в прошлое, бороться с проблемами.	попадать прошлое бороться проблема
Сделать наш мир лучше.	сделать наш мир хороший
Смешные мечты, да?	смешной мечта да
Потом я об этом забыл.	потом забыть
И начал думать, что могу на этом заработать.	и начать думать мочь заработать
Сожалеешь?	сожалеть
Каждый день.	каждый день
Прошлого не исправить.	прошлое исправить
Хотя может ты изобретешь прибор, который сможет это сделать?	хотя изобрести прибор который смочь это сделать
Я бы купил себе такой.	я купить такой
Меня заберут завтра вечером.	я забрать завтра вечером
- Заберут меня отсюда. - Рад это слышать.	забрать отсюда рад это слышать
Куда они тебя повезут?	куда повезти
Заберут для проведения процедуры.	забрать проведение процедура
Сказали: Это не больно.	сказать это больно
Всё сделают компьютеры и приборы.	весь сделать компьютер прибор
Так что это закончится ночью, или на следующее утро.	так это закончиться ночью следующий утро
Если что - зовите.	если звать
А потом что?	а что
- Перевезут в другую тюрьму. - Чудесно.	перевезти другой тюрьма чудесно
- Просто чертовски круто. - Парню нужна помощь.	просто чертовски круто парень нужный помощь
Я просил тебя Энтони, не участвовать в этом эксперименте.	я просить энтони участвовать эксперимент
- Я докажу, что я не виновен. - Что, невиновен?	я доказать виновный что невиновный
Ты в ту ночь, сам мне всё рассказал.	ты тот ночь весь рассказать
Может ты забыл, но я то всё помню.	мочь забыть весь помнить
Пап, произошло кое-что ужасное.	папа произойти коечто ужасный
Мне пришлось забирать тебя оттуда.	я прийтись забирать оттуда
Я видел как мой сын лежит в машине, с передозировкой наркотиками.	я видеть сын лежать машина передозировка наркотик
И мне самому пришлось обо всём позаботиться.	и самый прийтись о весь позаботиться
Я ничего не рассказал копам, ради твоего же блага.	я рассказать копа ради твой благо
Для тебя бы всё сложилось хорошо там, где ты находишься сейчас, а теперь тебя отвезут неизвестно куда.	для весь сложиться там находиться сейчас отвезти неизвестно куда
- Но я не подсяду на наркоту снова. - Дерьмо это всё, Энтони.	но подсесть наркот снова дерьмо это весь энтони
Одно неверное движение, и ты снова станешь тем, кем был.	один неверный движение снова стать тем кто быть
Я хочу сделать хоть что-то полезное.	я хотеть сделать чтоть полезный
Ты за всю жизнь не сделал ничего полезного.	ты жизнь сделать полезный
А теперь ты злишься, да?	а злиться да
А я выходит, плохой отец, раз в тебя не верю.	а выходить плохой отец верить
Я спасал твой зад сотни раз, теперь всё, с меня хватит.	я спасать твой зад сотня раз весь хватить
Ты можешь ненавидеть меня, но всё что я делал, я делал для тебя.	ты мочь ненавидеть я весь делать делать ты
- Ты до сих пор думаешь, что невиновен? - Да.	ты сей пора думать невиновный да
Докажи это.	доказать это
Черт.	черта
Он был прав.	он право
Что это?	что это
Мне нужно настроить детектор. У каждого чипа, своя частота.	я нужно настроить детектор у каждый чип свой частота
Я пошлю сигнал и определю частоту, и тогда мы поймаем сигнал Тома.	я послать сигнал определить частота поймать сигнал том
Ты укажешь нам на то воспоминание, в котором находится Том,	ты указать мы воспоминание который находиться тот
а ему скажешь:	сказать
пусть остается в одном месте. Мы пропустим информацию через консоль,	пусть оставаться один место мы пропустить информация консоль
вернём Тома в его тело, и дело сделано.	вернуть том тело дело сделать
- Это сработает? - Я считаю,	это сработать я считать
что это наш единственный шанс. - Сколько времени займёт?	это наш единственный шанс сколько время занять
Через час начнём, думаю процесс займёт не более 4-х часов.	через час начать думать процесс занять 4х часы
Вообще-то, это может занять больше времени.	вообщеть это занять время
- Ты о чём? - Я нужен вам.	ты что я нужный вы
Я попрошу Тома об услуге, он должен видеть это.	я попросить том услуга должный видеть это
Том, я помог тебе во многом, не так ли?	тот помочь ты многое ли
Мне кое-что нужно от тебя.	я коечто нужно ты
Помоги мне вспомнить что произошло в ночь убийства.	помочь вспомнить произойти ночь убийство
Я видел что произошло, ты убил свою подружку.	я видеть произойти убить подружка
Это копы вбили мне в голову, там был кто-то еще той ночью.	это копа вбить голова ктоть тот ночью
Я хочу доказать что они ошибаются.	я хотеть доказать ошибаться
- У нас нет на это времени. - Так найдите время!	у это время так найти время
Я хочу чтобы он понял чего я хочу, пусть скажет сделает ли он это.	я хотеть понять хотеть пусть сказать сделать это
Том...	тот
Я буду ждать твоего ответа.	я быть ждать твой ответ
Ты соврал. Ты что, никогда меня не отпустишь?	ты соврать ты что отпустить
- Ты убил её, тебе этого мало? - Я делал ужасные вещи, но я не убийца.	ты убить её ты мало я делать ужасный вещий убийца
- С чего ты это взял? - Но она порвала с тобой, ты был под кайфом и наверное зол.	с это взять но порвать ты кайф наверное злой
- Всё то ты знаешь! - Ты видишь действия, но не эмоции.	весь знаешь ты видеть действие эмоция
Для тебя это как книжка с картинками. Ты не знаешь, что она для меня значила.	для это книжка картинка ты знаешь значить
Ты меня не обманешь, Энтони. Я видел как ты принимал наркотики.	ты обмануть энтони я видеть принимать наркотик
Я видел как ты кололся, как ты бухал, как ты угрожал людям.	я видеть колоться бухать угрожать человек
У каждого есть скелет в шкафу.	у каждый скелет шкаф
Ты знаешь мою историю, но ты не знаешь меня. Зато я себя знаю!	ты знаешь мой история знаешь я зато знать
И кто же ты? Человек с которым я сейчас говорю,	и ты человек который говорить
или человек который колет себе наркотики?	человек который колет наркотик
Копы думают что ты убил её, твой отец думает что ты убил её, и я так думаю.	копа думать убить её твой отец думать убить её думать
Думаешь мы все ошибаемся? И доказательства ошибаются?	думать ошибаться и доказательство ошибаться
Ты это сделал, Энтони. В чём твоя проблема?	ты это сделать энтони в что твой проблема
Проблема в том, что той ночью произошло кое-что еще.	проблема тот тот ночью произойти коечто ещё
Там был еще один человек, я хочу узнать, кто это был.	там человек хотеть узнать это быть
В погоне за воспоминаниями нету смысла.	в погон воспоминание нету смысл
Я проведу тебя, я всё помню.	я провести ты весь помнить
Даже если там еще кто-то был, факт в том, что ты в неё выстрелил.	даже ктоть быть факт тот она выстрелить
Не случайно, и не в порядке самообороны.	не случайно порядок самооборона
- Есть ли смысл выяснять детали? - Для меня, есть.	есть смысл выяснять деталь для я есть
Пусть это будет ценой за твою свободу, Том.	пусть это цена твой свобода тот
Я думал, я имею дело с достойным мужчиной.	я думать иметь дело достойный мужчина
Все совершают ошибки.	весь совершать ошибка
Для таких как ты, я подопытный кролик...	для такой ты подопытный кролик
но ты сделаешь, то что я скажу. Я твоя единственная надежда отсюда выбраться.	сделать сказать я твой единственный надежда отсюда выбраться
У нас есть время до утра.	у время утро
Хочешь, чтобы я помог тебе? Помоги сначала мне.	хотеть помочь ты помочь сначала я
Эбби, у нас небольшая задержка. Не волнуйся.	эбби небольшой задержка не волноваться
- Том уже там? - Да, его привезли час тому назад.	тот там да привезти час тот назад
Хорошо. Я сообщу тебе, когда у нас что-нибудь прояснится.	хорошо я сообщить ты чтонибыть проясниться
Итак, начнём.	итак начать
Расскажи мне про Адриану.	рассказать адриан
Всё что помнишь.	весь помнить
Мы были вместе 2 года.	мы вместе 2 год
Порой с ней было нелегко.	порой нелегко
Семейные проблемы. В 16 попытка суицида.	семейный проблема в 16 попытка суицид
Я... Подсадил её на тяжелые наркотики.	я подсадить её тяжёлый наркотик
Сначала нам было весело.	сначала мы весело
Потом она... Стала для меня всем.	потом она стать весь
Потом я притормозил, потому что понял, что мы можем плохо кончить.	потом притормозить понять мочь плохо кончить
Но она не смогла остановиться.	но смочь остановиться
Я испробовал разные способы, но не смог ей помочь.	я испробовать разный способ смочь помочь
И в один миг, она ушла от меня, не объяснив почему.	и миг уйти я объяснить почему
Она не отвечала на звонки.	она отвечать звонок
И я... Сьехал с катушек.	и я сьехать катушка
А потом я увидел её уже мертвой.	а увидеть её мёртвый
Я поймал сигнал.	я поймать сигнал
Ждём только вас. Время идёт.	ждать вы время идти
Ты сказал что той ночью произошло еще кое-что?	ты сказать тот ночью произойти коечто
Расскажи мне всё что помнишь.	рассказать весь помнить
Минни, будь готова к переходу.	минний быть готовый переход
Я помню, проснулся в ванной и услышал какой-то шум. Звук бьющегося стекла.	я помнить проснуться ванна услышать какойтый шум звук биться стекло
У меня была баночка таблеток, и пистолет Адрианы.	у баночка таблетка пистолет адриана
Болела голова. Я не знаю как долго был без сознания...	болеть голова я знать долго сознание
Незнакомое место.	незнакомый место
Я помню, были картины на комоде.	я помнить картина комод
В гостинной был диван и телевизор. Не помню что шло.	в гостинный диван телевизор не помнить идти
Этажерка, часы. Я что-то услышал. И отключился.	этажерка часы я чтоть услышать и отключиться
Пробел.	пробел
Я даже не помню как вытащил пистолет.	я помнить вытащить пистолет
Минни, ищи нападающего.	минний искать нападать
Манекен.	манекен
Кругом одни условные обозначения. Только 5% истинных воспоминаний. Нет контекста.	кругом один условный обозначение только 5 истинный воспоминание нет контекст
- Ты не помнишь кто это был, и что было вокруг?. - Но воспоминание настоящее?	ты помнить это быть вокруг но воспоминание настоящее
- Да. - Значит ты должен докопаться.	да значит должный докопаться
Встретимся там.	встретиться там
- Смотри внимательно. - Я уже 3 раза смотрел.	смотреть внимательно я 3 раз смотреть
Кругом одни макеты, журналы и нападающий. Мы зашли в тупик, чего ты еще от меня хочешь?	кругом один макет журнал нападать мы заслать тупик хотеть
Что ты прикажешь мне делать?	что приказать делать
- Я ничего не говорил о журналах. - И что?	я говорить журнал и что
Они есть в твоей памяти, просто ты не помнишь, что это были за журналы.	они твой память просто помнить это журнал
