cleaned_text	lemm_text
Чинаски!	чинаск
Поди сюда!	поди сюда
- У тебя водительские права есть? - Да.	у водительский право есть да
У нас водитель заболел. И есть срочные заказы. Тебе надо будет их доставить.	у водитель заболеть и срочный заказ ты доставить
Эй, Чи...!	эй чи
Что, плохо тебе?	что плохо ты
Бывало и лучше.	бывать хороший
Да я походу проспал больше, чем ты прожил.	да поход проспать большой прожить
Чинаски, ты уволен.	чинаск уволить
Есть свободные комнаты?	есть свободный комната
- 150 баксов в неделю. - Хорошо.	150 бакс неделя хорошо
- Вы работаете? - Работаю на себя.	вы работать работать себя
- Могу я поинтересоваться, что вы делаете? - Я писатель.	мочь поинтересоваться делать я писатель
Книги пишите?	книга писать
Ну, я еще не созрел для романа... пока что.	ну созрелый роман пока что
ОК.	ок
Большинство людей думает, что они умеют водить. Но на самом деле, умеют водить очень немногие.	большинство человек думать уметь водить но самый дело уметь водить очень немногий
Они умеют лишь управлять.	они уметь лишь управлять
Каждый день я вижу 2-3 человек, проезжающих на красный свет так, будто он и не существует.	каждый день видеть 23 человек проезжать красный свет так существовать
Образ жизни, который эти люди ведут, сводит их с ума, безумие отражается и на их езде.	образ жизнь который человек вести сводить ум безумие отражаться езда
Я здесь не для того, чтобы учить вас жить. Я здесь для того, чтобы научить вас водить.	я тот учить жить я тот научить водить
В каком случае человек может потерять контроль над машиной?	в какой случай человек потерять контроль машина
Когда у него стоит?	когда стоить
Если вы не можете вести машину, когда у вас стоит, вы нам не подойдете.	если мочь вести машина стоить мы подойти
Некоторые из наших лучших водителей могут ездить со стояком дни и ночи напролет.	некоторый наш хороший водитель мочь ездить стояк день ночь напролёт
Итак, когда человек может потерять контроль над машиной и не сможет его восстановить?	итак человек потерять контроль машина смочь восстановить
Да, Чинаски?	да чинаск
Человек может потерять контроль над машиной, когда он чихает.	человек потерять контроль машина чихать
Правильно.	правильно
Что вы делаете, когда чихаете?	что делать чихать
- Вы Генри Чинаски? - Да сэр.	вы генри чинаск да сэр
Идите за мной	идти я
Садитесь.	садиться
Мы вас проверили, Чинаски.	мы проверить чинаск
У вас 18 арестов за нарушение общественного порядка. И один за езду в пьяном виде.	у 18 арест нарушение общественный порядок и езда пьяный вид
- За езду в пьяном виде было два. - Вы сообщили нам ложные сведения. Вы нам не подходите.	за езда пьяный вид два вы сообщить мы ложный сведение вы мы подходить
Вы мне такси не вызовите?	вы такси вызвать
Пока мы живем мы постоянно попадаем во всякие ловушки.	пока жить постоянно попадать всякий ловушка
И писательство может стать ловушкой.	и писательство стать ловушка
Некоторые писатели склонны писать лишь о том, что понравилось их читателям.	некоторый писатель склонный писать лишь тот понравиться читатель
Если они слышат положительные отзывы, то верят в них.	если слышать положительный отзыв верить они
Для сочинительства есть лишь один суд в последней инстанции - сам писатель.	для сочинительство лишь суд последний инстанция писатель
Если он прогибается под критиков, издателей, читателей, то ему конец.	если прогибаться критик издатель читатель конец
И, само собой, если он прогибается под своей известностью...	и сам себя прогибаться свой известность
...то его можно смело спускать в унитаз вместе с говном.	то сметь спускать унитаз вместе говно
- Писатель? - Да.	писатель да
- Вы уверены? - Нет.	вы уверить нет
Почему вы хотите работать на фабрике солений?	почему хотеть работать фабрика соление
- Мне это бабушку напоминает. - Правда?	я это бабушка напоминать правда
Она меня всегда угощала соленьями, когда я к ней в гости приходил.	она угощать соление гость приходить
- А что вы пишите? - В основном рассказы.	а писать в основное рассказ
- Я на полпути к роману. - О чем он будет?	я полпути роман о быть
- Обо всем. - То есть, например, о раке?	о весь то есть например рак
Да.	да
А как насчет моей жены?	а насчёт мой жена
И про нее тоже будет.	и быть
Я писал 3-4 рассказа в неделю.	я писать 34 рассказ неделя
И отправлял по почте. Представляю, как нью-йоркские редакторы на них реагировали.	и отправлять почта представлять ньюйоркский редактор реагировать
Слышь, опять этот дурак рассказ прислал!	слышь дурак рассказ прислать
Большинство из них я отсылал Джону Мартину, чей журнал, Блэк Спэрроу, я высоко ценил.	большинство отсылать джон мартин чей журнал блэк спэрроу высоко ценить
Чинаски? Вы не зайдете на минуту?	чинаск вы зайти минута
Мистер Джентри тоже писатель.	мистер джентри писатель
Я сказал ему, что вы были писателем и он захотел с вами познакомиться. Вы не против?	я сказать он писатель захотеть вы познакомиться вы против
Я не против.	я против
Мистер Джентри мой друг.	мистер джентри друг
Вы не возражаете, если я пойду?	вы возражать пойти
ОК.	ок
Та сцена в офисе не выходила у меня из головы. Сигары, дорогая одежда...	тот сцена офис выходить голов сигара дорогой одежда
Я думал о высоких ставках.	я думать высокий ставка
О долгих поездках по извилистым подъездным дорожкам, ведущим к великолепным домам.	о долгий поездка извилистый подъездный дорожка ведущий великолепный дом
О беззаботности. Поездках в Европу.	о беззаботность поездка европа
Красивых женщинах.	красивый женщина
Чинаски, ты куда собрался? Иди работай, смена еще не кончилась.	чинаск собраться идти работать смена кончиться
- Мне надо выпить. - Нет, нет. Нельзя. Иди работай.	я выпить нет нет нельзя идти работать
Вон туда.	вон туда
Отвали!	отвалить
Эй!	эй
- Ты как? - Нормально.	ты как нормальный
Мне здесь такой не нужен!	я нужный
Потом я встретил Джен.	потом встретить джена
Я угостил ее выпивкой, а она дала мне свой телефон.	я угостить выпивка дать свой телефон
Через три дня я переехал в ее квартиру.	через день переехать квартира
У Джен была машина за 500 долларов.	у джена машина 500 доллар
Прикол был в том, как включить фары.	прикол тот включить фара
Хотя у нас и было преимущество в виде сломанных рессор.	хотя преимущество вид сломать рессора
Джен превосходно еблась.	джена превосходно еблася
Пизда у нее была узкой. И на хер она реагировала как на нож, которым ее режут.	пизда узкий и хер реагировать нож который резать
Вот бы узнать, сколько сейчас времени!	вот узнать сколько время
Ты сказал, что починишь часы.	ты сказать починить часы
Ладно, посмотрим...	ладный посмотреть
Вчера в полночь мы ставили время по телевизору.	вчера полночь ставить время телевизор
Известно, что часы спешат на 35 минут в час.	известно часы спешить 35 минута час
На них сейчас 19:30. Но это не так, потому что еще не стемнело.	на 1930 но это так стемнеть
Значит, семь с половиной часов.	значит семь половина часы
Семь раз по 35 минут...	семь 35 минута
Получается 245 минут.	получаться 245 минута
Половина от 35 это...	половина 35 это
17 с половиной.	17 половина
Что в итоге дает нам...	что итог давать мы
252 с половиной минуты.	252 половина минута
Значит мы должны перевести их на 4 часа и 42 с половиной минуты.	значит должный перевести 4 час 42 половина минута
Так что часы мы ставим на 5:47. Вот так.	так часы ставить 547 вот так
Сейчас 5:47.	сейчас 547
Время ужинать, а у нас есть нечего.	время ужинать нечего
Давай еще бутылку вина откроем. Хочешь я блины сделаю?	давать бутылка вино открыть хотеть блин сделать
Не знаю даже, смогу я съесть еще хоть один блин.	не знать даже смочь съесть блин
Окей, блины так блины.	окей блин блин
Мы так и не купили масло.	мы купить масло
- Ну, жарь их тогда опять насухую. - Хрустящие получатся. Очень хрустящие.	ну жарить насухой хрустеть получиться очень хрустеть
Да и ладно, детка.	да ладный детка
Что это?	что это
Что там?	что там
Есть кто-нибудь?	есть ктонибыть
Все на выход!	весь выход
Да это пожарные.	да это пожарный
Наконец мне удалось устроится на склад велозапчастей.	наконец удаться устроиться склад велозапчасть
Чтобы меня взяли, мне пришлось унижаться.	чтобы взять прийтись унижаться
Я сказал им, что работа для меня - все равно что второй дом.	я сказать имя работа равно два дом
На скачки ходишь?	на скачка ходить
Угу.	угу
Ты не против, если я посмотрю?	ты против посмотреть
Смотри.	смотреть
- На Парнягу Бобби ставки не высокие. - Я знаю. Он ведь даже не в фаворитах.	на парняга бобби ставка высокий я знать он фаворит
- Оно и лучше. - И какие ты думаешь у него шансы?	оно хороший и какой думать шанс
Думаю 9 к 2.	думать 9 2
- Во сколько стартует последний забег? - В 5:30.	в сколько стартовать последний забег в 530
- А мы заканчиваем в 5:00. - Вряд ли успеем.	а заканчивать 500 вряд успеть
Но попробовать-то можно. Ипподром тут рядом.	но попробоватьто можно ипподром ряд
- Поедешь со мной? - Не вопрос.	поехать я не вопрос
Следи за часами. Подрываемся без пяти пять.	следить часами подрываться пять пять
Видишь, я тебе говорил что успеем!	видеть ты говорить успеть
200$ на выигрыш Парняги Бобби.	200 выигрыш парняга бобби
Парняги Бобби впереди всех. Он лидирует!	парняга бобби впереди весь он лидировать
Мы имеем дело с победителем!	мы иметь дело победитель
Если только какой-нибудь толстожопый спринтер из отстающих не прорвется.	если какойнибудь толстожопый спринтер отставать прорваться
Давай, давай Бобби!	давать давать бобби
- Да! - Надо было еще 200$ на него поставить.	да надо 200 поставить
Пойдем, выпьем по рюмашке.	пойти выпить рюмашка
На следующий день кое-кто из ребят на работе попросил сделать ставки за них.	на следующий день коекто ребята работа попросить сделать ставка они
Хэнк, мы должны сделать за них ставки.	хэнк должный сделать ставка
Мэнни, у этих парней нет денег.	мэнни этот парный деньга
Есть только мелочь, которую им жены выдают на кофе и бубле-гум.	есть мелочь который жена выдавать кофе бублегум
У нас и поважнее есть дела, чем торчать у окна с 2-х долларовыми ставками.	у важный дело торчать окно 2х долларовый ставка
А мы не будем ставить их деньги, мы будем их забирать себе.	а быть ставить деньга быть забирать себя
- А если они поставят на победителя? - Не поставят.	а поставить победитель не поставить
Они постоянно ставят не на ту лошадь.	они постоянно ставить тот лошадь
А если они поставят на нашу лошадь?	а поставить наш лошадь
Значит мы будем знать, что выбрали не ту лошадь.	значит быть знать выбрать тот лошадь
По-моему она прорвется.	помоему прорваться
Беги, Спитфайр!	бежать спитфайра
Да! Молодчина!	да молодчина
- Ты женат, Мэнни? - Ни за что.	ты женатый мэнни ни что
- Женщины бывают? - Иногда.	женщина бывать иногда
- Но надолго не задерживаются. - В чем причина?	но надолго задерживаться в причина
Женщины, они как работа с полной занятостью. Приходится выбирать, чем заниматься.	женщина работа полный занятость приходиться выбирать заниматься
- Да, сильная эмоциональная нагрузка. - Физическая тоже.	да сильный эмоциональный нагрузка физический тоже
Хотят чтоб их ебали днями напролет.	хотеть ебали днями напролёт
Ну, а ты найди такую, которую тебе ебать приятно.	ну найти такой который ты ебать приятно
Можно, но если ты пьешь и играешь, они думают, что тебе плевать на их любовь.	можно пить играть думать ты плевать любовь
Найди такую, которой нравится пить, играть и ебаться.	найти такой который нравиться пить играть ебаться
Да кому нужна такая?	да кома нужный такой
Я купил себе дорогой костюм и хорошие ботинки.	я купить дорогой костюм хороший ботинок
Владелец склада велозапчпстей уже не казался таким могущественным.	владелец склад велозапчпстея казаться такой могущественный
Мы с Мэнни стали задерживаться на обеде...	мы мэнни стать задерживаться обед
...и возвращались, куря хорошие сигары. Новая жизнь плохо вязалась с Джен.	и возвращаться курить хороший сигара новый жизнь плохо вязаться джена
Она привыкла к ебле по четыре раза в день и привыкла видеть меня бедным и зашуганным.	она привыкнуть ебло четыре раз день привыкнуть видеть бедный зашугать
Мистер Конный игрун!	мистер конный игрун
Великий мистер Конный игрун!	великий мистер конный игрун
Когда мы познакомились, мне нравилось смотреть, как ты ходишь по комнате.	когда познакомиться нравиться смотреть ходить комната
Ты не просто ходил, ты как будто мог пройти сквозь стену, будто ты хозяин, будто тебе все по фигу.	ты просто ходить мочь пройти сквозь стен хозяин ты фига
А теперь у тебя в кармане появилось несколько баксов, и ты стал другим.	а карман появиться несколько бакс стать другой
Ведешь себя, как будущий дантист, или водопроводчик.	вести себя будущий дантист водопроводчик
Не надо мне в уши ссать о водопроводчиках, Джен.	не ухо ссать водопроводчик джена
- Мы две недели не занимались любовью. - Любовь может принимать разные формы.	мы два неделя заниматься любовь любовь принимать разный форма
Ты две недели не ебал меня.	ты два неделя ебал я
Имей терпение. Через полгода поедем отдыхать в Рим, или в Париж.	иметь терпение через полгода поехать отдыхать рим париж
Посмотри на себя! Налил себе хорошего виски, а я тут эту сивуху пью.	посмотреть себя налить хороший висок сивуха пить
- Великолепный мистер Конный игрун! - Я тебе отдал душу.	великолепный мистер конный игрун я ты отдать душить
Я дал тебе мудрость и свет и музыку и даже смех!	я дать ты мудрость свет музыка смех
Между прочим, я величайший в мире игрок на тотализаторе.	между прочить великий мир игрок тотализатор
Говно ты лошадиное!	говно лошадиный
Нет, игрок на тотализаторе!	нет игрок тотализатор
Я осознал - чтобы быть великим любовником, надо иметь много свободного времени.	я осознать великое любовник иметь свободный время
Я был лучшим ебарем, будучи бездельником, чем трудясь от звонка до звонка.	я хороший ебарем быть бездельник трудиться звонок звонок
- Всегда хотела там побывать. - Отличное место, серьезно.	всегда хотеть побывать отличный место серьёзно
Знаешь, я хотел сиз тебя женщину сделать, а ты просто обычная блядь!	знаешь хотеть сизый женщина сделать просто обычный блядь
Если кто-то против того, что я сделал, только скажите!	если ктоть против тот сделать сказать
Садитесь, Чинаски. Вы уже знаете, что мы собираемся с вами распрощаться.	садиться чинаск вы знаете собираться вы распрощаться
- Да, все начальники предсказуемы. - Вы уже целый месяц разгильдяйствуете.	да начальник предсказуемый вы целый месяц разгильдяйствовать
- Да я тут жопу рвал, а вы это даже не цените! - Вы не рвали тут жопу, Чинаски!	да жопа рвать это ценить вы рвать жопа чинаск
Я отдаю вам свое время. Это все, что у меня есть.	я отдавать свой время это весь есть
За несчастные 6 долларов в час.	за несчастный 6 доллар час
