cleaned_text	lemm_text
Макиавелли! Ты не поведал мне ничего нового!	макиавелли ты поведать новое
Сюн Тзю, Исскуство Войны.	сюн тзю исскуство война
Стьюи, эти книги не для малышей. Вот. Посмотри телепузиков.	стьюй книга малыш вот посмотреть телепузиковы
Да как ты смеешь! Эта книга могла дать мне ключ к порабощению человечества.	да сметь этот книга мочь дать ключ порабощение человечество
Ух ты.	ух ты
Боже. Чем больше я сопротивляюсь, тем сильнее меня затягивает. Не могу оторваться!	бог чем сопротивляться сильный затягивать не мочь оторваться
<i>Ещё! Ещё!</i>	iещё ещёi
Да! Да! Ещё! Ещё! Боже, ну ещё разочек!	да да ещё ещё бог ещё разочек
Извини, Стьюи.	извинить стьюй
"Сейчас покажут биографию участника группы ""Wham."""	сейчас показать биография участник группа wham
Я свободен! Свободен от чар этих дьявольских телепузиков!	я свободный свободный чара этот дьявольский телепузиковы
Благодарю тебя. Когда я овладею миром, твоя смерть будет быстрой и безболезненной.	благодарить ты когда овладеть мир твой смерть быстрый безболезненный
Минутку внимания.	минутка внимание
Завтра бейсбольная тренировка. Нужно подготовиться к субботнему матчу.	завтра бейсбольный тренировка нужно подготовиться субботний матч
Уже забыли, как в прошлом году нас унизили Патакетские Шутники?	уже забыть прошлое год унизить патакетский шутник
Только взгляните на этих тупых очкариков.	только взглянуть этот тупой очкарик
Блин, как же я их ненавижу.	блин ненавидеть
"Сильнее, чем шпинат, пробки, и последнего сезона ""Госпиталя МЭШ"""	сильный шпинат пробка последний сезон госпиталь мэш
Ну, когда Алан Альда вышел на передний план...	ну алан альда выйти передний план
и шоу стало драматичным и поучительным?	шоу стать драматичный поучительный
Я прав? Вы согласны?	я право вы согласный
В этом году мы нанесём Шутникам поражение, с помошью нашего секретного оружия:	в год нанести шутник поражение помошить наш секретный оружие
Гильермо.	гильермо
Браво!	бравый
Я нанял Гильермо, так как верю, что он станет козырем нашей компании...	я нанять гильермо верить стать козырь наш компания
как на поле, так и на фабрике.	пол фабрика
У вас впечатляющие рекомендации.	у впечатляющий рекомендация
Уверен, для вас найдётся местечко.	уверенный найтись местечко
Теперь за работу.	теперь работа
Мистер Уид, у меня отличная идея для новой линии кукол по мотивам телешоу.	мистер уид отличный идея новый линия кукла мотив телешоу
"Трансформеры ""Правда Жизни"", как вам? Вот, полюбуйтесь."	трансформера правда жизнь вы вот полюбоваться
Изящная, как пуговка...	изящный пуговка
тучная, как корова...	тучный корова
радиоактивный скорпион. Осторожнее, миссис Гаретт. Идёт Блэр.	радиоактивный скорпион осторожный миссис гаретта идти блэр
- Я рассмотрю. - Он рассмотрит!	я рассмотреть он рассмотреть
"А ещё я сделаю, где Натали превращается в одну из ящеров из ""Юрского Парка."""	а ещё сделать натали превращаться один ящер юрский парк
"Пэт, я назову фразу целиком. ""Иди в сад."""	пэт назвать фраза целиком идти сад
Правильно.	правильно
Что-ж, ты почти угадал, Пап.	чтожий угадать папа
"Да уж. Даже и не верится, что мы не угадали про ""Волосатую мышонку."""	да уж даже вериться угадать волосатый мышонок
Пошли, Брайан. Мне на тренеровку по бейсболу.	послать брайан я тренеровка бейсбол
Тренировка? Я думала, что мы пойдем поприветствовать своих новых соседей.	тренировка я думать пойти поприветствовать свой новый сосед
Ну уж нет. Не хочу иметь ничего общего с соседями.	ну нет не хотеть иметь общий сосед
Наш прошлый сосед одолжил у меня тостер. Больше я его не видел.	наш прошлый сосед одолжить тостер большой видеть
Раз эта шлюха хочет полной опеки над детьми, она её получит.	раз этот шлюха хотеть полный опека ребёнок её получить
Питер, а вдруг они и вправду очень милые люди.	питер вправду очень милый человек
"""Очень милыми людьми."" Да, они всегда так говорят."	очень милый человек да говорят
А потом ты открываешь сточный колодец и... Бац! Город Живых Мертвецов!	а открывать сточный колодец и бац город живой мертвец
Извращенец!	извращенец
Не льсти себе, детка. У меня нет потовых желез.	не льстить себя детка у потовой железо
Итак, пора за игру, мои мальчики.	итак пора игра мой мальчик
Твой выход Гильермо.	твой выход гильермо
К сожалению, Джонсон сегодня отсутствует. Его жена рожает.	к сожаление джонсон сегодня отсутствовать он жена рожать
Что? Это он на сносях чтоли? Я буду подавать.	что это сноси чтоль я быть подавать
Даже и не знаю, что более сомнительно, твоя подача или верность Билла Клинтона.	даже знать сомнительно твой подача верность билл клинтон
Чего тут слож...	что сложа
Чего тут сложного, мячик кинуть?	что сложный мячик кинуть
- Хорошо. Беги на базу. - Кто-нибудь, позвоните в скорую.	хорошо бежать база ктонибыть позвонить скорый
Скажите им, что у него аллергия на пенициллин и белое вино!	сказать имя аллергия пенициллин белый вино
Идиот! Если не найдёшь замену Гильермо, будешь уволен!	идиот если найти замена гильермо быть уволить
Блин. Что, если меня уволят? Придётся возвращаться на старую работу...	блин что уволить прийтись возвращаться старый работа
топ моделью к Кельвину Кляйну.	топ модель кельвин кляйн
<i>Я не хочу быть как все.</i>	iя хотеть всеi
<i>Но я не хочу быть другой.</i>	iно хотеть другойi
<i>Я просто хочу быть.</i>	iя просто хотеть бытьi
"<i>Как же звали того злодея из ""Трона""?</i>"	iкак звать злодей тронаi
<i>Это сводит меня с ума!</i>	iэтый сводить умаi
Переезд - настоящее стихийное бедствие.	переезд настоящее стихийный бедствие
Мы пропустим ежегодный пробег в Провиденсе.	мы пропустить ежегодный пробег провиденсе
Но, так как у нас второй на подходе, Джо решил, что пора сменить обстановку.	но два подход джо решить пора сменить обстановка
А я не могу отказать Джо. Ни в чём.	а мочь отказать джо ни что
В Куахоге тоже скучать не приходится.	в куахог скучать приходиться
На прошлой неделе, один лишился глаза при игре в Бинго.	на прошлый неделя лишиться глаз игра бинго
L-17. Вот чёрт.	l17 вот чёрт
Сотню лет в него не играла!	сотня год играть
Молчать! С тех пор, как познакомились, трещите как две тупые сороки!	молчать с тот пора познакомиться трещать два тупой сорока
Я должен сбежать из этого пекла.	я должный сбежать пекло
Какой любознательный.	какой любознательный
Да. Он очень смышлёный.	да он очень смышлёный
Сейчас я был бы рад очутиться на месте ребёнка Чарльза Линдберга.	сейчас рад очутиться место ребёнок чарльз линдберг
Джо, знакомься, наша новая соседка, Лоис Гриффин	джо знакомиться наш новый соседка лоис гриффина
Очень приятно, Лоис. А это что за малышок?	очень приятно лоис а это малышок
Это Стьюи. Золотце, поприветствуй мистера Свонсона.	это стьюй золотце поприветствовать мистер свонсон
На колени.	на колено
Привет. Меня зовут Мег. Я живу по соседству.	привет я звать мег я жить соседство
Знаю. Я давно любуюсь тобой издалека.	знать я давно любоваться ты издалёка
- Будешь со мной встречаться? - С удовольствием.	быть я встречаться с удовольствие
- Да он голубой. - Размечтался!	да голуба размечтаться
Убирайся отсюда, вонючка!	убираться отсюда вонючка
Я считай что уволен.	я считать уволить
Где, чёрт возьми, я раздобуду такого же здоровяка, как Гильермо?	где чёрт взять раздобыть такой здоровяк гильермо
Недавно захожу в раздевалку, а он там самого мистера Уида завалил.	недавно заходить раздевалка самый мистер уида завалить
Ну вот, отлично. Лоис уже прицепилась к новым соседям.	ну вот отлично лоис прицепиться новый сосед
- Она хочет тебя с ними познакомить. - Вечно она меня тянет в общество.	она хотеть они познакомить вечно тянуть общество
Вечеринки, школьные собрания, озеленение Иерусалима.	вечеринка школьный собрание озеленение иерусалим
Что? Да я всего-то сказал, что еврея от араба нипочём не отличу.	что да всеготь сказать еврей араб нипочём отличить
- А вы, должно быть, Питер. Джо Свонсон. - Да, да. Приятно познакомиться, Фил.	а вы должный быть питер джо свонсон да да приятно познакомиться фил
Кстати, на другой стороне улицы у вас тоже есть соседи.	кстати сторона улица сосед
Так что не обязательно доставать меня.	так обязательно доставать я
Буду иметь ввиду. Слушай, а у тебя отвёртки, случайно, не найдётся?	быть иметь ввиду слушай отвёртка случайно найтись
Блин, да вы, соседи, хуже заразы. Начинается с отвёртки.	блин вы сосед худой зараза начинаться отвёртка
А потом не успеешь опомниться, вы уже пользуетесь моим супермаркетом...	а успеть опомниться пользоваться мой супермаркет
моей химчисткой и даже моим почтальоном.	мой химчистка мой почтальон
"Ты только послушай. ""Отвёртки не найдётся?"""	ты послушать отвёртка найтись
Каков нахал.	каков нахал
- Ты уже нашёл игрока на замену? - Нет. Поверь, я искал.	ты найти игрок замена нет поверь искать
Хидео-сан почтёт за честь играть за вашу команду.	хидеосан почесть честь играть ваш команда
Но он хотел бы поинтересоваться, каким будет вознаграждение.	но хотеть поинтересоваться какой вознаграждение
Моя любить тебя долго.	мой любить долго
Боже, я бы рад помочь. Да мне пора пойти в зал...	бог рад помочь да пора пойти зал
да хвост пожевать.	хвост пожевать
Питер, я пригласила Джо и Бонни на ваш субботний матч.	питер пригласить джо бонний ваш субботний матч
Лоис, я не хочу их видеть.	лоис хотеть видеть
Вот поэтому, я и прошу тебя выражать все свои пожелания в письменном виде.	вот поэтому просить выражать свой пожелание письменный вид
Бонни сказала, что Джо большой фанат бейсбола. Он даже играл в колледже.	бонний сказать джо большой фанат бейсбол он играть колледж
Играл говоришь?	играть говорить
Добро пожаловать в наш квартал.	добро пожаловать наш квартал
Привет, Джо.	привет джо
- Питер! - Можешь не вставать.	питер мочь вставать
Какой сюрприз. А я то думал, ты меня невзлюбил.	какой сюрприз а думать невзлюбить
Почему? Это из-за того, что я сказал днём. Нет.	почему это изз тот сказать днём нет
Видишь ли, у меня болезнь такая, слова сами изо рта вылетают.	видеть ли болезнь такой слово сам из рот вылетать
Иди к чёрту! Ой. Вот, видишь, о чём я?	идти чёрт ой вот видеть что я
Извини, виноват.	извинить виноватый
Я думал, что перегнул палку, попросив у тебя отвёртку.	я думать перегнуть палка попросить отвёртка
Ты шутишь? Можешь просить всё, что захочешь.	ты шутить мочь просить весь захотеть
Отлично. У тебя, случаем, нет проволоки, картину повесить?	отлично у ты случаем проволока картина повесить
Проволоки? Каков сукин сын.	проволока каков сукин сын
Сукин сын! Сукин сын! Ну вот, опять.	сукин сын сукин сын ну вот опять
Не хочу тебя обременять.	не хотеть обременять
Да нет проблем. Для этого и нужны соседи. А знаешь, для чего ещё?	да проблема для нужный сосед а знаешь ещё
Чтобы сыграть за нашу бейсбольную команду в эту Субботу.	чтобы сыграть наш бейсбольный команда суббота
- Ну как, сосед? - Звучит забавно.	ну как сосед звучать забавно
Самое забавное, что это незаконно как нарушение авторских прав.	самый забавный это незаконно нарушение авторский право
Увидимся на матче, Джо.	увидеться матч джо
<i>Патакетские Шутники Куахогские Кукольники</i>	iпатакетский шутник куахогский кукольникиi
- Хочешь жевачку? - Спасибо.	хотеть жевачка спасибо
- Это была жевачка с сюрпризом. - В смысле?	это жевачка сюрприз в смысл
Она с героином.	она героин
У меня озноб.	у озноб
Эй, Питер!	эй питер
Приятно видеть здесь твою семью, Питер.	приятно видеть твой семь питер
Если твой чемпион сейчас не появится, ты сможешь уделять им всё свободное время...	если твой чемпион появиться смочь уделять весь свободный время
дома.	дом
Он придёт, мистер Уид. Вам стоит увидеть его в действии.	он прийти мистер уид вы стоить увидеть действие
Может отбивать, может подавать... Питер!	мочь отбивать подавать питер
Зачем ему инвалидная коляска?	зачем инвалидный коляска
Срань Господня! Он сраный калека!	срань господний он сраный калека
Питер, наше новое секретное оружие - этот привлекательный паралитик?	питер наш новое секретный оружие привлекательный паралитик
Так, Джо, подловил ты меня. Вставай и сияй. Давай.	так джо подловить я вставать сиять давать
- Поднимайся и покажи им. Вставай. - А ты остряк, Питер.	подниматься показать имя вставать а остряк питер
- Мяч в игре! - За работу!	мяч игра за работа
Клянусь, я и не предполагал. Может, они не станут на него подавать.	клясться предполагать мочь стать подавать
Я прикрываю центр.	я прикрывать центр
Грузчики весь ковёр запачкали.	грузчик весь ковёр запачкать
- Я уже всё перепробовала. Не отходит. - А как насчёт лимонного сока?	я весь перепробовать не отходить а насчёт лимонный сок
- А если попробовать газировкой? - А что, если попробовать заткнуться?	а попробовать газировка а что попробовать заткнуться
Бейсбол - отличная игра, да?	бейсбол отличный игра да
Говорят, бейсбол - наша национальная забава.	говорят бейсбол наш национальный забава
Я не люблю солёного.	я любить солёный
Чёрт! Не подавайте на Джо. Пожалуйста, не подавайте на Джо!	чёрт не подавать джо пожалуйста подавать джо
Аут!	аут
Так держать, Джо! Пора отработать своё парковочное место!	так держать джо пора отработать свой парковочный место
Вот так! Ты видела такое?	вот так ты видеть такой
- Это мой Джо! - Какого чёрта?	это джо какой чёрт
Полу-человек, полу-машина.	получеловек полумашина
Обладая такой технологией, я мог бы сбежать от этих ведьм!	обладать технология мочь сбежать этот ведьма
Давай, киборг!	давать киборг
Теперь всё возложено на его широкие, мускулистые плечи!	теперь весь возложить широкий мускулистый плечо
Давай, Джо!	давать джо
Вот так, Джо! Давай! Да!	вот так джо давать да
Быстрее! Джо! Вот так!	быстрый джо вот так
Слава Джо!	слава джо
Да, слава тому, кто его нашёл! Ура!	да слава тот найти ура
Ладно.	ладный
Просто пальчики оближешь, не так ли? По старому полицейскому рецепту.	просто пальчик облизать ли по старое полицейский рецепт
Угощайтесь. Сегодня не только у моей жены будет свинья под боком.	угощаться сегодня мой жена свинья боком
Джо, ты такой забавный.	джо забавный
В участке тоже всем нравится.	в участок весь нравиться
Отстой, Брайан. Джо украл мою славу.	отстой брайан джо украсть мой слава
Эй, народ! Самая пора для лимбо!	эй народ самый пора лимбо
- Стоит признать. Он - душа компании. - Да?	стоить признать он душить компания да
Я покажу им, кто тут действительная душа компании.	я показать имя действительный душить компания
Эй, смотрите! Я упал в бассейн прямо в одежде!	эй смотреть я упасть бассейн прямо одежда
Разве не забавно? Вот он какой, Питер Гриффин. Ребята?	разве забавно вот какой питер гриффина ребята
Ребята?	ребята
- Вот такая у меня идея. - Питер, иди сюда.	вот такой идея питер идти сюда
Ну наконец-то. Признание.	ну наконецтый признание
