cleaned_text	lemm_text
Съедаешь последний кусок пиццы, чтобы мы из-за него не подрались.	съедать последний кусок пицца изз подраться
Да, папочка. Не отколи ты такой штуки...	да папочка не отколоть штука
Я бы не нашла подход к Кевину.	я найти подход кевин
А когда мои школьные друзья увидят нас по телеку...	а мой школьный друг увидеть телек
"они подумают, что ты - просто псих. И я смогу сказать: ""Этот псих - мой отец!"""	подумать просто псих и смочь сказать этот псих отец
А я бы никогда не выйграла серебряную медаль в Нагано, если бы вы не подвозили...	а выйграло серебряный медаль нагано подвозить
меня на каток каждое утро.	каток каждый утро
Похоже, быть героем - не всегда значит, спасать чьи-то жизни и ловить бандитов.	похоже герой значит спасать чьитый жизнь ловить бандит
Это значит в нужную минуту быть рядом с людьми, которых ты любишь.	это значит нужный минута ряд человек который любить
На помощь! Кто-то только-что украл мою сумочку!	на помощь ктоть толькочто украсть мой сумочка
А нам то что? Мы вас впервые видим.	а мы что мы впервые видеть
Перевод: NiFiGaSeBe! nifigasebe@gmail.com	перевод nifigasebe nifigasebegmailcom
