cleaned_text	lemm_text
Сукин с...! Чёрт!	сукин с чёрт
Крайтон.	крайтон
- Что ты ломаешь на этот раз? - Я ничего не ломаю.	что ломать раз я ломать
Пытаюсь разобраться, в кавычках,	пытаться разобраться кавычка
как работает наша навигационная, в кавычках, система.	работать наш навигационный кавычка система
Не уделишь мне микрот?	не уделить микрот
Сейчас нет времени, Чи.	сейчас время чи
Крайтон, мне...	крайтон я
мне, правда, нужно с тобой поговорить.	я правда нужно ты поговорить
Чи!	чи
У меня, правда, нет времени.	у я правда время
У тебя нет времени?	у время
Хорошо.	хорошо
Ах ты сукин...	ах сукин
Нет.	нет
Нерри.	нерри
Эта маленькая тралк!	этот маленький тралк
Айрин, мы не уверены, что это Чиана угнала твой Праулер.	айрин уверить это чиана угнать твой праулера
Но ведь он исчез, Крайтон.	но исчезнуть крайтон
Я не сразу заметил её вылет, в этот момент некоторые системы слежения были отключены.	я сразу заметить её вылет момент некоторый система слежение отключить
Она могла улететь на многие тысячи метрасов.	она мочь улететь многие тысяча метрас
Вот, что мы нашли в Ремонтном Отсеке. На нём следы крови Чианы.	вот найти ремонтный отсек на он след кровь чианы
- Что это? - Я думаю, это диск жизни.	что это я думать это диск жизнь
Их имплантируют некоторым видам.	они имплантировать некоторые вид
Они создают постоянную энергетическую связь между близкими существами.	они создавать постоянный энергетический связь близкие существо
- Но почему она его вынула? - Он не работает.	но почему вынуть он работать
Это значит, что тот, с кем Чиана была связана	это значит тот кто чиана связать
мёртв.	мёртвый
О, Боже. Она ведь хотела со мной поговорить, а я её отшил.	о бог она хотеть я поговорить её отшить
Ничего.	ничто
Ты бывала в местах и похуже.	ты бывать место худой
Кто здесь? Хватит прятаться!	кто здесь хватить прятаться
Покажись!	показаться
Какая милая никса.	какой милый никс
Давайте ее заберем.	давать забрать
Меня зовут Джон Крайтон, я - астронавт	я звать джон крайтон астронавт
столкнувшись с волной излучения, я попал в червоточину	столкнуться волна излучение попасть червоточина
и теперь я застрял на дальнем краю Вселенной, на корабле	застрять дальний край вселенная корабль
живом корабле, со странными формами жизни.	живой корабль странный форма жизнь
Помогите мне! Пожалуйста!	помочь я пожалуйста
Меня кто-нибудь слышит?	я ктонибыть слышать
За мной охотится безумный военачальник	за я охотиться безумный военачальник
я делаю всё, что могу	делать весь мочь
я просто ищу дорогу домой.	просто искать дорога домой
УХОД В СКАЛУ	уход в скал
Неужели вся эта планета покрыта могилами?	неужели весь этот планет покрыть могила
Это - Королевское планетарное кладбище.	это королевский планетарный кладбище
Ты никогда таких не видел?	ты такой видеть
Нет.	нет
Чиана!	чиана
А где вы хороните своих вождей на Зеле?	а хоронить свой вождь зеле
Зарываем в землю.	зарывать земля
Чиана!	чиана
Там же, где живут остальные? Отвратительно!	там же жить остальной отвратительный
Я проверила Праулер, он в порядке.	я проверить праулера порядок
По крайней мере, она смогла его посадить.	по крайний мера смочь посадить
Поехали. Воспользуемся транспортом.	поехать воспользоваться транспорт
Нет. Это вещи Чианы.	нет это вещий чианы
Вы идёте?	вы идти
Идем.	идти
О чём это вы?	о что это вы
Я никуда не пойду.	я никуда пойти
Я остаюсь здесь!	я оставаться здесь
Да ради Бога.	да ради бог
Только не грабь могилы, Спарки!	только грабить могила спарка
Как ты смеешь предполагать, что	как сметь предполагать
Хайнирский Доминар будет...	хайнирский доминар быть
Йотца!	йотец
Тебе это ничего не напоминает?	ты это напоминать
Ну, конечно, напоминает, все эти туннели выглядят одинаково.	ну конечно напоминать туннель выглядеть одинаково
Мы заблудились?	мы заблудиться
Что они с ней делают?	что делать
- Понятия не имею. - Ты видишь у них оружие?	понятие иметь ты видеть оружие
Нет. Я спасу Чиану.	нет я спас чиана
А я займусь остальными.	а заняться остальной
- Всем, лечь на землю, сейчас же! - Чиана!	весь лечь земля же чиана
Давай!	давать
Что вы делаете?	что делать
Никто не мог продержаться на этой штуке больше пятидесяти микротов!	никто мочь продержаться штука пятьдесят микротов
Я побила рекорд!	я побить рекорд
На твоем месте, я бы этого не делала.	на твой место делать
С какой стати вы притащились за мной?	с стать притащиться я
Мы за тебя волновались, поэтому мы...	мы волноваться поэтому мы
Как это мило! А сейчас проваливайте к фреллу!	как это мило а проваливать фрелла
- Чиана... - Нет, Крайтон.	чиана нет крайтон
Теперь у меня нет времени.	теперь время
Эй, старец.	эй старец
Кому, чёрт возьми, ты это говоришь?	кома чёрт взять это говорить
И кто ты такой?	и такой
Молнон.	молнона
Попробуешь?	попробовать
Взгляните на неё!	взглянуть она
Ты поразила Вину!	ты поразить вина
Морщины, трупные пятна.	морщина трупный пятно
- Ты пришла из прошлого, никса. - Из прошлого?	ты пришлый прошлое никс из прошлое
Идемте, гарды, они жутко измотаны.	идти гарда жутко измотать
Старики.	старик
Ты что-нибудь поняла?	ты чтонибыть понять
"Не много, лишь то, что я ""измотана"" до дрена."	не много лишь то измотать дрен
Если найдёшь Чиану, спроси - что это?	если найти чиана спросить это
Спроси её сам.	спросить её сам
Айрин,	айрин
она на меня злится.	злиться
И постарайся не слишком ругать ее за Праулер.	и постараться слишком ругать праулера
Будь с ней мила.	быть мила
Это мне удается с трудом.	это удаваться труд
Ну, хотя бы не пристрели её.	ну хотя пристрелить её
Ну, хорошо, Райджел. Расскажи ещё раз.	ну хорошо райджела рассказать ещё раз
Почему ты их бросил?	почему бросить
Я уже говорил! Они первыми меня бросили!	я говорить они один бросить
Пилот потерял контакт с Крайтоном и Айрин несколько арнов назад.	пилот потерять контакт крайтон айрин несколько арновый назад
- Куда они пошли? - Вниз.	куда послать вниз
Под землю.	под земля
Они пошли искать Чиану.	они послать искать чиана
Кажется, Крайтон решил, что она еще жива.	кажется крайтон решить живой
Ах, ты, фреллов Лаксианин!	ах ты фреллов лаксианина
- Что это? - Мои личные вещи.	что это мой личный вещий
Ты разграбил могилы?	ты разграбить могила
И поверь мне, это было не так-то просто.	и поверь я это такто просто
А теперь оставь меня.	а оставить я
Да, так-то лучше.	да такто хороший
Убирайся.	убираться
И на закуску.	и закуска
Что тебе надо?	что ты надо
Ты забыла вот это.	ты забыть это
Это мой брат. Нерри.	это брат нерри
Диск не работает.	диск работать
Значит, он умер.	значит умереть
Мне очень жаль.	я очень жаль
Слушай, давай я покажу тебе эти места.	слушай давать показать ты место
Знаешь, что они делают, если хотят, чтобы ты осталась?	знаешь делать хотеть остаться
Заставляют тебя пробежать через горящие обручи	заставлять пробежать гореть обруч
голой, совсем голой.	голый голый
А после этого, ты отправляешься в акустическую камеру.	а это отправляться акустический камера
Я там только что была. Всё твоё тело начинает вибрировать.	я быть весь твой тело начинать вибрировать
Ты должна попробовать.	ты должный попробовать
По-моему, ты слишком много выпила.	помоему слишком выпить
Не будь такой, как Крайтон.	не быть такой крайтон
Перестань, на Мойе все такие правильные.	перестать мойя такой правильный
Останься со мной.	остаться я
Ты должна остаться.	ты должный остаться
Ну, хотя бы, на сбор.	ну хотя бы сбор
И что это такое?	и это такой
Молнон говорит, что это очень дредово.	молнона говорить это очень дредовый
Обещал, что у меня снесёт крышу.	обещать снести крыша
Эй, парень. Мы раньше не встречались?	эй парень мы ранний встречаться
Слишком поздно.	слишком поздно
О чём ты толкуешь, приятель?	о что толковать приятель
Пропавшие уже знают.	пропасть знать
Эй, эй, сосредоточься. Смотри мне в глаза.	эй эй сосредоточиться смотреть глаз
Дас,	дас
пора прыгать, гарда.	пора прыгать гарда
Появился новый нарл.	появиться новый нарл
Собрались кланы.	собраться клан
Пора отпраздновать!	пора отпраздновать
Раньше, наверху, древние копали Королевские Могилы,	ранний наверху древние копать королевский могила
но места больше нет!	место нет
И Короли ушли.	и король уйти
Теперь мы одни	теперь один
но мы живем!	жить
Кто войдет в скалу?	кто войти скал
- Что за...? - Фрелл.	что за фрелла
Акустическая сеть.	акустический сеть
- Может, объяснишь? - Эта сеть поддерживается гулом голосов.	мочь объяснить этот сеть поддерживаться гулом голос
Миротворцы используют этот прием в тренировочных воздушных боях,	миротворец использовать приём тренировочный воздушный бой
она смягчает падение.	смягчать падение
Я готов.	я готовый
Я же говорил.	я говорить
Фрелл!	фрелла
Дас.	дас
Вошел в скалу!	войти скал
Дред. Я должна это сделать!	дред я должный это сделать
- Чиана. - Оставь её, Крайтон.	чиана оставить её крайтон
Идём.	идти
Знаешь что? Мы приведем её в чувство и немедленно вытащим отсюда!	знаешь что мы привести её чувство немедленно вытащить отсюда
Диск жизни, который мы нашли на борту Мойи, принадлежал её брату.	диск жизнь который найти борт мойя принадлежать её брат
- Значит, он умер? - Да.	значит умереть да
Я думаю, поэтому ей здесь и нравится.	я думать поэтому нравиться
Она пытается доказать, что жизнь продолжается.	она пытаться доказать жизнь продолжаться
Айрин, когда мне понадобится заключение психолога о Чиане, я тебе сообщу.	айрин понадобиться заключение психолог чиана ты сообщить
Если попытаешься увезти ее силой, она останется здесь тебе назло.	если попытаться увезти силой остаться ты назло
Нет. Не останется.	нет не остаться
Не сейчас.	не сейчас
И что они с ним сделают?	и сделать
Вымочат кожу, высушат кости,	вымочить кожа высушить костя
и Дас будет похоронен в куполе сборов.	дас похоронный купол сбор
Только что погиб твой лучший друг!	только погибнуть твой хороший друг
Все умирают, никса.	весь умирать никс
Ты боишься смерти.	ты бояться смерть
Никогда не знаешь, когда это произойдет и как следует поступить.	никогда знаешь это произойти следовать поступить
Страх, никса,	страх никс
он угнетает.	угнетать
Но не нас. Мы живём.	но мы мы жить
Мы делаем, что хотим. Мы свободны, потому что умеем входить в скалу.	мы делать хотеть мы свободный уметь входить скал
Последний смертельный прыжок.	последний смертельный прыжок
Думаю, ты поняла.	думать понять
Останься с нами, никса.	остаться мы никс
Поклонись скале, хотя для меня она на втором месте.	поклониться скал хотя второе место
А что же на первом?	а первое
Заткнись.	заткнуться
Умолкни.	умолкнуть
Не будешь ли ты так любезна заткнуться?	не быть любезный заткнуться
Я делаю это для твоего же блага, Райджел.	я делать это твой благо райджела
Большое спасибо!	большой спасибо
Только делай это где-нибудь в другом месте! Я пытаюсь уснуть!	только делать это гденибыть друг место я пытаться уснуть
А ты не думал, что эти вещи могут быть под защитой?	а думать вещий мочь защита
Под защитой? Чего?	под защита что
Проклятья!	проклятие
Йотц! Мое единственное проклятье это ты!	йотц мой единственный проклятие это ты
В любом случае, если оно и существует,	в любой случай оно существовать
во что я не верю! То коснется только меня!	верить то коснуться я
Да, ты прав.	да право
Вина.	вино
Мне очень жаль Даса.	я очень жаль дас
О, не жалей его, никса.	о жалеть он никс
Может, не стоит пить?	мочь стоить пить
Попробуешь?	попробовать
А о чём ты говорила с Чианой на скале?	а что говорить чиана скал
Когда появится Нарл, Чиана хочет прыгнуть.	когда появиться нарл чиана хотеть прыгнуть
Я её благословила.	я её благословить
Чиана, у тебя есть микрот?	чиана микрот
Для тебя, нет.	для ты нет
Ну, хорошо. Знаешь, что?	ну хорошо знаешь что
Прости меня, я все понял, прости что я не выслушал тебя на корабле,	простить я понять простить выслушать корабль
Хорошо?	хорошо
Крайтон! Я оказалась здесь не из-за тебя.	крайтон я оказаться изз ты
Хочу напомнить, я тебе не дочь,	хотеть напомнить ты дочь
и не твоя сестра, я всего лишь твоя	твой сестра лишь твой
твоя тралк, да и то лишь во сне!	твой тралк лишь сон
Так что, прошу	так что просить
пожалуйста! Улетай!	пожалуйста улетать
Я пытаюсь помочь.	я пытаться помочь
Мне не нужна твоя помощь.	я нужный твой помощь
Мне здесь нравится.	я нравиться
Нравятся эти люди.	нравиться человек
Чиана, ты же видишь, они не понимают, что творят!	чиана видеть понимать творить
Они словно обкуренные обезьяны, прыгают в пропасть!	они словно обкурить обезьяна прыгать пропасть
Тогда скажи мне, чем так фреллово замечательна наша жизнь на Мойе!	тогда сказать я фрелловый замечательный наш жизнь мойя
Скажи.	сказать
Они перед смертью успевают пожить в свое удовольствие, Крайтон.	они смерть успевать пожить свой удовольствие крайтон
Я тоже этого хочу.	я хотеть
Ты говорил	ты говорить
я в любой момент, когда пожелаю, могу покинуть корабль.	люба момент пожелать мочь покинуть корабль
Уйти, когда захочу.	уйти захотеть
Что ж,	что ж
счастливо.	счастливо
Можешь прыгать, когда захочешь.	мочь прыгать захотеть
Чиана сделала свой выбор, Джон.	чиана сделать свой выбор джон
Прекрасно.	прекрасно
Просто здорово, Айрин.	просто здорово айрин
Надеюсь, если я решу прыгнуть под автобус,	надеяться решить прыгнуть автобус
ты окажешься рядом.	оказаться ряд
Вина сказала, ты вступаешь в клан.	вино сказать вступать клан
Ты действительно хочешь прыгнуть?	ты действительно хотеть прыгнуть
Может быть.	мочь быть
Молнон!	молнона
Эй, Боб Марли, ты не видел Молнона?	эй боб марля видеть молнона
Забудь. Я сам его найду.	забыть я найти
Молнон.	молнона
Нет, пожалуйста, не надо!	нет пожалуйста надо
Я ошибся. Прости.	я ошибиться простить
Я не хотел причинить тебе боль.	я хотеть причинить ты боль
Ты за мной следишь,	ты я следить
почему?	почему
Ты стар.	ты старый
И ты всё равно живешь!	и весь равно жить
Как тебя зовут?	как звать
Джанникс.	джанникс
Что с тобой случилось?	что ты случиться
Это случается со всеми, кто живет двадцать два цикла,	это случается весь жить двадцать цикл
и не уходит в скалу.	уходить скал
Гарды и никсы не хотят этого видеть.	гарда никс хотеть видеть
Поэтому мы уходим, прячемся.	поэтому уходить прятаться
Пропадаем.	пропадать
Пропадаете? Ты одна из пропавших?	пропадать ты один пропасть
Дас говорил, что знает, почему так происходит.	дас говорить знать почему происходить
Он сказал, скала даст ответ.	он сказать скал дать ответ
О чём ты?	о что ты
Я пропавшая. Я должна ею остаться.	я пропасть я должный она остаться
Ты, должно быть, уже прожил двадцать два цикла, а?	ты должный быть прожить двадцать цикл а
Твой конец близок, войдешь ты в скалу или нет.	твой конец близкий войти скал нет
Ты говорил с пропавшими.	ты говорить пропасть
Ты и в правду умён.	ты правда умный
