cleaned_text	lemm_text
Ты видел ее лицо? Она ведь не понимала, что с ней происходит.	ты видеть лицо она понимать происходить
- Я говорил тебе - плохо все это. - Я знала участника эксперимента.	я говорить ты плохо это я знать участник эксперимент
Честно?	честно
- Как зовут? - Этих имен нет в твоем списке.	как звать этот имя твой список
Извини, я их и людьми-то не считал.	извинить людьмитый считать
Я хотела помочь им, найти для них способ излечения, или еще что-то.	я хотеть помочь имя найти способ излечение чтоть
Поэтому тебе нужны эти записи?	поэтому ты нужный запись
И как же ты сможешь помочь им?	и смочь помочь имя
Сразу после знакомства с записями красный криптонит не открыть.	сразу знакомство запись красный криптонит открыть
Какой еще красный криптонит?	какой красный криптонит
Зеленый криптонит убивает Супермена, красный - лишает его силы.	зелёный криптонит убивать супермен красный лишать сила
Это золотой криптонит. А красный делает странные штуки -	это золотой криптонит а красный делать странный штука
он может раздвоить Супермена и превратить его в младенца.	раздвоить супермен превратить младенец
Тебе нравится Супермен?	ты нравиться супермен
Больше люблю Бэтмена.	большой любить бэтмена
Серьезно? Почему?	серьёзно почему
Потому что он обыкновенный парень.	потому обыкновенный парень
И потому что в Темном Рыцаре он побеждает Супермена.	и тёмный рыцарь побеждать супермен
Это точно.	это точно
Не знаю, пригодится ли это тебе,	не знать пригодиться это ты
но у меня есть не только фильм, но еще и досье с документами.	фильм досье документ
Если хочешь, можешь ознакомиться с ними.	если хотеть мочь ознакомиться они
Это Гил. Передайте Рейберду, что дело Конант закрыто.	это гил передать рейберда дело конант закрытый
С запиской не получилось, но к самоубийству не придраться.	с записка получиться самоубийство придраться
Почему бы и нет? Проверьте ее дело.	почему нет проверить дело
У нее уже были две неудачные попытки. А третья вышла на славу.	у два неудачный попытка а три выйти слава
Ай, да котик.	ай котик
Нашла что-то полезное?	найти чтоть полезный
Да нет, вроде.	да нет вроде
Это к делу не относится.	это дело относиться
Это твой отец?	это твой отец
- Здорово выглядит. - Он фотогеничный.	здорово выглядеть он фотогеничный
Он умер?	он умереть
Пока, вроде, жив.	пока вроде живой
Чем он тебе не угодил?	чем ты угодить
- Тебя интересует мой отец? - Еще как. Что между вами произошло?	ты интересовать отец ещё как что вы произойти
Ничего особенного.	ничто особенный
"Что значит ""ничего особенного""?"	что значит ничто особенный
Его и отцом-то не назовешь.	он отцомтый назвать
Он изменял маме, потом ушел. На нас с братом вообще внимания не обращал.	он изменять мама уйти на брат вообще внимание обращать
Ничего особенного.	ничто особенный
Сколько тебе было лет?	сколько ты год
Когда он ушел от нас?	когда уйти мы
Девять.	девять
Так что, в основном ты рос без отца.	так что основное расти отец
- В основном - да. - Фотографии - обманчивая штука.	в основное да фотография обманчивый штука
Вроде, вы близки, а ты его ненавидишь.	вроде близкий ненавидеть
Ненависть тут не при чем. Я не могу простить его.	ненависть чем я мочь простить он
- Я не хотела. - Ты не виновата.	я хотеть ты виноватый
Все равно - извини.	весь равно извинить
А в футбол ты все играешь?	а футбол играть
В школе я занимался кроссом.	в школа заниматься кросс
У меня и награды есть.	у награда есть
Чего ты смеешься?	что смеяться
Иди ко мне.	идти к я
- Мне пора. - Как?	я пора как
Мы можем прекратить, если хочешь.	мы мочь прекратить хотеть
Что ты делаешь?	что делать
- Я что-то не то сделал? - Я не могу.	я чтоть сделать я мочь
Погоди минутку. Не уходи.	погодить минутка не уходить
Скажи, что произошло?	сказать произойти
Прошу, не трогай меня. Ты хороший. Я не хочу причинить тебе боль.	просить трогать я ты хороший я хотеть причинить ты боль
О чем ты?	о ты
Извини, что разбудил. Это Винсент Сфорца.	извинить разбудить это винсент сфорец
Я нашел Чарлин Макги.	я найти чарлин макг
Погоди, не пере...	погодить перо
Правда?	правда
Соедините меня с ним.	соединить он
Здравствуйте. Это Джон Рейнберд.	здравствовать это джон рейнбёрдо
Поздравляю. Я слышал, ваше упорство принесло плоды.	поздравлять я слышать ваш упорство принести плод
Вы верите в судьбу?	вы верить судьба
Нет, сэр, я верю в движение наличности.	нет сэр верить движение наличность
Интересно, во что верит Винсент Сфорца?	интересно верить винсент сфорец
- Расскажите мне о нем. - Перед вами его личное дело.	рассказать немой перед вы личный дело
Ему можно доверять?	он доверять
Он честен.	он честный
Я не совсем это имею в виду.	я это иметь вид
"Я сказал ему привести Чарлин Макги, ""убедить"" ее прийти сюда."	я сказать привести чарлин макг убедить прийти сюда
До начала операции осталось мало времени.	до начало операция остаться мало время
Если он знает, где она, надо направить к ней людей, чтобы они разобрались.	если знать она направить человек разобраться
"С Чарли невозможно ""разобраться""."	с чарли невозможно разобраться
Если вы думаете, что он убедит ее...	если думать убедить она
Он считает, что пытается помочь ей.	он считать пытаться помочь она
Обманывать легко, когда правда не известна.	обманывать легко правда известный
Это я. Нам надо поговорить.	это я мы поговорить
Уходи прочь.	уходить прочь
Я знаю, кто ты.	я знать ты
Ты - Чарлин Макги.	ты чарлин макг
Открой же!	открыть же
Можно войти?	можно войти
Классный огнетушитель.	классный огнетушитель
Вполне в духе Энди Уорхолла.	вполне дух энди уорхолл
Ты уезжаешь?	ты уезжать
Послушай, в моей компании работают ведущие ученые.	послушать мой компания работать ведущий учёный
Если ты с ними встретишься, они точно тебе помогут.	если они встретиться точно ты помочь
Я сама о себе позабочусь.	я сам позаботиться
Ты не можешь просто взять и убежать.	ты мочь просто взять убежать
Ты видел фильм.	ты видеть фильм
- Ну и что? - Я убила двух человек.	ну что я убить два человек
- Вот, что. - Но они пытались обидеть тебя, да?	вот что но пытаться обидеть ты да
- Они исполняли свой долг. - Но тебе было десять лет!	они исполнять свой долг но ты десять год
Тебя не осудят за убийство.	ты осудить убийство
Речь не о суде. Меня хотят использовать.	речь суд я хотеть использовать
- Тогда давай я передам тебе деньги... - Не трогай меня!	тогда давать передать ты деньга не трогать я
Испугался, да? Это хорошо.	испугаться да это хорошо
- Подожди. - Отстань от меня.	подождать отстать я
- Я пытаюсь помочь тебе. - Зачем?	я пытаться помочь ты зачем
Мне знакомо чувство, когда некому доверять. Становится одиноко.	я знакомый чувство некого доверять становиться одиноко
Все, кто помогал мне, умерли по моей вине.	весь помогать я умереть мой вина
Что ты знаешь об одиночестве!	что знаешь одиночество
Ладно. Ты победила.	ладный ты победить
У этих ученых может быть то лекарство, которое ты ищешь.	у этот учёный лекарство который искать
У людей из твоей компании?	у человек твой компания
И ты думаешь, я им поверю?	и думать поверить
Разве у тебя есть выбор?	разве выбор
Надеешься в одиночку найти средство?	надеяться одиночка найти средство
Тебе предоставляется возможность.	ты предоставляться возможность
Золотой криптонит?	золотой криптонит
Я не оставлю тебя ни на секунду.	я оставить секунда
Все будет происходить только так, как ты того захочешь.	весь происходить так захотеть
Подумай об этом, прошу тебя.	подумать это просить ты
Обязательно подумай.	обязательно подумать
- Она придет. - Поздравляю вас.	она прийти поздравлять вы
- Отличная работа. - Спасибо.	отличный работа спасибо
Я бы хотел присутствовать на первой встрече с ней.	я хотеть присутствовать один встреча она
- Вот как? - Я пообещал встретить ее.	вот как я пообещать встретить она
У нее была тяжелая жизнь. Она не доверяет людям.	у тяжёлый жизнь она доверять человек
- А вам она доверяет? - Да.	а доверять да
Дело в том, что у нас этим занимаются специально обученные психологи,	дело тот это заниматься специально обученный психолог
они работают по особой методике.	работать особа методика
- Можно поговорить с ними? - Надо Ричардсона искать.	можно поговорить они надо ричардсон искать
Так что, не отвлекайтесь, ладно?	так что отвлекаться ладный
Да, пока я не забыл. Кто восстановил вам видео-файл?	да пока забыть кто восстановить видеофайл
Мой брат.	мой брат
Отличная работа. Хорошо, что мы в курсе.	отличный работа хорошо курс
Спасибо.	спасибо
Кто у тебя в списке? Ты им деньги выплачиваешь?	кто список ты деньга выплачивать
Нет, это делаю не я. Я их разыскиваю.	нет это делать я я разыскивать
Значит, ты ничего не знаешь.	значит знаешь
ИМЯ НЕ НАЙДЕНО	имя не найти
Как это, имя не найдено? Я его сам туда внес.	как это имя найти я туда внести
Это Винсент.	это винсент
Привет! Говорят, ты нашел Макги. Молодчина!	привет говорят найти макг молодчина
Спасибо. Послушай, я тут решил немного счетами заняться.	спасибо послушать решить немного счёт заняться
Ты в бухгалтерии не числишься.	ты бухгалтерия числиться
Это точно. Но я не могу найти ни один из платежей.	это точно но мочь найти платёж
Есть несколько счетов, которые мы используем для выплат,	есть несколько счёт который использовать выплата
и мы особо не афишируем этот групповой иск.	особо афишировать групповой иск
Ни на одного человека, которого я нашел, ничего нет.	ни один человек который найти нет
Им заплатили. Обо всем уже позаботились.	имя заплатить о весь позаботиться
Больше вопросов нет? Не волнуйся об этом.	большой вопрос нет не волноваться это
Есть жертвы по моей части?	есть жертва мой часть
МЕДИЦИНСКИЙ ОТЧЕТ. САМОУБИЙСТВО	медицинский отчёт самоубийство
Боже!	бог
ПРИЧИНА СМЕРТИ: АВТОКАТАСТРОФА	причина смерть автокатастрофа
ПАРАЛИЧ СЕРДЦА	паралич сердце
ПРИЧИНА: НАНЕС СЕБЕ ОГНЕСТРЕЛЬНЫЕ РАНЫ	причина нанести себя огнестрельный рана
Да, пока я не забыл. Кто восстановил вам видео-файл?	да пока забыть кто восстановить видеофайл
Генри, немедленно уходи из квартиры.	генри немедленно уходить квартира
- Но я готовлю суп. - Я серьезно. Сваливай.	но готовить суп я серьёзно сваливать
- Что стряслось? - Это из-за фильма. Уходи немедленно!	что стрястись это изз фильм уходить немедленно
"Иначе за мной приедут ""люди в черном""?"	иначе я приехать человек чёрный
Прошу тебя, сматывай.	просить ты сматывать
Я хочу загрузить фильм.	я хотеть загрузить фильм
Оставь фильм в покое. Уходи.	оставить фильм покой уходить
Сюда посторонним въезд воспрещен.	сюда посторонний въезд воспретить
Я - Чарлин Макги. Меня ждут.	я чарлин макг я ждать
Здание 14. Пройдете прямо по городку и налево.	здание 14 пройти прямо городок налево
По городку?	по городок
Сколько лет, сколько зим!	сколько год сколько зима
Совсем взрослой стала.	совсем взрослый стать
Так, пойдем.	так пойти
- Куда? - Разве ты мне не доверяешь?	куда разве доверять
Папочка!	папочка
Что с ним случилось?	что случиться
Ему вкололи наркотики.	он вколоть наркотик
У меня огромные неприятности.	у огромный неприятность
Им известно, что я сильно привязался к тебе, и	имя известно сильно привязаться ты
они знают, что я помогал тебе.	знать помогать ты
И теперь они предоставляют мне самый последний шанс.	и предоставлять самый последний шанс
Какой шанс?	какой шанс
Пойдем.	пойти
Мне и говорить-то об этом неудобно.	я говоритьто неудобно
О чем?	о чем
Они хотят направить твою силу против человека.	они хотеть направить твой сила против человек
Именно так я им и ответил.	именно ответить
Но тогда они сказали, что если ты откажешься, они меня убьют.	но сказать отказаться убить
Поэтому я и привел тебя сюда, чтобы ты посмотрела на своего папу.	поэтому привести сюда посмотреть свой папа
Потому что, если меня не станет, ты больше никогда папу не увидишь.	потому что стать папа увидеть
Извини, что так получилось.	извинить получиться
- Я... - Он лжет. Все, что он говорит - ложь.	я он лгать весь говорить ложь
Это он разлучил нас.	это разлучить мы
Это он приказал убить твою маму.	это приказать убить твой мама
Ну, хватит!	ну хватить
Ты хоть раз смотрел в глаза умирающему человеку?	ты смотреть глаз умирать человек
Можешь попрощаться с ней.	мочь попрощаться она
Погоди!	погодить
Погоди!	погодить
- Я видела, как ты умер. - Ты видела, как я горел. Это больнее.	я видеть умереть ты видеть горелый это больной
Не волнуйся. Я уже давно простил тебя.	не волноваться я давно простить ты
Надеюсь, и ты простила меня.	надеяться простить я
Ты убил моего отца.	ты убить мой отец
Я не хотел его убивать. Просто он хотел умереть и спровоцировал меня.	я хотеть убивать просто хотеть умереть спровоцировать я
И теперь мы с тобой чувствуем себя виноватыми.	и ты чувствовать виноватый
Вы все переиначиваете. Совсем не изменились.	вы переиначивать совсем измениться
Еще как изменился. Я смотрел в глаза умирающим людям,	ещё измениться я смотреть глаз умирать человек
пытаясь найти в этом цель жизни.	пытаться найти цель жизнь
Или бога.	или бог
А от меня что вам надо?	а надо
Ты должна помочь мне заполнить пустоту.	ты должный помочь заполнить пустота
Что?	что
Мне нужен бог, чтоб судил меня, Мне нужен бог, чтоб проклял меня.	я нужный бог судить я я нужный бог проклясть я
Я его себе сам создам.	я создать
Вы хотите создать себе Бога?	вы хотеть создать бог
Ты была лишь первым шагом, но с тех пор мы ушли гораздо дальше.	ты лишь один шагом тот пора уйти гораздо далёкий
Да вы не шутите.	да шутить
Прошу, вернись.	просить вернуться
Вот кому спасибо за столь счастливое воссоединение.	вот кома спасибо столь счастливый воссоединение
Все не так, как ты думаешь.	весь так думать
Привет, дружище.	привет дружище
Я уже поговорил с Джоэлем. Мы предлагаем вам повышение.	я поговорить джоэль мы предлагать повышение
Боже!	бог
Вы понимаете, что угроза огнестрельным оружием работодателю	вы понимать угроза огнестрельный оружие работодатель
это основание для немедленного увольнения?	это основание немедленный увольнение
Что ж, чему быть...	что ж что быть
Ну?	ну
Что - ну?	что ну
Пристрели меня.	пристрелить я
Я и не сомневался.	я сомневаться
Бежим!	бежать
Клянусь, я ничего не знал об этом. Тебе надо...	клясться знать это ты надо
Вон туда.	вон туда
- Это что еще такое? - Я ведь говорил, что она придет.	это такой я говорить прийти
- Заткнись. - Она все знает.	заткнуться она знать
Они такие же, как и я.	они такой же я
- Не надо стрелять. - Никто и не собирается стрелять.	не стрелять никто собираться стрелять
Мы как пришли, так и уйдем.	мы прислать уйти
А я не о чем тебя не прошу.	а просить
Я просто говорю - не стреляй в меня.	я просто говорить стрелять я
Лучше выстрели в себя.	хороший выстрелить себя
Себе в ногу.	себя нога
Очень круто!	очень круто
Честно, я не пронимаю, что за шумиха.	честно пронимать шумиха
