cleaned_text	lemm_text
Я разочарован. Мне даже кажется, что меня надули.	я разочаровать я кажется надуть
- А ты что скажешь? - Точно, надули.	а сказать точно надуть
Что ж, хорошо.	что ж хорошо
Посмотрим, что у тебя есть.	посмотреть есть
У меня ноги загорелись.	у нога загореться
На пол. На колени.	на половина на колено
Не двигаться.	не двигаться
Именно такой я тебя и представлял.	именно представлять
Можешь встать?	мочь встать
Выходите.	выходить
Мы не убьем вас. Мистеру Рейнберду вы нужны живыми.	мы убить вы мистер рейнберда нужный живой
Только без глупостей. Вам не удастся покинуть эту территорию.	только глупость вы удаться покинуть территория
У меня есть план.	у план
Выброси пистолет.	выбросить пистолет
Что?	что
Он тебе не понадобится.	он ты понадобиться
Чудесно.	чудесно
Теперь ложись лицом на пол.	теперь ложиться лицо половина
Это вы лучше убегайте.	это убегать
У тебя это всегда внутри?	у это внутри
Извини, что пришлось смотреть.	извинить прийтись смотреть
Ты и сейчас тоже это делаешь?	ты это делать
Нет, это уже не я.	нет это я
Ты что делаешь?	ты делать
Ты знаешь, что я могу.	ты знаешь мочь
Я не хочу делать тебе больно.	я хотеть делать ты больно
Я это серьезно.	я это серьёзно
Что ты задумал?	что задумать
Не заставляй меня делать это.	не заставлять делать это
Остановись!	остановиться
Что ты наделала?	что наделать
- Пусти. - Еще!	пустить ещё
- Прекрати. - Еще!	прекратить ещё
Не надо!	не надо
Не надо в него стрелять.	не стрелять
Прошу вас.	просить вы
Меняю Чарли на мальчика. Такое условие.	менять чарли мальчик такой условие
- Хорошо. - Скажи ему, чтобы отпустил Чарли.	хорошо сказать он отпустить чарли
Коди.	кодить
Теперь опускай пушку.	теперь опускать пушка
Еще рано.	ещё рано
Вы будете под прицелом, пока Чарли не уйдет отсюда.	вы быть прицел пока чарли уйти отсюда
Хорошо. Музыку здесь заказываешь ты.	хорошо музыка заказывать ты
Уходи отсюда.	уходить отсюда
Иди же!	идти же
Он понятия не имеет, какой интересной сейчас станет его жизнь.	он понятие иметь интересный стать жизнь
Джон все еще жив.	джон живой
- Я знаю. - Ты должна вернуться.	я знать ты должный вернуться
- Почему Джон все еще жив? - Я не знаю.	почему джон живой я знать
Я пообещала папе не делать этого. Я нарушила обещание.	я пообещать папа делать это я нарушить обещание
Милая, погоди. Я была вынуждена.	милый погодить я вынудить
Приходится нарушать обещания. Такова жизнь.	приходиться нарушать обещание таков жизнь
- Жизнь здесь не при чем. - Давай думать.	жизнь чем давать думать
Что мы делаем, когда нам грозит опасность? Мы убегаем.	что делать мы грозить опасность мы убегать
Мы исчезаем. Это - единственный способ выжить.	мы исчезать это единственный способ выжить
Ты обманываешь меня.	ты обманывать я
Мама и папа обманывали. Джон обманывал. А теперь еще и ты.	мама папа обманывать джон обманывать а ты
Все меня обманывают.	весь обманывать
Мы не будем такими. Мы не должны были такими стать.	мы быть такой мы должный такой стать
- Как же нам быть? - Я не знаю.	как мы быть я знать
Нам не спастись от этого.	мы спастись это
Ты знаешь, что тебе надо делать?	ты знаешь ты делать
Тебе надо вернуться.	ты вернуться
- Мисс... - Ты должна вернуться.	мисс ты должный вернуться
Здесь нельзя спать.	здесь спать
Я жду автобус.	я ждать автобус
Какой автобус вы ждете?	какой автобус ждать
На Финикс.	на финикс
- Он прибудет через 20 минут. - Спасибо.	он прибыть 20 минута спасибо
Ты думаешь о Винсенте.	ты думать винсент
"Думаешь ""как быть - сесть в автобус или вернуться к нему?""."	думать как сесть автобус вернуться он
- Извините, это вы мне? - Ответ - вернуться к нему.	извинить это я ответ вернуться он
- Как вы нашли меня? - Я тебе не враг.	как найти я я ты враг
Конечно. Теперь весь мир для меня состоит только из друзей.	конечно теперь весь мир состоять друг
- Откуда вы? Из теплицы Рейнберда? - Тебе все и так известно.	откуда вы из теплица рейнберда ты известно
Если ты знаешь, кто я, тогда тебе известно, что я могу делать.	если знаешь я ты известно мочь делать
Мне это известно.	я это известно
Что вам надо?	что надо
Это сложный вопрос.	это сложный вопрос
А вы начните с начала. И покороче.	а начать начало и короткий
Я был другом твоей семьи.	я друг твой семья
20 лет назад мы с твоими родителями были в исследовании Ванлесса.	20 год назад твой родитель исследование ванлёсс
И после этого наша жизнь изменилась.	и наш жизнь измениться
Ричардсон.	ричардсон
Сэр, произошла жуткая путаница.	сэр произойти жуткий путаница
- И затем... - Она сбежала.	и затем она сбежать
- Что произошло? - Винсент отобрал у меня пистолет.	что произойти винсент отобрать пистолет
- Ему повезло. - Он - бухгалтер.	он повезти он бухгалтер
У него нет доступа на эту территорию.	у доступ территория
- Рейнберд попросил привести его. - Кто тебе платит?	рейнбёрдо попросить привести он кто ты платить
- Вы, сэр. - Именно. Ты работаешь на меня.	вы сэр именно ты работать я
Дело Винсента - найти Ричардсона. А ты это дело закроешь.	дело винсент найти ричардсон а это дело закрыть
- Но я нашел... - Ты нашел Макги. И результат налицо.	но найти ты найти макг и результат налицо
Перевернула все вверх дном, и тебе опять искать ее,	перевернуть вверх дно ты искать она
в результате задержки, новые расходы. Я понятно выражаюсь?	результат задержка новое расход я понятно выражаться
Найди Ричардсона, потому что проект на полном ходу.	найти ричардсон проект полный ход
Пусть бюджет на Лучезарную Бурю превышен, но состоится она вовремя.	пусть бюджет лучезарный буря превысить состояться вовремя
Слушаюсь, сэр.	слушаться сэр
- Как она выглядела? - Ничего особенного.	как выглядеть ничто особенный
- Разве что ботинки его подожгла. - Заткнись.	разве ботинок поджечь заткнуться
- Девочка с огоньком. - Забавно.	девочка огонёк забавно
Я сказал тебе - заткнись. Понял, Эндрю?	я сказать ты заткнуться понять эндрю
С огоньком или без - старовата.	с огонёк староватый
Ты ведь тоже ее видел, да?	ты видеть да
Доброе утро.	добрый утро
Ну и вечерок вчера выдался!	ну вечерок вчера выдаться
Да, удивительный.	да удивительный
Думал, вы иначе выразитесь. Но я понимаю вас.	думать иначе выразиться но понимать вы
Такое нарушение безопасности и менее чем за сутки до начала операции.	такой нарушение безопасность менее сутки начало операция
Но раз вы довольны, то и я доволен.	но довольный довольный
Тише!	тиша
Смотрите на Коди.	смотреть кодить
- А что еще она сделала? - Ничего.	а сделать ничто
- Сладкая на вкус. - Что?	сладкий вкус что
Мальчик ни слова за всю жизнь не произнес, а тут - сразу три.	мальчик слово жизнь произнести сразу три
Ай да Коди! Первое предложение в жизни!	ай кодить первое предложение жизнь
Ты, случаем, не вообразил, что она теперь твоя подруга?	ты случаем вообразить твой подруга
Она не хотела с нами играть. Думаю, это ее и вывело из себя.	она хотеть мы играть думать это вывести себя
С ней было скучно. Верно? Хватит об этом.	с скучно верно хватить это
Она поиграла со мной.	она поиграть я
- Как вы не понимаете! - Что я не понимаю?	как понимать что понимать
Да вы посмотрите на него! Он начинает общаться. Он заинтересован.	да посмотреть он он начинать общаться он заинтересовать
В нем всегда был скрытый потенциал,	в немой скрытый потенциал
но ему не хватало энергии, горючего, чтобы преодолеть перемену.	хватать энергия горючий преодолеть перемена
Зато у Чарли этого горючего для него хоть отбавляй.	зато чарли горючий отбавлять
Какую еще перемену преодолеть?	какой перемена преодолеть
А этого я еще не знаю.	а знать
Что вам было известно о внезапном визите прошлой ночью?	что известно внезапный визит прошлый ночью
Я знаю, насколько важен для вас этот проект, сэр.	я знать насколько важный проект сэр
Я понимаю, что вам необходимо связать все в одно целое.	я понимать необходимый связать один целое
Я очень надеюсь, что Чарлин Макги не отвлечет вас от сути.	я очень надеяться чарлин макг отвлечь суть
Благодарю вас за откровенность.	благодарить откровенность
Спасибо, сэр.	спасибо сэр
Надеюсь, вы понимаете, что я говорю это из глубокого уважения.	надеяться понимать говорить это глубокий уважение
Конечно.	конечно
Что вы намерены делать с Винсентом?	что намерить делать винсент
Вам нравится иметь возможность правомочного отрицания событий?	вы нравиться иметь возможность правомочный отрицание событие
С юридической точки зрения - да.	с юридический точка зрение да
А раз так - не надо задавать мне лишние вопросы.	а задавать лишний вопрос
Вы были близкими друзьями?	вы близкие друг
С Викки дружили все.	с викки дружить весь
У нее был такой заразительный смех.	у заразительный смех
Засмеется - и ее уже не остановишь. Все ее вечно пытались рассмешить.	засмеяться остановить весь вечно пытаться рассмешить
- Похоже, она нравилась вам. - Она меня совсем не замечала.	похоже нравиться вы она замечать
А потом появился Энди. Сразу было видно - они подходят друг другу.	а появиться энди сразу видно подходить друг друг
Викки и Энди.	викки энди
На свидания ходили. Здорово!	на свидание ходить здорово
- Зачем они на это пошли? - На что?	зачем это послать на что
- Лот 6. - $100 были большими деньгами в 1979.	лот 6 100 больший деньга 1979
Но ведь это происходило в институте. Должно быть, надежно?	но это происходить институт должный быть надёжно
Многим из нас... Мы не могли приспособиться к перемене.	многий мы мы мочь приспособиться перемена
Понимаешь, стоит модифицировать пару протеинов, и...	понимать стоить модифицировать пара протеин и
Твои родители были очень сильными, раз они так долго протянули.	твой родитель очень сильный долго протянуть
Но вы же приспособились.	но приспособиться
Я сошел с ума.	я сойти ум
Но вы... вы не похожи на сумасшедшего.	но вы похожий сумасшедший
- Вкусный кофе? - Отдает сигаретами.	вкусный кофе отдавать сигарета
Чем вы занимались все эти 20 лет?	чем заниматься 20 год
- Тебя ждал. - Откуда вы узнали, где я появлюсь?	ты ждать откуда узнать появиться
Я знал, где место нашей встречи.	я знать место наш встреча
- Это не ответ. - Еще какой ответ.	это ответ ещё ответ
Просто это не то, что ты хотела бы услышать.	просто это то хотеть услышать
- Что же, интересно, я хочу услышать? - События, их причина и следствие.	что же интересно хотеть услышать событие причина следствие
Вселенная работает по другим законам. Нет ни прошлого, ни будущего.	вселенная работать другой закон нет прошлое будущее
Только настоящее.	только настоящее
Вы сумасшедший.	вы сумасшедший
А ты вот воспламеняешь предметы.	а воспламенять предмет
Я был как все.	я весь
Шел по жизни спиной вперед,	идти жизнь спина вперёд
видя только то, что осталось позади.	видеть то остаться позади
А потом попал в Лот 6.	а попасть лот 6
И с тех пор вижу все. Прошлое, настоящее и будущее.	и тот пора видеть весь прошлое настоящее будущее
Все вижу.	весь видеть
Все одновременно.	весь одновременно
- Кстати, нам пора. - Почему?	кстати мы пора почему
- Надо сейчас же уходить. - Но почему?	надо уходить но почему
Потому что те, кто тебя ищут, через минуту будут стоять в дверях.	потому тот искать минута быть стоять дверь
- Я не пойду с вами. - Одно дело сказать - другое сделать.	я пойти вы один дело сказать другой сделать
- Почему я должна вам верить? - Ты не должна.	почему должный верить ты должный
Посиди здесь еще минутку, и сама убедишься.	посидеть минутка сам убедиться
Меня зовут Макс.	я звать макс
Хочешь покажу, где щитовидная железа.	хотеть показать щитовидный железо
Спасибо.	спасибо
Вам известно, где вы находитесь?	вы известно находиться
"Вы в дневном воспитательном центе компании ""Системз Оперейшнз""."	вы дневный воспитательный цент компания системза оперейшнза
- И все они? - Необыкновенные?	и они необыкновенный
Да, очень необыкновенные.	да очень необыкновенный
А сейчас я собираюсь произнести два слова,	а собираться произнести слово
и вы мне расскажите все, что вам известно про эти два слова.	рассказать весь известно слово
- Значит, вы видите будущее? - Я его не вижу. Я в нем нахожусь.	значит видеть будущее я видеть я немой находиться
Со мной уже все произошло, и я не могу ничего изменить.	с я произойти мочь изменить
- У всех есть выбор. - У всех есть иллюзия выбора.	у выбор у иллюзия выбор
- Это не одно и то же. - Вы заблуждаетесь.	это один же вы заблуждаться
"Вот как? Зачем ты вернулась в ""Системз Оперейшнз""?"	вот как зачем вернуться системза оперейшнза
- Винсент сказал, что они помогут мне. - И ты поверила ему?	винсент сказать помочь я и поверить он
- Сейчас это уже не имеет значения. - Еще как имеет. Все имеет значение.	сейчас это иметь значение ещё иметь весь иметь значение
Все взаимосвязано. И многое зависит от того, что будет с Винсентом.	весь взаимосвязанный и многий зависеть тот винсент
Что вы имеете в виду?	что иметь вид
Ты убежала. А он остался.	ты убежать а остаться
- Я не просила его что-либо делать. - У него не было выбора.	я просить чтолибо делать у выбор
А у меня, значит, он есть? Я должна спасти его?	а я значит есть я должный спасти он
Значит, я не возвращаюсь за ним?	значит возвращаться он
Возвращаешься.	возвращаться
Винсент умрет, если ты его не спасешь.	винсент умереть спасти
Можно я буду звать тебя Винсентом? А ты меня зови Джоном.	можно быть звать винсент а звать джон
- Что они делают? - Помогают.	что делать помогать
Полный контроль. Можешь остановить все это, когда захочешь.	полный контроль мочь остановить это захотеть
Тебе надо просто побеседовать со мной.	ты просто побеседовать я
Расскажи мне о ней.	рассказать она
У тебя есть ее личное дело. Ты знаешь о ней больше, чем я.	у личный дело ты знаешь большой я
Хочу знать то, чего нет в бумагах.	хотеть знать то бумага
Я хочу знать, какая она.	я хотеть знать она
Я не понимаю.	я понимать
Она по-прежнему закусывает нижнюю губу, когда нервничает?	она попрежний закусывать нижний губа нервничать
Она...	она
Она засыпает, когда ее поглаживают по спине?	она засыпать поглаживать спина
Я хочу все знать о ней.	я хотеть знать она
Понимаешь, я не видел, как она взрослеет.	понимать видеть взрослеть
Где она?	где она
Я не знаю.	я знать
Ей есть куда пойти? У нее есть надежное убежище?	она пойти у надёжный убежище
Я не знаю.	я знать
Клянусь тебе, я не знаю.	клясться ты знать
- И хорошо. Иначе я бы сказал. - Не сомневаюсь.	и хорошо иначе сказать не сомневаться
Пол, спроси его, откуда он узнал о нас.	половина спросить он откуда узнать мы
Вам это уже известно.	вы это известно
У тебя горят глаза.	у гореть глаз
Они плавятся.	они плавиться
Генри, немедленно уходи из квартиры.	генри немедленно уходить квартира
- Но я готовлю суп. - Уходи!	но готовить суп уходить
- Что стряслось? - Это из-за фильма. Уходи немедленно.	что стрястись это изз фильм уходить немедленно
"Иначе за мной приедут ""люди в черном""?"	иначе я приехать человек чёрный
