cleaned_text	lemm_text
Я хочу загрузить фильм. Оставь фильм в покое. Уходи.	я хотеть загрузить фильм оставить фильм покой уходить
- Привет, дружище. - Где мой брат?	привет дружище где брат
У нас есть пленка, у нас есть ты. Так что, обойдемся без брата.	у плёнка ты так что обойтись брат
Никакого группового иска не было.	никакой групповой иск быть
Ты убил всех этих людей.	ты убить этот человек
Ты нашел их для меня.	ты найти я
- Но зачем? - А сам-то ты как думаешь?	но зачем а самтый думать
Нам за это платят.	мы это платить
Закроем с западным регионом Никаких незваных гостей не будет.	закрой западный регион никакой незваный гость быть
- Куда им идти этим гостям? - На Лучезарную Бурю.	куда идти это гость на лучезарный буря
Мне об этом сказал Гил.	я сказать гил
Хорошо. Я тебе уже говорил: Ты под полным контролем.	хорошо я ты говорить ты полный контроль
Мы остановим, только попроси.	мы остановить попросить
Пожалуйста, прекратите.	пожалуйста прекратить
Если тебе удастся спасти его, тогда что?	если ты удаться спасти он что
Кажется, вы тут предсказатель.	кажется предсказатель
Если мне что-то и известно, это не значит, что я понимаю причину.	если чтоть известно это значит понимать причина
Мне казалось, у меня нет выбора.	я казалось выбор
Но ты ведь так не считаешь.	но считать
Откуда мне знать?	откуда знать
Винсенту все обо мне известно, и он не боится.	винсент о известно бояться
Он тебя не боится? Еще как боится!	он бояться ещё бояться
Оставим это.	оставить это
Думаешь, вы с Винсентом будете как твои родители?	думать винсент быть твой родитель
Я просила оставить эту тему. Ладно?	я просить оставить тема ладный
Как бы я хотел, чтобы твоя жизнь складывалась иначе.	как хотеть твой жизнь складываться иначе
Вы вбили себе в голову, что вам все известно. Да?	вы вбить голова известно да
Да, все известно.	да известно
Я страшно устала от всей этой метафизической чепухи.	я страшно устать весь метафизический чепуха
А мне каково знать, что произойдет каждую последующую секунду, день?	а каков знать произойти каждый последующий секунда день
Когда мне дали этот препарат,	когда дать препарат
вся моя жизнь пошла наперекосяк, мне словно пулю пустили в мозг.	весь жизнь пошлый наперекосяк словно пуля пустить мозг
Тебе легче: Ты пожар устроишь.	ты лёгкий ты пожар устроить
Именно это Рейнберду и надо. Я теряю контроль и убиваю - он счастлив.	именно это рейнберда надо я терять контроль убивать счастливый
Я только спасу Винсента, и больше ничего.	я спас винсент ничто
- Как скажешь. - Только не надо этого снисхождения,	как сказать только снисхождение
может, у тебя и нет выбора, только у меня он есть.	мочь выбор есть
Ты потерял сознание. Вот, выпей.	ты потерять сознание вот выпить
Не капризничай, это чистая вода.	не капризничать это чистый вод
Я могу сделать так, что он выпьет.	я мочь сделать так выпить
Не так быстро. Вот, хорошо.	не быстро вот хорошо
Тебе нельзя терять силы. Я хочу, чтобы ты понял - хоть я тебя и пытаю,	ты терять сила я хотеть понять пытать
ты все равно считаешься членом моей команды.	равно считаться член мой команда
- Я не состою в твоей команде. - Еще как состоишь.	я состоять твой команда ещё состоять
Ведь именно ты нашел Чарли. Я же искал ее десять лет.	ведь именно найти чарли я искать десять год
И не нашел. А ты вот взял и нашел.	и найти а взять найти
Я проголодался.	я проголодаться
Но ты на ней не остановился? Сколько препаратов ты испытал?	но остановиться сколько препарат испытать
Лот 7? Лот 8?	лот 7 лот 8
Сколько?	сколько
Тебе лучше знать. Ты же все хвосты отслеживал.	ты знать ты хвост отслеживать
Полагаю, идеальных результатов мы достигли на Лоте 23.	полагать идеальный результат достигнуть лот 23
И эти чудесные молодые люди являют собой успех нашего дела.	и чудесный молодая человек являть себя успех наш дело
Лот 23?	лот 23
Да, мы провели много экспериментов,	да провести эксперимент
но так всегда бывает, когда происходит разработка технологии.	бывать происходить разработка технология
Мы же занимаемся генной последовательностью хромосомы 17.	мы заниматься генный последовательность хромосома 17
Нельзя обращаться с людьми, как с подопытными кроликами.	нельзя обращаться человек подопытный кролик
Мне все можно.	я можно
Я проголодался.	я проголодаться
- Что с ним такое? - Наш мальчик проголодался.	что такой наш мальчик проголодаться
Понимаешь, Коди - потребитель энергии.	понимать кодить потребитель энергия
Он ее поглощает.	он поглощать
Электричество, тепло, жизнь.	электричество тепло жизнь
- Жизнь? - Что как не жизнь есть энергия?	жизнь что жизнь энергия
Он поглощает жизнь. Питается ей.	он поглощать жизнь питаться она
Кое-кто еще обладает схожей силой, но тебе о ней все и так известно.	коекто обладать схожий силой ты известно
Как я научил ее всему.	как научить весь
И как она потом бросила меня. Да что уж там...	и бросить я да там
Вот почему я теперь работаю только с мальчиками.	вот почему работать мальчик
Вы только посмотрите на это!	вы посмотреть это
Она, должно быть, великолепно выглядела в этом, да?	она должный быть великолепно выглядеть это да
Понятия не имею.	понятие иметь
Ладно, рассказывай. Что произошло, когда вы остались наедине?	ладный рассказывать что произойти остаться наедине
Ничего.	ничто
Он говорит неправду.	он говорить неправда
Ты спал с ней?	ты спасть она
Не твое дело.	не твой дело
Ты спал с ней?	ты спасть она
Дело номер 91-1990.	дело номер 911990
Мэри Конант.	мэри конант
Тело взрослой, белой женщины нормального телосложения.	тело взрослый бела женщина нормальный телосложение
Примерно 48 лет. Каштановые волосы, карие глаза.	примерно 48 год каштановый волос карий глаз
Рост 1 метр 62 сантиметра.	рост 1 метр 62 сантиметр
Вес 57 килограммов.	вес 57 килограмм
Кожа нормальная. Шов от удаленного аппендицита.	кожа нормальный шов удалённый аппендицит
Татуировок или иных пометок нет.	татуировка иной пометка нет
Я жива.	я живой
Причиной смерти считается самоудушение.	причина смерть считаться самоудушение
Орудием самоубийства был полиэтиленовый пакет,	орудие самоубийство полиэтиленовый пакет
который сняли с головы трупа и поместили к уликам.	который снять голов труп поместить улика
Помогите!	помочь
Сейчас я исследую мозг, с целью выявления причины смерти.	сейчас исследовать мозг цель выявление причина смерть
Помогите!	помочь
- Чем могу помочь? - Джон Рейнберд.	чем мочь помочь джон рейнбёрдо
Прошу прощения.	просить прощение
- Здесь таких нет. - Вы в этом уверены?	здесь такой нет вы уверить
Его нет в списке. Из какого он отдела?	он список из какой отдел
Из отдела Исследований и Развития.	из отдел исследование развитие
- Нет таких. - А в отделе Похищений и Убийств?	нет такой а отдел похищение убийство
Вам туда нельзя.	вы туда нельзя
Ребятки, возвращайтесь к себе в комнату.	ребятки возвращаться комната
- Я хочу посмотреть на пожар. - Заткнись.	я хотеть посмотреть пожар заткнуться
Что ты делаешь, болван?	что делать болван
Здесь Чарли.	здесь чарли
- Туда нельзя. - Хочу увидеть Чарли.	туда нельзя хотеть увидеть чарли
- Нам отсюда нельзя. - Стой!	мы отсюда нельзя стоять
Всем оставаться в этой комнате.	весь оставаться комната
- Это кто там голос подал? - Я.	это голос подать я
Сейчас вмажу тебе. Ты меня знаешь.	сейчас вмазать ты ты знаешь
Вон там все на камеру снимают.	вон камера снимать
Прекрати!	прекратить
Отвали от меня.	отвалить я
Почему ты не остановил его?	почему остановить он
Я пытался. Он не реагирует.	я пытаться он реагировать
Запри за нами дверь. Садись вон туда, лицом к стене.	запереть мы дверь садиться вон туда лицо стена
- Что? - Лицом к стене.	что лицо стена
Что происходит?	что происходить
Не шуми.	не шуметь
Осторожно.	осторожно
- Отпусти его. - Как бы ни так.	отпустить он как так
- Давай, Чарли. - Ты поражаешь прицельным огнем?	давать чарли ты поражать прицельный огонь
У кого из нас прицел точнее?	у кто прицел точнее
Зажарь этого сукиного сына.	зажарить сукин сын
Ей это не под силу.	она это сила
- Она тебя за компанию боится убить. - Отпусти его.	она компания бояться убить отпустить он
Думаю, придется тебе все-таки убить меня.	думать прийтись ты всетаки убить я
Ты ведь именно этого хочешь?	ты именно хотеть
- Пожалуйста, отпусти его. - Давай поторгуемся.	пожалуйста отпустить он давать поторговаться
Что ты мне за него дашь?	что дать
- Я останусь здесь, с тобой. - Не надо...	я остаться здесь ты не надо
- Останешься, значит? - Ты прав, мы созданы друг для друга.	остаться значит ты право создать друг друг
Я не верю тебе. Плохи наши дела.	я верить ты плохой наш дело
Смотрите, кто пришел! Что же ты приуныла, Чарли?	смотреть прийти что приуныть чарли
- Уходи отсюда. - О чем ты? Она спасать тебя пришла.	уходить отсюда о ты она спасать пришлый
Теперь она не уйдет.	теперь уйти
Может, ты боишься своего истинного лица?	мочь бояться свой истинный лицо
- Не слушай его. - У тебя это на лбу написано.	не слушай он у это лоб написать
- Замолчи. - Чарли, покажи на что ты способна.	замолчать чарли показать способный
Ну, что, рты раскрыли!?	ну что рот раскрыть
Пойдем.	пойти
- Где это мы? - Я не знаю.	где это мы я знать
Зачем здесь макет города?	зачем макет город
- Для обучения, может? - Обучения чему?	для обучение мочь обучение что
Вперед.	вперёд
Погоди.	погодить
Это из тех случаев неполной смерти. Жертва движется в туннеле к свету,	это тот случай неполный смерть жертва двигаться туннель света
- но в последний момент возвращается. - Было чувство отделения от тела?	последний момент возвращаться быть чувство отделение тело
По ее словам, она все время находилась в сознании.	по слово время находиться сознание
Тогда почему решили, что она умерла?	тогда почему решить умереть
Такие случаи уже были, они весьма редки -	такой случай быть весьма редкий
когда погребенные под снегом люди, были признаны умершими.	погрести снег человек признать умерший
Нет ни пульса, ни дыхания, а потом они самопроизвольно оживали.	нет пульс дыхание самопроизвольно оживать
Самопроизвольное оживление - как самопроизвольное возгорание?	самопроизвольный оживление самопроизвольный возгорание
"- Слышали о ""бесчувствии""? - Когда людей замораживают?"	слышать бесчувствие когда человек замораживать
Это как состояние гибернации. Сердце бьется так медленно, что нет пульса.	это состояние гибернация сердце биться медленно пульс
- Один удар в час, например. - И такие случаи были?	один удар час например и такой случай быть
В учебниках - да.	в учебник да
Я - Спецагент Прюитт. Из ФБР.	я спецагент прюитта из фбр
Я так понял, вас пытались убить.	я понять пытаться убить
- Их надо остановить. - Непременно.	они остановить непременно
Вы в полной безопасности.	вы полный безопасность
Я не о себе беспокоюсь. Они думают, что я мертва.	я беспокоиться они думать мёртвый
А кто еще в опасности?	а опасность
Так они мне и сказали!	так сказать
Меня хотели убить. Я слишком много знаю.	я хотеть убить я слишком знать
Кто вас хотел убить?	кто хотеть убить
Он представился Гилом Джеймсом.	он представиться гил джеймс
"Сказал что из ""Системз Оперейшнз""."	сказать системза оперейшнза
- Кто такой Гил Джеймс? - Мужчина, который хотел меня убить.	кто гил джеймс мужчина который хотеть убить
Его подослал Рейнберд.	он подослать рейнбёрдо
- Лот 6. - Простите, я не понимаю.	лот 6 простить понимать
Препараты, эксперименты над способностями мозга, 70-е годы.	препарат эксперимент способность мозг 70е год
Расширяли возможности мозга.	расширять возможность мозг
Боже! Рейнберд!	бог рейнбёрдо
Он уже тогда там работал. Они все еще там.	он работать они там
Это они!	это они
Все хорошо.	весь хорошо
Вы в полной безопасности.	вы полный безопасность
Скажите, как они расширяли возможности мозга?	сказать расширять возможность мозг
- Мы могли делать разные вещи. - Какие вещи?	мы мочь делать разный вещий какой вещий
- Разные. Мы все были разными. - А что лично вы могли делать?	разный мы разный а лично мочь делать
Я управляла предметами. Они у меня работали.	я управлять предмет они работать
Чинили поломанные предметы?	чинить поломать предмет
Я не понимаю.	я понимать
Вы могли бы мне это продемонстрировать?	вы мочь это продемонстрировать
Мне больно это делать.	я больно это делать
Я в этом не сомневаюсь.	я сомневаться
Подождите. Куда вы?	подождать куда вы
Что скажете?	что сказать
Она верит в то, что говорит. Я пока воздержусь от комментариев.	она верить то говорить я пока воздержаться комментарий
Теперь вы ей верите? Осторожно!	теперь верить осторожно
А я ведь искал вас.	а искать вы
Вы - Ричардсон.	вы ричардсон
Чего смеешься?	что смеяться
Я только что закрыл Западный Регион.	я закрыть западный регион
Вы сказали, что мне его не спасти.	вы сказать спасти
А я вот взяла и спасла.	а взять спасти
Да, спасла.	да спасти
Так-то!	такто
Расскажешь нам историю?	рассказать мы история
Необязательно о Чарли. Можно и о чем-нибудь другом.	необязательно чарли можно чемнибыть друг
Никаких историй.	никакой история
Почему?	почему
Мне нужна была ваша помощь, а вы мне ее не оказали.	я нужный ваш помощь оказать
Как я после этого должен себя чувствовать?	как должный чувствовать
- Ты зол на нас? - Нет, на себя.	ты злой мы нет себя
Я не научил вас ничему более важному	я научить ничто важный
чем завязывать шнурки на ботинках или ездить на велосипеде.	завязывать шнурок ботинок ездить велосипед
Простите, сэр. Меня пригласили войти. Я могу подождать вас за дверью.	простить сэр я пригласить войти я мочь подождать дверь
Ну, что вы! Заходите, пожалуйста. Присаживайтесь.	ну вы заходить пожалуйста присаживаться
Проходите. Не стесняйтесь.	проходить не стесняться
Мы чуть-чуть заняты. У нас урок.	мы чутьчуть занятый у урок
Правда, вы могли бы помочь нам.	правда мочь помочь мы
Конечно. Чем смогу.	конечно чем смочь
Гил работает бухгалтером.	гил работать бухгалтер
Это значит, что иногда он должен убивать людей.	это значит должный убивать человек
Гил должен был задержать Чарли, не дать ей сбежать, но у него не вышло.	гил должный задержать чарли дать сбежать выйти
А потом, когда Чарли вернулась, он во второй раз упустил ее.	а потом чарли вернуться два упустить она
Он слишком большой, чтобы я его отшлепал. Может, вы знаете, как быть?	он слишком большой отшлёпать мочь знаете быть
Есть предложения?	есть предложение
Гарсиа, собирайся. Мы отправляемся в командировку.	гарсиа собираться мы отправляться командировка
- Куда? - В Колорадо.	куда в колорадо
"Информация жертвы достоверна. ""Системз Оперейшнз"" - имеются."	информация жертва достоверный системза оперейшнза иметься
- Причем, целых три. - Вот как?	причём целое три вот как
Зато в колорадской фирме работают Джон Рейнберд и Гил Джеймс.	зато колорадский фирма работать джон рейнбёрдо гил джеймс
