cleaned_text	lemm_text
...ей не стоило бы говорить тебе такие вещи.	она стоить говорить ты такой вещий
Она должна говорить приятные вещи. Хорошие вещь.	она должный говорить приятный вещий хороший вещь
- Я люблю тебя, Уилл. - Я знаю.	я любить ты уилла я знать
Ну же, милая. Я уезжаю всего на пять дней.	ну же милый я уезжать пять день
- Джессика, ты была очень грубой. - Нет, не была.	джессика очень грубый нет быть
Да, ты ведешь себя как трехлетняя.	да вести трехлетний
Тогда уезжай и оставь меня в покое.	тогда уезжать оставить покой
Я хотела бы попрощаться. Как следует попрощаться.	я хотеть попрощаться как следовать попрощаться
Знаешь, я не... Я не знаю почему ты так расстроена.	знаешь не я знать почему расстроить
Я думала тебе нравится быть с папой и Мелиндой.	я думать ты нравиться папа мелинда
Я говорила тебе что нет.	я говорить ты нет
Ну, у нас ведь было соглашение	ну соглашение
Тогда уезжай.	тогда уезжать
Это все потому что ты улетаешь на Гавайи.	это улетать гавайи
- Замолчи, отец! - Уилл.	замолчать отец уилла
Она наша мама. Ты не должен злиться на неё.	она наш мама ты должный злиться она
Ты должен быть благосклоннее.	ты должный благосклонный
Уилл!	уилла
Он прав, Дэниел.	он право дэниел
У меня кое что есть для тебя.	у кой ты
- Правда? - Да.	правда да
Тебе. Для вдохновения.	ты для вдохновение
Спасибо.	спасибо
"""Малый бизнесс для чайников. """	малый бизнесса чайник
Очень мило с твоей стороны, детка.	очень мило твой сторона детка
Ты называешь меня чайником?	ты называть чайник
Нет, нет. Я прочитала эту книгу перед тем как заняться бизнесом.	нет нет я прочитать книга заняться бизнес
От корки до корки.	от корка корка
Позволь мне задать тебе вопрос.	позволить задать ты вопрос
Для тебя было бы проше если бы я был президентом фирмы а не инструктором по серфу ?	для прош президент фирма инструктор серф
Кайл, я не пытаюсь изменить тебя.	кайло пытаться изменить ты
Я пытаюсь вдохновить тебя.	я пытаться вдохновить ты
Да, но ты и так вдохновляешь меня.	да вдохновлять я
И ты мне на самом деле нравишься.	и самый дело нравиться
Нет. Я люблю тебя Джеки.	нет я любить джеки
Как ты думаешь, это странно что мы до сих пор не .	как думать это странно сей пора
...познакомились с друзьями друг друга?	познакомиться друг друг друг
Немного, наверное.	немного наверное
И чего ты думаешь мы ждем?	и думать ждать
Чего ты ждешь?	что ждать
Честно? Часть меня, наверное, ждет когда тебе исполнится тридцать.	честно часть я наверное ждать ты исполниться тридцать
Тебя смущает мой возраст?	ты смущать возраст
А тебя?	а ты
Я имею ввиду, ты мог бы встречаться с девушкой, которая на двадцать лет моложе меня.	я иметь ввиду мочь встречаться девушка который двадцать год молодой я
Мы из разных поколений.	мы разный поколение
Я очень старая для тебя?	я очень старый ты
Нет, иногда мне кажется это я слишком стар для тебя.	нет кажется это слишком старый ты
Я буду счастлив представить тебя своим друзьям.	я быть счастливый представить свой друг
Я не беспокоюсь по этому поводу. Почему должен?	я беспокоиться это повод почему должный
Ты прекрасна. Я горжусь что ты моя девушка.	ты прекрасный я гордиться девушка
Знаешь, двадцатилетняя женшина...	знаешь двадцатилетний женшина
Ну...	ну
Что насчет моих друзей?	что насчёт мой друг
Вот это большая проблемма.	вот это большой проблемма
Просто... Я предпочитаю не слишком часто посещать материк.	просто я предпочитать слишком часто посещать материк
Никогда?	никогда
Раз в год, максимум.	раз год максимум
Я имею ввиду, я не знаю. Могу ли я поехать на материк? Могу ли я жить там?	я иметь ввиду знать мочь поехать материк мочь жить там
Честно?	честно
Да, честно.	да честно
Мне не нравится покидать остров.	я нравиться покидать остров
Думаешь я эгоист, потому что не приеду к тебе в Денвер.	думать эгоист приехать ты денвер
- Пока нет. - Нет?	пока нет нет
Спроси меня через несколько месяцев.	спросить несколько месяц
Знаешь, я не знаю. Вся эта суета на материке кажется мне безумной.	знаешь знать весь этот суета материк кажется безумный
Я имею ввиду, нам дана всего одна жизнь а вы тратите её простаивая в пробках в час пик,	я иметь ввиду мы дать один жизнь тратить её простаивать пробка час пик
...или работая под лампами дневного света	или работать лампа дневный свет
...в комнате с кондиционером, склонившись над компьютером...	в комната кондиционер склониться компьютер
...заглатывая кофеин. Для чего все это?	заглатывать кофеин для это
Ты не обязан так жить.	ты обязать жить
Я знаю, но каждый раз когда я бываю на материке...	я знать каждый бывать материк
я боюсь что он проглотит меня.	бояться проглотить я
Ну, твоя жизнь намного проще чем у большинства людей.	ну твой жизнь намного простой большинство человек
Я думаю ты недооцениваешь эту простоту.	я думать недооценивать простота
Я идиот, правда? Упрямый осел?	я идиот правда упрямый осесть
- Честно? - Да, честно.	честно да честно
Я думаю ты ведешь себя на свой возраст.	я думать вести свой возраст
Я принесу нам ещё пива.	я принести мы ещё пиво
- Вы подруга Кайла? - Да.	вы подруга кайло да
Я Эндрю Барри. Могу я принести вам выпить?	я эндрю барри мочь принести выпить
Нет, нет, нет.Кайл уже... У моего сына такая же футболка.	нет нет неткайло уже у мой сын такой футболка
- Эта? - Да.	этот да
Да, это я. Я профессиональный серфер.	да это я я профессиональный серфер
Сколько вашему сыну?	сколько ваш сын
- Одинадцать. - Одинадцать.	одинадцать одинадцать
У меня есть несколько футболок с автографами в рюкзаке.	у несколько футболка автограф рюкзак
Ух ты.	ух ты
Возимите одну.	возимитя один
Позор тебе, Дрю. Ты заигрываешь с моей девушкой?	позор ты дрю ты заигрывать мой девушка
Это ничего?	это ничто
Нет, если только ты не хочешль есть через трубочку.	нет хочешль трубочка
- Спасибо. - На здоровье.	спасибо на здоровье
И если не подойдет...	и подойти
Да, да, забей. Иди раздавать свои майки где нибудь ещё.	да да забить идти раздавать свой майка ещё
Сколько ему?	сколько он
Двадцать один, и это слишком для тебя.	двадцать один это слишком ты
Меня могли бы арестовать.	я мочь арестовать
Эй, смотри, я получила её для Уилла. Она подписана.	эй смотреть получить её уилла она подписать
Ух ты.	ух ты
Что?	что
Это твой телефон.	это твой телефон
Семь сообщений. Все от Дэниэла.	семь сообщение весь дэниэл
- Что? - Что то случилось.	что что случиться
Эй это я.	эй это я
Где ты была? Я несколько часов пытался дозвониться.	где быть я несколько часы пытаться дозвониться
У меня не было с собой телефона.	у себя телефон
Зачем он тебе нужен если...	зачем ты нужный если
Дэниел, что случилось?	дэниел случиться
Была аврия.	быть аврий
Твоя няня была за рулем.	твой няня руль
- Уилл в порядке. Джесс сейчас в хирургии. - В хирургии?	уилла порядок джесс хирургия в хирургия
Сломана рука.	сломать рука
- Все так плохо? - Нет, она будет в порядке.	весь плохо нет порядок
- Что произошло? - Пьяный водитель выехал на стоп знак.	что произойти пьяный водитель выехать стоп знак
Ладно, знаешь что? Я... Я прилечу первым же рейсом.	ладный знаешь что я я прилететь один рейс
Она спрашивала про тебя.	она спрашивать ты
Просто скажи ей что я её люблю. Я приеду так скоро как смогу. Хорошо?	просто сказать её любить я приехать скоро смочь хорошо
- Да. - Уилл с тобой?	да уилла ты
Нет, он дома с Мелиндой.	нет дом мелинда
Послушай, уже за полночь. Я бы не звонил сейчас. Он скорее всего уже спит.	послушать полночь я звонить сейчас он скорее спать
Хорошо. Хорошо. Я позвоню тебе как только узнаю когда рейс.	хорошо хорошо я позвонить ты узнавать рейс
Мне все равно сколько раз мне придется пересаживаться.	я равно сколько прийтись пересаживаться
Сейчас, я вылетаю из Гонолулу в Сан Франциско.	сейчас вылетать гонолулу сан франциско
Потом мне нужно из Сан Франциско в Денвер.	потом нужно сан франциско денвер
Хорошо. До свидания.	хорошо до свидание
Они будут ждать меня. Они работают над этим.	они быть ждать я они работать это
Хорошо. Я не буду звонить и беспокоить тебя.	хорошо я быть звонить беспокоить ты
Просто дай мне знать как она, когда будешь в воздухе.	просто дать знать она быть воздух
Спасибо. Знаешь что? Я почувствую себя намного лучше когда вернусь домой.	спасибо знаешь что я почувствовать намного вернуться домой
Да. И я пришлю тебе твои вещи.	да и прислать ты твой вещий
Береги себя, ладно?	беречь себя ладный
Эй.	эй
Я думал ты прилетишь первым рейсом.	я думать прилететь один рейс
Я так и сделала.	я сделать
- Сейчас уже полдень. - Без шуток.	сейчас полдень без шутка
- Что на тебе надето? - Это единственное что у меня было.	что ты надеть это единственный быть
Это его? Ему что, двенадцать?	это он он что двенадцать
Я везла это для Уилла.	я везти это уилла
Знаешь, ты можешь идти. Я посижу с Джесс.	знаешь мочь идти я посидеть джесс
Уилл приедет сюда. Мелинда заберет его с плавания.	уилла приехать сюда мелинда забрать плавание
- Нет, я просила Лизу забирать его. - Ну, её нет. Я её уволил.	нет просить лиза забирать он ну её нет я её уволить
- Да, она сказала мне и я снова наняла её. - Я не хочу чтобы она работала на нас.	да сказать снова нанять её я хотеть работать мы
Даниэль, это был несчастный случай.	даниэль это несчастный случай
И у меня есть опека, поэтому я имею право принять такое решение,а не ты.	и опека поэтому иметь право принять такой решениеа ты
- Может тебя стоит лишить опеки. - Будь осторожен.	мочь стоить лишить опека быть осторожный
Ты отсутствующая мать. Ты поглощена Гавайями.	ты отсутствовать мать ты поглотить гавайи
Значит то что ты в дороге две недели в месяц	значит дорога два неделя месяц
...не делают тебя отсутствующим отцом?	не делать отсутствовать отец
- Я этим зарабатываю на жизнь. - Поэтому ты спал в Нью-Йорке.	я это зарабатывать жизнь поэтому спасть ньюйорк
Мы действительно будем обсуждать это здесь?	мы действительно быть обсуждать это здесь
Не разговаривай с моей няней. Она моя няня!	не разговаривать мой няня она няня
Мистер и миммис Лоуренс?	мистер миммис лоуренс
Я доктор Соннет, Я хирург Джессики.	я доктор соннет я хирург джессика
- У вас с женой есть минутка? - бывшей женой.	у жена минутка бывший жена
Чтож, Джессика держится отлично. Но мы хотели бы оставить её...	чтожий джессика держаться отлично но хотеть оставить её
...на несколько дней чтобы проследить что все хорошо.	на несколько день проследить хорошо
Хорошо. Убедитесь что с ней всё будет хорошо.	хорошо убедиться весь хорошо
- Он не всегда такой очаровательный. - Не беспокойтесь об этом.	он очаровательный не беспокоиться это
- Спасибо, доктор Соннет. - Хорошо.	спасибо доктор соннет хорошо
- Джессика. - Мамочка!	джессика мамочка
О, боже мой!	о бог мой
О, боже мой! Ты в порядке.	о бог мой ты порядок
Да, перестань, мама. Мне уже лучше.	да перестать мама я хороший
Я так рада. И прости что меня не было рядом.	я рада и простить ряд
Я знаю. Я знаю. Всё хорошо.	я знать я знать весь хорошо
Да. Когда папа позвонил я сразу же помчалась в аэропорт.	да когда папа позвонить сразу помчаться аэропорт
Все прислали мне цветы. Все уже знают.	весь прислать цвета весь знать
Уверена, все беспокоятся за тебя.	уверить беспокоиться ты
Да. О, боже, посмотри на свой гипс.	да о бог посмотреть свой гипс
Знаешь что? Нам надо купить волшебный фломастер	знаешь что мы купить волшебный фломастер
...и позволить людям подписать его.	и позволить человек подписать он
- Да, она еще немного болит. - Да. Ну тогда сделаем это когда тебе станет лучше.	да немного болеть да ну сделать это ты стать хороший
Я могу что нибудь сделать для тебя?	я мочь сделать ты
- Ты можешь привезти мою подушку из дома? - Да.	ты мочь привезти мой подушка дом да
И какой нибудь нормальной еды. Здесь слишком много желе.	и нормальный еда здесь слишком желе
О боже, я так рада что ты в порядке.	о бог рада порядок
Это было страшно.	это страшно
Знаю что было.	знать быть
Посмотри на свои шарики.	посмотреть свой шарик
Да, они от папы и Мелинды.	да папа мелинда
Джессика?	джессика
Джессика, мой друг с Гавайев передал тебе подарок.	джессика друг гавайи передать ты подарок
Вот. Все танцовщицы носят это. Это орхидеи.	вот весь танцовщица носить это это орхидея
- Правда? - Да.	правда да
- Хочешь я прочту открытку? - Конечно.	хотеть прочесть открытка конечно
"""Для Джесс от Кайла. """	для джесс кайло
"- ""Дорогая Джессика... "" - Мам?"	дорогой джессика мама
Меня беспокоит твое усройство.	я беспокоить твой усройство
Устройство? Где ты услышала это?	устройство где услышать это
Может быть твой парень на самый лучший для тебя.	мочь твой парень самый хороший ты
Может быть ты лучше чем он.	мочь он
О, нет, детка. Это не правда.	о нет детка это правда
Кайл прекрасный человек, Иначе зачем ему надо было присылать тебе этот замечательный подарок.	кайло прекрасный человек иначе присылать ты замечательный подарок
Ты уверена?	ты уверить
Да, я уверена. Он очень беспокоился за тебя	да уверить он очень беспокоиться
И я чувствую себя ужасно что была с ним когда	и чувствовать ужасно
с тобой случилось несчастье.	ты случиться несчастие
Не беспокойся, я больше не уеду, хорошо?	не беспокоиться уехать хорошо
- Не уедешь? - Нет.	не уехать нет
- Почему? - Я хочу быть здесь.	почему я хотеть здесь
Значит, ты больше не вернешься на Гавайи?	значит вернуться гавайи
Нет.	нет
Хорошо.	хорошо
Я не могу оставить мою настоящую жизнь ради фантазии.	я мочь оставить мой настоящий жизнь ради фантазия
Фантазии?	фантазия
Ведь это так и есть.	ведь это есть
- Увидимся завтра. - Спасибо.	увидеться завтра спасибо
Послушай, Джеки, Тебе не обязательно называть это фантазией чтобы все закончить.	послушать джеки ты обязательно называть это фантазия закончить
Но не притворяйся что то что было между нами не было реальностью.	но притворяться мы реальность
Я не притворяюсь. Я...	я притворяться я
Я говорю что чувствую это,	я говорить чувствовать это
...потому что ты находишься на другой стороне земного шара.	потому находиться сторона земной шар
Знаешь что я думаю?	знаешь думать
Я думаю твоя дочь получила травму, и это чертовски напугало тебя.	я думать твой дочь получить травма это чертовски напугать ты
Так и должно быть.	так должный быть
Но теперь ты чувствуешь вину за это, поэтому ты уползла в свою дыру.	но чувствовать вина это поэтому уползти дыра
- У тебя нет детей, Кайл. - И что?	у ребёнок кайло и что
Я хочу сказать, что для меня все намного сложнее.	я хотеть сказать намного сложный
Для тебя жизнь проще.	для жизнь простой
Наверное это правда.	наверное это правда
Я не знаю что сказать. Я не рада прощанию.	я знать сказать я рада прощание
"Тогда не говори прощай. Скажи, ""Увидимся позже. """	тогда говорить прощать сказать увидеться поздний
Я не уверена что увижу тебя позже, Кайл.	я уверить увидеть поздний кайло
Береги себя, Джеки.	беречь себя джеки
Ты тоже.	ты тоже
