cleaned_text	lemm_text
Ага, разрезает на кусочки и прячет в холодильнике.	ага разрезать кусочек прятать холодильник
Он был милым. И очень нежным.	он милый и очень нежный
Нежным, когда приготовит тебя, и мы больше никогда тебя не увидим.	нежный приготовить ты увидеть
Ага,именно.	агаименный
Ладно, девчонки, оставим это. Оставим.	ладный девчонка оставить это оставить
Может этот парень любовь всей жизни Джеки.	мочь парень любовь весь жизнь джеки
Вот моя малышка!	вот малышок
Привет, девчонки.	привет девчонка
Итак, ты поговоришь с детьми в перерыве?	итак поговорить ребёнок перерыв
Ты планируешь путешевствие ?	ты планировать путешевствие
Пока нет.	пока нет
Ну, а я да. А собиралась обсудить это с тобой.	ну да а собираться обсудить это ты
Летишь на Гаваи повидать своего мальчика?	лететь гавай повидать свой мальчик
Энни рассказала Филу, Фил рассказал мне. Боже Джеки.	энни рассказать фил фил рассказать я бог джеки
Это ниже твоего достоинства.	это ниже твой достоинство
На самом деле, я подумывала навестить маму в Каннектикуте.	на самый дело подумывать навестить мама каннектикута
Это мои две недели, поэтому это действительно не твоё дело куда я поеду.	это мой два неделя поэтому это действительно твой дело поехать
Как хочешь пижон. Веселись.	как хотеть пижон веселиться
Почему ты разговаривала с ним?	почему разговаривать он
- С кем? - С папой.	с кто с папа
- Что ты имеешь ввиду? - Он всегда тебя расстраивает. Я видел вас.	что иметь ввиду он расстраивать я видеть вы
Извини, дорогой.	извинить дорогой
Знаешь, иногда у нас с папой бывают разногласия...	знаешь папа бывать разногласие
...и мы идем на компромисы.	и идти компромис
Мне жаль что ты видел меня сварливую.	я жаль видеть сварливый
Ты была такая счастливая когда вернулась из поездки.	ты такой счастливый вернуться поездка
А теперь ты снова грустная.	а снова грустный
Я не грустная. Правда, нет.	я грустный правда нет
Мне больше нравится когда ты счастривая.	я нравиться счастривать
Привет вы позвонили Кайлу Гамильтону. оставьте сообщение.	привет позвонить кайло гамильтон оставить сообщение
Привет Кайл. Это Джеки Лоуренс.	привет кайло это джеки лоуренс
Я просто думала над тем что ты сказал,	я просто думать сказать
...и если это тебя все еще интересует , знаешь, можем попробовать снова .	и это интересовать знаешь мочь попробовать снова
Значит так. Ладно.	значит так ладный
Позвони мне если захочешь. Пока.	позвонить захотеть пока
Для вашей безопасности, пожалуйста, не оставляйте ваш багаж	для ваш безопасность пожалуйста оставлять ваш багаж
...или личный вещи без присмотра.	или личный вещий присмотр
Для вашей безопасности, пожалуйста, не оставляйте ваш багаж	для ваш безопасность пожалуйста оставлять ваш багаж
...или личный вещи без присмотра.	или личный вещий присмотр
Его здесь нет.	он нет
Зачем я это делаю?	зачем это делать
Вот почему я это делаю.	вот почему это делать
Не плохо. Ты отлично выглядишь.	не плохо ты отлично выглядеть
Спасибо.	спасибо
Я говорила что Уилл занялся сноубордом?	я говорить уилла заняться сноуборд
Он помешался на этом.	он помешаться это
Он одержим этой девушкой Гретхен Блейлер.	он одержать девушка гретхен блейлера
Да. Она... Она завоевала золото на соревнованиях, верно?	да она она завоевать золото соревнование верно
Я не знаю про соревнования но она блондинка, милая, и ей семнадцать.	я знать соревнование блондинка милый семнадцать
Значит Уиллу тоже нравятся женщины постарше?	значит уилла нравиться женщина старший
- Да. Наверное. - Умный малыш.	да наверное умный малыш
А как Джесс?	а джесс
У Джессики больше мозгов.	у джессика мозги
И она на самом деле умная, и упрямая когда это нужно.	и самый дело умный упрямый это нужно
Я скучаю по ним.	я скучать он
Уверен в этом.	уверенный это
Нет, но им бы здесь понравилось. Уилл хотел бы учиться серфингу.	нет понравиться уилла хотеть учиться серфинг
Почему бы тебе не взять их в следующий раз?	почему ты взять следующий раз
Сегодня четвертое июля и в центре Денвера жарко,	сегодня четыре июль центр денвер жарко
температура уже достигла 90 градусов.	температура достигнуть 90 градус
Девочки, пожалуйста, держитесь подальше от солнца.	девочка пожалуйста держаться далёкий солнце
Я не дождусь конца лета, когда они вернутся в школу.	я дождаться конец лето вернуться школа
Николь, ты должна увидеть фотографии от Джеки.	николь должный увидеть фотография джеки
- Она присылала тебе майл? - Нет.	она присылать ты майла нет
Ну, очевидно этот парень просто фоторграф-любитель...	ну очевидно парень просто фоторграфлюбитель
Она уезжала, наверное, четыре раза за последние шесть месяцев.	она уезжать наверное четыре раз последний шесть месяц
Ух ты. Она на доске. Она выглядит так как будто у неё получается..	ух ты она доска она выглядеть она получаться
Это шесть часов полета. Пол дня туда, пол дня обратно.	это шесть часы полёт половина день туда половина день обратно
Это невероятная трата времени, ты так не думаешь?	это невероятный трата время думать
Не знаю. Я так не делала.	не знать я делать
Николь, у неё кризис среднего возраста.	николь она кризис среднее возраст
Но вместо того чтобы перекрасить волосы и заняться йогой...	но вместо перекрасить волос заняться йога
...она каждый месяц летает до полпути к Японии.	она каждый месяц летать полпути япония
Это серьезно.	это серьёзно
Ух ты! Это этот парень? Горячий.	ух ты это парень горячий
Навегное.	навегной
Нет, так и есть. Он горячий.	нет есть он горячий
Боже мой. Посмотри на его плечи.	бог мой посмотреть плечо
 Ладно, ладно.	ладный ладный
Мы должны поговорить с ней о её чувствах.	мы должный поговорить её чувство
Наверное ты права.	наверное право
Вернись ка на одну.	вернуться ка один
Эй, я хочу кое что спросить.	эй хотеть кой спросить
Валяй.	валять
Ну, на самом деле, Я давно хотел спросить у тебя, но...	ну самый дело я давно хотеть спросить ты но
Вернувшись в Денвер...	вернуться денвер
Ты не встречалась с этим горным мужчиной, ведь так?	ты встречаться это горный мужчина так
Потому что просто я представил эту картину с парнями во фланелевых рубашках,	потому просто представить картина парень фланелевый рубашка
медведи гризли и...	медведь гризли и
Нет.	нет
Ладно, хорошо, я просто... мне не нравится эта идея.	ладный хорошо просто нравиться этот идея
Что ты хочешь сказать?	что хотеть сказать
Что я хочу сказать? Думаю я хочу сказать это.	что хотеть сказать думать хотеть сказать это
Ты мне на самом деле нравишься. И я хочу чтобы ты была моей девушкой.	ты самый дело нравиться и хотеть мой девушка
Я тебе нравлюсь, и ты хочешь чтобы я была твоей девушкой.	я ты нравиться хотеть твой девушка
Ага.	ага
- И никаких свиданий с другими? - Нет.	и никакой свидание другой нет
А как же ты?	а ты
Я буду встречаться с кем захочу.	я быть встречаться кто захотеть
Нет, Серьезно. Как ты на это смотришь?	нет серьёзно как это смотреть
Я с удовольствием стану твоей девушкой.	я удовольствие стать твой девушка
Ого, выглядишь невероятно.	ого выглядеть невероятно
Спасибо. Чувствую себя отлично.	спасибо чувствовать отлично
Вся банда здесь.	весь банда здесь
Привет вам девчонки.	привет девчонка
Привет.	привет
Как прошла поездка?	как пройти поездка
Отлично. Что происходит?	отлично что происходить
Ты была на Гаваях четыре раза включая Рождество.	ты гавая четыре раз включая рождество
Ты знаешь это?	ты знаешь это
Да была. Что в этом такого?	да быть что такой
В этом ничего такого нет, если ты не делаешь из этого секрет?	в такой нет делать секрет
Ты знаешь.. Не делаю. Это только то, что я не целеюсь и болтаю все время.	ты знаешь не делать это то целеиться болтать время
Как ты собираешься привыкнуть к тому что ты одинока	как собираться привыкнуть тот одинокий
...если ты все время мотаешься на Гавайи?	если время мотаться гавайи
Я не одинока. У меня есть парень.	я одинокий у парень
Теперь он твой парень?	теперь твой парень
Хорошо, а что происходит когда ты возвращаешься? Здесь есть много парней которые могли бы тебя устроить	хорошо происходить возвращаться здесь парный который мочь устроить
Вы, девчонки, никогда не осуждали меня, ни разу за все эти годы	вы девчонка осуждать я раз год
А теперь мы это делаем.	а это делать
Николь права. Твое место здесь.	николь право твой место здесь
Ну, мне нравятся Гавайи и мне нравится Кайл.	ну нравиться гавайи нравиться кайло
Так почему мое место здесь?	так почему мой место здесь
Что тебе нравится так это секс на Гавайях. Вот что тебе нравится.	что ты нравиться это секс гавайи вот ты нравиться
Знаешь что, Энни, ты не знаешь всей истории.	знаешь что энни знаешь весь история
Он на тринадцать лет моложе тебя.	он тринадцать год молодой ты
Я имею ввиду, как это вообще может быть возможно?	я иметь ввиду это вообще возможно
Ну, мне жаль что у вас не закружилась голова от него, ...	ну жаль закружиться голова он
...но мы встречаемся уже семь месяцев.	но встречаться семь месяц
Ладно. Возможно Джеки права и она знает что делает.	ладный возможно джеки право знать делать
Тем не менее, мы должны были это обсудить.	тем менее должный это обсудить
...если бы ему было сорок а Джеки двадцать семь.	если сорок джеки двадцать семь
Нет, мы больше не будем это обсуждать, никогда,	нет быть это обсуждать никогда
...потому что на самом деле это не ваше дело.	потому самый дело это ваш дело
Мы твои подруги. И твое счастье это наше дело.	мы твой подруга и твой счастие это наш дело
И на самом деле часть меня все еще несчастна?	и самый дело часть несчастный
Потому что я никогда не была счастливее.	потому счастливый
И это меня пугает, вот и всё.	и это пугать весь
Мы не хотели тебя обидеть.	мы хотеть обидеть
И ты должна подумать о своих детях.	и должный подумать свой ребёнок
Ладно, хорошо, держите это при себе.	ладный хорошо держать это себя
Я учитываю своих детей в каждом решении, которое принимаю.	я учитывать свой ребёнок каждый решение который принимать
Джеки. Джеки, не уходи.	джеки джеки уходить
Нет, знаете что? Я не хочу говорить ничего, о чем потом пожалею.	нет знаете что я хотеть говорить ничто пожалеть
Мои дети счастливы когда счастлива я.	мой ребёнок счастливый счастливый я
Мы просто думаем что ты заслуживаешь лучшего.	мы просто думать заслуживать хороший
Почему? Потому что вы не приняли Кайла.	почему потому принять кайло
Или тут дело еще в чем то.	или дело то
Ну как же, внезапно в моей одинокой жизни...	ну же внезапно мой одинокий жизнь
...появилось развлечение, а не только угнетение или оскорбление.	появиться развлечение угнетение оскорбление
И наверное мой опасный маленький отпуск	и наверное опасный маленький отпуск
...намного лучше чем дни и ночи проведенные в офисе	намного день ночь провести офис
Джеки.	джеки
Мы добились своего.	мы добиться свой
Ты смотришь закат солнца?	ты смотреть закат солнце
Оно уже должно сесть.	оно должный сесть
Опиши это, пожалуйста.	описать это пожалуйста
На что ты смотришь в ванной? Опиши все до последней детали.	на смотреть ванна описать последний деталь
Подожди.	подождать
Привет, Клер.	привет клер
Я разрываюсь, что лучше, римская расцветка или плиссировка.	я разрываться хороший римский расцветка плиссировка
Римская расцветка или плиссировка?	римский расцветка плиссировка
Можем... можем мы обсудить это завтра?	мочь мочь обсудить это завтра
Генри уедет рано. Ты можешь приехать?	генри уехать рано ты мочь приехать
Хорошо. Я скоро буду.	хорошо я скоро быть
Спасибо.	спасибо
Извини Кайл. Звонила клиентка. Мне нужно с ней встретиться.	извинить кайло звонить клиентка я нужно встретиться
Вечером в воскресенье?	вечером воскресение
Да. Её муж завтра уезжает.	да её муж завтра уезжать
Она хочет чтобы я с ним встретилась.	она хотеть встретиться
Генри и я решили построить ещё один дом в Джексоне.	генри решить построить ещё дом джексон
- Привет Джеки. - Вот план.	привет джеки вот план
- Привет Генри. - Более семи тысяч квадратных футов.	привет генри более семь тысяча квадратный фут
Гараж на три машины и спа.	гараж машина спа
Извините меня, дамы.	извинить я дама
Мы хотели бы чтобы ты возглавила начало	мы хотеть возглавить начать
...и поработала с архитектором.	и поработать архитектор
О, нет. Это работа моей мечты. О ней напишут в журналах.	о нет это работа мой мечта о написать журнал
- Чтож, поздравляю. - Спасибо.	чтожий поздравлять спасибо
Это просто мысль что придется работать на эту женщину еще год ...	это просто мысль прийтись работать женщина год
Это нужно?	это нужно
Ну, я имею ввиду, это очень удивительно.	ну иметь ввиду это очень удивительно
Но я должна решить как быть с детьми.	но должный решить ребёнок
Знаешь, они еще не пошли в школу.	знаешь послать школа
Хорошо, найми няню.	хорошо нанять няня
Даниэль не позволит. Он не доверяет незнакомцам.	даниэль позволить он доверять незнакомец
Даниэль тебе не позволит? Ну...	даниэль ты позволить ну
Детка, почему тебе нужно разрешение Даниэля?	детка почему ты нужно разрешение даниэль
Ты прав. Не нужно.	ты право не нужно
Уилл, Джесс, это Лиза.	уилла джесс это лиза
- Привет. - Привет.	привет привет
Она будет помогать нам до конца лета.	она помогать мы конец лето
Ну знаете, отвозить в лагерь и всякое такое.	ну знаете отвозить лагерь всякий такой
Почему бы тебе не показать ей свою комнату?	почему ты показать комната
- Конечно. - Мило.	конечно мило
Спасибо.	спасибо
Мам?	мама
Да?	да
- У меня есть подружка, Стефани, Stephanie... - Я не знала что у тебя есть подружка.	у подружка стефани stephanie я знать подружка
Есть. Я встретил её на Четвертое Июля.	есть я встретить её четыре июль
И вчера, когда я занял второе место по плаванию...	и вчера занять два место плавание
...она сказала что я не выиграл потому что слишком маленький.	она сказать выиграть слишком маленький
Она сказала что я бы плавал быстрее если бы не был маленьким.	она сказать плавать быстрый маленькая
Прежде всего, Уилл, ты именно такого размера, какого должен быть.	прежде всего уилла именно такой размер какой должный быть
И все растут с разной скоростью.	и расти разный скорость
И знаешь, никто не может говорить, что кто-то слишком большой или кто-то слишком маленький.	и знаешь никто говорить ктоть слишком большой ктоть слишком маленький
И судя по твоему отцу...	и судить твой отец
...ты очень скоро будешь возвышаться над всеми нами.	ты очень скоро быть возвышаться весь мы
Да?	да
И если Стефани этого не понимает, и не хочет принимать тебя таким...	и стефани понимать хотеть принимать такой
...какой ты есть, то это её проблеммы.	какой есть это её проблемма
- Откуда у тебя эта майка? - Мелинда дала её мне.	откуда этот майк мелинда дать её я
- Клевая. - Спасибо.	клевый спасибо
Эй, и еще, если Стефани твоя подружка...	эй ещё стефани твой подружка
