cleaned_text	lemm_text
Как насчёт этой, мама?	как насчёт этот мама
Отлично, но нам нужна не выше девяти футов.	отлично мы нужный выше девять фут
Двенадцатифутовая, мадам. Вы не найдете дерева красивее, чем это.	двенадцатифутовый мадам вы найти дерево красивый это
Спасибо, но у на не высокий потолок.	спасибо высокий потолок
Здесь есть и другие.	здесь другой
Как мы повезем елку на машине?	как повезти ёлка машина
Я не знаю.	я знать
Мам, я думаю надо позвонить папе.	мама думать позвонить папа
- Привет,Клер. - Почему?	приветклер почему
Чтобы он пришел и положил елку на верх машины.	чтобы прийти положить ёлка верх машина
Нет, Джес, мы это сделаем.	нет джес это сделать
У нас не получится. Она тяжелая, мам.	у получиться она тяжёлый мама
Нет, я слушаю.	нет слушать
Прекрати говорить о нем. Меня это огорчает.	прекратить говорить немой я это огорчать
Я знаю что мы выбрали матовый цвет для ванны.	я знать выбрать матовый цвета ванна
Я думала, ты уехала на Таити.	я думать уехать таити
Я не поехала. У Генри встреча в Китае.	я поехать у генри встреча китай
Как быстро ты сможешь приехать сюда?	как быстро смочь приехать сюда
Ты такая умница, что приехала, Джеки,...	ты такой умница приехать джеки
...но маляры уже уехали.	но маляр уехать
А у меня эта дегустация...	а этот дегустация
- Привет дети. - Привет.	привет ребёнок привет
...с поставщиком продуктов для Рождественского праздника Генри.	с поставщик продукт рождественский праздник генри
Мне очень жаль.	я очень жаль
Я позвоню тебе завтра.	я позвонить ты завтра
Окей.	окей
Мы потратили полчаса, чтобы добраться сюда.	мы потратить полчаса добраться сюда
Я знаю, милый.	я знать милый
Ты должна уволить её.	ты должный уволить её
Я не могу её уволить. Она мой клиент.	я мочь её уволить она клиент
Так, всё равно её уволь.	так весь равно её уволить
Нет. Она мой босс. Это невозможно.	нет она босс это невозможно
Давай, милая.	давать милый
Подвинься , мам. Осторожней.	подвинуться мама осторожный
- Мам... - Да. я в порядке.	мама да порядок
Возьми это, Уилл.	взять это уилла
Ладно.	ладный
Окей.	окей
Сюда.	сюда
Ладно. Так, надо это собрать.	ладный так это собрать
...И потом мы сюда поставим Рождественскую ёлку.	и сюда поставить рождественский ёлка
Вы ребята, поднимайте её и держите,	вы ребята поднимать её держать
...а я подкручу шурупы.	а подкрутить шуруп
Ну, Папа бы сделал умнее.	ну папа сделать умный
Да, у папы новый метод без наклонов, без подьемов, и стоит на одной ноге.	да папа новый метод наклон подьем стоить один нога
Ну, а у нас есть эта прекрасная маленькая подставка для елки,	ну этот прекрасный маленький подставка ёлка
...которая была приобретена еще до вашего рождения.	который приобрести ваш рождение
Она очень старая.	она очень старый
Да, но мы не поменяем её	да поменять её
...только потому, что появились новые.	только потому появиться новое
И мы уважаем эту подставку для елки	и уважаемый подставка ёлка
хоть она и старая.	старый
Вот так.	вот так
Можно мы украсим её огоньками?	можно украсить её огонёк
Да.	да
Знаете что, давайте сделаем перерыв и перекусим.	знаете что давать сделать перерыв перекусить
Нет, не сейчас.	нет сейчас
А Мелинда разрешает нам есть когда мы хотим.	а мелинда разрешать мы хотеть
Ну, это потому, что Мелинда - подружка вашего папочки и не ваша мама,...	ну это потому мелинда подружка ваш папочка ваш мама
...и это не её обязанность - говорить вам когда есть. Это моя обязанность.	и это её обязанность говорить есть это обязанность
Так что давайте есть.	так давать есть
Я просто думаю, что, когда имеешь дело с печатью на ткани, ...	я просто думать что иметь дело печать ткань
...всегда лучше определиться с цветом фона.	всегда определиться цвет фон
И сделать оттенок таким же повсюду? Белая магнолия?	и сделать оттенок такой повсюду белый магнолия
Или барселонский белый, он теплее.	или барселонский белый тёплый
И последнее, что я хотела бы обсудить с тобой.	и последний хотеть обсудить ты
Рождественская вечеринка, Джеки, мы были бы рады видеть тебя на ней.	рождественский вечеринка джеки рад видеть она
Я знаю, что это твое первое Рождество после развода.	я знать это твой первое рождество развод
Чтож. Спасибо. Это очень мило,...	чтожий спасибо это очень мило
...но я проведу Сочельник со своими детьми.	но провести сочельник свой ребёнок
Но спасибо, что не забыла обо мне.	но спасибо забыть о я
Я знаю, какими могут быть праздники.	я знать какой мочь праздник
Точно. Я ценю это.	точно я ценить это
Увидимся утром.	увидеться утром
Хорошо.	хорошо
Выглядит замечательно.	выглядеть замечательный
Так, у нас есть десять минут. Уилл, можешь включить музыку?	так десять минута уилла мочь включить музыка
- Я могу побыть диджеем? - Да, можешь.	я мочь побыть диджей да мочь
- Отлично. - И Джесс...	отлично и джесс
- Так, отнеси это в столовую. - Хорошо.	так отнести это столовый хорошо
- А это в бар. Ты мне очень поможешь. - Хорошо.	а это бар ты очень помочь хорошо
- Привет, папочка. - Привет, Джесс. С Рождеством!	привет папочка привет джесс с рождество
Привет, Мелинда.	привет мелинда
С Рождеством.	с рождество
Привет.	привет
Подумал, что у нас будет больше времени утром	подумать время утром
...если привезти подарки сегодня.	если привезти подарок сегодня
Дэн, моя Рождественская вечеринка сейчас начнется.	дэн рождественский вечеринка начаться
Правда?	правда
Привет, Мелинда.	привет мелинда
Привет, Джекки.	привет джекка
Может быть положишь эти подарки под елку?	мочь положить подарок ёлка
Было бы замечательно.	быть замечательный
Хорошо.	хорошо
Вижу, ты купил Уиллу сноуборд.	видеть купить уилла сноуборд
Да. Хочу, чтобы он взял его в путешествие.	да хотеть взять путешествие
Я думала, мы договорились не дарить больших подарков.	я думать договориться дарить больший подарок
Это же не соревнование, Джеки.	это соревнование джеки
Можно я выключу это?	можно выключить это
Да. И знаешь что? Я уже не успеваю.	да и знаешь что я успевать
Не разрешай детям поздно ложиться сегодня.	не разрешать ребёнок поздно ложиться сегодня
Они должны быть у меня в 9:00. Вылет в полдень.	они должный 900 вылет полдень
Джеки, это тебе.	джеки это ты
Дэниел сказал, что на этой неделе у тебя день рождения.	дэниел сказать неделя день рождение
Да. Спасибо.	да спасибо
Соровник стукнул. Ого.	соровникнуть стукнуть ого
Это дизайнерская кофта. Джуси Кутюр.	это дизайнерский кофта джусить кутюра
Я же знаю, что ты не вылезаешь из своей любимой толстовки.	я знать вылезать свой любимый толстовка
Поэтому подумала, что тебе может пригодиться новая. Более модная.	поэтому подумать ты пригодиться новый более модный
Она очень удобная.	она очень удобный
Что ж, это очень любезно с твоей стороны.	что ж это очень любезно твой сторона
Можно я позже открою?	можно поздний откроить
- Да. Конечно. - Ага, конечно.	да конечно ага конечно
Хорошо. Ну, с Рождеством.	хорошо ну рождество
- Эй! - Нет, я слушаю.	эй нет слушать
То есть они просто ждали когда я открою подарок.	то просто ждать откроить подарок
Какой болван.	какой болван
Эй, Уилл, не забудь - на следующей неделе День рождения твоей мамы.	эй уилла забыть следующий неделя день рождение твой мама
Я знаю.	я знать
Болван.	болван
- Ты думаешь это нелепо? - Определенно.	ты думать это нелепо определённо
Приехать к нам без предупреждения вместе с Мелиндой в канун рождества?	приехать мы предупреждение вместе мелинда канун рождество
Джеки, ты очень много ему прощаешь.	джеки очень прощать
Я бы голову ему открутила.	я голова открутить
Согласна, а ты думаешь я по жизни в этом свитере?	согласный думать жизнь свитер
Ну последнее время точно,...	ну последний время точно
...я думаю я была с тобой когда ты его купила 20 лет назад.	я думать ты купить 20 год назад
Дай передохнуть. У меня и времени не было, чтобы измениться.	дать передохнуть у время быть измениться
Но... ты согласна с Мелиндой ?	но согласный мелинда
Да какая разница? ?	да разница
"Точно, ты вся такая ""не обращайте на меня внимания,"	точно весь такой не обращать внимание
"""я просто сломленная и побитая..."	я просто сломить побить
"и мой мозг восстает против магазинов и секса""."	мозг восставать против магазин секс
Поверь мне, ты справишься.	поверь я справиться
О чем ты вообще?	о вообще
О подружке Дэниэла.	о подружка дэниэл
О боже, я собиралась тебе сказать.	о бог собираться ты сказать
На прошлой неделе я встретила её в супермакете. На вид ей лет 16.	на прошлый неделя встретить её супермакет на вид год 16
Очень мило, Энни. Ты мне очень помогла.	очень мило энни ты очень помочь
Что? Извини, дорогая, но это правда.	что извинить дорогой это правда
Джеки, естественно, симпатичнее и умнее.	джеки естественно симпатичный умный
О чем только думал Дэниэл?	о думать дэниэл
Он думает, что она выглядит на 16.	он думать выглядеть 16
А Мелинда девушка на одну ночь или у него абонемент?	а мелинда девушка один ночь абонемент
О, нет нет, она его подружка.	о нет подружка
6 месяцев, и ей не 16, а все 28.	6 месяц 16 28
Кто-нибудь ешё хочет шампанского?	ктонибыть ешё хотеть шампанский
Нет, спасибо, я за рулем.	нет спасибо руль
Нет, у нас за ужином вино.	нет ужин вино
Кстати об ужине, нам пора.	кстати ужин мы пора
Ну что покатили?	ну покатить
Не, подожди. Ты куда собралась?	не подождать ты собраться
Ну, у нас столик забронирован на 8.	ну столик забронировать 8
Значит я приготовила всю эту еду для...	значит приготовить еда для
Я надеюсь ты не уедешь?	я надеяться уехать
Блин, Извини, дорогая. Всё новмально?	блин извинить дорогой весь новмальный
Знаешь. Да какая разница. Мы с Брайэном остаёмся.	знаешь да разница мы брайэном оставаться
- Мы тоже можем остаться. - Нет нет нет нет нет, извините.	мы мочь остаться нет нет извинить
А знаете что.я просто Не хочу чтобы вечеринка заканчивалась.	а знаете чтой просто не хотеть вечеринка заканчиваться
- Да всё нормально. Вы, ребят, идите. - Мы всё понимаем.	да весь нормальный вы ребята идти мы весь понимать
Просто идите. Повеселитесь там.	просто идти повеселиться там
Дорогая, ты уверена? Всё нормально?	дорогой уверить весь нормальный
Ты отлично справляешься.	ты отлично справляться
- Мы сделаем для тебя. - Хорошо.	мы сделать ты хорошо
- Миша! - Спасибо.	миша спасибо
Мы собираемся к бабушке с дедушкой,...	мы собираться бабушка дедушка
..но к десерту мы вернемся.	но десерт вернуться
Милая. Нам пора.	милый мы пора
- Ладно. - Хорошо.	ладный хорошо
Ей, ей.	она она
Мам, я помогу.	мама помочь
нет, не надо, тебе пора спать.	нет надо ты пора спать
Завтра рано вставать.	завтра рано вставать
скоро твой день рождения. Тридцатого декабря?	скоро твой день рождение тридцать декабрь
Да.Да.Тридцатого.	дадатридцать
Думаешь нам стоит ехать кататься на лыжах?	думать мы стоить ехать кататься лыжа
Почему нет.	почему нет
А может нам лучше здесь остаться?	а мы остаться
На мой день рождения?	на день рождение
Да. Я имею ввиду тебе лучше не оставаться одной...	да я иметь ввиду ты оставаться один
...в свой собственный день рождения.	в свой собственный день рождение
А я и не буду одна. Ко мне приедут подруги.	а быть один к приехать подруга
Тебе не о чем беспокоиться.	ты беспокоиться
Мы может устроить вечеринку?	мы устроить вечеринка
Знаешь что? Мы купим торт когда ты вернешься.	знаешь что мы купить торт вернуться
Но ты же собираешься повеселиться, правда?	но собираться повеселиться правда
Даа, я собираюсь повеселиться по полной,	даа собираться повеселиться полный
...я вас разыщу, позвоню...	я разыскать позвонить
...И заставлю спеть песенку для меня.	и заставить спеть песенка я
- Обещаешь? - Обещаю. А сейчас иди спать.	обещать обещать а идти спать
- Спокойной ночи, мам. - Спокойной ночи	спокойный ночь мама спокойный ночь
- Я тебя люблю. - Я тебя тоже люблю.	я любить я любить
А этот шоколадный санта был в твоём чулке.	а шоколадный сант твой чулок
Но ты же не особо любишь сладости, верно?	но особо любить сладость верно
Нет, Можешь взять. Только не ешь за завтраком.	нет мочь взять только есть завтрак
- Хорошо, я тебя люблю. - Я тебя тоже люблю.	хорошо любить я любить
Люблю. Люблю.	любить любить
- Пока, мам. - я тебя люблю, мам.	пока мама любить мама
- Я тоже вас люблю. Повелелитесь.	я любить повелелиться
Счастливого Рождества!	счастливый рождество
Счастливого Рождества!	счастливый рождество
Кстати, а когда дети вернуться?	кстати ребёнок вернуться
За день до нового года.	за день новое год
Я думала вы ребят две недели работаете, две - отдыхаете.	я думать ребята два неделя работать два отдыхать
Обычно да, но сейчас каникулы.	обычно да каникулы
Что?	что
С Днём Рождения.	с днём рождение
Ты на Гавайях отметишь свой день рождения.	ты гавайи отметить свой день рождение
Что?	что
Быстро, три дня, три ночи, ...	быстро день ночь
...В отеле Ройал Гавайи.	в отель ройать гавайи
Мы позагораем, сделаем массаж, попьем коктейли у бассейна.	мы позагорать сделать массаж попить коктейль бассейн
- Кристин! - Что? Ты моя лучшая подруга.	кристин что ты хороший подруга
Тебе стукнет 40, и мне скоро,...	ты стукнуть 40 скоро
...и мы это абсолютно заслужили..	и это абсолютно заслужить
Спасибо.	спасибо
Я не знаю получится ли это, Джекки. Мы собирались на вечеринку.	я знать получиться это джекка мы собираться вечеринка
Ну,ты можешь нанять няню?	нут мочь нанять няня
Думаешь, я найду её на кануне Нового года?	думать найти её канун новое год
Папа полный отстой на сноуборде!	папа полный отстой сноуборд
Ну, спасибо тебе, Уилл.	ну спасибо ты уилла
Папа, упал семь раз!	папа упасть семь раз
Спасибо. Могу я поговорить по своему телефону, пожалуйста?	спасибо мочь поговорить свой телефон пожалуйста
Слушай, мне надо спросить у Мелинды.	слушай спросить мелинда
Что, подождать. Мой первый отпуск за три года	что подождать мой один отпуск год
...зависит от 28 летней ?	зависеть 28 летний
Ей будет 29 в марте.	она 29 март
Она что старая?	она старый
Ладно, Джеки. Я попробую что нибудь сделать.	ладный джеки я попробовать сделать
Нет, только дай мне знать как можно скорее.	нет дать знать скорее
- Джеки! Джеки. - Эй.	джеки джеки эй
Моя бабушка упала и сломала себе бедро.	мой бабушка упасть сломать бедро
О, боже...С ней всё хорошо? ?	о божес весь хорошо
Я надеюсь. Я должна пойти в больницу.	я надеяться я должный пойти больница
...и поговорить с докторами.	и поговорить доктор
Никто больше это не сделает.	никто это сделать
Она действительно напугана.	она действительно напугать
Боже.Конечно, пошли.	божеконечный послать
- Куда ты собралась? - Я собралась тебя отвезти.	куда собраться я собраться отвезти
Нет. Ты не пропустишь этот рейс.	нет ты пропустить рейс
- Нет. - Да.	нет да
Нет.	нет
- Джеки! - Кристин, нет.	джеки кристин нет
Джеки, прекрати вести себя как пятилетняя.	джеки прекратить вести пятилетний
- Но... - За всё заплачено.	но за весь заплатить
