cleaned_text	lemm_text
Всё будет в порядке.	весь порядок
Спасибо большое.	спасибо большой
Жжет, я знаю. Ты в порядке.	жечь знать ты порядок
Вот так, приятель.	вот так приятель
Уилл, так мило что ты позвонил.	уилла мило позвонить
С днем рождения, мама.	с днём рождение мама
Спасибо, милый. Джессика там?	спасибо милый джессика там
Это мама.	это мама
С днем рождения!	с днём рождение
Привет, Джесс!	привет джесс
Тебе весело на Гаваях?	ты весело гавая
Да. Я видела очень красивых рыб. И черепаху, тоже.	да я видеть очень красивый рыба и черепаха тоже
Не может быть! Большую?	не быть большой
Ты не представляешь насколько...	ты представлять насколько
Мам, Я должна идти потому что мы пьем горячий шоколад	мама я должный идти пить горячий шоколад
...и Мелинда вернулась.	и мелинда вернуться
Ладно.	ладный
Мне так жаль, что тебя нет здесь но мы получили твой подарок.	я жаль получить твой подарок
Хорошо, мне некогда. Я люблю тебя милая.	хорошо некогда я любить милый
Люблю тебя. С Днём Рожденья.	любить ты с днём рождение
Спасибо. Пока.	спасибо пока
Обед.	обед
Ты был действительно хорош с эти мальчиком сегодня.	ты действительно хороший мальчик сегодня
Спасибо. Я видел такие ожоги много раз.	спасибо я видеть такой ожог раз
Ладно, итак, я взял три свои любимые вещи, ...	ладный итак взять свой любимый вещий
Такос Махи с ананасом, Португальские роллы с желе гуавы.	такос мах ананас португальский ролл желе гуава
Великолепно. И кофе Кона что бы всё это запить.	великолепно и кофе кон весь это запить
Извини. Но я не голодна.	извинить но голодный
Это прикольно, что ты это говоришь Но я тебе не верю.	это прикольный это говорить но ты верить
Ешь.	есть
Вот так, полный рот.	вот так полный рота
Вкусно. Правда вкусно.	вкусно правда вкусно
- Правда? - Честно.	правда честно
Хорошо, теперь попробуй португальский ролл.	хорошо попробовать португальский ролл
Кто большая девочка? Давай.	кто большой девочка давать
Вау!	вау
Почему на улице всегда вкуснее?	почему улица вкусный
Да, правда?	да правда
- Думаю я еще откушу. - Кусай.	думать откусить кусать
Итак, где ты научился французскому?	итак научиться французский
Я год провёл во Франции, занимался сёрфингом. А ты?	я год провести франция заниматься сёрфинг а ты
Я изучала в средней школе.	я изучать средний школа
Потом, Училась в Сорбоне в Париже в школе дизайна.	потом учиться сорбон париж школа дизайн
Тебе звонят.	ты звонить
Это клиентка. Я должна ответить.	это клиентка я должный ответить
Что значит должна? Это твой день рождения.	что значит должный это твой день рождение
- Плюнь на неё. - Да, Я хотела бы, но не могу.	плюнуть она да я хотеть бы мочь
Подожди, подожди? Почему не можешь?	подождать подождать почему мочь
Она одна из самых крупных моих клиентов.	она один самый крупный мой клиент
Хорошо, тогда скажи ей что уронила телефон в водопад.	хорошо сказать уронить телефон водопад
- Какой водопад? - Вайхи.	какой водопад вайх
Вайхи?	вайх
Там потрясающе красиво. Я не позволю тебе пропустить это.	там потрясающе красиво я позволить ты пропустить это
В отличии от звонка, который ты пропустила.	в отличие звонок который пропустить
Пойдём, дурочка.	пойти дурочка
Ты назвал меня дурочкой?	ты назвать дурочка
Смотри под ноги.	смотреть нога
Ого. Это чудесно.	ого это чудесно
Так и есть.	так есть
Вот он.	вот он
Ничего себе. Действительно прекрасно.	ничто себя действительно прекрасно
Да. 800 квадратных метров.	да 800 квадратный метр
Нет, это. Я имею ввиду, мне нравится.	нет это я иметь ввиду нравиться
Ты знаешь как сделать дом чистым и простым.	ты знаешь сделать дом чистый простой
Да. Это уборка.	да это уборка
Да. Ты знаешь, с пространством и светом.	да ты знаешь пространство свет
Я всегда говорю своим клиентам что им надо избавится от беспорядка.	я говорить свой клиент избавиться беспорядок
Знаешь, добавить света.	знаешь добавить свет
Именно.	именно
Знаешь, я думаю сбегать быстренько в душ.	знаешь думать сбегать быстренько душа
Почему бы нет?	почему нет
Кстати о беспорядке, ты тут делаешь наркотики?	кстати беспорядок делать наркотик
Нет.	нет
Для чего это?	для это
Это натуральный,, без нефти, не токсичный воск для сёрфа.	это натуральный нефть токсичный воск сёрф
- Я делаю его от царапин. - воск для сёрфа.	я делать царапина воск сёрф
Ты когда нибудь слышала про Большое тихоокеанское мусорное пятно ?	ты слышать большой тихоокеанский мусорный пятно
- Нет.Что это? - Оно между Калифорнией и Гавайями.	нетчто это оно калифорния гавайи
И это просто невероятно гигантская куча мусора	и это просто невероятно гигантский куча мусор
...попавшая в спираль из течений, верно?	попасть спираль течение верно
Но она массивная. Размером с Техас.	но массивный размер техас
Звучит жутко.	звучать жутко
Поэтому, мой материал биологический . Так он не пополняет беспорядок.	поэтому материал биологический так пополнять беспорядок
Это вроде как мой способ, ну знаешь, внести вклад.	это вроде способ знаешь внести вклад
Смотри.	смотреть
Этот парень из ЛА, Майкл Ларкин. Он хочет его продавать.	этот парень ла майкл ларкина он хотеть продавать
Он сразу сделал мне предложение.	он сразу сделать предложение
Серьезно, поэтому он каждый день звонит мне.	серьёзно поэтому каждый день звонить я
Ну, так перезвони ему?	ну перезвонить он
- Нет. - Почему?	нет почему
'Потомучто я любитель по жизни и предпочитаю держаться подальше от этого.	потомучто любитель жизнь предпочитать держаться далёкий это
Так, что ты сказал? Тебе не нравятся профессионалы?	так сказать ты нравиться профессионал
Нет, Я сказал что не все должно использоваться.	нет я сказать должный использоваться
Я иду в душ.	я идти душа
Да, это ассистент Кайла Гамильтона, мне нужен мистер Ларкин.	да это ассистент кайло гамильтон нужный мистер ларкина
Да, можете передать ему	да мочь передать
...что мистер Гамильтон хотел бы встретиться с ним	что мистер гамильтон хотеть встретиться
...когда он будет на Гавайях?	когда гавайи
Спасибо.	спасибо
Что это ты сейчас сделала?	что это сделать
Ты хочешь чтобы я на самом деле это сделала?	ты хотеть самый дело это сделать
Это подстава?	это подстава
В ЛА 10 часов.	в ла 10 часы
Потому что, знаешь, ты выплывешь из своего теплого гнездышка	потому что знаешь выплыть свой тёплый гнёздышко
...и поймаешь волну своей жизни. Или что то в этом роде.	и поймать волна свой жизнь или род
Да, да, да. так... именно так.	да да да так именно так
Итак, ты говоришь что я должен буду сделать это когда нибудь?	итак говорить должный быть сделать это нибыть
Когда нибудь.	когда нибыть
Итак, ничего слишком нарядного, верно?	итак слишком нарядный верно
Верно. Я не должен видеть как ты переодеваешься?	верно я должный видеть переодеваться
Нет.	нет
Почему?	почему
Потому что сейчас светло, и я родила двоих детей.	потому светло родить двое ребёнок
Не думай, я не скромничаю.	не думать скромничать
А стоило бы, потому что ты прекрасно сохранилась.	а стоить бы прекрасно сохраниться
Спасибо.	спасибо
Эй, Как тебе это?	эй как ты это
Выглядит отлично.	выглядеть отлично
Спасибо.	спасибо
Сколько тебе лет?	сколько ты год
А это важно?	а это важный
Я нарушаю закон?	я нарушать закон
Двадцать семь.	двадцать семь
Я определенно не буду одеваться перед тобой.	я определённо быть одеваться ты
- Эй, знаешь что тебе нужно? - Что мне нужно?	эй знаешь ты нужно что нужно
Бикини.	бикини
Это точно не то что мне нужно.	это точно нужно
Сделай это.	сделать это
Когда нибудь. Может быть.	когда нибыть мочь быть
Ну, что было не так?	ну так
Не знаю.	не знать
Мы встретились в париже, мне было 24 года.	мы встретиться париж 24 год
А два года спустя он сделал предложение.	а год спустя сделать предложение
Мы купили первый дом, появился первый ребенок. Потом второй.	мы купить один дом появиться один ребёнок потом два
А потом я поняла что мы почти не видимся.	а понять видеться
Он работал. Я работала.	он работать я работать
И даже когда мы оба были дома...	и оба дом
мы больше времени проводили с детьми а не друг с другом	время проводить ребёнок друг друг
А потом?	а потом
А потом...	а потом
Принесли мой праздничный пирог.	принести праздничный пирог
Да, ну, загадай желание.	да ну загадать желание
Алоха, Добро пожаловать в Национальный Аэропорт Гонолулу.	алох добро пожаловать национальный аэропорт гонолулу
Обьявьявляется посадка на рейс 17, до Лос Анджелеса...	обьявьявляться посадка рейс 17 лос анджелес
...поссажиров просят пройти на посадке...	поссажиров просить пройти посадка
Ладно, Кайл.	ладный кайло
Ладно, Джеки.	ладный джеки
Я на самом деле рада нашему знакомству.	я самый дело рада наш знакомство
Возвращайся.	возвращаться
Я... Я купил кое что для тебя.	я я купить кой ты
Просто сувенир, чтобы ты не забыла отпуск.	просто сувенир забыть отпуск
Спасибо. Рада была познакомится .	спасибо рада познакомиться
- Ты уже говорила. - Верно. Береги себя.	ты говорить верно беречь себя
- Хорошо. Удачно долететь. - Хорошо.	хорошо удачно долететь хорошо
С Новым Годом!	с новый год
С Новым Годом!	с новый год
- Девять, восемь, семь, шесть... - Девять, восемь, семь, шесть...	девять восемь семь шесть девять восемь семь шесть
...пять, четыре, три, два, один. ... пять, четыре, три, два, один.	пять четыре три два один пять четыре три два один
С Новым Годом!	с новый год
Уилл, я знаю почему тебе нравится кататься на сноуборде.	уилла знать почему ты нравиться кататься сноуборд
Я имею ввиду, я словно птица. Я как будто летала.	я иметь ввиду словно птица я летать
Это, болезнь, Мам. Ты подсела?	это болезнь мама ты подсесть
Да, подсела.	да подсесть
Это удивительно.	это удивительно
Посмотри на меня. Я тоже заболела.	посмотреть я я заболеть
Ты больная!	ты больной
Я могу одеть это в школу?	я мочь одеть это школа
Да. С кофтой с длинными рукавами, чтобы не замерзнуть.	да с кофта длинный рукав замёрзнуть
Мам, мы получили твои вещи. .Это твой день рождения.	мама получить твой вещий это твой день рождение
- Это от нас обоих. - Я подписала открытку.	это оба я подписать открытка
- Я должна прочитать? - Мама!	я должный прочитать мама
Извините. Ладно.	извинить ладный
"""Для мамы. С Днем Рождения, мама."	для мама с днём рождение мама
"""С любовью, Джессика и Уильям. """	с любовь джессика уильям
Прекрасно. Спасибо. Так мило. Мне нравится.	прекрасно спасибо так мило я нравиться
Ух ты.! Он прекрасен.	ух ты он прекрасный
Это осиновый лист.	это осиновый лист
Это для твоих ключей.	это твой ключ
Мне нравится. Спасибо. Это так мило с вашей стороны ребята.	я нравиться спасибо это мило ваш сторона ребята
А знаете что.? Я по вам очень сильно соскучилась.	а знаете что я очень сильно соскучиться
Обнимите меня. Идите.	обнять я идти
- Мы тоже соскучились, мама. - Мы тоже соскучились, мама.	мы соскучиться мама мы соскучиться мама
Вы в идеальной позиции для щекотки !	вы идеальный позиция щекотка
Это было весело. Чего вы ещё хотите?	это весело что ещё хотеть
Подробностей. Посмотрите на неё, она прями сияет!	подробность посмотреть она прямить сиять
Это все из-за одной ночи?	это изз один ночь
Вы провели вместе ночь?	вы провести вместе ночь
Да. И эта ночь обернулась двумя,	да и этот ночь обернуться два
когда он появился у неё в комнате на следующее утро.	появиться она комната следующий утро
- Иди ты. - Начни с его имени.	идти ты начать имя
Его зовут Кайл Гамильтон.	он звать кайло гамильтон
- Сколько ему лет? - Двадцать семь.	сколько год двадцать семь
Двадцать семь?	двадцать семь
27 лет и инструктор по серфингу.	27 год инструктор серфинг
Боже мой! И у тебя с ним был сэкс?	бог мой и сэкс
Просто бесподобные два дня и две ночи...	просто бесподобный день два ночь
Бесподобные?	бесподобный
Знаете, всем этим я обязана Кристине.	знаете весь это обязать кристине
Даже не знаю как отблагодатить тебя?	даже знать отблагодатить ты
Ну, я просто рада что ты счастлива.	ну просто рада счастливый
Знаешь, как любила говорить моя бабушка...	знаешь любить говорить бабушка
"""Единственный способ повлиять на человека это переспать с кем нибудь другим. """	единственный способ повлиять человек это переспать кто другой
Твоя бабушка так говорила?	твой бабушка говорить
Да, именно.	да именно
- С днем рождения, Джеки. - Спасибо.	с днём рождение джеки спасибо
Ты движешься вперед.	ты двигаться вперёд
За движение.	за движение
- За движение. - За движение.	за движение за движение
Когда я упаковывала вещи, я забыла зарядку...	когда упаковывать вещий забыть зарядка
...а когда я добралась мой телефон уже умер.	а добраться телефон умереть
Ты могла воспользоваться телефоном отеля?	ты мочь воспользоваться телефон отель
Извини. Это из школы Джессики.	извинить это школа джессика
Алло?	алло
Что на тебе надето?	что ты надеть
Джинсы и рубашка. Как ты?	джинса рубашка как ты
Хорошо. А как ты?	хорошо а ты
Очень занята.	очень занятый
Звучит так, как будто тебе нужен отпуск.	звучать так ты нужный отпуск
Я думаю тебе стоит вернуться на Гаваи.	я думать ты стоить вернуться гавай
У меня отпуск раз в пять лет.	у отпуск пять год
Да брось, Джеки. Так нельзя жить.	да бросить джеки так жить
Наверное. Но у меня клиент. Могу я тебе перезвонить?	наверное но клиент мочь ты перезвонить
Да. Эй, ты все же подумай наж этим.	да эй подумать наж это
Я правда хотел бы увидеть тебя снова.	я правда хотеть увидеть снова
Я перезвоню.	я перезвонить
Это был вызов.	это вызов
Да. Вот почему я до сих пор не перезвонила.	да вот почему сей пора перезвонить
Так, в чем вызов?	так вызов
Брось, он ребенок.	бросить ребёнок
Он молод. Я имею ввиду, все могло бы быть, будь он постарше.	он молодой я иметь ввиду мочь быть быть старший
Извините? разве вы не слышали про Фенмен Мур?	извинить слышать фенмена мур
Деми? Джулиана Мур?	деметь джулиан мур
Они обе замужем за парнями на десять лет моложе себя.	они оба замужем парень десять год молодой себя
А Кетти Курик? Ей пятьдесят а ей парню тридцать.	а кетти курик она пятьдесят парень тридцать
Парень Кэтти Курик банкир, а не серфер.	парень кэтти курик банкир серфер
Да. Но Кайл инструктор.	да но кайло инструктор
Инструктор который говорит на французском.	инструктор который говорить французский
- Я говорила что он знает французский? - Ты упоминала это.	я говорить знать французский ты упоминать это
А что если он сумасшедший? Что если он преследует тебя?	а сумасшедший что преследовать ты
Что если он псих корорый преследует одиноких, пожилых женщин?	что псих корорый преследовать одинокий пожилое женщина
Брось, сорокалетняя это еще не пожилая.	бросить сорокалетний это пожилой
И она не одинокая.	и одинокий
Ну, я немного одинока.	ну немного одинокий
нет, ты не одинокая, ты, отчаянная, ведь так?	нет одинокий ты отчаянный так
Нет, может Николь права.	нет николь право
Я имею ввиду, может быть он убивает туристов каждую неделю.	я иметь ввиду убивать турист каждый неделя
