cleaned_text	lemm_text
Возвращайся спать, Кеннет. Мама должна работать.	возвращаться спать кеннет мама должный работать
Подожди секундочку, подожди...	подождать секундочка подождать
Сука!	сук
"""Багровая мгла"""	багровый мгла
<i>Экстренные службы среагировали</i>	iэкстренный служба среагировалиi
<i>на скопление транспорта на севере 95-го шоссе.</i>	iна скопление транспорт север 95го шоссеi
<i>Полицейский департамент Фортхэвена советует автомобилистам</i>	iполицейский департамент фортхэвен советовать автомобилистамi
<i>избегать всех подъездных путей</i>	iизбегать подъездный путейi
<i>к окружной больнице Фортхэвена до дополнительного уведомления.</i>	iк окружный больница фортхэвен дополнительный уведомленияi
<i>Это звучит плохо, друзья,</i>	iэтый звучать плохо друзьяi
<i>поэтому оставайтесь на волне Фортхэвен 87.3,</i>	iпоэтому оставаться волна фортхэвен 873i
<i>относительно всех новостей, которые происходят.</i>	iотносительно новость который происходятi
<i>Я - Ден Мэстерс. И далее на...</i>	iя ден мэстерс и далее наi
Жизненно важные органы?	жизненно важный орган
До сих пор фибрилляция желудочков, 20 минут.	до сей пора фибрилляция желудочек 20 минута
Продолжайте непрямой массаж сердца.	продолжать непрямой массаж сердце
Заряд дефибриллятора, 360.	заряд дефибриллятор 360
Внимание.	внимание
- Остановка сердца. - Нулевой сигнал на выходе.	остановка сердце нулевой сигнал выход
- Ничего. - Доктор Томас.	ничто доктор томас
Мы пробуем снова.	мы пробовать снова
Мы остановимся.	мы остановиться
Руководство команды, которое уверенно в себе и оперативно...	руководство команда который уверенно оперативно
ни один пациент не может просить большего.	пациент просить больший
Ладно, положите мистера Д. обратно в его коробку,	ладный положить мистер далее обратно коробка
и все отчитываются передо мной в моем кабинете для разбора полётов.	отчитываться перед я мыть кабинет разбор полёт
Вперед и вверх.	вперёд вверх
Ты справилась, Кэт.	ты справиться кэт
Йо, Кэт!	йо кэт
- Когда-нибудь делала это с манекеном? - Господи.	когданибудь делать это манекен господь
Гаррис, Гаррис.	гаррис гаррис
Извини. Я собирался позвонить тебе.	извинить я собираться позвонить ты
Я уже почти собрался, если это будет каким-то утешением.	я собраться это какимтый утешение
Нет.	нет
Это ваши вундеркиндеры?	это ваш вундеркиндер
Наша работа в безопасности.	наш работа безопасность
- За мной. - Так что с Гаррисом?	за я так гаррис
Его последний исследовательский проект был высок по амбициям,	он последний исследовательский проект высокий амбиция
но низок по безопасности пациента.	низкий безопасность пациент
Они прекратили финансирование и перевели его сюда.	они прекратить финансирование перевести сюда
Ага, с остальными отбросами.	ага остальной отброс
Каковы адренергические эффекты от лекарств первого ряда при остановке сердца?	каков адренергический эффект лекарство первое ряд остановка сердце
Увеличение коронарного диастолического давления,	увеличение коронарный диастолический давление
увеличение эндокардиоперфузии во время сокращений.	увеличение эндокардиоперфузия время сокращение
Скажи мне, что это твой не самый лучший удар.	сказать я это твой самый хороший удар
Позёрство.	позёрство
Господи, вам, двум хреновым умникам, надо гораздо чаще выходить наружу!	господь вы два хреновый умник гораздо чаща выходить наружу
- О, Харриет, ты весьма остра, а? - Ладно.	о харриета весьма острый а ладный
Хватит уже. Сегодня мы отдыхаем.	хватить уже сегодня отдыхать
Черт... чуваки.	черта чувак
Я не могу. Мне надо выяснить, почему Мистер Д. не добился своего сегодня.	я мочь я выяснить почему мистер далее добиться свой сегодня
Кэт, ты же знаешь, что Мистер Д. без мозгов и сделан из пластика, верно?	кэт знаешь мистер далее мозги сделать пластик верно
Как любой хренов парень. На хрен Мистера Д.	как люба хреновый парень на хрен мистер далее
Я уверена - ты что-то задумала, Харриет.	я уверить чтоть задумать харриета
Вовсе нет. Я всё ещё жду звонка от Мистера Б. Я чувствую себя такой использованной.	вовсе нет я весь ещё ждать звонок мистер б я чувствовать использовать
- Джейк собирается быть там. - И?	джейк собираться там и
"Что ж, мне надоела эта ""Я слишком занята для бойфренда"" хрень."	что ж надоесть этот я слишком занятый бойфренд хрень
Ты горяча. Он горяч. Пускай это случится.	ты горячить он горячий пускай это случиться
Да, Кэт, раскрепостись уже или те шлюшки из Джонс Хопкинс съедят его заживо.	да кэт раскрепоститься тот шлюшка джонс хопкинс съесть заживо
Спасибо.	спасибо
Да, Кэт, раскрепостись уже или те шлюшки из Джонс Хопкинс съедят его заживо.	да кэт раскрепоститься тот шлюшка джонс хопкинс съесть заживо
Спасибо.	спасибо
В любом случае, я уже сказала ему, что ты придешь.	в любой случай сказать он прийти
- Что? - И что ты хочешь, чтобы он был там.	что и хотеть там
О, ты хренова...	о хреновый
Эй, тебе доставляет удовольствие вот так вот ползать повсюду?	эй ты доставлять удовольствие ползать повсюду
Здравствуй, К-Кэтрин.	здравствовать ккэтрин
- Он действительно странный. - Он безобиден.	он действительно странный он безобидный
Это типичная Кэтрин:	это типичный кэтрин
"""Дайте мне ваших беспризорников и ваших простолюдинов""."	дать ваш беспризорник ваш простолюдин
Не успеешь оглянуться, как ты будешь предлагать бродяге ночлег или сироте...	не успеть оглянуться быть предлагать бродяга ночлег сирота
- Хэрриет! - Господи, Кэт, извини.	хэрриета господь кэт извинить
Не парься.	не париться
Эй, Уолт, работаешь в первом-классе сегодня? Я впечатлена.	эй уолт работать первомкласс сегодня я впечатлен
Только одну ночь. Завтра возвращаюсь на дно.	только один ночь завтра возвращаться дно
- Счастливого пути. - Пока.	счастливый путь пока
Он восхитителен.	он восхитительный
Спасибо. Это его день рождения сегодня. Один месяц.	спасибо это день рождение сегодня один месяц
- Чертова вагина. - Эй, у него большой?	чертовый вагин эй большой
- Он сын своего отца. - Именно поэтому я и спросил.	он сын свой отец именно поэтому спросить
Ты всё ещё кутишь в особняке своих родителей?	ты весь ещё кутить особняк свой родитель
- Завидуешь? - Разве по мне видно?	завидовать разве видно
- Да. - Тогда это ответ на вопрос.	да тогда это ответ вопрос
Итак, Джейк...	итак джейк
ты сегодня видел Кэт в реанимации?	сегодня видеть кэт реанимация
Когда она так сосредоточена,	когда сосредоточить
вся увлечена и взволнована, полна эмоций...	весь увлечь взволновать полный эмоция
- Она потрясна, да? - Да, она...	она потрясный да да она
очень впечатляет.	очень впечатлять
Нет, не так впечатляет, как научно-исследовательская стипендия при Университете Джонс Хопкинс.	нет впечатлять научноисследовательский стипендия университет джонс хопкинс
Возможная научно-исследовательская стипендия при Университете Джонс Хопкинс,	возможный научноисследовательский стипендия университет джонс хопкинс
но спасибо, да, это очень клёво.	спасибо да это очень клёвый
Что ж, ты заслуживаешь этого.	что ж заслуживать это
Но мы будем скучать по тебе.	но быть скучать ты
Ну, я еще не уехал. Я буду с вами ещё месяц или около того.	ну уехать я быть вы ещё месяц около тот
Что скажете, ребята?	что сказать ребята
Прогноз: обдолбаемся.	прогноз обдолбаться
- Черт, да. - Ууу!	черта да ууу
Ууу!	ууу
- Спокойной ночи, Кристал. - Пока, ребята.	спокойный ночь кристал пока ребята
О, Боже, пожалуйста. Ребята...	о бог пожалуйста ребята
О, черт.	о черта
Привет... Кэтрин.	привет кэтрин
Привет.	привет
Может быть я... Я могу...	мочь я я мочь
Отвалить?	отвалить
Нет, нет.	нет нет
проводить... проводить... проводить... тебя домой?	проводить проводить проводить домой
Кэт не твой тип. У неё есть пульс.	кэт твой тип у она пульс
Чертов чокнутый урод.	чертовый чокнутый урод
Ребята.	ребята
У тебя грязный рот.	у грязный рота
Ага, я подавлена. Проваливай.	ага подавить проваливать
Спасибо, Кеннет, но я как раз собиралась потусоваться здесь еще немного.	спасибо кеннет собираться потусоваться немного
Конечно, ну да.	конечно да
Ладно.	ладный
- У вас вечеринка, верно? - Ага, верно.	у вечеринка верно ага верно
- Ты не приглашен. - Ты еще здесь?	ты пригласить ты здесь
- Мы закрыты. - Он как раз уходит.	мы закрытый он уходить
- Наслаждайтесь вечеринкой. - Будем.	наслаждаться вечеринка быть
Что с этой чертовой курткой?	что чертовый куртка
Адьос, неудачник.	адьос неудачник
Этот парень - чертов чокнутый урод.	этот парень чертовый чокнутый урод
А твои таблетки, Шон.	а твой таблетка шон
Продолжай идти, придурок.	продолжать идти придурок
Те.. те, что находятся в твоем кармане.	тот тот находиться твой карман
Те, что из.. из аптеки.	тот из аптека
Тех, что у тебя возможно не должно быть.	тот возможно должный быть
- Ты заблуждаешься. - Нет, нет.	ты заблуждаться нет нет
Смотри, я...	смотреть я
Я записал тебя.	я записать ты
Что?	что
Эй, я сказал - мы закрыты!	эй сказать закрытый
- Ладно. - Этот парень не управляем.	ладный этот парень управлять
- Дерьмо, ребята. - О, боже.	дерьмо ребята о бог
Политика больницы - никакой терпимости к таким вещам.	политика больница никакой терпимость такой вещь
- Ребята, это на самом деле плохо. - Дерьмо.	ребята это самый дело плохо дерьмо
О, чел, ну и чертовы дела.	о чело чертовый дело
Притормози, ладно? Больница не знает.	притормозить ладный больница знать
- Ещё нет. - Мы должны вернуть его.	ещё нет мы должный вернуть он
Кэтрин.	кэтрин
Давай, ты нравишься ему.	давать нравиться он
- Кэтрин, серьезно. - Давай.	кэтрин серьёзно давать
Иди, иди.	идти идти
Кеннет, подожди.	кеннет подождать
Эй, почему бы тебе не вернуться во внутрь?	эй почему ты вернуться внутрь
И мы сможем поболтать и потусоваться.	и смочь поболтать потусоваться
М-мне?	ммна
Ну да, тебе.	ну да ты
Ладно.	ладный
Пошли.	послать
Чувак, я буду получать удовольствие, накачивая этого парня.	чувак быть получать удовольствие накачивать парень
- Продолжай лить, чувак. Наполним до краёв. - Он хорошо повеселиться.	продолжать лить чувак наполнить край он повеселиться
Запиши и это, Кеннет, ты маленький говнюк.	записать это кеннет маленький говнюк
Ты в порядке, Кеннет?	ты порядок кеннет
Да, да, я в порядке.	да да порядок
Ты знаешь, я считаю, что мы все должны время от времени развлекаться.	ты знаешь считать должный время время развлекаться
Знаешь, выпустить немного пара.	знаешь выпустить немного пара
Ну да, я знаю. Я знаю.	ну да знать я знать
Теперь мы все друзья, верно?	теперь друг верно
Да, конечно.	да конечно
Верняк.	верняк
Получилось. Получилось.	получиться получиться
Итак, я полагаю, что спаивание людей - единственный способ,	итак полагать спаивание человек единственный способ
которым ты можешь заставить их делать то, что ты хочешь.	который мочь заставить делать то хотеть
Эй, если именно так ты хочешь оправдать ночь страсти,	эй именно хотеть оправдать ночь страсть
- то тебе решать. - Не помню никакой страсти.	ты решать не помнить никакой страсть
Не беспокойся. Я помню.	не беспокоиться я помнить
Просто иди выруби его.	просто идти вырубить он
Эй, Шон, Кеннет в порядке, поэтому просто оставь его. Всё круто.	эй шон кеннет порядок поэтому просто оставить он весь круто
Ты уверена в этом, Кэтрин?	ты уверить это кэтрин
Я ничем не рискую.	я ничто рисковать
Йоу, Кенни.	йоу кенни
Хочешь потягивать коровью мочу со старушками?	хотеть потягивать коровий моча старушка
Или хочешь поиграть с большими ребятами?	или хотеть поиграть больший ребята
Ты должен сделать это, чтобы немного догнаться, друг мой.	ты должный сделать это немного догнаться друг мой
Кеннет, ты не должен делать это.	кеннет должный делать это
Боже, ты его хренова мамочка? Спасибо.	бог хреновый мамочка спасибо
Давай, Кенни, ты один из нас, дружище. Иди сюда!	давать кенни мы дружище идти сюда
- Давай. - Хватай это.	давать хватать это
- Ууу. - Поднимайся, поднимайся сюда.	ууу подниматься подниматься сюда
Да, Кенни дружище. Нам это нравится. Заторчи. Давай.	да кенни дружище мы это нравиться заторчать давать
Эй, ты в порядке?	эй порядок
Я не знаю.	я знать
- Всё будет хорошо. - О да, это чокнутый урод.	весь хорошо о да это чокнутый урод
Чокнутый урод, чокнутый урод, чокнутый урод!	чокнутый урод чокнутый урод чокнутый урод
Положи его в рот, трусишка!	положить рота трусишка
- О, Боже. - Господи.	о бог господь
Что за хрень?	что хрень
- Боже. - Кто это с тобой сделал?	бог кто это ты сделать
Ты сделал это, Кеннет, верно?	ты сделать это кеннет верно
Нет, нет, вы не знаете.	нет нет знаете
Вы н-не знаете ничего обо мне.	вы нне знаете о я
Ты прав, Кеннет, мы не знаем тебя, и нам так жаль.	ты право кеннет знать ты мы жаль
Вам ни хрена не жаль.	вы хрен жаль
Нет. Вам никогда ни хрена не жаль.	нет вы хрен жаль
Вы... вы... вы...	вы вы вы
вы все высокомерные	высокомерный
со своими мудрожопыми комментариями.	свой мудрожопый комментарий
Вы все нахрен одинаковые.	вы нахрен одинаковый
Вы ублюдки.	вы ублюдок
Вы...	вы
Кеннет!	кеннет
Харриет, выруби стробоскоп. Он эпилептик и у него приступ.	харриета вырубить стробоскоп он эпилептик приступ
- Он не может дышать. - Ему сейчас нужен дыхательный путь.	он дышать он нужный дыхательный путь
Просто сохраняйте спокойствие, ладно. Сохраняйте, черт, спокойствие!	просто сохранять спокойствие ладный сохранять черта спокойствие
Хорошо. Когда я разрежу, его прорвет.	хорошо когда разрезать прорвать
Стив, не будь чокнутым.	стив быть чокнутый
Стив, не слушай его. Ему сейчас нужна трахеостомия.	стив слушай он он нужный трахеостомия
- Стив! - Заткнись, Шон!	стив заткнуться шон
Делай это, Стив, ты также можешь написать свое чертово имя на нем.	делать это стив также мочь написать свой чертовый имя немой
- Дай мне это. - Пошел на хрен, кретин.	дать это пойти хрен кретин
Черт.	черта
- Кэт, нет. Просто выслушай меня. - Отвали от меня.	кэт нет просто выслушать я отвалить я
- Что черт возьми ты делаешь, Кэт? - Отвали от меня.	что черта взять делать кэт отвалить я
- Ему нужна помощь! - Не делай этого!	он нужный помощь не делать это
Господи, Шон, что черт возьми ты делаешь?	господь шон черта взять делать
- Отвали нахрен от меня! - Подождите, слушайте.	отвалить нахрен я подождать слушать
Его дыхательные пути очищены.	он дыхательный путь очистить
Я думаю, что он еще дышит.	я думать дышать
Ладно, к черту всё. Я вызываю скорую.	ладный черта весь я вызывать скорый
Джейк, мы обдолбаны в дерьмо.	джейк обдолбать дерьмо
Мы с этим парнем, который полностью накачан наркотой, украденной из больницы.	мы это парень который полностью накачать наркотой украсть больница
- Как это будет выглядеть? - Хорошо, блин.	как это выглядеть хорошо блин
- У нас нет времени ждать. - Пошлите.	у время ждать послать
Мы вызываем скорую - мы официально вовлечены.	мы вызывать скорый официально вовлечь
