cleaned_text	lemm_text
Это будет в протоколе. Они должны действовать, создавать пример.	это протокол они должный действовать создавать пример
Никакой терпимости. Никаких исключений.	никакой терпимость никакой исключение
И папочка, возможно, будет не в силах откупить тебя от этого, Ким.	и папочка возможно сила откупить это ким
Черт, возможно, ему даже не захочется.	черта возможно захотеться
Говоря о папочках...	говорить папочка
"твоя новая ""Виза"", Харриет, будет аннулирована."	твой новый виза харриета аннулировать
- Я пришлю тебе открытку. - Как ты обо всех заботишься, Шон.	я прислать ты открытка как о заботиться шон
Джейк, твоя чудесная репутация лопнет.	джейк твой чудесный репутация лопнуть
Джонс Хопкинс не захочет тебя знать.	джонс хопкинс захотеть знать
Это дерьмово, но это так.	это дерьмовый это так
- Хватит, Шон. - Хочешь узнать свой прогноз?	хватить шон хотеть узнать свой прогноз
Вот он:	вот он
сломана, без пульса, без реанимации,	сломать пульс реанимация
вытри свои слёзы грошовой стипендией	вытереть свой слеза грошовый стипендия
- по дороге назад в Хиксвиль. - Пошел к черту.	дорога назад хиксвиль пойти черта
Ты с нами, Кэтрин.	ты мы кэтрин
Наркотики или не наркотики, ты пропала.	наркотик наркотик пропасть
Ладно, Шон, остановись.	ладный шон остановиться
Мы отвезем его в приемный покой и скажем, что нашли его.	мы отвезти приёмный покоить скажем найти он
Это без разницы. Это так и так свяжет его с нами.	это разница это связать мы
А когда он очнется и начнет жаловаться кому-то, кто будет слушать -	а очнуться начать жаловаться комуть слушать
это будет выглядеть чертовски мрачно для нас. Поверьте мне.	это выглядеть чертовски мрачно мы поверьте я
Мы оставим его снаружи. Никакой связи.	мы оставить снаружи никакой связь
А что, если никто его не найдет?	а что никто найти
- Найдут. - Ты не можешь знать этого, Ким.	найти ты мочь знать это ким
Окей, никто из нас не знает этого.	окей никто знать это
Ну да. Таким образом, он всё же получит помощь, и мы ни при чем.	ну да такой образ весь получить помощь чем
Шон, ты ведешь.	шон вести
О, и что будет, когда Кеннет придет в сознание...	о быть кеннет прийти сознание
Если он придет? Ты думаешь, он просто простит и забудет?	если прийти ты думать просто простить забыть
Ты думаешь, он будет хранить молчание об этом?	ты думать хранить молчание это
Его слово против наших.	он слово против наш
Мы отрицаем всё.	мы отрицать весь
Легче опровергнуть какого-то недоделанного придурка.	лёгкий опровергнуть какоготь недоделать придурок
Мы держимся вместе. Мы не видели его этим вечером.	мы держаться вместе мы видеть это вечером
Нас здесь не было. Никого, ясно?	мы быть никто ясно
Харриет права. Вытаскивайте его.	харриета право вытаскивать он
О Боже, это не происходит.	о бог это происходить
Это должно произойти. Иначе мы попали.	это должный произойти иначе попасть
И конец гребаной истории!	и конец гребана история
Давай, вытряхивай его отсюда.	давать вытряхивать отсюда
- Толкай его, давай! - Пошел.	толкать он давать пойти
Кэт?	кэт
Ты там?	ты там
Послушай, нас никто не видел. Всё сделано.	послушать никто видеть весь сделать
Кэт?	кэт
Кэт, это всё сработает в лучшую сторону, окей?	кэт это весь сработать хороший сторона окей
Ты увидишь.	ты увидеть
По телефону: Больница округа Фортхэвен.	по телефон больница округа фортхэвен
Здравствуйте, я звоню по поводу пациента.	здравствовать звонить повод пациент
Пациента?	пациент
- Имя пациента? - Кеннет, Кеннет Чизолм.	имя пациент кеннет кеннет чизолм
Вы родственник?	вы родственник
Нет. Нет, я друг.	нет нет друг
- Тогда, боюсь... - Пожалуйста, вы можете сказать мне что-нибудь,	тогда бояться пожалуйста мочь сказать чтонибыть
что угодно о нем?	угодный немой
- Пожалуйста, можете подождать? - Да, я подожду.	пожалуйста мочь подождать да подождать
Он в интенсивной терапии. Извините, но это всё, что я могу вам сказать.	он интенсивный терапия извинить это весь мочь сказать
Спасибо.	спасибо
Кеннет в коме.	кеннет кома
Господи.	господь
О, Боже.	о бог
Господи.	господь
Кажется, наш разговор, потворствующий нашим слабостям и прикрывающий наши задницы,	кажется наш разговор потворствующий наш слабость прикрывать наш задница
длился достаточно долго для того, чтобы его мозг начал испытывать кислородное голодание.	длиться достаточно долго тот мозг начать испытывать кислородный голодание
- Люди же выходят из комы, так? - В большинстве случаев, да.	человек выходить кома так в большинство случай да
Да, но в этом случае,	да случай
он принял большие дозы алкоголя и наркотиков.	принять большой доза алкоголь наркотик
Я имею ввиду, что в этом случае,	я иметь ввиду случай
его мозг испытывал недостаток кислорода слишком долгое время.	мозг испытывать недостаток кислород слишком долгий время
Давай просто объясню, Йошими. Это не псевдокома.	давать просто объяснить йонуть это псевдокома
Не хроническое вегетативное состояние.	не хронический вегетативный состояние
Это глубокая кома.	это глубокий кома
Мы тоже все расстроены, Кэт.	мы расстроить кэт
Ясно.	ясно
Поэтому давайте просто пойдем к доктору Стэгмену и расскажем ему, что произошло.	поэтому давать просто пойти доктор стэгмена рассказать он произойти
Нет, нет!	нет нет
Ты сошла со своего чертова ума?	ты сойти свой чертовый ум
Слушай, это позор, верно?	слушай это позор верно
Но давайте быть логичными.	но давать логичный
Если он спит, он не может двигаться. Не может говорить.	если спать двигаться не говорить
Что хорошего сделает этот разговор кому-то?	что хороший сделать разговор комуть
Это то, что нужно сделать.	это то нужно сделать
Кэтрин...	кэтрин
нам нужно держаться друг за друга.	мы нужно держаться друг друг
Нам просто нужно держаться вместе. Нет смысла в...	мы просто нужно держаться вместе нет смысл в
Нет смысла?	нет смысл
Ким, то что мы сделали, может стать причиной чьей-то смерти.	ким сделать стать причина чьейтый смерть
Приглуши свой голос. Ким права.	приглушить свой голос ким право
- Не говори, черт, за меня, Шон. - Ладно, хорошо, хорошо.	не говорить черта я шон ладный хорошо хорошо
Не буду.	не быть
Ты можешь говорить за себя, Ким.	ты мочь говорить себя ким
Вы все можете.	вы мочь
И мы все сделали это... прошлой ночью.	и сделать это прошлый ночью
Кеннет в коме. Это трагедия,	кеннет кома это трагедия
но мы не можем изменить это.	мочь изменить это
Расскажешь, Кэт, и обосрешь жизнь всем нам	рассказать кэт обосресть жизнь весь мы
и ты не будешь менять одну чертову вещь ради Кеннета.	быть менять один чёртов вещь ради кеннет
Хочешь пойти и признаться? Попробуй.	хотеть пойти признаться попробовать
Удачи в поиске другой стипендии.	удача поиск стипендия
Но буду честен:	но быть честный
Я буду отрицать всё.	я быть отрицать весь
Правильно.	правильно
Итак, если Кеннет не сможет заговорить,	итак кеннет смочь заговорить
то этого как будто не случалось.	случаться
Нет, случалось.	нет случаться
И нам никогда не уйти от этого.	и мы уйти это
Но это сделано.	но это сделать
Ким.	ким
Извини.	извинить
В чем дело?	в дело
Доктор Гаррис.	доктор гаррис
Да, а вы одна из студенток доктора Стэгмена, не так ли?	да один студентка доктор стэгмена ли
За что вы извиняетесь?	за извиняться
Я интересовалась наблюдением больных комой,	я интересоваться наблюдение больной кома
поэтому мне жаль, что я не могу помочь этому пациенту.	поэтому жаль мочь помочь это пациент
Аа.	аа
Позвольте рассказать вам кое-что,	позволить рассказать коечто
кое-что, что доктор Стэгмен не расскажет вам.	коечто доктор стэгмена рассказать вы
В этом отделении... в этой больнице,	в отделение больница
мы на самом деле не лечим пациентов.	самый дело лечить пациент
Мы просто ухаживаем за ними.	мы просто ухаживать они
Это всё из-за бюждета и отчётности.	это весь изз бюждеть отчётность
Улучшения опровергнуты.	улучшение опровергнуть
Амбиции смешны.	амбиция смешной
Я читала вашу исследовательскую статью	я читать ваш исследовательский статья
о трансплантации нервных клеток-предшественников в случаях внутричерепных травм.	трансплантация нервный клетокпредшественник случай внутричерепной травма
Я бы хотела наблюдать этот случай, если вы позволите мне.	я хотеть наблюдать случай позволить я
Ладно, вы можете наблюдать, если хотите, но это будет не долго.	ладный мочь наблюдать хотеть это долго
Родственники не откликнулись,	родственник откликнуться
прогнозы не улучшились,	прогноз улучшиться
и он без страховки.	страховка
Вы говорите про отключение аппаратов жизнеобеспечения.	вы говорить отключение аппарат жизнеобеспечение
Итак, после того, как кардиотесты подтвердились,	итак тот кардиотест подтвердиться
да, это именно то, что мы собираемся сделать.	да это именно то собираться сделать
Эй, Кэт.	эй кэт
Стэгмен потерял тебя во время обхода.	стэгмена потерять время обход
Можешь взять мои записи, если хочешь.	мочь взять мой запись хотеть
Эй, в чем дело?	эй дело
Они завтра отключают Кеннета.	они завтра отключать кеннет
- Слава Богу. - Господи, Шон, что с тобой?	слава бог господь шон ты
- Что? - Это уже слишком, Шон.	что это слишком шон
- Ты в порядке? - Не знаю, Ким.	ты порядок не знать ким
"Минутку. ""Они""?"	минутка они
Ты говорила с кем-то об этом?	ты говорить кемтый это
- Мы должны были помочь ему. - Эй, эй.	мы должный помочь он эй эй
Эй, эй, эй, Кэт.	эй эй эй кэт
Ты права, окей?	ты право окей
Мы должны были. Но посмотри на нас.	мы должный быть но посмотреть мы
Подумай о людях, которым мы сможем помочь...	подумать человек который смочь помочь
в течение следующих лет.	течение следующий год
Ты собираешься быть замечательным врачом.	ты собираться замечательный врач
Это - кое-что, а? Это на самом деле кое-что.	это коечто а это самый дело коечто
Да.	да
Доктор Стэгмен, я сейчас исследую последний ряд лекарственных препаратов.	доктор стэгмена исследовать последний ряд лекарственный препарат
Мне было бы интересно услышать ваши соображения.	я интересно услышать ваш соображение
Лекарства для борьбы с отторжением органов и лекарства, регенерирующие нервную систему,	лекарство борьба отторжение орган лекарство регенерировать нервный система
в соединении способствуют стимуляции мертвых митохондрий.	соединение способствовать стимуляция мёртвый митохондрия
Эти соединения находятся на ранней стадии длительных испытаний.	этот соединение находиться ранний стадия длительный испытание
Я не думаю, что они появятся на экзамене в ближайшее время, Кэт.	я думать появиться экзамен ближний время кэт
Всё-таки, гипотетически, я имела в виду, что эти существующие лекарства	всётаки гипотетичёска иметь вид существующий лекарство
могли бы помочь в стимуляции пациентов в коме, правильно?	мочь помочь стимуляция пациент кома правильно
Однажды, возможно.	однажды возможно
Это, собственно, не моя область, понимаете?	это собственно область понимать
Поговори с доктором Гаррисом.	поговорить доктор гаррис
Я всё же предпочту ваше мнение.	я весь предпочесть ваш мнение
Закрой свои глаза.	закрыть свой глаз
Давай, закрой свои глаза.	давать закрыть свой глаз
Представь, что ты смотришь на ясное ночное небо.	представить смотреть ясный ночное небо
То, что ты видишь - ничто...	то видеть ничто
несколько тысяч звезд, видных невооруженным глазом,	несколько тысяча звезда видный невооружённый глаз
незначительная часть ста миллиардов звезд,	незначительный часть сто миллиард звезда
которые составляют нашу галактику. Дело в том, что	который составлять наш галактика дело тот
нервных соединений в твоем мозге	нервный соединение твой мозг
больше, чем звезд во всем нашем маленьком уголке вселенной.	большой звезда весь наш маленький уголок вселенная
Ты вводишь оба этих лекарства	ты вводить оба этот лекарство
в нечто настолько невероятно сложное,	нечто настолько невероятно сложный
поэтому, мы должны быть очень, очень осторожными.	поэтому должный очень очень осторожный
Кэтрин...	кэтрин
ты совсем не похожа на себя.	похожий себя
Скоро буду.	скоро быть
Спасибо, доктор.	спасибо доктор
Привет.	привет
- Шелби? - Да.	шелбить да
- Привет, я - Кэтрин. - Привет.	привет кэтрин привет
Э, доктор Стэгмен сказал мне следить за жизненными показателями нового пациента.	э доктор стэгмена сказать следить жизненный показатель новое пациент
Кеннета...	кеннет
- Кеннета Чизолма? - Да.	кеннет чизолма да
А Гаррис одобрил это?	а гаррис одобрить это
К сожалению. Это значит, я буду ходить здесь туда-сюда всю ночь.	к сожаление это значит быть ходить тудасюда ночь
Ну, тогда он весь твой.	ну весь твой
О, секунду. Ты должна будешь позвонить этому парню,	о секунда ты должный быть позвонить это парень
детективу Картеру.	детектив картер
На всякий случай, если к Кеннету придут посетители, хорошо?	на всякий случай кеннет прийти посетитель хорошо
Не переживай. Не будут. В смысле, никто не приходит.	не переживать не быть в смысл никто приходить
Хорошо.	хорошо
Спасибо.	спасибо
У Гарриса вечеринка?	у гаррис вечеринка
Я просто курьер.	я просто курьер
Будет готово через несколько минут.	быть готовый несколько минута
Должно быть ты любишь эти страстные сообщения.	должный любить страстный сообщение
Слушай, если ты хочешь отдохнуть, то я буду в порядке здесь.	слушай хотеть отдохнуть быть порядок здесь
Да? Ты уверена?	да ты уверить
Хм.	хм
Я буду не долго.	я быть долго
Давай.	давать
Не поступай так со мной, Кеннет.	не поступать я кеннет
<i>Третий этаж.</i>	iтри этажi
Давай.	давать
- Пока. - Пока.	пока пока
Счастливого пути.	счастливый путь
Эй, Кэт.	эй кэт
Эй, Кэт, подожди.	эй кэт подождать
Кэт, эй, я тебя искала везде.	кэт эй искать везде
- Где ты была? - Не сейчас, Йошими, хорошо?	где быть не сейчас йонуть хорошо
Просто выслушай меня, Кэт.	просто выслушать я кэт
Пожалуйста, послушай, всё, что я знала - учебники,	пожалуйста послушать весь знать учебник
методички и дурацкие манекены.	методичок дурацкий манекен
Видя его таким... Я не могла ничего поделать с этим.	видеть такой я мочь поделать это
Ты пыталась помочь ему той ночью, а я просто стояла рядом.	ты пытаться помочь тот ночью просто стоялый ряд
Оказалось, что я тоже не смогла ему помочь.	оказаться смочь помочь
Всё кончено, Йошими, хорошо?	весь конченый йонуть хорошо
Я пыталась помочь ему, только ничего не вышло.	я пытаться помочь он выйти
Просто продолжаем жить.	просто продолжать жить
Но, Кэтрин, мне так жаль.	но кэтрин жаль
Что вы делаете?!	что делать
Прекратите!	прекратить
Итак, ты замечала что-нибудь странное за ним в последнее время?	итак замечать чтонибыть странный последний время
Я хотела сказать..	я хотеть сказать
мы проходили мимо него каждую ночь.	проходить мимо каждый ночь
"""Счастливого пути""."	счастливый путь
И это всё.	и это весь
