cleaned_text	lemm_text
Что ж неплохое начало.	что неплохой начать
Красивая картина.	красивый картина
Но рамка подкачала. Не так ли?	но рамка подкачать не ли
Если абстрагироваться от эпохи поризма...	если абстрагироваться эпоха поризм
то я с удовольствием констатирую, что это, по-моему, рассвет раннего импрессионизма...	удовольствие констатировать это помоему рассвет ранний импрессионизм
Да вы знаток...	да знаток
А как же? Иначе я бы пришел сюда?	а же иначе прийти сюда
- Вы вооружены? - Зачем?	вы вооружённый зачем
- Вы застрахованы? - Само собой...	вы застраховать сам себя
Будьте любезны, скажите название своей страховой компании?	быть любезный сказать название свой страховой компания
Это упростит поиск, чем скорей вы подпишите контракт, тем скорее вы получите картину.	это упростить поиск скорый подписать контракт скорее получить картина
"Страховая компания ""Лойд"", бульвар Капуцинно."	страховой компания лойда бульвар капуцинный
Отлично!	отлично
Они меня знают.	они знать
А я нет. Это верно.	а нет это верно
Простите что не представился... Александр де Ламбрез.	простить представиться александр де ламбреза
Мадам... я благословляю нашу встречу.	мадам благословлять наш встреча
Моя профессия не часто дает такую счастливую возможность.	мой профессия часто давать такой счастливый возможность
Чтобы не быть у вас в долгу...	чтобы долг
Позвольте заметить, что не часто воры бывают так любезны.	позволить заметить часто вор бывать любезный
Мсье де Ламбрез, могу я попросить проводить меня в спальню. Я боюсь темноты.	мсьё де ламбреза мочь попросить проводить спальня я бояться темнота
Я и сам боялся темноты, когда был ребенком.	я бояться темнота ребёнок
В нашем огромном имении...	в наш огромный имение
в Лисабоне... я бегал по полям...	лисабон бегать поль
Александр! Брось меня на кровать!	александр бросить кровать
Зови меня Ирен...	звать ирена
Опомнитесь! Вы поддались чувствам.	опомниться вы поддаться чувство
- В такой поздний час. - Свяжи меня. Говори грубости.	в поздний час связать я говорить грубость
- Где я хороша... - Да, но мы только не успеем...	где хороший да успеть
- Нет, успеем. Служанка придет только утром.	нет успеть служанка прийти утром
- А ваш муж? - Он в Страсбурге. Строит новую Европу.	а ваш муж он страсбург строить новый европа
Что только не бывает на свете.	что бывать свет
Дюпре. Домой идешь?	дюпра домой идти
Да, шеф. Я вам купил эклеры.	да шеф я купить эклер
Спасибо.	спасибо
- Дюпре! - Здесь!	дюпра здесь
- Оле! - Здесь!	оля здесь
- Робе! - Здесь!	роба здесь
В 14 отделении из отпуска вернулись все, господин директор.	в 14 отделение отпуск вернуться весь господин директор
Господа... как вы видите... несмотря измышления прессы, заключенные возвращаются.	господин видеть несмотря измышление пресса заключённый возвращаться
Да, господин директор.	да господин директор
- Дюпре. - Да, господин директор.	дюпра да господин директор
Номер двадцать семь двенадцать.	номер двадцать семь двенадцать
- Что вы делали в отпуске, Дюпре. - В отпуске?	что делать отпуск дюпра в отпуск
Дюпре, осторожней.	дюпра осторожный
Отпуск, господин директор, я провел с пользой.	отпуск господин директор провести польза
Обошел все бюро по трудоустройству и узнал, что ручной труд снова в почете.	обойти бюро трудоустройство узнать ручной труд снова почёт
Хороший слесарь, работу найдет, господин директор.	хороший слесарить работа найти господин директор
Верно Дюпре, верно.	верно дюпра верно
- Так что, я тряхну стариной, господин директор? - Хорошо.	так что тряхнуть старина господин директор хорошо
Спасибо, господин директор.	спасибо господин директор
За такие благие намерения, Дюпре вышел на свободу гораздо раньше.	за такой благой намерение дюпра выйти свобода гораздо ранний
А наш бравый молодец тряхнул стариной на берегах Адриатики.	а наш бравый молодец тряхнуть старина берег адриатик
Вдоль которой прогуливались несколько миллиардеров от Сицилии до Монако.	вдоль который прогуливаться несколько миллиардер сицилия монако
Пассажиры и пассажирки были без ума от неотразимого магараджи Дедудебишаны Барбабадаи.	пассажир пассажирка ум неотразимый магараджа дедудебишан барбабадай
Но все его внимание было приковано к миссис Шварц.	но внимание приковать миссис шварц
Той самой в джинсовой рубашке Шварц.	тот самый джинсовый рубашка шварц
- Прелестно... Великолепно... С каждым годом вы все лучше и лучше.	прелестно великолепно с каждый год хороший
- Как вы? - Замечательно.	как вы замечательный
- Приятно вас видеть.	приятно видеть
Ваши миниатюры прелестны, дорогой.	ваш миниатюра прелестный дорогой
Но, по-моему, вы чересчур много просите за них.	но помоему чересчур просить они
40000 долларов за приключения обезьяньего бога? Вы так думаете? Такую цену никому бы не приложил.	40000 доллар приключение обезьяний бог вы думать такой цена никто приложить
Согласна.	согласный
Но я оплачу тремя трехтысячными векселями.	но оплатить три трехтысячный вексель
- А может всем капиталом? - А может мы поженимся?	а весь капитал а пожениться
Выйти в замуж в 43 года, разве я сумасшедшая?	выйти замуж 43 год сумасшедший
Вопрос остался без ответа. Принц уже положил глаз на миллионы миссис Памела Иглен Джордж.	вопрос остаться ответ принц положить глаз миллион миссис памела иглен джордж
И возвращение к его профессии, стало менее болезненным.	и возвращение профессия стать менее болезненный
Сеньора, познакомьтесь, магараджа Дедудебишана Барбабадай.	сеньор познакомиться магараджа дедудебишан барбабадать
И когда она услышала, что каждый год 3 миллиона его подданных платят ему золото столько, сколько он весит.	и услышать каждый год 3 миллион поддать платить золото столько сколько весить
То она сочла его безумно приятным.	то счесть безумно приятный
Мм. Какой вопрос. Вы меня удивили и смутили.	мм какой вопрос вы удивить смутить
Но я вам отвечу. Мой вес 75 килограмм.	но ответить мой вес 75 килограмм
Вам надо есть больше белого мяса.	вы белый мясо
На следующий вечер вдова-красотка погрузилась в грезы.	на следующий вечер вдовакрасотка погрузиться грёза
Моя печальная красавица, о чем вы мечтаете?	мой печальный красавица мечтать
Об остановке в Монако. Там наши жизненные пути разойдутся.	о остановка монако там наш жизненный путь разойтись
Вам не так знакома боль расставаний... Особенно, если расстаешься навсегда.	вы знакомый боль расставание особенно расставаться навсегда
Вы теряли близкого человека?	вы терять близкий человек
Хуже... супруга.	худой супруг
Я пережил подобные минуты отчаянья.	я пережить подобный минута отчаяние
Когда потерял моего любимого белого слона.	когда потерять мой любимый белый слон
Думал, никогда не отправлюсь от потери.	думать отправиться потеря
Мне становилось все хуже...	я становиться худой
Мои верные слуги беспокоились...	мой верный слуга беспокоиться
И кстати, я так похудел, что потянул только на 65 слитков.	и кстати похуделый потянуть 65 слитковый
Теперь я здесь... рядом с вами.	теперь здесь ряд вы
мы вместе... и я бы не хотел будить те тяжкие воспоминания, но...	вместе хотеть будить тот тяжкий воспоминание но
чем занимался ваш покойный супруг?	заниматься ваш покойный супруг
Всем и ничем.	весь ничто
- Он разрабатывал копи. - Угольные?	он разрабатывать копь угольный
- Алмазные. - Мы с вами пример того, что голос настоящей печали не умолкает никогда.	алмазный мы вы пример тот голос настоящий печаль умолкать никогда
Монте-Карло не разлучит нас.	монтекарло разлучить мы
На третий вечер, принц крутил вдову в вихре вальса.	на три вечер принц крутило вдова вихор вальс
- Голова кружится? - Я пьяна...	голова кружиться я пьяный
На фоне теплого моря... ветерок из Африки...	на фон тёплый море ветерок африка
трепал кудри вдовы... в глазах принца мерцали отблески золота.	трепать кудри вдовый глаз принц мерцать отблеск золото
Вам телеграмма.	вы телеграмма
Мой друг... я разорена... я лишилась всего.	мой друг разорить лишиться всего
У меня больше ничего нет. Даже на самые мелкие расходы.	у нет даже самый мелкий расход
- Крепитесь, все-таки же у вас что-то осталось. - Это мои брильянты. И я их заложу.	крепиться всетаки чтоть остаться это мой брильянт и заложить
Я не оставлю вас в беде, Памела. Пользуйтесь моим кошельком.	я оставить беда памела пользоваться мой кошелёк
Нет-нет, только не вашим.	нетнуть ваш
Они говорили о деньгах еще час или два... После чего, прекрасная Памела, произнесла имя принца.	они говорить деньга час два после что прекрасный памела произнести имя принц
Дедудебиша	дедудебиш
И тут же отдалась ему до самого утра.	и отдаться самый утро
Здравствуйте, шеф.	здравствовать шеф
На четвертый день, судно пристало в Монте-Карло.	на четыре день судно пристать монтекарло
- Памела, вы там? Это Бибу. - Войдите.	памела там это биб войти
У меня нет слов.	у слово
У меня тоже.	у тоже
Но есть угрызения совести.	но угрызение совесть
- Не надо ничего усложнять, Бибу.	не усложнять биб
Обойдемся без всяких лишних слов. Не будем вульгарными.	обойтись всякий лишний слово не быть вульгарный
Это доллары. Вы ничего не имеете против?	это доллар вы иметь против
Вы спасаете бедную женщина и проявляете столько деликатности.	вы спасать бедный женщина проявлять столько деликатность
- Что вы за человек? - Иногда я и сам себя не понимаю.	что человек иногда понимать
Не может быть... Кошмар... фальшивые.	не быть кошмар фальшивый
Вот мерзавка!	вот мерзавка
Подделка!	подделка
Бывший номер 27-12 напоролся на Софи Шафрон, неоднократно судимую за мошенничество и кражи.	бывший номер 2712 напороться софи шафрон неоднократно судить мошенничество кража
- Мерзавка! - Негодяй!	мерзавка негодяй
Софи, моей порочности и твоей красотой, мы не мало дичи наловим.	софи мой порочность твой красота мало дичь наловить
Первый трофей имел слишком подвижный облик Гельмонта фон Аппенбурга. Он влюбился без памяти в Памелу Иглен Джордж.	один трофей иметь слишком подвижный облик гельмонт фон аппенбург он влюбиться память памела иглен джордж
Безудержную вдову, алмазного короля.	безудержный вдова алмазный король
Но бдительный Виконт де Аламбреуз строго следил за добродетелем своей сестренки.	но бдительный виконт де аламбреуз строго следить добродетель свой сестрёнка
Могу я с вашего позволения, кузен, позвонить в Венецию?	мочь ваш позволение кузен позвонить венеция
- Конечно, телефон в машине. - Спасибо.	конечно телефон машина спасибо
Он назвал меня кузеном. Хороший знак.	он назвать кузен хороший знак
Он так привержен старинным принципам.	он приверженный старинный принцип
Опытный игрок Александр взял за правило за ранее рассчитывать ходы.	опытный игрок александр взять правило ранее рассчитывать ход
Венеция была городом не очень высокой морали и там жил его верный друг.	венеция город очень высокий мораль жить верный друг
Дамы и господа, перед вами подлинное полотно Антонио Каноли, известного как Канолетто.	дама господин вы подлинный полотно антонио каноль известный канолетто
Вот здесь мастер венецианской школы утопил свой талант.	вот мастер венецианский школа утопить свой талант
Простите.	простить
- Слушаю. - Ахил, ты все в музеи Канолетто?	слушать ахилый музей канолетто
- Ты что уже вышел из тюрьмы? - А ты в нее скоро сядешь.	ты выйти тюрьма а скоро сесть
Хоть ты и бессовестный тип, я устрою все так, что у тебя купят картину.	хоть бессовестный тип устроить так купить картина
Я тебя выдам за своего дядю. Будь четырнадцатого в половине четвертого в салоне Гандальеры в гостинице Даниеля в Венеции.	я выдать свой дядя быть четырнадцать половина четыре салон гандальер гостиница даниель венеция
Надеюсь этот прием, поможет вам развеять грусть. Если только ваш брат не против.	надеяться приём помочь развеять грусть если ваш брат против
Тише, он уже здесь.	тиша здесь
Гельмонт пригласил нас погостить у него в замке.	гельмонт пригласить погостить замок
Кажется, мсье, сестре не скучно с вами.	кажется мсьё сестра скучно вы
Предвкушая значимый вечер, весь в страстном ожидании, Гельмонт, кавалер Золотого Руна, не поскупился.	предвкушать значимый вечер весь страстный ожидание гельмонт кавалер золотой руно поскупиться
Ты скоро?	ты скоро
Успех всей операции зависит от тщательности подготовки.	успех весь операция зависеть тщательность подготовка
Повторяю. Мы получаем телеграмму - разорены. Ты в обмороке, герцог переносит тебя в свою спальню.	повторять мы получать телеграмма разорить ты обморок герцог переносить спальня
Ты зовешь брата. Выходишь в коридор, кашляешь. Кашляешь громко. Я тебя слышу и вешаюсь.	ты звать брат выходить коридор кашлять кашлять громко я слышать вешаться
Ты выбегаешь и кричишь, Гельмонт, и вы меня снимаете.	ты выбегать кричать гельмонт снимать
Если и после этого он не выполнит свой долг...	если выполнить свой долг
Не слишком ли все сложно?	не слишком сложно
Я работаю не в низком стиле, а в романтическом.	я работать низок стиль романтический
За обаяние и красоту!	за обаяние красота
- Голова кружится? - Я пьяна.	голова кружиться я пьяный
Боже! Боже мой!	бог бог мой
Мне осталось только одно!	я остаться один
Я разорена.	я разорить
Будьте моей... и все что я имею будет ваше.	быть мой иметь ваш
Будьте милосердны, оставьте меня.	быть милосердный оставить я
Похоже вам стало лучше?	похоже стать хороший
Да.	да
Что ты говоришь?	что говорить
Что он говорит?	что говорить
Он недоволен и я не пойму почему.	он недовольный понять почему
Что ты говоришь?	что говорить
Мерзавка!	мерзавка
Молодец...	молодец
Он заговорил.	он заговорить
А вы вообще заткнитесь!	а вообще заткнуться
Знаешь, сколько я времени весел?	знаешь сколько время весёлый
- Но почему ты повесился? - Потому что ты кашляла.	но почему повеситься потому кашлять
Ты кашляла 2 минуты.	ты кашлять 2 минута
Уверяю вас, она не кашляла.	уверять вы кашлять
А ты вообще заткнись!	а вообще заткнуться
Молчать!	молчать
Молчать!	молчать
Как ты разговариваешь с моим женихом?	как разговаривать мой жених
- Что-что? - Да, я имею честь у вас просить руку вашей сестры.	чточто да иметь честь просить рука ваш сестра
Что? Руку моей сестры?	что рука мой сестра
Ах, как глупо!	ах глупо
Гельмонт не обращай внимание, он сумасшедший.	гельмонт обращать внимание сумасшедший
Так нельзя!	так нельзя
Вы мне?	вы я
Пропустите! Пропустите!	пропустить пропустить
Никогда не видела такого идиота!	никогда видеть такой идиот
А да, чуть не забыла, видела магараджу со своим слоном и прочей чушью!	а да забыть видеть магараджа свой слон прочий чушь
Думай, что говоришь!	думать говорить
Ему незачем знать о наших разногласиях!	он незачем знать наш разногласие
Дело было в шляпе, он подписал чек!	дело шляпа подписать чек
